Title,Category
Don't Eat Your Heart Out Cookbook,"Cooking , Reference"
Christmas Cookies,"Cooking , General"
"Eat More, Weigh Less: Dr. Dean Ornish's Life Choice Program for Losing Weight Safely While Eating Abundantly","Cooking , Health & Healing , Low Fat"
Healing Benefits of Garlic,"Cooking , Specific Ingredients , Herbs, Spices, Condiments"
Cook Healthy: Cook Quick,"Cooking , Health & Healing , Low Fat"
"Hey Mom! I'm Hungry!: Great-Tasting, Low-Fat, Easy Recipes to Feed Your Family","Cooking , Health & Healing , Low Fat"
Big Kitchen Instruction Book,"Cooking , Regional & Ethnic , American , General"
Currier and Ives Four Seasons Cookbook,"Cooking , General"
Cooking for Jack,"Cooking , General"
Linda Mccartney's Home Cooking,"Cooking , Reference"
Beginners Cookbook (Home Library),"Cooking , General"
"Wine in Everyday Cooking: ""Cooking with Wine for Family and Friends""","Cooking , Beverages , Wine & Spirits"
The Ideals Country Kitchen Cookbook,"Cooking , Reference"
From Mama's Kitchen,"Cooking , General"
The Big Bite Book of Pizzas,"Cooking , General"
The Festival Cookbook: Four Seasons of Favorites,"Cooking , Seasonal"
What To Cook When You Think There's Nothing in the House To Eat: More Than 175 Easy Recipes And Meal Ideas,"Cooking , General"
Little Vegetarian Feasts: Main-Dish Grains,"Cooking , General"
Stir-Fry (Sunset Creative Cooking Library),"Cooking , Methods , Wok"
Christopher Idone's Glorious American Food,"Cooking , General"
Glorious French Food: A Fresh Approach to the Classics,"Cooking , Regional & Ethnic , French"
A Taste for Love: A Romantic Cookbook for Two,"Cooking , Courses & Dishes , General"
Eat Smart for a Healthy Heart Cookbook,"Cooking , Health & Healing , General"
Flavor,"Cooking , Courses & Dishes , General"
Pierre Franey's Cooking In America,"Cooking , Regional & Ethnic , American , General"
Soup Suppers: More Than 100 Main-Course Soups and 40 Accompaniments,"Cooking , Courses & Dishes , Soups & Stews"
Dining with the Duchess: Making Everyday Meals a Special Occasion,"Cooking , Health & Healing , General"
Shaken Not Stirred,"Cooking , Beverages , Bartending"
"PARKER'S WINE BUYER'S GUIDE, 5TH EDITION : Complete, Easy-to-Use Reference on Recent Vintages, Prices, and Ratings for More Than 8,000 Wines from All the Major Wine Regions","Cooking , Reference"
The Dannon Book of Yogurt,"Cooking , General"
The Elegant Onion: The Art of Allium Cookery,"Cooking , General"
Mississippi Memories: Classic American Cooking from the Heartland to the Mississippi Bayou,"Cooking , General"
Dressed to Grill: Savvy Recipes for Girls Who Play with Fire,"Cooking , Methods , Outdoor"
John Clancy's Christmas Cookbook,"Cooking , General"
Western Junior League Cookbook,"Cooking , Regional & Ethnic , American , Western States"
Christmas Treasures: Christmas Cookies,"Cooking , Courses & Dishes , Cookies"
The Perfect Christmas,"Cooking , Holiday"
Zucchini Pumpkins and Squash OP (Artful Kitchen),"Cooking , Vegetarian"
The Four Seasons Spa Cuisine,"Cooking , General"
American Wine (No. 80782),"Cooking , General"
Jim Coleman's Flavors,"Cooking , Regional & Ethnic , American , General"
Food and Wine's Holiday Favorites,"Cooking , Beverages , Alcoholic , Wine"
"Holiday Cooking (Great Taste, Low Fat)","Cooking , Holiday"
The London Ritz Book of Christmas: The Art & Pleasures of a Traditional Christmas,"Cooking , Reference"
The Herbal Palate Cookbook,"Cooking , Specific Ingredients , Herbs, Spices, Condiments"
New York Entertains.,"Cooking , General"
Pasta Verde,"Cooking , Specific Ingredients , Pasta"
The Book of Fish and Shellfish,"Cooking , Seasonal"
Berries: A Cookbook,"Cooking , Reference"
The Art of Accompaniment: Making Condiments,"Cooking , General"
Grills & Greens: Recipes for Salads and Sandwiches,"Cooking , Methods , Special Appliances"
"Cultivating the Cook's Garden: Deliciously Fresh Things to Eat, Just Outside Your Kitchen Door","Cooking , Specific Ingredients , Natural Foods"
Christmas With Southern Living 2000,"Cooking , Holiday"
Slow Food: Flavors and Memories of America's Hometowns,"Cooking , General"
"Neighboring on the Air: Cooking With the KMA Radio Homemakers (Shenandoah, Iowa)","Cooking , Reference"
Effects of Health Programs on Child Mortality in Sub-Saharan Africa (Population Dynamics of Sub-Saharan Africa: A Series),"Cooking , General"
Beers of the World,"Cooking , Beverages , Alcoholic , Beer"
"Saveur Cooks Authentic French: Rediscovering the Recipes, Traditions, and Flavors of the World's Greatest Cuisine","Cooking , Regional & Ethnic , French"
Brand Name Fat-Fighter's Cookbook,"Cooking , Health & Healing , General"
Vegetarian Feasts,"Cooking , General"
Mediterranean Flavors: Recipes from the Countries of the Sun,"Cooking , Regional & Ethnic , Mediterranean"
The Last Days of Haute Cuisine: The Coming of Age of American Restaurants,"Cooking , Methods , General"
The Farallon Cookbook: The Very Best of San Francisco Seafood Cuisine,"Cooking , Specific Ingredients , Seafood"
Dr. Atkins' New Diet Cookbook,"Cooking , Health & Healing , General"
Martha Stewart's Menus for Entertaining,"Cooking , Entertaining"
The Buzz On Wine,"Cooking , Beverages , Alcoholic , General"
Francine Prince's New Jewish Cuisine,"Cooking , Regional & Ethnic , Jewish & Kosher"
Jamie's Kitchen,"Cooking , Methods , General"
Recipes from an Italian Farmhouse,"Cooking , General"
CHICKEN AND OTHER POULTRY DISHES (Marie-Pierre Moine's French Kitchen),"Cooking , General"
Maryland's Historic Restaurants and Their Recipes,"Cooking , General"
Annette Annechild's Wok Your Way Skinny,"Cooking , Methods , Wok"
Cooking with Master Chefs,"Cooking , Reference"
The Book of Crepes and Omelets,"Cooking , Courses & Dishes , Breakfast"
Our Meals,"Cooking , General"
The Best of Gourmet: Featuring the Flavors of England Ireland and Scotland,"Cooking , Methods , Gourmet"
Nathalie Dupree Cooks Quick Meals For Busy Days: 180 Delicious Timesaving Recipes,"Cooking , Methods , Quick & Easy"
Cookie Time: With Vintage Cookie Jars from the Andy Warhol Collection,"Cooking , General"
The Working Stiff Cookbook: Great Food! Easy Recipes!,"Cooking , Methods , Quick & Easy"
"Pacific Northwest Flavors: 150 Recipes from the Region's Farmland, Coastline, Mountains, and Cities","Cooking , Regional & Ethnic , American , Western States"
Bugialli on Pasta,"Cooking , Regional & Ethnic , Italian"
Faye Levy's International Chicken Cookbook,"Cooking , Regional & Ethnic , International"
Grilling America,"Cooking , Regional & Ethnic , American , General"
"Toasts for Every Occasion: Warm, Wise, and Witty Words Collected from Around the World","Cooking , Entertaining"
CookSmart: Perfect Recipes for Every Day,"Cooking , Reference"
Cocina!: A Hands-On Guide to the Techniques of Southwestern Cooking,"Cooking , Regional & Ethnic , American , Southwestern States"
Family Fun Cookbook: 250 Irresistible Recipes for You and Your Kids,"Cooking , Regional & Ethnic , American , General"
Pamella Z Asquiths Fruit Tart,"Cooking , Specific Ingredients , Fruit"
Cappuccino/Espresso: The Book of Beverages (Nitty Gritty Cookbooks),"Cooking , Beverages , Coffee & Tea"
Tofu Cookery,"Cooking , Methods , Cookery for One"
"Making Your Own Gourmet Chocolate Drinks: Hot Drinks, Cold Drinks, Sodas, Floats, Shakes, and More!","Cooking , Beverages , Non-Alcoholic"
Whisky: The Water of Life - Uisge Beatha,"Cooking , Beverages , Alcoholic , General"
Fingerfood: Bite-sized Food for Cocktail Parties (Compacts),"Cooking , Methods , Quick & Easy"
"French Food, American Accent: Debra Ponzek's Spirited Cuisine","Cooking , Regional & Ethnic , French"
Mr. Food's Meals in Minutes,"Cooking , General"
Gourmet's Best Desserts,"Cooking , Methods , Gourmet"
The Bubba Gump Shrimp Co. Cookbook: Recipes and Reflections from FORREST GUMP,"Cooking , Specific Ingredients , Seafood"
Four Seasons with the Bread Machine Baker,"Cooking , Courses & Dishes , Bread"
"Polly Clingerman's Dinner Companion: Glorious, Easy Meals in Less Than an Hour","Cooking , Methods , Quick & Easy"
Heart of the Home: Notes From a Vineyard Kitchen,"Cooking , Reference"
Feasts: Menus for Home-Cooked Celebrations,"Cooking , General"
Healthy Holidays: Total Health Entertaining All Year Round,"Cooking , Holiday"
Classic Cakes and Cookies,"Cooking , Courses & Dishes , Cakes"
Historic Virginia Inns: A Cook's Tour,"Cooking , General"
Chicken Light,"Cooking , General"
Holidays,"Cooking , Holiday"
Party Cocktails,"Cooking , Beverages , Alcoholic , General"
"Chocolate: Discovering, Exploring, Enjoying","Cooking , Specific Ingredients , Chocolate"
Cooking for a Healthy Family,"Cooking , General"
Food and Wine Presents Best of the Best: The Best Recipes from the Year's 25 Best Cookbooks,"Cooking , General"
Twenty-Minute Menus: Time-Wise Recipes & Strategic Plans for Freshly Cooked Meals Every Day,"Cooking , Methods , Quick & Easy"
Pamella Asquith's Ultimate Chocolate Cake Book,"Cooking , General"
Manhattan's Dessert Scene: New York City's Top Dessert Spots Reveal Their Secret Recipes,"Cooking , Courses & Dishes , Desserts"
Nueva Salsa: Recipes to Spice It Up,"Cooking , Courses & Dishes , General"
Down Home Cookin' Without the Down Home Fat,"Cooking , Regional & Ethnic , Soul Food"
Weber's Real Grilling: Over 200 Original Recipes,"Cooking , Methods , Outdoor"
Betty Crocker's New Chinese Cookbook: Recipes by Leeann Chin,"Cooking , Regional & Ethnic , Chinese"
Keo's Thai Cuisine,"Cooking , Regional & Ethnic , Thai"
Best of Mediterranea,"Cooking , General"
Smoothies and Shakes,"Cooking , Beverages , Juices & Smoothies"
Holiday Celebrations (Williams-sonoma Lifestyles),"Cooking , Holiday"
America's Best Recipes,"Cooking , General"
Cook-Off America: Prize-Winning Recipes from the Public Television Series (PBS Cooking),"Cooking , Regional & Ethnic , American , General"
Thursday Is Pot Luck: From Hearty Casseroles to Stir-Fries to Main-Course Salads (Everyday Cookbooks),"Cooking , Regional & Ethnic , American , General"
A New Way to Cook,"Cooking , Regional & Ethnic , American , General"
The Complete Step-By-Step Diabetic Cookbook,"Cooking , Health & Healing , Diabetic & Sugar-Free"
Atkins for Life: The Complete Controlled Carb Program for Permanent Weight Loss and Good Health,"Cooking , Health & Healing , Weight Control"
Eating Well Secrets of Low-Fat Cooking: 100 Techniques & 200 Recipes for Great Healthy Food,"Cooking , Health & Healing , Low Fat"
"Ready, Set, Dough!: Incredibly Easy and Delicious Ways to Use Store-Bought Doughs","Cooking , Courses & Dishes , Desserts"
501 Delicious Heart Healthy Recipes: Feel Great - Lose Weight - Lower Your Cholesterol,"Cooking , Health & Healing , Low Fat"
"Pearls of Kitchen Wisdom: Tips, Shortcuts, and Recipes from a Country Home","Cooking , Methods , General"
Half-Scratch Magic: 200 Ways to Pull Dinner Out of a Hat Using a Can of Soup or Other Tasty Shortcuts,"Cooking , Methods , Quick & Easy"
"Fabulous Fondues: Appetizers, Main Courses & Desserts","Cooking , Courses & Dishes , Desserts"
Herbs (The Basic Flavorings Series),"Cooking , Specific Ingredients , Herbs, Spices, Condiments"
The New Vegetarian,"Cooking , Vegetarian"
Sugar Busters! Cut Sugar to Trim Fat,"Cooking , Health & Healing , Low Fat"
The Open Hand Celebration Cookbook: Great Chefs Cook for Festive Occasions,"Cooking , General"
The Vivid Flavors Cookbook: International Recipes from Hot & Spicy to Smokey & Sweet,"Cooking , Methods , Canning & Preserving"
Party!,"Cooking , Entertaining"
Keys Cuisine: Flavors of the Florida Keys,"Cooking , Regional & Ethnic , American , Southern States"
Quick Harvest: A Vegetarian's Guide to Microwave Cooking,"Cooking , General"
"The Everything Low Cholesterol Book: Reduce Your Risks And Ensure A Longer, Healthier Life","Cooking , Health & Healing , Low Cholesterol"
No Salt Needed Cookbook (Rodale's High Health Cookbook Series),"Cooking , General"
Cuisines of Europe (No. 06440),"Cooking , General"
Katie Brown Entertains: 16 Menus 16 Occasions 16 Tables,"Cooking , Reference"
Everyday Family Favourites,"Cooking , Courses & Dishes , General"
"Another Taste of Florida: The Best of ""Thought You'd Never Ask","Cooking , General"
A Clove of Garlic: Garlic for Health and Cookery : Recipes and Traditions,"Cooking , Specific Ingredients , Herbs, Spices, Condiments"
Tofu Mania: Add Tofu to 120 of Your Favorite Dishes,"Cooking , Vegetarian"
THE MICROWAVE COOK'S COMPLETE,"Cooking , Methods , Microwave"
Rose's Celebrations,"Cooking , General"
Table Inspirations: Original Ideas for Stylish Entertaining,"Cooking , Tablesetting"
The Colossal Cookie Cookbook,"Cooking , General"
Soyfoods Cookery: Your Road to Better Health,"Cooking , Vegetarian"
The Basic Gourmet Entertains: Foolproof Recipes and Manageable Menus for the Beginning Cook,"Cooking , Entertaining"
What's Cooking: Chicken,"Cooking , General"
Juices and Tonics,"Cooking , Beverages , Non-Alcoholic"
Grill Pan Cookbook: Great Recipes for Stovetop Grilling,"Cooking , Courses & Dishes , Salads"
Chiles,"Cooking , Specific Ingredients , Vegetables"
Let There Be Lite: An Illuminating Guide to Delicious Low-fat Cooking,"Cooking , Health & Healing , Low Fat"
The International Soup Book,"Cooking , Courses & Dishes , Soups & Stews"
Rotisserie Chickens to the Rescue!: How to Use the Already-Roasted Chickens You Purchase at the Market to Make More Than 125 Simple and Delicious Meals,"Cooking , Specific Ingredients , Poultry"
Cooking Thin with Chef Kathleen: 200 Easy Recipes for Healthy Weight Loss,"Cooking , Regional & Ethnic , American , General"
Cookoff: Recipe Fever in America,"Cooking , Regional & Ethnic , American , General"
The Book of Dressings and Marinades,"Cooking , Methods , General"
A Taste of Hawaii: New Cooking from the Crossroads of the Pacific,"Cooking , Regional & Ethnic , American , Western States"
A Little New York Cookbook,"Cooking , Regional & Ethnic , American , General"
Best Food Writing 2002,"Cooking , Essays & Narratives"
Feast of India: A Legacy of Recipes and Fables,"Cooking , Regional & Ethnic , Indian & South Asian"
Lighten Up: Low-Fat Versions of More Than 100 of America's Best-Known and Best-Loved Recipes,"Cooking , Health & Healing , Low Fat"
Jewish Holiday Treats: Recipes and Crafts for the Whole Family (Treats: Just Great Recipes),"Cooking , Regional & Ethnic , Jewish & Kosher"
Jane Butel's Southwestern Grill,"Cooking , Regional & Ethnic , American , Southwestern States"
Rose Reisman Brings Home Light Pasta,"Cooking , Specific Ingredients , Pasta"
Pasta Improvvisata: How to Improvise in Classic Italian Style,"Cooking , Beverages , Wine & Spirits"
Secrets of Fat-Free Cooking : Over 150 Fat-Free and Low-Fat Recipes from Breakfast to Dinner-Appetizers to Desserts,"Cooking , Health & Healing , Low Fat"
Mrs. Cook's Kitchen,"Cooking , Methods , Quick & Easy"
Start It: New Ideas for Sensational Appetizers (Cook It),"Cooking , Courses & Dishes , Appetizers"
The Living Heart Cookbook: Gourmet Low-Fat Recipes from Chez Eddy : Previously Published As the Chez Eddy Living Heart Cookbook,"Cooking , General"
"WORLD ATLAS OF WINE, 4TH EDITION","Cooking , Reference"
Decantations: Reflections on Wine by The New York Times Wine Critic,"Cooking , Beverages , Alcoholic , General"
Domesticity: A Gastronomic Interpretation of Love,"Cooking , General"
I'm Listening: The Butter Busters Cookbook Companion,"Cooking , Health & Healing , Low Fat"
Sides: Over 150 Enticing Accompaniments that Make the Meal,"Cooking , General"
Good Housekeeping Menus for a Whole Year of Dinners With over 700 Recipes and Tips,"Cooking , General"
The Deaf Smith Country Cookbook: Natural Foods for Family Kitchens,"Cooking , General"
Favorite Brand Name Recipe Cookbook Reference Series,"Cooking , Reference"
Betty Crocker's Buffets,"Cooking , General"
Main-Dish Soups (Little Vegetarian Feasts),"Cooking , Courses & Dishes , Soups & Stews"
Light & Healthy Microwave Cooking,"Cooking , Methods , Microwave"
Weight Watchers' Fast and Fabulous Cookbook,"Cooking , General"
Microwave Cook Book,"Cooking , General"
The Natural Healing Cookbook: Over 450 Delicious Ways to Get Better and Stay Healthy,"Cooking , General"
The Best 125 Meatless Pasta Dishes,"Cooking , Specific Ingredients , Pasta"
Graham Kerr's Minimax Cookbook,"Cooking , Reference"
Craig Clairborne's Gourmet Diet,"Cooking , Methods , Gourmet"
Too Busy to Cook?: Time-Saving Recipes and Easy Menus from Bon Appetit,"Cooking , General"
The Wellness Lowfat Cookbook,"Cooking , Health & Healing , Low Fat"
The Rodale Cookbook,"Cooking , Regional & Ethnic , American , General"
"A Yankee Christmas: Recipes, Crafts, and Carols","Cooking , Reference"
Best Recipes of the Great Food Companies,"Cooking , Reference"
Low-Fat & Luscious,"Cooking , Health & Healing , Low Fat"
In the Kitchen with Rosie: Oprah's Favorite Recipes,"Cooking , Reference"
Betty Crocker's Microwaving for One or Two,"Cooking , Methods , Microwave"
Better Homes and Gardens Low-Calorie Microwave Cookbook,"Cooking , General"
A Musical Feast: Recipes from over 100 of the World's Most Famous Musical Artists,"Cooking , General"
Cooking With a Food Processor,"Cooking , Methods , Special Appliances"
The Joy of Chocolate,"Cooking , Courses & Dishes , Chocolate"
The Great Cooks' Guide to Clay Cookery,"Cooking , Regional & Ethnic , American , General"
Delicious Desserts (Creative cuisine),"Cooking , General"
Lynn Fischer's Quick Low Cholesterol Gourmet: Delicious and Healthy Meals You Can Prepare in 20 Minutes or Less,"Cooking , Health & Healing , Low Cholesterol"
Spa Food Menus & Rec Fr Sonoma,"Cooking , Reference"
You've Got It Made: Make-Ahead Meals for the Family and for Cooperative Dinner Parties,"Cooking , General"
Microwave Diet Cookery,"Cooking , General"
Healthy Exchanges Cookbook,"Cooking , Health & Healing , General"
Butter Busters,"Cooking , Reference"
Sweet and Sugar Free: An All Natural Fruit-Sweetened Dessert Cookbook,"Cooking , Health & Healing , Diabetic & Sugar-Free"
James McNair's Salads,"Cooking , Courses & Dishes , Salads"
Windows on the World: Complete Wine Course,"Cooking , Beverages , Alcoholic , Wine"
Southern Living 1984 Annual Recipes (Southern Living Annual Recipes),"Cooking , Regional & Ethnic , American , Southern States"
Southern Living Cooking Light,"Cooking , General"
Baby Games: The Joyful Guide to Child's Play from Birth to Three Years,"Cooking , General"
The Party: A Guide to Adventurous Entertaining,"Cooking , Entertaining"
Supermarket Gourmet,"Cooking , Methods , Quick & Easy"
Healthy Family Cookbook (Better Homes and Gardens),"Cooking , Health & Healing , General"
"Simple, Lowfat & Vegetarian: Unbelievably Easy Ways to Reduce the Fat in Your Meals!","Cooking , Vegetarian"
The Lose Weight Naturally Cookbook,"Cooking , Specific Ingredients , Natural Foods"
The Book of Breakfasts and Brunches,"Cooking , Courses & Dishes , Brunch"
Simply Scrumptious Microwaving: A Collection of Recipes from Simple Everyday to Elegant Gourmet Dishes: A Cookbook,"Cooking , Regional & Ethnic , American , General"
Enjoying American Wines (California Culinary Academy),"Cooking , Beverages , Wine & Spirits"
Picnics in the Park: Moveable Feasts for Dining Alfresco,"Cooking , General"
"The Low-Fat, Low-Cholesterol Diet","Cooking , Health & Healing , Low Fat"
Recipes for Fat Free Living 2 Cookbook,"Cooking , Health & Healing , Low Fat"
Wine,"Cooking , Beverages , Wine & Spirits"
Thou Shalt Not Grill (Pennsylvania Dutch Mysteries with Recipes),"Cooking , General"
The Book of Stir-fry Dishes,"Cooking , Reference"
James Mcnair's Cheese,"Cooking , Specific Ingredients , Dairy"
Family Cookbook,"Cooking , Reference"
Cinnamon,"Cooking , General"
Basil,"Cooking , Reference"
The Strong Bones Healthy Exchanges Cookbook: 170 Calcium-Rich Recipes for a Lifetime of Healthy Eating (Healthy Exchanges Cookbooks),"Cooking , Health & Healing , General"
Cooking Secrets of the CIA: Favorite Recipes from the Culinary Institute -- America's Most Celebrated Cooking SchoolCompanion to the PBS Series,"Cooking , General"
Pasta and Garlic: Low-Fat Recipes..... That Work,"Cooking , Specific Ingredients , Pasta"
Controlling Your Fat Tooth,"Cooking , Reference"
Choices for a Healthy Heart (Comb Binding),"Cooking , Health & Healing , General"
"Robin Leach's Healthy Lifestyles Cookbook: Menus and Recipes from the Rich, Famous, and Fascinating","Cooking , General"
Five-Minute Pasta Sauces,"Cooking , Specific Ingredients , Pasta"
"Chicken Dinners 1, 2, 3: 125,000 Possible Combinations for Dinner Tonight (The 1, 2, 3 Dinners)","Cooking , Specific Ingredients , Poultry"
House Beautiful Entertaining,"Cooking , Entertaining"
Goodness of Potatoes and Roots (Goodness Series),"Cooking , Specific Ingredients , Vegetables"
Diabetic Desserts,"Cooking , Health & Healing , Diabetic & Sugar-Free"
Great Food: Over 175 Recipes from Six of the World's Greatest Chef's,"Cooking , Regional & Ethnic , International"
Winning Styles Cookbook,"Cooking , General"
ENTERTAINING DESSERTS,"Cooking , Entertaining"
"Chicken Dinners   24 Seasonal Menus: Featuring Delicious, Easy-to-Make Chicken Recipes for Family Suppers, ...","Cooking , Specific Ingredients , Poultry"
The Holiday Cookbook,"Cooking , Holiday"
The Five-Minute Salad,"Cooking , Courses & Dishes , Salads"
Mr. Food from My Kitchen to Yours: Stories and Recipes from Home,"Cooking , General"
The Louisiana New Garde,"Cooking , General"
Vinegars,"Cooking , General"
The High-Performance Cookbook: 150 High-Carb Recipes for Peak Performance,"Cooking , Health & Healing , General"
Kitchen Conversations: Robust Recipes and Lessons in Flavor from One of America's Most Innovative Chefs,"Cooking , Methods , General"
Dad Cooks Up a Party: The Complete Guide to Entertaining Family and Friends,"Cooking , Entertaining"
Appetizing Hors d'Oeuvres (Cole's Cooking Companion Series),"Cooking , Courses & Dishes , Appetizers"
Eat Smart for a Healthy Heart Cookbook,"Cooking , Health & Healing , General"
Prune Gourmet,"Cooking , General"
Cook Now Serve Later,"Cooking , Reference"
Vegetarian Baby: A Sensible Guide for Parents,"Cooking , Vegetarian"
The Fine Art of Garnishing (From Radish Roses To Watermelon Whales),"Cooking , General"
Help: healthy exchanges lifetime plan,"Cooking , Health & Healing , General"
Weight Watchers New International Cookbook,"Cooking , General"
Bordeaux: Revised Third Edition,"Cooking , Reference"
Family Circle Eat What You Love & Lose: Quick and Easy Diet Recipes from Our Test Kitchen,"Cooking , Health & Healing , Weight Control"
Chef Tells Quick Cuisine,"Cooking , General"
Cooking with Cornelius,"Cooking , General"
Reader's Digest Great Recipes for Good Health,"Cooking , Health & Healing , General"
Red Hot Gourmet (The Cooking Companion),"Cooking , Regional & Ethnic , General"
Patio Daddy-O: '50S Recipes With a Modern Twist,"Cooking , Methods , Outdoor"
The Country Fair Cookbook,"Cooking , General"
A Collection of the Very Finest Recipes Ever Assembled into One Cookbook,"Cooking , General"
Cooking Light the Lazy Gourmet,"Cooking , Health & Healing , Low Salt"
Recipes from Historic Hotels of America,"Cooking , General"
Beyond Chicken Soup: A Collection of Contemporary and Traditional Food Favorites,"Cooking , Reference"
"Drinks Without Alcohol: Nonalcoholic Slurpies & Smoothies, Cocktails & Punches, 200 Fresh, Fast & Fruity Little Sips and Great Big Gulps! Revised Edition","Cooking , Beverages , Non-Alcoholic"
Joie Warner's Caesar Salads: America's Favorite Salad,"Cooking , General"
"Pat and Betty's No-Fuss Cooking: More Than 200 Delicious, Time-Saving, and Easy Recipes From the Reynolds Kitchens","Cooking , Methods , Quick & Easy"
America and Its Cuisine,"Cooking , General"
Simple Southwest Cooking,"Cooking , Regional & Ethnic , American , Southwestern States"
POTATOES P (Particular Oalate Cookbook Series),"Cooking , Specific Ingredients , Vegetables"
Sensational Salads,"Cooking , General"
At Home with the French Classics,"Cooking , Regional & Ethnic , French"
Southwest Tastes: From the Television Series Great Chefs of the West,"Cooking , Regional & Ethnic , American , Southwestern States"
Betty Crocker's 1-2-3 Dinner: 350 Quick and Delicious Supper Solutions,"Cooking , General"
Lunch and Brunch Cookbook,"Cooking , Courses & Dishes , Brunch & Tea Time"
World Food Italy (World Food Series),"Cooking , Regional & Ethnic , Italian"
Kitchen Keepsakes by Request,"Cooking , Regional & Ethnic , General"
Everything Low Carb Cookbook (Everything Series),"Cooking , Health & Healing , Weight Control"
The All-in-One Diabetic Cookbook,"Cooking , Health & Healing , Diabetic & Sugar-Free"
Pierre Franey's Low-Calorie Gourmet,"Cooking , Methods , Gourmet"
Al Fresco,"Cooking , Health & Healing , General"
Autumn at the Farmers' Market (Gail Greco's Little Bed & Breakfast Cookbook Series),"Cooking , General"
"Red, Hot and Green","Cooking , Vegetarian"
New Southern Cooking,"Cooking , Regional & Ethnic , American , Southern States"
Betty Crocker's Pasta Favorites (Betty Crocker Paperback),"Cooking , Specific Ingredients , Pasta"
"American Heart Association Cookbook, 5th Edition","Cooking , Regional & Ethnic , American , General"
Joan Lunden's Healthy Cooking,"Cooking , Health & Healing , Low Fat"
Low Fat & Loving It: How to Lower Your Fat Intake and Still Eat the Foods You Love,"Cooking , Health & Healing , Low Fat"
"Weekend Kitchen, The:: Menus and Recipes for Relaxed Entertaining and Family Fun","Cooking , Reference"
Blue Ribbon Recipes: Award-Winning Recipes from America's Country Fairs (The Old Farmer's Almanac Home Library),"Cooking , Regional & Ethnic , American , General"
The Higher Taste: A Guide to Gourmet Vegetarian Cooking and a Karma-Free Diet,"Cooking , Vegetarian"
