Title,Category
Blue Collar Food: Easy Home Cooking for Hardworking People by Two Really Nice Guys,"Cooking , General"
The Essential Baking Cookbook,"Cooking , Methods , Baking"
Great Food Without Fuss: Simple Recipes from the Best Cooks,"Cooking , General"
"High Spirits: A Celebration of Scotch, Bourbon, Cognac, and More","Cooking , Beverages , Wine & Spirits"
"Low-Fat, High-Flavor Cookbook (Today's Gourmet)","Cooking , Health & Healing , Low Fat"
A Proper Breakfast,"Cooking , Courses & Dishes , Breakfast"
"Entertaining in Style: A Year of Recipes, Menus & Celebrations","Cooking , Entertaining"
James McNair Cooks Italian,"Cooking , Regional & Ethnic , Italian"
Home Cookin' with Dave's Mom,"Cooking , General"
Making It in Less Than a Hour,"Cooking , General"
Kitchen Science,"Cooking , General"
The Best of Family Circle Cookbook,"Cooking , General"
Light Desserts,"Cooking , General"
"Eat More, Weigh Less: Dr. Dean Ornish's Life Choice Program for Losing Weight Safely While Eating Abundantly","Cooking , Health & Healing , Low Fat"
Burt Wolf's Menu Cookbook,"Cooking , General"
Prevention's Quick and Healthy Low-Fat Cooking: Featuring Healthy Cuisines from the Mediterranean,"Cooking , Health & Healing , Low Fat"
Savoring the Wine Country,"Cooking , Beverages , Alcoholic , Wine"
Campbell's Easy Summer Recipes,"Cooking , Seasonal"
The Book of Grilling and Barbecuing,"Cooking , Methods , Barbecue & Grilling"
The Good Housekeeping Best Chicken Recipes,"Cooking , Regional & Ethnic , American , General"
The Book of Sushi,"Cooking , Regional & Ethnic , Japanese"
The Bread Machine Bakery Book,"Cooking , Courses & Dishes , Bread"
Dream Desserts: Luscious Low-Fat Recipes,"Cooking , General"
Betty Crocker's Microwave Cookbook,"Cooking , General"
Betty Crocker Mexican,"Cooking , General"
"The Best of Gourmet, 1986","Cooking , Methods , Gourmet"
Big Broccoli Book,"Cooking , Specific Ingredients , Vegetables"
"Christmas With Southern Living, 1987","Cooking , Holiday"
"Meat on the Grill: New Recipes for Beef, Lamb, Pork and Other Meats","Cooking , General"
The Seasonal Kitchen: A Return to Fresh Foods,"Cooking , General"
Debbi Fields' Great American Desserts: 100 Mouthwatering Easy-to-Prepare Recipes,"Cooking , Regional & Ethnic , American , General"
Cooking With Claudine (Jacques Pepin's Kitchen),"Cooking , General"
The Perfect Potato: Over 100 Fabulous Recipes-- from Appetizers to Desserts--for Potato Lovers Everywhere,"Cooking , Specific Ingredients , Vegetables"
Land O Lakes - Treasury of Country Recipes,"Cooking , General"
Healthy Vegetarian Cooking: Innovative Vegetarian Recipes for the Adventurous Cook,"Cooking , Vegetarian"
Weekdays Are Quick Meals: From Speedy Stir-Fires to Soups to Skillet Dishes and Thirty-Minute Stews (Everyday Cookbooks),"Cooking , Methods , Quick & Easy"
The Essential Barbecue Cookbook (Essential Cookbooks Series),"Cooking , Methods , Barbecue & Grilling"
Our Meals,"Cooking , General"
The Book of Hot and Spicy Foods,"Cooking , Reference"
"One-Pot Meals (Great Taste, Low Fat)","Cooking , Methods , Quick & Easy"
Hearty Salads,"Cooking , Courses & Dishes , Salads"
Wine Spectator's: The Essentials Of Wine,"Cooking , Beverages , Wine & Spirits"
Famous Personalities of Flight Cookbook,"Cooking , General"
Weight Watchers Healthy Life-Style Cookbook,"Cooking , Health & Healing , General"
Better Homes and Gardens Dieting for One (Better Homes & Gardens Books),"Cooking , General"
Grill It! Vegetarian: Over 80 Meat-free Recipes To Revolutionize Your Cooking,"Cooking , Methods , Barbecue & Grilling"
30 Low-Fat Meals in 30 Minutes,"Cooking , Health & Healing , Low Fat"
Sip to Shore: Cocktails and Hors D'Oeuvre,"Cooking , Reference"
Better Homes and Gardens Family Favorites Made Lighter,"Cooking , Reference"
Pasta Perfect (The Cooking Companion),"Cooking , Regional & Ethnic , Italian"
"The Eat Well, Be Well Cookbook","Cooking , General"
Ice Cream: The Perfect Weekend Treat,"Cooking , Specific Ingredients , Dairy"
Smoked Salmon,"Cooking , Specific Ingredients , Seafood"
The Great American Food Almanac,"Cooking , General"
Prepare To Cook,"Cooking , General"
More Healthy Homestyle Cooking: Family Favorites You'll Make Again And Again,"Cooking , Health & Healing , General"
Bacchus & Me: Adventures in the Wine Cellar,"Cooking , Beverages , Wine & Spirits"
The New Vegetarian Cookbook,"Cooking , Vegetarian"
The Passover Table: New and Traditional Recipes for Your Seders and the Entire Passover Week,"Cooking , Reference"
The Top One Hundred Pasta Sauces,"Cooking , Specific Ingredients , Pasta"
The Vegetarian Times Cookbook,"Cooking , Vegetarian"
Live! Don't Diet!: The Low-Fat Cookbook That Can Change Your Life!,"Cooking , General"
The Diabetic Chocolate Cookbook,"Cooking , Health & Healing , Diabetic & Sugar-Free"
Orville Redenbacher's Popcorn Cookbook,"Cooking , General"
"Drinks Without Liquor: For Bashes, Beaches, Bbqs and Birthdays","Cooking , Beverages , Wine & Spirits"
The Southern Living Garden Book (Southern Living (Paperback Oxmoor)),"Cooking , Regional & Ethnic , American , Southern States"
The Best of Bon Appetit: A Collection of Favorite Recipes from America's Leading Food Magazine: 001,"Cooking , General"
The Carefree Cook,"Cooking , General"
Finger Lickin' Rib Stickin' Great Tastin' Hot & Spicy Barbecue,"Cooking , Methods , Barbecue & Grilling"
Weight Watchers' Healthy Life-style Cookbook,"Cooking , General"
2-In-1: The Instant Cholesterol and Fat Control System,"Cooking , General"
Weight Watchers Favorite Recipes,"Cooking , Reference"
Great Chefs of the East: From the Television Series Great Chefs of the East,"Cooking , General"
The Monticello Cook Book,"Cooking , Regional & Ethnic , American , Southern States"
Weber's Art of the Grill Deck: Recipes for Outdoor Living (Discerning Tastes),"Cooking , Methods , Barbecue & Grilling"
Provencal Light,"Cooking , Reference"
Heartland Baking from the Midwest's Best Cooks,"Cooking , Methods , Baking"
The Naturalist's Herb Guide,"Cooking , Specific Ingredients , Herbs, Spices, Condiments"
From the Recipe Files of the C.I.A.,"Cooking , General"
"Best of Gourment, Volume 4 (Best of Gourmet)","Cooking , Methods , Gourmet"
Pillsbury Thirty-Minute Meals,"Cooking , Methods , Quick & Easy"
How to Garnish,"Cooking , General"
The Grill Book: New Foods and Flavors for the Grill,"Cooking , Methods , Barbecue & Grilling"
Wholehearted Cooking: Simply Delicious Low-Fat Recipes,"Cooking , Reference"
Supercut,"Cooking , Reference"
Winequest: The Wine Dictionary,"Cooking , Beverages , Wine & Spirits"
The Kitchen Companion,"Cooking , General"
The Creative Cook,"Cooking , General"
Art of Food,"Cooking , General"
"The Foxworthy Down-Home Cookbook: No Arugula, No Pate...No Problem!","Cooking , General"
Good Kitchen Magic (Good Magic),"Cooking , Methods , General"
The Farmer's Cookbook,"Cooking , General"
"The No Salt, No Sugar, No Fat, No Apologies Cookbook","Cooking , General"
Jeanne Jones Entertains: Cook It Light Menus for Every Occasion,"Cooking , Entertaining"
"The Mushroom Cookbook: More Than Sixty Easy, Imaginative Recipes (Basic Ingredients)","Cooking , Specific Ingredients , Vegetables"
Raising Kids and Tomatoes: Amusing Tales and Appetizing Recipes,"Cooking , Methods , General"
Recipes to Lower Your Fat Thermostat: The Official Companion to How to Lower Your Fat Thermostat and the New Neuropsychology of Weight Control,"Cooking , General"
The 5 in 10 Pasta Cookbook: 5 Ingredients in 10 Minutes or Less,"Cooking , General"
The Little Baking Cookbook: Traditional Recipes from a Country Kitchen (The Little Cookbook Series),"Cooking , General"
Chef Paul Prudhomme's Fork in the Road,"Cooking , Reference"
Coffee and Tea,"Cooking , Beverages , Coffee & Tea"
Tortillas,"Cooking , Regional & Ethnic , Mexican"
Peppers: A Cookbook,"Cooking , Reference"
Lee Bailey's Country Weekends (Recipes for Good Food and Easy Living),"Cooking , Regional & Ethnic , American , General"
Mediterranean Vegetarian Cooking,"Cooking , Regional & Ethnic , Mediterranean"
Prevention's Quick and Healthy Low-Fat Cooking: Featuring All-American Food,"Cooking , Regional & Ethnic , American , General"
Simple Pasta Step by Step,"Cooking , Methods , Quick & Easy"
"Home Cooking With Amy Coleman, Vol. 3","Cooking , General"
Four Seasons Salads (Creative Cuisine),"Cooking , General"
The Bread Machine Cookbook (Nitty Gritty Cookbooks),"Cooking , Courses & Dishes , Bread"
The Norman Rockwell Illustrated Cookbook: Classic American Recipes,"Cooking , General"
Crockery Favorites,"Cooking , Reference"
The Casual Vineyard Table: From Wente Vineyards,"Cooking , Regional & Ethnic , American , California Style"
"500 Treasured Country Recipes: Mouthwatering, Time-Honored, Tried-and-True, Handed-Down, Soul-Satisfying Dishes","Cooking , Regional & Ethnic , American , General"
Organic Food Guide: How To Shop Smarter And Eat Healthier,"Cooking , Specific Ingredients , Natural Foods"
The New Americana Cookbook: A Heart-Healthy Excursion Through Regional Cuisines,"Cooking , Regional & Ethnic , Central American & South American"
Sweet Indulgences,"Cooking , Reference"
Savory to Sweet: Pies & Tarts (The Creative Cook),"Cooking , Courses & Dishes , Pies"
Favorite Brand Name Pasta Collection,"Cooking , Specific Ingredients , Pasta"
Back to Protein: The Low Carb/No Carb Meat Cookbook,"Cooking , Health & Healing , General"
Diabetic Microwave Cookbook,"Cooking , Health & Healing , Diabetic & Sugar-Free"
Dining in France,"Cooking , General"
Grandma's Comfort Food Made Healthy (A Healthy Exchanges Cookbook),"Cooking , Regional & Ethnic , American , General"
Great Grilling: Easy & Elegant Entertaining All Year Round,"Cooking , General"
"Perfect Preserves: Easy Recipes for Delicious Jams, Jellies, Pickles, and Relishes","Cooking , General"
The Healing Power of Foods Cookbook,"Cooking , Health & Healing , General"
The American Bed and Breakfast Cookbook,"Cooking , General"
Best Wines!: Gold Medal Winners from the Leading Competitions Worldwide,"Cooking , Beverages , Wine & Spirits"
Eating Southern Style,"Cooking , Regional & Ethnic , American , Southern States"
"500 Low-Fat Fruit and Vegetable Recipes: The One-Stop Source for Heathful, Great-Tasting Meals","Cooking , Specific Ingredients , Vegetables"
Wine Spectator's: Pocket Guide To Wine,"Cooking , Beverages , Alcoholic , General"
Jane Butel's Hotter Than Hell: Hot & Spicy Dishes from Around the World,"Cooking , Reference"
Old-Fashioned Country Christmas Cookbook,"Cooking , Holiday"
"American Heart Association Low-Fat, Low-Cholesterol Cookbook, Second Edition: Heart-Healthy, Easy-to-Make Recipes That Taste Great","Cooking , Health & Healing , Low Fat"
"Food Mania: An Extraordinary Visual Record of the Art of Food, from Kitchen Garden to Banqueting Table","Cooking , History"
Diabetes Meal Planning Made Easy : How to Put the Food Pyramid to Work for You,"Cooking , Health & Healing , Diabetic & Sugar-Free"
Superfoods: Cook Your Way to Health,"Cooking , Health & Healing , General"
Champagne: The Spirit of Celebration,"Cooking , Beverages , Wine & Spirits"
"Cooking With Love, Italian Style","Cooking , Regional & Ethnic , Italian"
Picnic! Recipes and Menus for Outdoor Enjoyment,"Cooking , Methods , Outdoor"
Holiday Entertaining (Williams Sonoma Kitchen Library),"Cooking , Holiday"
From Sea To Shining Sea: The Great American Seafood Cookbook,"Cooking , Regional & Ethnic , American , General"
The Christmas Candy Book,"Cooking , Courses & Dishes , Confectionery"
Poultry on the Grill,"Cooking , Specific Ingredients , Poultry"
Country Inn Cookbook,"Cooking , General"
Halloween Treats: Recipes and Crafts for the Whole Family,"Cooking , Methods , General"
Chicken: 150 Great Recipes for All Seasons,"Cooking , Specific Ingredients , Meat"
The Crab Cookbook,"Cooking , Specific Ingredients , Seafood"
Bluefish Cookbook,"Cooking , Regional & Ethnic , American , New England"
The Butterball Turkey Cookbook,"Cooking , General"
Thanksgiving: Festive Recipes for the Holiday Table (Williams Sonoma Kitchen Library),"Cooking , Holiday"
Quick & Easy Chocolate: 70 Imaginative Recipes for the Busy Cook,"Cooking , Methods , Quick & Easy"
"Pumpkin, Butternut & Squash: 30 Sweet and Savory Recipes","Cooking , Specific Ingredients , Fruit"
Chicken Breasts:116 new and classic recipes for the fairest part of the fowl,"Cooking , Specific Ingredients , Poultry"
Jewish Holiday Feasts (The Artful Kitchen Collection),"Cooking , Regional & Ethnic , Jewish & Kosher"
Chicken for Every Occasion Cookbook,"Cooking , General"
The Christmas Cookie Book,"Cooking , Seasonal"
Christmas (Cook's Encyclopedias),"Cooking , Reference"
Jack Daniel's the Spirit of Tennessee Cookbook,"Cooking , Beverages , Wine & Spirits"
Busy Woman's Cookbook,"Cooking , Methods , Quick & Easy"
Everything Wine Book (Everything (Cooking)),"Cooking , Beverages , Alcoholic , Wine"
Best of the Best from North Carolina: Selected Recipes From North Carolina's Favorite Cookbooks,"Cooking , Regional & Ethnic , American , Southern States"
The Flavor of the Chesapeake Bay Cookbook,"Cooking , General"
A Return to Sunday Dinner,"Cooking , Regional & Ethnic , General"
The Essential Barbecue Cookbook (Cole's Home Library Cookbooks),"Cooking , Methods , Outdoor"
Cooking for One,"Cooking , General"
The Chesapeake Bay Crab Cookbook,"Cooking , General"
All-Maine Cooking,"Cooking , Regional & Ethnic , American , New England"
"Simple Foods for the Pack, Second Edition","Cooking , Reference"
The Useful Pig: 150 Succulent Pork Recipes,"Cooking , General"
Celebration of American Food: Four Centuries in the Melting Pot (The Library of Congress Series),"Cooking , Regional & Ethnic , American , General"
Great Cooking With Country Inn Chefs: A Culinary Journey Across America,"Cooking , Reference"
The All-Summer Cookbook,"Cooking , Seasonal"
"Cooking Fresh from the Mid-Atlantic: Tantalizing Recipes, Famous Chefs, and Conversations","Cooking , Regional & Ethnic , American , Middle Atlantic States"
The Chesapeake Cookbook,"Cooking , Reference"
Bocaditos,"Cooking , Regional & Ethnic , Mexican"
"The New Complete Coffee Book: A Gourmet Guide to Buying, Brewing, and Cooking","Cooking , Beverages , Coffee & Tea"
Extreme Lo-Carb Meals On The Go: Fast And Fabulous Solutions To Get You Through The Day,"Cooking , Methods , Quick & Easy"
The Taste of France,"Cooking , Regional & Ethnic , French"
Martha Stewart's Quick Cook,"Cooking , Methods , Quick & Easy"
The Lady & Sons Just Desserts: More Than 120 Sweet Temptations from Savannah's Favorite Restaurant,"Cooking , Courses & Dishes , Desserts"
"Corn: 140 Recipes: Roasted, Creamed, Simmered & More","Cooking , Specific Ingredients , Vegetables"
Martha Stewart's Quick Cook,"Cooking , Methods , Quick & Easy"
Diner: The Best of Casual American Cooking (The Casual Cuisines of the World),"Cooking , Regional & Ethnic , American , General"
Bread Machine Magic: 139 Exciting New Recipes Created Especially for Use in All Types of Bread Machines,"Cooking , Courses & Dishes , Bread"
Lost Arts,"Cooking , Reference"
Smithsonian Folklife Cookbook,"Cooking , Reference"
The Great Food Almanac: A Feast of Facts from A to Z,"Cooking , General"
With Heart And Soul - Among Friends,"Cooking , Regional & Ethnic , American , General"
"Jewish Cooking The Traditions, Techniques, Ingredients, and Recipes","Cooking , General"
"Thanksgiving Book, The","Cooking , General"
Rachael Ray 30-Minute Meals 2,"Cooking , Methods , Quick & Easy"
Chili Cookbook,"Cooking , Reference"
The Get with the Program! Guide to Good Eating: Great Food for Good Health,"Cooking , Health & Healing , General"
Virginia's Historic Restaurants and Their Recipes,"Cooking , Regional & Ethnic , American , Southern States"
Charles Wysocki's Americana Cookbook,"Cooking , Regional & Ethnic , American , General"
U.S.A. Cookbook,"Cooking , Regional & Ethnic , American , General"
Dutch Oven Cooking,"Cooking , Regional & Ethnic , European"
Best of the Best from Virginia Cookbook: Selected Recipes from Virginia's Favorite Cookbooks,"Cooking , Regional & Ethnic , American , Southern States"
Cooking for Camp and Trail,"Cooking , General"
Good Housekeeping Illustrated American Cookbook,"Cooking , Regional & Ethnic , American , General"
Bugialli's Italy: Traditional Recipes From The Regions Of Italy,"Cooking , Regional & Ethnic , Italian"
Cooking Secrets: Mid-Atlantic & Chesapeake,"Cooking , Regional & Ethnic , American , Middle Atlantic States"
More Wok Cookery,"Cooking , Methods , Wok"
Virginia Celebrates: Recipes and Ideas for Entertaining,"Cooking , Regional & Ethnic , American , Southern States"
Secrets of Fat-Free Baking,"Cooking , Courses & Dishes , Desserts"
Country Inn Meals to Remember: Based on the Pbs-TV Series More Country Inn Cooking With Gail Greco,"Cooking , Regional & Ethnic , American , General"
"Cheese: How to Choose, Serve and Enjoy","Cooking , Specific Ingredients , Dairy"
U.S.A. Cookbook,"Cooking , Regional & Ethnic , American , General"
The Great East Coast Seafood Book,"Cooking , Specific Ingredients , Seafood"
Celebrating the Impressionist Table,"Cooking , Regional & Ethnic , French"
Pasta Machine Cookbook (A Nitty Gritty Cookbook),"Cooking , Specific Ingredients , Pasta"
The Stonyfield Farm Yogurt Cookbook,"Cooking , Specific Ingredients , Dairy"
The Tea Book,"Cooking , Beverages , Coffee & Tea"
Better Homes and Gardens Bread Machine Bounty,"Cooking , Courses & Dishes , Bread"
Southern Living Big Book of Christmas Baking,"Cooking , Holiday"
The Christmas Table: A Holiday Menu Cookbook,"Cooking , General"
Country Breakfasts,"Cooking , General"
Eating in: The Official Single Man's Cookbook,"Cooking , Reference"
The 47 Best Chocolate Chip Cookies in the World: The Recipes That Won the National Chocolate Chip Cookie Contest,"Cooking , Courses & Dishes , Cookies"
Muffins,"Cooking , Reference"
Food Finds: America's Best Local Foods and the People Who Produce Them,"Cooking , Regional & Ethnic , American , General"
The Good Breakfast Book: Making Breakfast Special,"Cooking , Courses & Dishes , Breakfast"
Cool Desserts,"Cooking , General"
Country Inns and Backroads Cookbook,"Cooking , Regional & Ethnic , American , General"
Chocolate: Food of the Gods,"Cooking , General"
The Summertime Cookbook: Elegant but Easy Dining--Indoors and Out,"Cooking , General"
Williams-Sonoma's Celebrating the Pleasures of Cooking: Chuck Williams Commemorates 40 Years of Cooking in America,"Cooking , Regional & Ethnic , American , General"
LA France Gastronomique,"Cooking , General"
The Cook's Magazine Cookbook,"Cooking , General"
James McNair's Potato Cookbook,"Cooking , Specific Ingredients , Vegetables"
A Festive Christmas (Better Homes & Gardens Test Kitchen),"Cooking , Holiday"
The Best of Ice Cream: A Cookbook,"Cooking , General"
Even More Top Secret Recipes: More Amazing Kitchen Clones of America's Favorite Brand-Name Foods,"Cooking , Regional & Ethnic , American , General"
The Lady & Sons Savannah Country Cookbook,"Cooking , Regional & Ethnic , American , Southern States"
Simply Homemade Food Gifts,"Cooking , Holiday"
Christopher Idone's Salad Days,"Cooking , Courses & Dishes , Salads"
"Taking Tea: The Essential Guide to Brewing, Serving, and Entertaining with Teas from Around the World","Cooking , Beverages , Coffee & Tea"
Skewer It!: 50 Recipes for Stylish Entertaining,"Cooking , General"
Chocolate Bar (Stonesong Press Books),"Cooking , Specific Ingredients , Chocolate"
Colorado Collage,"Cooking , Regional & Ethnic , American , Southwestern States"
American Frugal Housewife: Dedicated to Those Who Are Not Ashamed of Economy (Cooking in America),"Cooking , Regional & Ethnic , American , General"
Virginia Fare,"Cooking , General"
Diabetic Meals in 30 Minutes--Or Less!,"Cooking , Health & Healing , Diabetic & Sugar-Free"
California Pizza Kitchen Cookbook,"Cooking , Regional & Ethnic , American , California Style"
Gluten Free & Easy: Enjoy Your Favorite Foods with These 90+ Recipes,"Cooking , Health & Healing , Gluten-Free"
"Spies, Black Ties, & Mango Pies: Stories and Recipes from CIA Families All over the World","Cooking , General"
"The Spirit of Christmas: Creative Holiday Ideas, Book 8","Cooking , Holiday"
The Spirit of Christmas: Creative Holiday Ideas Book 10,"Cooking , Holiday"
The Spirit of Christmas,"Cooking , Holiday"
Penny Whistle Party Planner,"Cooking , General"
Chinese Cooking Class Cookbook,"Cooking , Regional & Ethnic , Chinese"
Tuesday Is Chicken and Turkey and Chicken Salad and More (Everyday Cookbooks),"Cooking , Specific Ingredients , Poultry"
Biscuits and Scones: 62 Recipes from Breakfast Biscuits to Homey Desserts,"Cooking , Reference"
"Homemade, best made (Reader's Digest General Books)","Cooking , Regional & Ethnic , American , General"
Zone-Perfect Meals in Minutes (The Zone),"Cooking , Health & Healing , General"
Forever Summer (Style Network's),"Cooking , Regional & Ethnic , American , General"
The Naked Chef,"Cooking , Regional & Ethnic , English, Scottish & Welsh"
"Nigella Bites: From Family Meals to Elegant Dinners -- Easy, Delectable Recipes For Any Occasion","Cooking , Methods , Baking"
Chinese Kosher Cooking,"Cooking , Regional & Ethnic , Jewish & Kosher"
The Party Girl Cookbook,"Cooking , Entertaining"
Juicing for Life: A Guide to the Benefits of Fresh Fruit and Vegetable Juicing,"Cooking , Beverages , General"
Back to the Table: The Reunion of Food and Family,"Cooking , Courses & Dishes , General"
Everyday Pasta: A Cookbook,"Cooking , Regional & Ethnic , Italian"
Everyday Italian: 125 Simple and Delicious Recipes,"Cooking , Regional & Ethnic , Italian"
"Fish on the Grill: More Than 70 Elegant, Easy, and Delectable Recipes","Cooking , General"
30 Low-Fat Vegetarian Meals in 30 Minutes,"Cooking , Vegetarian"
Cooking 'Round the Clock: Rachael Ray's 30-Minute Meals,"Cooking , Methods , Quick & Easy"
Food & Wine Magazine's Best of the Best,"Cooking , General"
Stir-Fry (Williams-Sonoma Kitchen Library),"Cooking , Reference"
Southern Living 1987 Annual Recipes (Southern Living Annual Recipes),"Cooking , Regional & Ethnic , American , Southern States"
Ice Creams and Sorbets: Bantam Library of Culinary Arts,"Cooking , General"
Fresh Ways With Soups and Stews (Healthy Home Cooking),"Cooking , Courses & Dishes , Soups & Stews"
"Unbelievable Desserts with Splenda: Sweet Treats Low in Sugar, Fat and Calories","Cooking , Courses & Dishes , Desserts"
Perfect Mix,"Cooking , Courses & Dishes , Desserts"
"C'MON AMERICA, LET'S EAT!: Susan's Favorite Low-Fat Recipes To Fit Your Lifestyle","Cooking , Health & Healing , Low Fat"
Southern Living: Microwave Cooking Made Easy,"Cooking , General"
Vegetarian Epicure,"Cooking , Vegetarian"
The Wok: A Complete and Easy Guide to Preparing a Wide Variety of Authentic Chinese Favorites (Nitty Gritty Cookbooks),"Cooking , Methods , Wok"
"Pasta Light: 80 Low-Fat, Low Calorie, Fast & Fabulous Pasta Sauces","Cooking , Health & Healing , Low Fat"
The Flavors of France: Fabulous Vegetarian Cuisine for Every Occasion : An Earthly Delight Cookbook,"Cooking , General"
The 99% Fat-Free Cookbook (99% Fat-free Series),"Cooking , Reference"
Delia Smith's Summer Collection: 140 Recipes fo,"Cooking , Seasonal"
Lee Bailey's Soup Meals,"Cooking , Courses & Dishes , Soups & Stews"
"The Moosewood Cookbook: Recipes from Moosewood Restaurant, Ithaca, New York","Cooking , General"
Wine For Dummies,"Cooking , Beverages , Alcoholic , General"
The American Vegetarian Cookbook from the Fit for Life Kitchen,"Cooking , Regional & Ethnic , American , General"
Food & Wine Annual Cookbook 2004: An Entire Year of Recipes,"Cooking , General"
Farmer's Market Cookbook (Making the most of fresh and seasonal produce with over 140 recipes),"Cooking , General"
The Gourmet Potluck: Show-Stopping Recipes for the Buffet Table,"Cooking , Methods , Special Appliances"
"One-Pot Vegetarian Dishes (One-Pot Sunday Suppers Series , No 2)","Cooking , Vegetarian"
New Flavors from Your Crockery Cooker (Better Homes and Gardens(R)),"Cooking , Courses & Dishes , Soups & Stews"
"Desserts, Candy & Cookie Cookbook","Cooking , Courses & Dishes , Desserts"
Christmas With Southern Living 1994,"Cooking , Holiday"
Chicken (Williams-Sonoma Kitchen Library),"Cooking , Specific Ingredients , Poultry"
"Alice, Let's Eat","Cooking , Essays & Narratives"
The Frugal Gourmet Cooks American,"Cooking , Methods , Gourmet"
500 More Low-Carb Recipes,"Cooking , Health & Healing , Weight Control"
"The American Country Inn and Bed & Breakfast Cookbook: More Than 1,700 Crowd-Pleasing Recipes from 500 American Inns (American Country Inn & Bed & Breakfast Cookbook)","Cooking , Regional & Ethnic , American , General"
"Rosie's Bakery All-Butter, Fresh Cream, Sugar-Packed, No-Holds-Barred Baking Book","Cooking , Methods , Baking"
Beyond Parsley,"Cooking , Reference"
Set with Style: Perfect Tables from the Dining Room to the Kitchen,"Cooking , Entertaining"
Chicken on the Run (Collectors Series),"Cooking , Specific Ingredients , Poultry"
Southern Living 1991 Annual Recipes (Southern Living Annual Recipes),"Cooking , Regional & Ethnic , American , Southern States"
Tea Chings: The Tea and Herb Companion :Appreciating the Varietals and Virtues of Fine Tea and Herbs,"Cooking , Beverages , Coffee & Tea"
"Wine, Food & Friends: Karen's Wine and Food Pairing Guide, Plus Over 100 Cooking Light Recipes","Cooking , Entertaining"
Overstreet's New Wine Guide: Celebrating the New Wave in Winemaking,"Cooking , Beverages , Alcoholic , Wine"
Betty Crocker's Working Woman's Cookbook,"Cooking , General"
The 20-Minute Natural Foods Cookbook,"Cooking , General"
