Title,Category
The Best of Mexico,"Cooking , Regional & Ethnic , Mexican"
Great Snacks & Appetizers,"Cooking , Courses & Dishes , Appetizers"
Super-Charged Smoothies: More Than 60 Recipes for Energizing Smoothies,"Cooking , Beverages , Juices & Smoothies"
50 Chowders: 50 Chowders,"Cooking , Regional & Ethnic , American , General"
The Pleasures of Cooking,"Cooking , Reference"
Recipes from America's Small Farms: Fresh Ideas for the Season's Bounty: A Cookbook,"Cooking , Specific Ingredients , Natural Foods"
"1,001 Low-Fat Vegetarian Recipes, 2nd ed.","Cooking , Regional & Ethnic , Vietnamese"
"The Complete Vegan Cookbook: Over 200 Tantalizing Recipes, Plus Plenty of Kitchen Wisdom for Beginners and Experienced Cooks","Cooking , Vegan"
"Hot Toddies: Mulled Wine, Buttered Rum, Spiced Cider, and Other Soul-Warming Winter Drinks","Cooking , Beverages , Wine & Spirits"
The Vegetarian Grill: 200 Recipes for Inspired Flame-Kissed Meals,"Cooking , Methods , Barbecue & Grilling"
"The Vegan Gourmet, Expanded 2nd Edition : Full Flavor & Variety With over 120 Delicious Recipes","Cooking , Vegan"
Better Homes and Gardens Country Cooking,"Cooking , General"
Christmas with Southern Living 2006,"Cooking , Holiday"
Family Circle Step-by-Step Sensational Vegetable Recipes,"Cooking , General"
The Arrows Cookbook: Cooking and Gardening from Maine's Most Beautiful Farmhouse Restaurant,"Cooking , General"
A Passion for Coffee,"Cooking , Beverages , Coffee & Tea"
Becoming a Chef: With Recipes and Reflections from America's Leading Chefs,"Cooking , Methods , Professional"
Luscious Lemon Desserts,"Cooking , Courses & Dishes , Desserts"
The Best of Southern Italian Cooking,"Cooking , Regional & Ethnic , Italian"
Friday Is Fish and Shrimp and Scallops and Crab and More (Everyday Cookbooks),"Cooking , Specific Ingredients , Seafood"
The Big Book of Backyard Cooking: 250 Favorite Recipes for Enjoying the Great Outdoors,"Cooking , Methods , Outdoor"
Christmas with Southern Living 2004,"Cooking , Holiday"
Better Homes and Gardens Cajun Cooking,"Cooking , General"
Desserts to Die for,"Cooking , Courses & Dishes , Desserts"
The Pasta Bible,"Cooking , Specific Ingredients , Pasta"
Good Things for Easy Entertaining: The Best of Martha Stewart Living,"Cooking , Entertaining"
Salads (Williams-Sonoma Kitchen Library),"Cooking , Courses & Dishes , Salads"
"Allrecipes All Time Favorite Best Brand Recipes: Over 350 Brand Name Recipes from Allrecipes.com, The Worlds Number 1 Cooking Website","Cooking , General"
Christmas Around the World Cookbook,"Cooking , General"
Better Than Peanut Butter & Jelly: Quick Vegetarian Meals Your Kids Will Love!,"Cooking , Vegetarian"
Beyond Grits and Gravy: The South's All-Time Favorite Recipes (Best of the Best Cookbook Series),"Cooking , Regional & Ethnic , American , Southern States"
The Barbecue! Bible: Over 500 Recipes,"Cooking , Methods , Barbecue & Grilling"
Fix-it and Forget it Recipes for Entertaining: Slow Cooker Favorites for All the Year Round,"Cooking , Methods , General"
Cheap. Fast. Good!,"Cooking , Methods , Quick & Easy"
Semi-Homemade Slow Cooker Recipes 2,"Cooking , Methods , Special Appliances"
Paula Deen's The Deen Family Cookbook,"Cooking , Regional & Ethnic , American , Southern States"
Cooking Light Soups & Stews Cookbook,"Cooking , Courses & Dishes , Soups & Stews"
Recipes from Central Market,"Cooking , Regional & Ethnic , Jewish & Kosher"
"The Best of Gourmet, 1998, Featuring the Flavors of India","Cooking , Methods , Gourmet"
Good Fats and Oils (Natural Health Guide) (Alive Natural Health Guides),"Cooking , Health & Healing , General"
The All New Complete Cooking Light Cookboook: The Ultimate Guide from America's #1 Food Magazine (Cookbook),"Cooking , Courses & Dishes , General"
The Raw Gourmet,"Cooking , Methods , Gourmet"
Make-It-Simple Entertaining: Fabulous Menus for Festive Celebrations,"Cooking , Entertaining"
The Beer Enthusiast's Guide: Tasting & Judging Brews from Around the World,"Cooking , Beverages , Beer"
Cooking Class Chicken Cookbook,"Cooking , Specific Ingredients , Poultry"
Cooking Light: Dessert,"Cooking , Courses & Dishes , Desserts"
"Satisfying Soups: Homemade Bisques, Chowders, Gumbos, Stews & More","Cooking , Reference"
"Marlene Koch's Sensational Splenda Recipes: Over 375 Recipes Low in Sugar, Fat, and Calories","Cooking , Specific Ingredients , General"
Roasting: A Simple Art,"Cooking , Methods , Baking"
Casual Cookouts (Fresh & Simple),"Cooking , Methods , Barbecue & Grilling"
Pasta (101 Essential Tips),"Cooking , Specific Ingredients , Pasta"
Pepperidge Farm Easy Entertaining: Recipes for Family and Friends,"Cooking , Entertaining"
Betty Crocker's Bisquick Cookbook,"Cooking , Methods , Baking"
The Microwave Master,"Cooking , General"
Pillsbury: Best Muffins and Quick Breads: Favorite Recipes from America's Most-Trusted Kitchens,"Cooking , General"
The Versatile Rice Cooker (Nitty Gritty Cookbooks),"Cooking , Specific Ingredients , Rice & Grains"
Steaklover's Companion: 170 Savory Recipes from America's Greatest Chefs,"Cooking , Specific Ingredients , Meat"
Mable Hoffman's Crockery Cookery,"Cooking , General"
First Steps in Winemaking,"Cooking , Beverages , Wine & Spirits"
Paula Deen's Kitchen Wisdom and Recipe Journal,"Cooking , Regional & Ethnic , American , Southern States"
Flavors of China,"Cooking , Regional & Ethnic , Chinese"
Wok Cookbook,"Cooking , General"
Better Homes and Gardens Tasty Timesaving Cooking,"Cooking , General"
Anne Willan's LOOK & COOK Fish Classics,"Cooking , Specific Ingredients , Seafood"
101 Things to Do with a Tortilla,"Cooking , Regional & Ethnic , American , Southwestern States"
America's Most Wanted Recipes: Delicious Recipes from Your Family's Favorite Restaurants (America's Most Wanted Recipes Series),"Cooking , Courses & Dishes , General"
Wine: A Basic Course,"Cooking , Beverages , Alcoholic , General"
"Mccormick & Schmick's: Seafood Restaurant Cookbook, 2nd Edition","Cooking , Specific Ingredients , Seafood"
500 Cupcakes: The Only Cupcake Compendium You'll Ever Need (500 Cooking (Sellers)),"Cooking , Courses & Dishes , Cakes"
"The Everything Slow Cooker Cookbook: 300 Delicious, Healthy Meals That You Can Toss in Your Crockery and Prepare in a Snap","Cooking , Methods , Special Appliances"
Southern on Occasion: A Companion to Inspire Gracious Living,"Cooking , Regional & Ethnic , American , Southern States"
"Cheese & Wine: A Guide to Selecting, Pairing, and Enjoying","Cooking , Specific Ingredients , Dairy"
'Tis the Season: A Vegetarian Christmas Cookbook,"Cooking , Holiday"
Six Ingredients or Less: Over 500 Quick and Easy Recipes Using 6 Ingredients or Less,"Cooking , Methods , Quick & Easy"
Christmas with Southern Living 2008: Great Recipes - Easy Entertaining - Festive Decorations - Gift Ideas,"Cooking , Holiday"
"FamilyFun's Parties: 100 Party Plans for Birthdays, Holidays & Every Day (FamilyFun Series, No. 3)","Cooking , Entertaining"
Larousse Traditional French Cooking,"Cooking , Regional & Ethnic , French"
The Top One Hundred Pasta Sauces,"Cooking , Specific Ingredients , Pasta"
Gourmet Today: More than 1000 All-New Recipes for the Contemporary Kitchen,"Cooking , Regional & Ethnic , General"
Betty Crocker's Good and Easy Cookbook,"Cooking , Methods , Quick & Easy"
Wild Rice for All Seasons Cook Book,"Cooking , Specific Ingredients , Rice & Grains"
The Simple Art of Napkin Folding: 94 Fancy Folds for Every Tabletop Occasion,"Cooking , Tablesetting"
"Ultimate Smoothies: Delicious Recipes for Over 125 of the Best Smoothies, Freezes, and Blasts","Cooking , Beverages , Juices & Smoothies"
The New Stir-fry Cookbook (Step-by-step),"Cooking , Methods , Special Appliances"
Not Your Mother's Slow Cooker Recipes for Entertaining,"Cooking , Methods , Quantity"
Not Your Mother's Slow Cooker Cookbook,"Cooking , Methods , Special Appliances"
Not Your Mother's Weeknight Cooking: Quick and Easy Wholesome Homemade Dinners,"Cooking , Courses & Dishes , General"
Professional Chef's Book of Buffets,"Cooking , General"
Your Organic Kitchen: The Essential Guide to Selecting and Cooking Organic Foods,"Cooking , Health & Healing , General"
Best of the Best Vol. 10: The Best Recipes from the 25 Best Cookbooks of the Year (Food & Wine Best of the Best Recipes Cookbook),"Cooking , Regional & Ethnic , International"
"Everybody Loves Ramen: Recipes, Stories, Games, & Fun Facts About the Noodles You Love","Cooking , General"
"Lidia's Italian-American Kitchen: The Companion to her New 52-Part Public Television Series her most Instructive, Personal, and Inspiring Cookbook","Cooking , Regional & Ethnic , Italian"
"Wild Women Throw a Party: 110 Original Recipes and Amazing Menus for Birthday Bashes, Power Showers, Poker Soirees, and Celebrations Galore","Cooking , Entertaining"
Pork and Ham Menus (Great Meals in Minutes),"Cooking , Specific Ingredients , Meat"
Better Homes and Gardens Pasta Recipes,"Cooking , General"
Colorado Cookbook (Cooking Across America),"Cooking , Regional & Ethnic , American , Western States"
Cooking for Christmas (Step-By-Step Series),"Cooking , General"
"Things Cooks Love: Implements, Ingredients, Recipes","Cooking , Regional & Ethnic , International"
Betty Crocker's Best Chicken Cookbook (Betty Crocker Cooking),"Cooking , Specific Ingredients , Poultry"
Good Housekeeping Baking: More Than 600 Recipes for Homemade Treats,"Cooking , Methods , Baking"
The Joy of Eating: A Simply Delicious Cookbook,"Cooking , Reference"
Extraordinary Meals from Ordinary Ingredients: 919 Fabulously Fast and Frugal Recipes Each With a Secret Ingredient,"Cooking , Regional & Ethnic , American , General"
Cooking for Comfort: More Than 100 Wonderful Recipes That Are as Satisfying to Cook as They Are to Eat,"Cooking , Regional & Ethnic , American , General"
Simple Slow Cooker Recipes (Better Homes & Gardens Cooking),"Cooking , Methods , Special Appliances"
Taste of Home: Busy Family Cookbook: 370 Recipes for Weeknight Dinners,"Cooking , Methods , Quick & Easy"
Got Milk? the Cookie Book,"Cooking , Courses & Dishes , Cookies"
Italian Grilling,"Cooking , Regional & Ethnic , Italian"
Betty Crocker's Quick Dinners in 30 Minutes or Less (Betty Crocker Paperbacks),"Cooking , Methods , Quick & Easy"
The Party Planner,"Cooking , Entertaining"
Grow 15 Herbs for the Kitchen: Storey's Country Wisdom Bulletin A-61 (Storey Country Wisdom Bulletin),"Cooking , Specific Ingredients , Herbs, Spices, Condiments"
Italy: A Culinary Journey,"Cooking , General"
The Eating Well Recipe Rescue Cookbook: Healthy Versions of Favorite Recipes from the Magazine of Food and Health,"Cooking , Reference"
Better Homes and Gardens Candy,"Cooking , General"
"Betty Crocker One-Dish Meals: Casseroles, Skillet Meals, Stir-Fries and More for Easy, Everyday Dinners (Betty Crocker Books)","Cooking , Methods , Quick & Easy"
The Master Your Metabolism Cookbook,"Cooking , Health & Healing , Weight Control"
Flat Belly Diet! Cookbook: 200 New MUFA Recipes,"Cooking , Health & Healing , Weight Control"
Tosca Reno's Eat Clean Cookbook: Delicious Recipes That Will Burn Fat and Re-Shape Your Body!,"Cooking , Health & Healing , General"
"The Kind Diet: A Simple Guide to Feeling Great, Losing Weight, and Saving the Planet","Cooking , Vegetarian"
Biggest Loser Family Cookbook: Budget-Friendly Meals Your Whole Family Will Love,"Cooking , Courses & Dishes , General"
Super Baby Food,"Cooking , Reference"
Ani's Raw Food Essentials: Recipes and Techniques for Mastering the Art of Live Food,"Cooking , Specific Ingredients , General"
Hungry Girl: 200 Under 200: 200 Recipes Under 200 Calories,"Cooking , Health & Healing , Weight Control"
"Eat What You Love: More than 300 Incredible Recipes Low in Sugar, Fat, and Calories","Cooking , Health & Healing , Diabetic & Sugar-Free"
Cook Yourself Thin Faster: Have Your Cake and Eat It Too with Over 75 New Recipes You Can Make in a Flash!,"Cooking , Health & Healing , Weight Control"
The G-Free Diet: A Gluten-Free Survival Guide,"Cooking , Health & Healing , General"
The Cake Mix Doctor Returns!: With 160 All-New Recipes,"Cooking , Courses & Dishes , Cakes"
"Hungry Girl 1-2-3: The Easiest, Most Delicious, Guilt-Free Recipes on the Planet","Cooking , Methods , Quick & Easy"
The Sneaky Chef to the Rescue: 101 All-New Recipes and Sneaky Tricks for Creating Healthy Meals Kids Will Love,"Cooking , Health & Healing , General"
Cook Yourself Thin: Skinny Meals You Can Make in Minutes,"Cooking , Health & Healing , Weight Control"
The Eat-Clean Diet Cookbook: Great-Tasting Recipes that Keep You Lean! (Eat Clean Diet Cookbooks),"Cooking , Health & Healing , Weight Control"
Green Smoothie Revolution: The Radical Leap Towards Natural Health,"Cooking , Specific Ingredients , Natural Foods"
"So Easy: Luscious, Healthy Recipes for Every Meal of the Week","Cooking , Health & Healing , General"
Prevention's Diabetes Diet Cookbook,"Cooking , Health & Healing , General"
Molto Gusto: Easy Italian Cooking,"Cooking , Regional & Ethnic , Italian"
Jan Karon's Mitford Cookbook and Kitchen Reader,"Cooking , Methods , General"
101 Things to Do with Ramen Noodles (101 Things to Do With...recipes),"Cooking , Methods , Baking"
"Ani's Raw Food Kitchen: Easy, Delectable Living Foods Recipes","Cooking , Methods , Raw Food"
"First Meals Revised: Fast, healthy, and fun foods to tempt infants and toddlers","Cooking , Methods , Quick & Easy"
Planet Barbecue!,"Cooking , Methods , Barbecue & Grilling"
Giada's Kitchen: New Italian Favorites: A Cookbook,"Cooking , Regional & Ethnic , Italian"
Food and Wine Annual Cookbook 2010: An Entire Year of Recipes,"Cooking , General"
Not Your Mother's Slow Cooker Recipes for Two,"Cooking , Methods , Special Appliances"
Gluten Free Every Day Cookbook: More than 100 Easy and Delicious Recipes from the Gluten-Free Chef,"Cooking , Health & Healing , Allergy"
Don't Panic: More Dinner's in the Freezer - A Second Helping of Tasty Meals You Can Make Ahead,"Cooking , Methods , Quick & Easy"
"Eating Well After Weight Loss Surgery: Over 140 Delicious Low-Fat High-Protein Recipes to Enjoy in the Weeks, Months and Years After Surgery","Cooking , Health & Healing , General"
"Southern Living: Homestyle Cookbook: Over 400 Mouthwatering, Made-with-Love Recipes","Cooking , Regional & Ethnic , American , Southern States"
The Healthy College Cookbook,"Cooking , Methods , Quick & Easy"
Cook with Jamie: My Guide to Making You a Better Cook,"Cooking , Regional & Ethnic , American , General"
12 Steps to Raw Foods: How to End Your Dependency on Cooked Food,"Cooking , Specific Ingredients , Natural Foods"
Cooking Light Annual Recipes 2008: EVERY RECIPE...A Year's Worth of Cooking Light Magazine,"Cooking , Health & Healing , Low Fat"
Giada's Family Dinners: A Cookbook,"Cooking , Regional & Ethnic , Italian"
New Gas Grill Gourmet: Great Grilled Food For Everyday Meals And Fantastic Feasts (Non),"Cooking , Methods , Barbecue & Grilling"
The Complete Joy of Homebrewing Third Edition,"Cooking , Beverages , Alcoholic , Beer"
"Barbecue! Bible Sauces, Rubs, and Marinades, Bastes, Butters, and Glazes (Steven Raichlen Barbecue Bible Cookbooks)","Cooking , Methods , Barbecue & Grilling"
America's Favorite Wild Game Recipes (The Hunting & Fishing Library),"Cooking , Specific Ingredients , Meat"
The Cocktail Bible: Traditional and Modern Cocktails for Every Occasion,"Cooking , Beverages , Alcoholic , General"
Vegetarian (Williams Sonoma Kitchen Library),"Cooking , Vegetarian"
Chocolate from the Cake Mix Doctor,"Cooking , Courses & Dishes , Cakes"
"The New American Heart Association Cookbook, 7th Edition","Cooking , Health & Healing , Heart"
Fix-it and Forget-it 5-Ingredient Favorites: Comforting Slow Cooker Recipes,"Cooking , Methods , Quick & Easy"
The Essential Christmas Cookbook,"Cooking , Holiday"
Great Cakes,"Cooking , Courses & Dishes , Cookies"
Kid Favorites Made Healthy: 150 Delicious Recipes Kids Can't Resist (Better Homes and Gardens Cooking),"Cooking , Health & Healing , General"
"Taste of Home Down Home Diabetic Cookbook: 300 Tantalizing Dishes With Less Sugar, Salt and Fat... but Featuring Full Flavor!","Cooking , Regional & Ethnic , General"
Quick from Scratch Herbs & Spices Cookbook,"Cooking , Specific Ingredients , Herbs, Spices, Condiments"
Quick from Scratch One-Dish Meals Cookbook,"Cooking , Courses & Dishes , General"
Goat Cheese: Delectable Recipes for All Occasions,"Cooking , Specific Ingredients , Dairy"
The World's Best Catfish Cookbook,"Cooking , Regional & Ethnic , American , Southern States"
1000 Recipe Cookbook,"Cooking , General"
Quick Chocolate Fixes: 75 Fast and Easy Recipes for People Who Want Chocolate...in a Hurry!,"Cooking , Courses & Dishes , Chocolate"
Pops!: Icy Treats for Everyone,"Cooking , Courses & Dishes , Desserts"
"Power Juices, Super Drinks: Quick, Delicious Recipes to Prevent & Reverse Disease","Cooking , Specific Ingredients , Natural Foods"
"Clearly Delicious: An Illustrated Guide to Preserving , Pickling & Bottling","Cooking , Reference"
The Washington Inn Cooks for Friends: 350 Favorite Recipes from Cape May's Premier Restaurant,"Cooking , Regional & Ethnic , American , Middle Atlantic States"
Dream Dinners: Turn Dinnertime into Family Time with 100 Assemble-and-Freeze Meals,"Cooking , Courses & Dishes , General"
Emeril's New New Orleans Cooking,"Cooking , Regional & Ethnic , American , General"
Totally Picnic Cookbook (Totally Cookbooks),"Cooking , Methods , Outdoor"
"Real Stew: 300 Recipes for Authentic Home-Cooked Cassoulet, Gumbo, Chili, Curry, Minestrone, Bouillabaise, Stroganoff, Goulash, Chowder, and Much More (Non)","Cooking , Courses & Dishes , Soups & Stews"
The Cook's Illustrated Complete Book of Poultry,"Cooking , Specific Ingredients , Poultry"
American Western Cooking from the Roaring Fork,"Cooking , Regional & Ethnic , American , Western States"
Better Homes and Gardens Fish and Seafood (Great Cooking Made Easy Series),"Cooking , General"
"The Professional Chef's Techniques of Healthy Cooking, Second Edition","Cooking , Methods , Quantity"
Mrs. Fields I Love Chocolate! Cookbook: 100 Easy & Irresistible Recipes,"Cooking , Courses & Dishes , Chocolate"
The Flavors of Bon Appetit: 1995,"Cooking , General"
Terrific Chicken (The Quick Cook),"Cooking , General"
"All on the Grill, 170 Recipes for the Complete Meal","Cooking , Methods , Barbecue & Grilling"
Paella: 40 Delicious Spanish Style Recipes (Contemporary Cooking),"Cooking , Regional & Ethnic , Spanish"
A Homemade Life: Stories and Recipes from My Kitchen Table,"Cooking , Regional & Ethnic , American , General"
Paula Deen: It Ain't All About the Cookin',"Cooking , Regional & Ethnic , American , Southern States"
Conveniently Vegan: Turn Packaged Foods into Delicious Vegetarian Dishes,"Cooking , Vegan"
Parker's Wine Bargains: The World's Best Wine Values Under $25,"Cooking , Beverages , Alcoholic , Wine"
The University Wine Course: A Wine Appreciation Text & Self Tutorial,"Cooking , Beverages , Alcoholic , Wine"
Smoothies & Juices,"Cooking , Specific Ingredients , Fruit"
Beef (Williams-Sonoma Kitchen Library),"Cooking , Specific Ingredients , Meat"
Extra-Special Crockery Pot Recipes (Nitty Gritty Cookbooks),"Cooking , General"
"Cooking Light Breads, Grains and Pastas: 80 Hearty and Flavorful Recipes for Breads, Biscuits, Waffles, Rice, Macaroni - and Mutch More","Cooking , Specific Ingredients , Rice & Grains"
"1001 Chocolate Treats: The Ultimate Collection of Cakes, Pies, Confections, Drinks, Cookies, Candies, Sauces, Ice Creams, Puddings, and Everything Else Chocolate","Cooking , Courses & Dishes , Chocolate"
Better Homes and Gardens Cooking for One,"Cooking , General"
Hot Wok,"Cooking , Methods , Wok"
The Lowfat Mexican Cookbook: True Mexican Taste Without the Waist,"Cooking , Regional & Ethnic , Mexican"
Soups and Stews for Fall and Winter Days: Kid-Pleasing Recipes,"Cooking , Courses & Dishes , Soups & Stews"
Soup Alive!,"Cooking , Courses & Dishes , Soups & Stews"
The New Wine Lover's Companion,"Cooking , Beverages , Alcoholic , Wine"
Betty Crocker's Holiday Baking,"Cooking , Methods , Baking"
Gourmet Guide to Herbs and Spices,"Cooking , Specific Ingredients , Herbs, Spices, Condiments"
Smart Crockery Cooking: Over 100 Delicious Recipes,"Cooking , General"
"Homemade Root Beer, Soda & Pop","Cooking , Beverages , Alcoholic , Beer"
Ten: All the Foods We Love and 10 Perfect Recipes for Each,"Cooking , Regional & Ethnic , American , General"
"1,001 Low-Fat Recipes: Quick, Easy, Great-Tasting Recipes for the Whole Family","Cooking , Health & Healing , Low Fat"
Cookie Sensations: Creative Designs for Every Occasion,"Cooking , Courses & Dishes , Cookies"
Step-by-Step: The Vegetable Cookbook,"Cooking , Specific Ingredients , Vegetables"
Complete Home Bartender's Guide: 780 Recipes for the Perfect Drink,"Cooking , Beverages , Bartending"
Food Men Love: All-Time Favorite Recipes from Caesar Salad and Grilled Rib-Eye to Cinnamon Buns and Apple Pie,"Cooking , General"
The Road to a Healthy Heart Runs through the Kitchen,"Cooking , Health & Healing , Heart"
Semi-Homemade Money Saving Meals,"Cooking , Methods , Quick & Easy"
Tarts: 40 Superb Recipes for Sweet & Savory Tarts (Contemporary Cooking),"Cooking , Courses & Dishes , General"
Perfect Preserves,"Cooking , Methods , Canning & Preserving"
"Crepes, Waffles, Pancakes!","Cooking , Courses & Dishes , Desserts"
"Famous Recipes, from Mrs. Wilkes' Boarding House in Historic Savannah","Cooking , General"
Restaurant Favorites at Home (The Best Recipe),"Cooking , Methods , Professional"
Savannah Seasons,"Cooking , Seasonal"
The Glass Pantry: Preserving Seasonal Flavors,"Cooking , Reference"
365 Last-Minute Meals (Better Homes & Gardens Cooking),"Cooking , Methods , Quick & Easy"
Biggest Book of Grilling: Hundreds of Sizzlin' Recipes for Charcoal and Gas Grills (Better Homes & Gardens),"Cooking , Methods , Barbecue & Grilling"
Windows on the World Complete Wine Course: 25th Anniversary Edition (Kevin Zraly's Complete Wine Course),"Cooking , Beverages , Alcoholic , Wine"
Recipe Hall of Fame Dessert Cookbook (Best of the Best Cookbook Series),"Cooking , Courses & Dishes , Desserts"
Mario Batali Holiday Food,"Cooking , Regional & Ethnic , Italian"
"Maple Syrup Cookbook: 100 Recipes for Breakfast, Lunch & Dinner","Cooking , Regional & Ethnic , American , New England"
James McNair's Fish Cookbook,"Cooking , Specific Ingredients , Seafood"
"Smart Breakfasts: 101 Delicious, Healthy Ways to Start the Day (The ""Jane Kinderlehrer Smart Food"" Series)","Cooking , Courses & Dishes , Breakfast"
"Greens Glorious Greens!: More than 140 Ways to Prepare All Those Great-Tasting, Super-Healthy, Beautiful Leafy Greens","Cooking , Specific Ingredients , Vegetables"
Barbecue!,"Cooking , Methods , Barbecue & Grilling"
"Gooseberry Patch Christmas, Book 8","Cooking , Holiday"
Modern Food Gifts,"Cooking , General"
Chocolate Delights (Creative Cuisine),"Cooking , Courses & Dishes , Chocolate"
"Cooking Know-How: Be a Better Cook with Hundreds of Easy Techniques, Step-by-Step Photos, and Ideas for Over 500 Great Meals","Cooking , Methods , Quick & Easy"
100 Best One-Dish Meals (Good Housekeeping),"Cooking , General"
The New American Heart Association Cookbook: 25th Anniversary Edition,"Cooking , Health & Healing , General"
The Joy of Grilling,"Cooking , Methods , Special Appliances"
"365 Easy Soup Recipes: Simple, Delicious Soups & Stews to Warm the Heart","Cooking , Courses & Dishes , Soups & Stews"
Easy Entertaining: Simple Recipes for Every Occasion,"Cooking , General"
America Entertains: A Year of Imaginative Parties,"Cooking , Entertaining"
"The New American Heart Association Cookbook, 8th Edition","Cooking , Health & Healing , General"
The Vegetarian Table: America,"Cooking , Vegetarian"
Cooking Healthy with Splenda (R),"Cooking , Health & Healing , General"
3 Books in 1: Rival Crock Pot (Slow Cooker Favorites; Winning Slow Cooker Recipes; Slow Cooker Recipes for All Occasions),"Cooking , Methods , Special Appliances"
Simply Sarasota - Creatively Casual Cuisine - Sarasota Junior League,"Cooking , Regional & Ethnic , American , Southern States"
365 Great Cakes and Pies,"Cooking , General"
InterCourses: An Aphrodisiac Cookbook,"Cooking , General"
Entertaining with Appetizers,"Cooking , General"
The Healthy Heart Gourmet,"Cooking , Methods , Gourmet"
Icebox Cakes: Simply Irresistible No-Bake Desserts,"Cooking , Courses & Dishes , Desserts"
Craig Claiborne's Memorable Meals,"Cooking , General"
Healthy Food For Healthy Kids: A Practical and Tasty Guide to Your Child's Nutrition,"Cooking , Health & Healing , Weight Control"
Family Circle Eat What You Love & Lose: Quick and Easy Diet Recipes from Our Test Kitchen,"Cooking , Health & Healing , General"
Tofu and Soyfoods Cookery: Delicious Foods for a Healthy Life,"Cooking , Vegetarian"
The Complete Book of Japanese Cooking,"Cooking , Regional & Ethnic , Japanese"
Betty Crocker 4-Ingredient Dinners,"Cooking , Methods , Quick & Easy"
As American As Apple Pie,"Cooking , General"
The Wall Street Journal Guide to Wine New and Improved,"Cooking , Beverages , Alcoholic , General"
Glorious Garnishes: Crafting Easy & Spectacular Food Decorations,"Cooking , General"
Gifts in a Jar: Muffins & Breads,"Cooking , Courses & Dishes , Bread"
Food and Love Cookbook (Smalley Franchise Products),"Cooking , Reference"
An Edible Christmas: A Treasury of Recipes for the Holiday Season,"Cooking , General"
Skinny Bitch in the Kitch (PLC Edition): Kick-Ass Recipes for Hungry Girls Who Want to Stop Cooking Crap (and Start Looking Hot!),"Cooking , Specific Ingredients , Natural Foods"
