Title,Category
"The Lady & Sons, Too!: A Whole New Batch of Recipes from Savannah","Cooking , Regional & Ethnic , American , Southern States"
"Rachael Ray's Big Orange Book: Her Biggest Ever Collection of All-New 30-Minute Meals Plus Kosher Meals, Meals for One, Veggie Dinners, Holiday Favorites, and Much More!","Cooking , Regional & Ethnic , American , General"
"ChefMD's Big Book of Culinary Medicine: A Food Lover's Road Map to Losing Weight, Preventing Disease, and Getting Really Healthy","Cooking , Health & Healing , General"
The Accidental Connoisseur: An Irreverent Journey Through the Wine World,"Cooking , Beverages , Alcoholic , General"
"Feeding the Whole Family: Whole Foods Recipes for Babies, Young Children and Their Parents","Cooking , General"
"Gluten-Free 101: Easy, Basic Dishes Without Wheat","Cooking , Health & Healing , General"
Barbecue Nation: One Man's Journey to Great Grilling,"Cooking , Methods , Barbecue & Grilling"
Zone Perfect Cookbook,"Cooking , Health & Healing , General"
The Healthy Southwest Table,"Cooking , Regional & Ethnic , American , Southwestern States"
Quick-Fix Vegetarian: Healthy Home-Cooked Meals in 30 Minutes or Less (Volume 1) (Quick-Fix Cooking),"Cooking , Methods , Quick & Easy"
Calciyum!: Delicious Calcium-Rich Dairy-Free Vegetarian Recipes,"Cooking , Vegetarian"
"One Bite at a Time, Revised: Nourishing Recipes for Cancer Survivors and Their Friends [A Cookbook]","Cooking , Health & Healing , Cancer"
One Bite at a Time: Nourishing Recipes for Cancer Survivors and Their Friends,"Cooking , Health & Healing , Cancer"
Outstanding in the Field: A Farm to Table Cookbook,"Cooking , Seasonal"
The Little Book of Olive Oil,"Cooking , Specific Ingredients , Herbs, Spices, Condiments"
The New Family Cookbook for People with Diabetes,"Cooking , Health & Healing , Diabetic & Sugar-Free"
"Southern Living: Ultimate Quick & Easy Cookbook: Incredibly Good, Unbelievably Easy -- over 450 Superfast Recipes","Cooking , Regional & Ethnic , American , Southern States"
Favorite Bread Machine Recipes,"Cooking , Courses & Dishes , Bread"
The Perfect Recipe for Losing Weight & Eating Great,"Cooking , Health & Healing , Weight Control"
Williams-Sonoma: Seafood: Food Made Fast,"Cooking , Specific Ingredients , Seafood"
"Cheese Hors d'Oeuvres: 50 Recipes for Crispy Canapés, Delectable Dips, Marinated Morsels, and Other Tasty Tidbits","Cooking , Courses & Dishes , Appetizers"
"Healthiest Meals on Earth: The Surprising, Unbiased Truth About What Meals to Eat and Why","Cooking , Health & Healing , General"
Local Flavors: Cooking and Eating from America's Farmers' Markets [A Cookbook],"Cooking , Regional & Ethnic , American , General"
"Feeding the Whole Family: Recipes for Babies, Young Children, and Their Parents","Cooking , Specific Ingredients , Natural Foods"
The Shoshoni Cookbook: Vegetarian Recipes from the Shoshoni Yoga Retreat,"Cooking , Vegetarian"
How to Taste: A Guide to Enjoying Wine,"Cooking , Beverages , Wine & Spirits"
The Cuisine of California,"Cooking , Regional & Ethnic , American , California Style"
Entertaining For Dummies,"Cooking , Entertaining"
Favorite Brand Name Recipe Cookbook: Ov 200,"Cooking , General"
Christmas with Southern Living 2003,"Cooking , Holiday"
Christmas With Southern Living 2001,"Cooking , Holiday"
Christmas with Southern Living 2005,"Cooking , Holiday"
Good Housekeeping Smart Carb Suppers: Delicious and Healthy Meals,"Cooking , Health & Healing , General"
Ainsley Harriott's Meals in Minutes as seen on BBC,"Cooking , Methods , Quick & Easy"
Tidewater on the Halfshell: Fine Virginia Recipes,"Cooking , Regional & Ethnic , American , Southern States"
Better Homes and Gardens Fresh Fish,"Cooking , General"
Betty Crocker's Best Recipes for Ground Meat (Betty Crocker's Red Spoon Collection),"Cooking , General"
"John Hadamuscin's Down Home: A Year of Cooking, Entertaining, and Living Easy","Cooking , Reference"
The Perfect Cup,"Cooking , Beverages , Coffee & Tea"
Betty Crocker's Step by Step Cookbook,"Cooking , General"
Good Housekeeping All-American Cookbook,"Cooking , Regional & Ethnic , American , General"
How to Repair Food,"Cooking , Reference"
"100% Pleasure: From Appetizers to Desserts, the Low-Fat Cookbook for People Who Love to Eat","Cooking , Courses & Dishes , Appetizers"
Gary Null's Power Foods: The 15 Best Foods for Your Health,"Cooking , Health & Healing , General"
Windows on the World Complete Wine Course: 2003 Edition: A Lively Guide (Kevin Zraly's Complete Wine Course),"Cooking , Beverages , Alcoholic , Wine"
Pillsbury: Best of the Bake-off Cookbook: 350 Recipes from Ameria's Favorite Cooking Contest,"Cooking , Methods , Baking"
"Marlene Koch's Sensational Splenda Recipes: Over 375 Recipes Low in Sugar, Fat, and Calories","Cooking , Health & Healing , Weight Control"
"Smart Muffins: 83 Recipes for Heavenly, Healthful Eating (Jane Kinderlehrer Smart Food Series)","Cooking , Reference"
Gone With the Grits: Grits Cookbook,"Cooking , Methods , Gourmet"
Taste of Home's Holiday & Celebrations Cookbook 2001,"Cooking , Holiday"
Party Basics (Basic Series),"Cooking , Courses & Dishes , General"
Fatburner: Get Slim Using the Glycemic Index Theory of Food Combining (Powerfood),"Cooking , Health & Healing , Weight Control"
"Festive Picnics: Recipes, Crafts and Decorations for Outdoor Occasions","Cooking , Methods , Outdoor"
Mr. Food's Quick and Easy Side Dishes,"Cooking , Methods , Quick & Easy"
The Essential Wine Book: An Indispensable Guide to the Wines of the World,"Cooking , General"
"Sugar Bust for Life!...With the Brennans, Part II : Cookbook and Companion Guide","Cooking , Health & Healing , Diabetic & Sugar-Free"
Best-Ever Holiday Recipe Collection,"Cooking , Holiday"
The Beer Lover's Rating Guide,"Cooking , Beverages , Alcoholic , Beer"
"Christmas Gifts of Good Taste Book: Festive Recipes and Easy Crafts, Book 6","Cooking , Seasonal"
"Pillsbury Family Christmas Cookbook: Celebrate the Season with More Than 150 Recipes, Plus Fun Craft Ideas","Cooking , Holiday"
Stews (Williams-Sonoma Kitchen Library),"Cooking , Courses & Dishes , Soups & Stews"
Cocktail Food: 50 Finger Foods with Attitude,"Cooking , Courses & Dishes , Appetizers"
Single Malt & Scotch Whiskey: Select and Savor Over 200 Brands and Varieties (Essential Connoisseur),"Cooking , Beverages , Wine & Spirits"
"Gooseberry Patch: Christmas, Book 3","Cooking , Seasonal"
Tasty Holiday Gifts,"Cooking , Reference"
Love by the Glass: Tasting Notes from a Marriage,"Cooking , Beverages , Alcoholic , General"
SuperFoods Rx: Fourteen Foods That Will Change Your Life,"Cooking , General"
KISS Guide to Wine (Keep It Simple Series),"Cooking , Beverages , Alcoholic , General"
Betty Crocker's New International Cookbook,"Cooking , General"
The New German Cookbook: More Than 230 Contemporary and Traditional Recipes,"Cooking , Regional & Ethnic , German"
Family Circle All-Time Favorite Recipes: More Than 600 Recipes and 175 Photographs,"Cooking , General"
"The Frugal Gourmet Cooks Italian: Recipes from the New and Old Worlds, Simplified for the American Kitchen","Cooking , Methods , Gourmet"
The Bread Machine Magic Book of Helpful Hints: Dozens of Problem-Solving Hints and Troubleshooting Techniques for Getting the Most Out of Your Bread,"Cooking , Courses & Dishes , Bread"
The Joys of Entertaining,"Cooking , Entertaining"
Diane Warner's Big Book of Parties,"Cooking , Entertaining"
Book of Wine,"Cooking , Beverages , Alcoholic , General"
Tipsy Smoothies: Over 150 Fabulous Cocktail Smoothie Recipes,"Cooking , Beverages , Wine & Spirits"
Meal in a Bowl,"Cooking , Regional & Ethnic , International"
Garnishing: A Feast For Your Eyes,"Cooking , Methods , Garnishing & Food Presentation"
James Beard's New Fish Cookery,"Cooking , Specific Ingredients , Seafood"
Casserole Cook Book,"Cooking , Courses & Dishes , Casseroles"
Wednesday Is Spaghetti and Macaroni and Fettucine and Pasta Salads and More (Everyday Cookbooks),"Cooking , Specific Ingredients , Pasta"
Hershey's Best-Loved Recipes (Favorite Brand Name Recipes),"Cooking , Specific Ingredients , Chocolate"
"The Humble Pie: 50 Tortes, Quiches, Pizzas, and Empanadas","Cooking , General"
Picnics of Provence: French Country-Style Picnics to Enjoy at Home or Abroad,"Cooking , Regional & Ethnic , French"
The Penny Whistle Lunch Box Book,"Cooking , General"
"Fresh Produce/A to Z: How to Select, Store and Prepare, over 250 Recipes","Cooking , General"
Casseroles: Classic to Contemporary,"Cooking , Courses & Dishes , Casseroles"
Quick & Healthy: Recipes for Vibrant Living,"Cooking , Health & Healing , General"
The Official Fajita Cookbook,"Cooking , General"
The Forget-About-Meat Cookbook.,"Cooking , General"
Jenny Craig's No Diet Required,"Cooking , Health & Healing , General"
The Schwarzbein Principle Cookbook,"Cooking , Health & Healing , General"
ULTIMATE ESPRESSO MACHINE COOKBOOK,"Cooking , Beverages , Coffee & Tea"
Betty Crocker's New American Cooking,"Cooking , Regional & Ethnic , American , General"
Christmas With Southern Living Cookbook,"Cooking , Holiday"
"Cooking with Three Ingredients: Flavorful Food, Easy as 1, 2, 3","Cooking , General"
Today's Kitchen Cookbook,"Cooking , General"
Mrs. Witty's Home-Style Menu Cookbook,"Cooking , Reference"
First Meals,"Cooking , Health & Healing , General"
John Hadamuscin's Simple Pleasures: 101 Thoughts and Recipes for Savoring the Little Things in Life,"Cooking , Reference"
Foods That Fight Pain: Revolutionary New Strategies for Maximum Pain Relief,"Cooking , Health & Healing , General"
The Pillsbury Cookbook: The All-Purpose Companion for Today's Cook,"Cooking , Methods , Baking"
The Pizza Gourmet,"Cooking , General"
Cookies: Step-By-Step Techniques,"Cooking , Courses & Dishes , Cookies"
Country Pies,"Cooking , General"
"High Flavor, Low-fat Pasta Cookbook: Steven Raichlen's","Cooking , Health & Healing , Low Fat"
French Regional Menus (Great Meals in Minutes),"Cooking , General"
Christmas with Paula Deen: Recipes and Stories from My Favorite Holiday,"Cooking , Regional & Ethnic , American , Southern States"
Modern Italian Cooking,"Cooking , Regional & Ethnic , Italian"
Weekday Meals (Grill by the Book),"Cooking , General"
Family Menus (Great Meals in Minutes),"Cooking , General"
5 O'Clock Grill (Better Homes and Gardens),"Cooking , Methods , Barbecue & Grilling"
The Good Herb: Recipes and Remedies From Nature,"Cooking , Specific Ingredients , Herbs, Spices, Condiments"
Hot Barbecue (Hot Series),"Cooking , Methods , Barbecue & Grilling"
Al Roker's Big Bad Book of Barbecue: 100 Easy Recipes for Backyard Barbecue and Grilling,"Cooking , Regional & Ethnic , American , General"
"Celebrate Virginia! The Hospitality, History and Heritage of Virginia","Cooking , Regional & Ethnic , American , Middle Atlantic States"
Death by Chocolate: The Last Word on a Consuming Passion,"Cooking , Courses & Dishes , Chocolate"
Heartland Cooking Crockery Favorites:  Traditional American Recipes,"Cooking , Regional & Ethnic , American , General"
New York Cabbie Cookbook,"Cooking , Regional & Ethnic , General"
Chesapeake Bay Cooking: The Companion Cookbook to the Public Television Series,"Cooking , Regional & Ethnic , American , Middle Atlantic States"
Meat Classics (Anne Willan's Look & Cook),"Cooking , Specific Ingredients , Meat"
Look & Cook Chicken Classics: The Ultimate Step-By-Step Guide to Mastering Today's Cooking- with Success Every Time!,"Cooking , Specific Ingredients , Poultry"
Look & Cook: Italian Country Cooking- The Ultimate Step-By-Step Guide to Mastering Today's Cooking with Success Every Time! (Anne Willan's Look & Cook),"Cooking , Regional & Ethnic , Italian"
1 Batter-50 Cakes: Baking to Fit Your Every Occasion (Quick & Easy (Silverback)),"Cooking , Methods , Baking"
Creme Brulee: The Bonjour Way (Cafe),"Cooking , Courses & Dishes , Desserts"
Beyond Wok,"Cooking , Regional & Ethnic , Chinese"
Coffee and Espresso (Quick & Easy),"Cooking , Beverages , Coffee & Tea"
Red Wine,"Cooking , Beverages , Alcoholic , General"
Lee Bailey's Southern Food And Plantation Houses,"Cooking , Regional & Ethnic , American , Southern States"
The Classic Pasta Cookbook,"Cooking , Specific Ingredients , Pasta"
Basic Cooking: All You Need to Cook Well Quickly (Basic Series),"Cooking , Methods , Quick & Easy"
Cooking for Children: What Children Like to Eat (Quick & Easy (Silverback)),"Cooking , Regional & Ethnic , American , General"
Little Tea Book (Little Books),"Cooking , Beverages , Coffee & Tea"
Bread Machine (Quick & Easy (Silverback)),"Cooking , Courses & Dishes , Bread"
BETTY CROCKER'S RED SPOON COLLECTION BEST RECIPES FOR FISH AND SHELLFISH,"Cooking , General"
Weight Watchers Stir-Fry to Szechuan: 100 Classic Chinese Recipes,"Cooking , Regional & Ethnic , Chinese"
Cafe Cuisine,"Cooking , General"
Rachael Ray: Best Eats in Town on $40 A Day,"Cooking , Entertaining"
Beans (Gourmet Pantry),"Cooking , Specific Ingredients , Vegetables"
6001 Food Facts and Chef's Secrets (or Grandmother's Kitchen Wisdom - Over 6001 Solutions to Common Kitchen Problems),"Cooking , Reference"
America's Best Recipes: A Hometown Collection,"Cooking , General"
America's Best: A National Community Cookbook,"Cooking , Regional & Ethnic , American , General"
The Southeast Asia Cookbook,"Cooking , Regional & Ethnic , Asian"
The Joslin Diabetes Gourmet Cookbook: Heart-Healthy Everyday Recipes For Family And Friends,"Cooking , Health & Healing , Diabetic & Sugar-Free"
Patricia Wells at Home in Provence: Recipes Inspired By Her Farmhouse In France,"Cooking , Regional & Ethnic , French"
"Spreads, Toppers & Dips: 100 New, Classic and International Recipes for the Ideal Party Food","Cooking , Courses & Dishes , Appetizers"
50 Easy Party Cakes,"Cooking , Courses & Dishes , Cakes"
Best Food Writing 2000,"Cooking , Essays & Narratives"
Southern Living Annual Recipes Cookbook 20th Anniversary Edition,"Cooking , Regional & Ethnic , American , Southwestern States"
Kafka's Soup: A Complete History of World Literature in 14 Recipes,"Cooking , General"
Pita the Great,"Cooking , Courses & Dishes , General"
Chicago Tribune Grilling,"Cooking , General"
Delicious Ways to Control Diabetes Cookbook,"Cooking , Health & Healing , Diabetic & Sugar-Free"
The Gathering Place: Informal International Menus That Bring Family and Friends Back to the Table,"Cooking , Entertaining"
Semi-Homemade Cooking 2,"Cooking , Reference"
It Must've Been Something I Ate,"Cooking , Essays & Narratives"
Baking Soda Bonanza,"Cooking , Specific Ingredients , Herbs, Spices, Condiments"
Fresh Ways With Salads (Healthy and Home Cooking Series),"Cooking , General"
Fresh Ways With Picnics and Barbeques (Healthy Home Cooking),"Cooking , General"
Fresh Ways With Cakes (Healthy Home Cooking),"Cooking , General"
Fresh Ways With Pastries and Sweets (Healthy Home Cooking),"Cooking , General"
The Festive Vegetarian,"Cooking , Vegetarian"
Meatless Meals for Working People: Quick and Easy Vegetarian Recipes,"Cooking , Reference"
The Pillsbury Chocolate Lover's Cookbook,"Cooking , Courses & Dishes , Chocolate"
Betty Crocker's Do-Ahead Cookbook,"Cooking , General"
Patricia Wells' Trattoria,"Cooking , Health & Healing , General"
Diane Seed's Mediterranean Dishes,"Cooking , Regional & Ethnic , Mediterranean"
Betty Crocker's Healthy New Choices: A Fresh Approach to Eating Well,"Cooking , Regional & Ethnic , American , General"
"Cooking From the Hip: Fast, Easy, Phenomenal Meals","Cooking , Methods , Quick & Easy"
"Fish- The Basics: An Illustrated Guide to Selecting, Storing, and Preparing All Kinds of Fresh Seafood","Cooking , Specific Ingredients , Seafood"
Chinese Cook Book,"Cooking , Regional & Ethnic , Chinese"
Betty Crocker's Vegetarian Cooking: Easy Meatless Main Dishes Your Family Will Love!,"Cooking , Vegetarian"
Wild Women in the Kitchen: 101 Rambunctious Recipes & 99 Tasty Tales,"Cooking , General"
"Leftovers: 200 Recipes, 50 Simple Master Preparations and 150 Delicious Variations for the Second Time Around","Cooking , General"
Home Plate Cooking,"Cooking , Regional & Ethnic , American , Southern States"
Little French Cookbook,"Cooking , Regional & Ethnic , French"
"60 Days of Low-Fat, Low-Cost Meals in Minutes: Over 150 Delicious, Healthy Recipes & Menus That Fit Your Budget","Cooking , Health & Healing , Low Fat"
"Cooking Under Cover: One-Pot Wonders- A Treasury of Soups, Stews, Braises and Casseroles","Cooking , General"
Balsamic Vinegar Cookbook,"Cooking , Methods , Gourmet"
Betty Crocker's Best Recipes for Weekend Breakfasts (Betty Crocker's Red Spoon Collection),"Cooking , General"
Roy's Feasts from Hawaii,"Cooking , Regional & Ethnic , American , General"
Chocolate from the Cake Mix Doctor,"Cooking , Courses & Dishes , Cakes"
"Gifts in a Jar: Soups (Gifts in a Jar, 4)","Cooking , Courses & Dishes , Soups & Stews"
"Gifts in a Jar: Cookies (Gifts in a Jar, 1)","Cooking , Courses & Dishes , Cookies"
"Gifts in a Jar: Bars & Brownies (Gifts in a Jar, 3)","Cooking , Courses & Dishes , Desserts"
Prevention's Quick and Healthy Low-Fat Cooking: Featuring Healthy Cuisines from the Mediterranean,"Cooking , Health & Healing , Low Fat"
Southern Living - Cook Quick,"Cooking , General"
Colorado Cache Cookbook: A Goldmine of Recipes from the Junior League of Denver,"Cooking , Regional & Ethnic , American , Western States"
Candy (The Good Cook Techniques & Recipes Series),"Cooking , General"
Mediterranean Menus (Great Meals in Minutes),"Cooking , General"
Chilies: A Book of Recipes (The Little Recipe Book Series),"Cooking , Specific Ingredients , Vegetables"
Flavored Breads (Basic Baking),"Cooking , Courses & Dishes , Bread"
The Taste of Home Cookbook,"Cooking , Methods , General"
The Chesapeake Collection: A Treasury of Recipes and Memorabilia from Maryland's Eastern Shore,"Cooking , Regional & Ethnic , American , General"
Hot & Spicy (Cooking for Today),"Cooking , Specific Ingredients , Herbs, Spices, Condiments"
The New York Bartender's Guide,"Cooking , Beverages , Wine & Spirits"
"Homecoming Special Foods, Special Memories","Cooking , General"
Better Homes and Gardens New Cookbook (Better Homes & Gardens New Cookbooks),"Cooking , General"
More Cooking Secrets of the CIA: The Companion Book to the Public Television Series,"Cooking , Methods , General"
Chesapeake Collection,"Cooking , Reference"
Quilter's Christmas Cookbook,"Cooking , Holiday"
Good Cooking: The New Basics,"Cooking , Regional & Ethnic , American , General"
Bernard Clayton's New Complete Book of Breads: Revised and Expanded,"Cooking , Courses & Dishes , Bread"
Biscotti,"Cooking , Courses & Dishes , Desserts"
Martini,"Cooking , Beverages , Wine & Spirits"
Beyond Panini,"Cooking , Regional & Ethnic , Italian"
The Silver Palate Good Times Cookbook,"Cooking , Entertaining"
Eat Papayas Naked: The pH-Balanced Diet for Super Health & Glowing Beauty,"Cooking , Health & Healing , Weight Control"
"The Stouffer Cookbook of Great American Food and Drink, from the Recipe Files of the Stouffer Corporation","Cooking , Regional & Ethnic , American , General"
"Quick Fix Meals: 200 Simple, Delicious Recipes to Make Mealtime Easy","Cooking , Reference"
Better Homes and Gardens Stir-Fry Recipes (Better homes and gardens books),"Cooking , General"
Simply Salads (The Simply Series),"Cooking , Courses & Dishes , Salads"
The Book of Appetizers,"Cooking , Courses & Dishes , Appetizers"
Sauces and Dips (Quick & Easy),"Cooking , Courses & Dishes , Sauces & Dressings"
Apples and Pears (Heavenly Treats),"Cooking , Specific Ingredients , Fruit"
Quick Fixes with Mixes,"Cooking , Courses & Dishes , Cookies"
A Cup of Comfort Cookbook: Favorite Comfort Foods to Warm Your Heart and Lift Your Spirit,"Cooking , General"
Betty Crocker's Cooking Basics: Learning to Cook with Confidence,"Cooking , Methods , General"
Best of Salads & Buffets: Over 325 salads and buffet recipes,"Cooking , General"
Irresistible Fondues (Quick & Easy),"Cooking , Methods , General"
The Trellis Cookbook: Contemporary American Cooking in Colonial Williamsburg,"Cooking , Reference"
"The Best of America's Test Kitchen 2007: The Year's Best Recipes, Equipment Reviews, and Tastings","Cooking , Courses & Dishes , General"
One Bite Won't Kill You: More than 200 Recipes to Tempt Even the Pickiest Kids on Earth,"Cooking , General"
Sushi (Quick & Easy),"Cooking , Regional & Ethnic , Japanese"
Biggest Book of Easy Canned Soup Recipes (Better Homes & Gardens),"Cooking , Specific Ingredients , General"
Cooking from Quilt Country : Hearty Recipes from Amish and Mennonite Kitchens,"Cooking , Methods , Cookery for One"
Rustic Italian Cooking (De Gustibus Presents the Great Cooks' Cookbooks),"Cooking , Regional & Ethnic , Italian"
"1,000 Classic Recipes From Around the World","Cooking , General"
"Party Receipts from the Charleston Junior League: Hors D'Oeuvres, Savories, Sweets","Cooking , Regional & Ethnic , American , Southern States"
Tuscany the Beautiful Cookbook,"Cooking , General"
Food with Flair (New Basics),"Cooking , Entertaining"
Good Life Cooking: Light Classics from Today's Gourmet,"Cooking , Reference"
Smith & Hawken: The Gardeners' Community Cookbook,"Cooking , Regional & Ethnic , American , General"
Steak Lover's Cookbook,"Cooking , Specific Ingredients , Meat"
"The Complete Meat Cookbook: A Juicy and Authoritative Guide to Selecting, Seasoning, and Cooking Today's Beef, Pork, Lamb, and Veal","Cooking , Specific Ingredients , Meat"
New York Times New England Heritage Cook Book,"Cooking , Regional & Ethnic , American , New England"
Clambakes & Fish Fries,"Cooking , Specific Ingredients , Seafood"
Onions Onions Onions: Delicious Recipes for the World's Favorite Secret Ingredient,"Cooking , Specific Ingredients , Vegetables"
True Thai: The Modern Art of Thai Cooking,"Cooking , Regional & Ethnic , Thai"
The Art of the Sandwich,"Cooking , Methods , General"
Michael Jackson's Great Beer Guide,"Cooking , Beverages , Beer"
"Feed Muscle, Shrink Fat Diet","Cooking , Health & Healing , Weight Control"
Convection Oven Cookery (Nitty Gritty Cookbooks),"Cooking , Methods , Cookery for One"
"Smoothies for Life! Yummy, Fun, and Nutritious!","Cooking , Beverages , Juices & Smoothies"
Southern Living Our Best Christmas Recipes,"Cooking , Holiday"
Home Cooking With Amy Coleman (Pbs Cooking Series),"Cooking , Methods , General"
American Bistro: Great Recipes in the New Cooking Tradition,"Cooking , General"
The Murray's Cheese Handbook: A Guide to More Than 300 of the World's Best Cheeses,"Cooking , Specific Ingredients , Dairy"
Southwest Indian Cookbook,"Cooking , Regional & Ethnic , Indian & South Asian"
The Best Of Mr. Food Dinner On The Double,"Cooking , Methods , Quick & Easy"
Flavored Oils: 50 Recipes for Cooking with Infused Oils,"Cooking , Specific Ingredients , Fruit"
"Trucs of the Trade: 101 Tricks, Tips, and Recipes from America's Greatest Chefs","Cooking , General"
The Kitchen Companion : The Ultimate Guide to Cooking and the Kitchen,"Cooking , Methods , General"
Chef Paul Prudhomme's Louisiana Tastes: Exciting Flavors from the State that Cooks,"Cooking , Regional & Ethnic , American , General"
Ideals Favorite Christmas Desserts,"Cooking , Holiday"
The Tabasco Cookbook: 125 Years of America's Favorite Pepper Sauce,"Cooking , Regional & Ethnic , American , General"
Big Flavors of the Hot Sun: Recipes and Techniques from the Spice Zone,"Cooking , Reference"
Chiles (Basic Flavoring Series),"Cooking , Specific Ingredients , Vegetables"
White House Cookbook: Revised and Updated Centennial Edition,"Cooking , General"
The Fourth Star: Dispatches from Inside Daniel Boulud's Celebrated New York Restaurant,"Cooking , General"
Great Adventures in Food: Fresh Ways to Celebrate Every Meal,"Cooking , Health & Healing , General"
Chef Paul Prudhomme's Seasoned America,"Cooking , Regional & Ethnic , American , General"
Get Your Buns in Here,"Cooking , Reference"
365 Great Cookies and Brownies,"Cooking , General"
Healthy Hometown Favorites: America's Best-Loved Recipes from Cummunity Cookbooks-Made Light by the Food Editors of Prevention Magazine,"Cooking , Health & Healing , General"
Mr. Food's Pizza 1-2-3,"Cooking , Courses & Dishes , Pizza"
The Firehouse Cookbook,"Cooking , Regional & Ethnic , American , General"
"Dining Out: Secrets from America's Leading Critics, Chefs, and Restaurateurs","Cooking , Courses & Dishes , Appetizers"
Cooking Light: Slow Cooker,"Cooking , Methods , Special Appliances"
Gather 'Round The Grill: A Year of Celebrations,"Cooking , Methods , Barbecue & Grilling"
Betty Crocker's Shortcut Cooking for the Smartcook,"Cooking , General"
The Creative Pasta Cookbook (Creative Cooking,"Cooking , Specific Ingredients , Pasta"
Ben & Jerry's Homemade Ice Cream & Dessert Book,"Cooking , Courses & Dishes , Desserts"
One Bowl,"Cooking , Regional & Ethnic , International"
"Old-Time Brand-Name Desserts: Recipes, Illustrations, and Advice from the Recipe Pamphlets of America's Most Trusted Food Makers","Cooking , Courses & Dishes , Desserts"
"Stews: 200 Earthy, Delicious Recipes","Cooking , Courses & Dishes , Soups & Stews"
Delia Smith's Summer Collection,"Cooking , General"
America's Favorite Fish Recipes: More Than 180 Mouthwatering Recipes from Fishing Guides and Professional Chefs (The Freshwater Angler),"Cooking , Specific Ingredients , Seafood"
The New Pasta Cookbook,"Cooking , General"
Vegetarian Recipes (Cooking for Today),"Cooking , Vegetarian"
Recipes for the Pressure Cooker (Nitty Gritty Cookbooks),"Cooking , Methods , Special Appliances"
The Best American Recipes 2001-2002,"Cooking , Courses & Dishes , General"
