Title,Category
"Keep the Lights Burning, Abbie (On My Own History)","Juvenile Nonfiction , Biography & Autobiography , Historical"
Winter (Toppers),"Juvenile Nonfiction , Concepts , Seasons"
Smart About the Fifty States: A Class Report (Smart About History),"Juvenile Nonfiction , History , United States , State & Local"
Fun With Trains Stencils (Dover Stencils),"Juvenile Nonfiction , Activity Books , General"
Kids Say Don't Smoke: Posters from the New York City Smoke-Free Contest,"Juvenile Nonfiction , Social Topics , Drugs, Alcohol, Substance Abuse"
Original Backyard Scientist: Experiments That Kids Can Perform Using Things Around the House Ages 4-12,"Juvenile Nonfiction , General"
Bottoms Up! Jokes from Bikini Bottom (SpongeBob SquarePants),"Juvenile Nonfiction , Humor , Jokes & Riddles"
The Story of Daniel Boone (A Dell Yearling Biography),"Juvenile Nonfiction , Biography & Autobiography , Historical"
All Through the Week with Cat and Dog (Learn to Read Fun and Fantasy),"Juvenile Nonfiction , School & Education"
Abe Lincoln's Hat (Step into Reading),"Juvenile Nonfiction , Readers , Beginner"
Notebook Spanish Dictionary,"Juvenile Nonfiction , Reference , Dictionaries"
What Lives in a Shell? (Let's-Read-and-Find-Out Science 1),"Juvenile Nonfiction , Science & Nature , General"
THE ASTRONAUTS (Random House Pictureback),"Juvenile Nonfiction , General"
Freckles the Rabbit (How Your Pet Grows),"Juvenile Nonfiction , General"
The Story of Jonah (Golden Look-look Book),"Juvenile Nonfiction , General"
Life in the Forest (Now I Know First Start Reader),"Juvenile Nonfiction , General"
The Panda (Animal World),"Juvenile Nonfiction , General"
Car Travel Games (The Usborne Book of Series),"Juvenile Nonfiction , Games & Activities , General"
I Wonder Why Skunks Are So Smelly and Other Neat Facts About Mammals,"Juvenile Nonfiction , General"
"The Planets in Our Solar System (Let's-Read-and-Find-Out Science, Stage 2)","Juvenile Nonfiction , Science & Nature , Astronomy"
Little Prayers (Look-Look),"Juvenile Nonfiction , General"
The Frog Prince (Fairy Tale Classics),"Juvenile Nonfiction , General"
Mummies Made in Egypt (Reading Rainbow Books),"Juvenile Nonfiction , History , Ancient"
What the Moon Is Like (Let's Read and Find Out Science Series),"Juvenile Nonfiction , Science & Nature , Astronomy"
Butterflies and Moths (Usborne First Nature),"Juvenile Nonfiction , Animals , General"
"Catching B, on My Way Grade 2 Theme 3: Houghton Mifflin the Nation's Choice (Houghton Mifflin Reading: The Nation's Choice)","Juvenile Nonfiction , Language Arts , General"
Wild Animal Babies (Look-Look),"Juvenile Nonfiction , General"
Wolves! (Know-It-Alls),"Juvenile Nonfiction , Animals , Foxes"
Sunken Treasure (Rise and Shine) (Reading Rainbow Books),"Juvenile Nonfiction , History , Exploration & Discovery"
The First Christmas: Stories for Children in Pictures and Rhyme,"Juvenile Nonfiction , Holidays & Celebrations , Christmas & Advent"
The Story of Passover,"Juvenile Nonfiction , Holidays & Celebrations , Passover"
Kingfisher Young Knowledge: Animal Homes,"Juvenile Nonfiction , Animals , General"
"Aladdin and the Magic Lamp (Step into Reading, Step 3, paper)","Juvenile Nonfiction , General"
Plenty of PUPPETS to Make,"Juvenile Nonfiction , General"
My Giant Fold-out Book of Bible Stories,"Juvenile Nonfiction , Religion , Bible Stories , General"
How Far Can a Butterfly Fly?: First Questions and Answers About Bugs (Time-Life Library of First Questions and Answers),"Juvenile Nonfiction , General"
The Children's Bible,"Juvenile Nonfiction , Religion , Biblical Studies"
Nature (Discover Hidden Worlds),"Juvenile Nonfiction , General"
The Human Body (Discover Hidden Worlds),"Juvenile Nonfiction , General"
If You Lived 100 Years Ago,"Juvenile Nonfiction , History , General"
Spiders! (Know-It-Alls Ser),"Juvenile Nonfiction , Animals , Insects, Spiders, etc."
"Lives of the Artists: Masterpieces, Messes (and What the Neighbors Thought)","Juvenile Nonfiction , Art , General"
Disney's Beauty and the Beast,"Juvenile Nonfiction , General"
The Peril of the Fort (Young Indiana Jones Chronicles),"Juvenile Nonfiction , General"
"Dr. Amelia's Boredom Survival Guide: First Aid for Rainy Days, Boring Errands, Waiting Rooms, Whatever!","Juvenile Nonfiction , Social Topics , General"
Adventures Of The Greek Heroes,"Juvenile Nonfiction , Social Science , Folklore & Mythology"
DK Readers: Spider-Man's Amazing Powers (Level 4: Proficient Reader),"Juvenile Nonfiction , Humor , Comic Strips & Cartoons"
The Upstairs Room (Trophy Newbery),"Juvenile Nonfiction , History , Holocaust"
Light Another Candle: The Story and Meaning Of Hanukkah,"Juvenile Nonfiction , General"
Curveballs: Wacky Facts to Bat Around (Sports Illustrated for Kids),"Juvenile Nonfiction , General"
The Baby Born in a Stable,"Juvenile Nonfiction , Religion , General"
Bicycle Rider,"Juvenile Nonfiction , Sports & Recreation , Cycling"
Gee Wiz! How to Mix Art and Science or the Art of Thinking Scientifically (Brown Paper School Book),"Juvenile Nonfiction , General"
Building Big,"Juvenile Nonfiction , Architecture"
"Basketball: Learn How to Put Speed in Your Step, Do the Drills, and Master all the Moves","Juvenile Nonfiction , Sports & Recreation , Basketball"
Prayers for a Small Child (A Knee-High Book),"Juvenile Nonfiction , General"
Homework Survival Guide English (Troll Homework Survival Guides),"Juvenile Nonfiction , Language Arts , General"
American Heritage Children's Dictionary (American Heritage Dictionary),"Juvenile Nonfiction , Language Arts , General"
The Life of Jesus (Lap Library),"Juvenile Nonfiction , Religion , Bible Stories , General"
Pretend Soup and Other Real Recipes: A Cookbook for Preschoolers and Up,"Juvenile Nonfiction , Reference , General"
STARTING to Go Where God Wants You to Be--Student Edition: 6 Small Group Sessions on Beginning Life Together,"Juvenile Nonfiction , Religious , Christian , General"
The Gigantic Joke Book,"Juvenile Nonfiction , Humor , Jokes & Riddles"
101 Ways to Do Better in School,"Juvenile Nonfiction , General"
Love @ First Site: A Novel,"Juvenile Nonfiction , People & Places , Asia"
The Compass In Your Nose: And Other Astonishing Facts About Humans,"Juvenile Nonfiction , General"
What Do People Do All Day?,"Juvenile Nonfiction , Careers"
Meet Abraham Lincoln,"Juvenile Nonfiction , Biography & Autobiography , Historical"
Building a Shelf and a Bike Rack: Beginner II - two hammers ('a little more ambitious') (Building Together Series),"Juvenile Nonfiction , General"
There's No Place Like Space: All About Our Solar System (Cat in the Hat's Learning Library),"Juvenile Nonfiction , History , Exploration & Discovery"
Troll Treasury of Animal Stories (Troll Treasury of Reading Series),"Juvenile Nonfiction , General"
The Hair Book (Bright & Early Book ; Be 24),"Juvenile Nonfiction , General"
"Mudworks: Creative Clay, Dough, and Modeling Experiences (1) (Bright Ideas for Learning)","Juvenile Nonfiction , Crafts & Hobbies"
Old Macdonald,"Juvenile Nonfiction , Concepts , General"
The Tarantula in My Purse and 172 Other Wild Pets: True-Life Stories to Read Aloud,"Juvenile Nonfiction , Animals , General"
DK Readers: Titanic: The Disaster That Shocked the World! (Level 3: Reading Alone),"Juvenile Nonfiction , Readers , Intermediate"
Mcgwire & Sosa: A Season to Remember,"Juvenile Nonfiction , Sports & Recreation , Baseball & Softball"
Disney Babies 1 to 10 (A Golden Sturdy Shape Book),"Juvenile Nonfiction , General"
Manatees (I Can Read About),"Juvenile Nonfiction , Animals , Marine Life"
Ghosts of War: Ghosts of War,"Juvenile Nonfiction , General"
I Can Draw Animals (I Can Draw Series),"Juvenile Nonfiction , Animals , General"
BRAVE LITTLE TAILOR (Disney's Wonderful World of Reading),"Juvenile Nonfiction , General"
Elephants (Zoobooks Series),"Juvenile Nonfiction , Animals , Elephants"
"Beyond the Night Sky (Explorer Plus, Ladybird)","Juvenile Nonfiction , General"
DK Readers: MLB Strikeout Kings (Level 4: Proficient Readers),"Juvenile Nonfiction , Readers , Chapter Books"
What's It Like to Be a Teacher,"Juvenile Nonfiction , General"
Factastic Millennium Facts,"Juvenile Nonfiction , History , General"
Leaves From A Child's Garden of Verses,"Juvenile Nonfiction , General"
What's Under the Ocean (Now I Know),"Juvenile Nonfiction , General"
Monster Mad Libs,"Juvenile Nonfiction , Games & Activities , General"
At the Plate with...Ken Griffey Jr. (Athlete Biographies),"Juvenile Nonfiction , Biography & Autobiography , Sports & Recreation"
The Slimy Stuarts,"Juvenile Nonfiction , History , Renaissance"
The Young Dancer,"Juvenile Nonfiction , Performing Arts , Dance"
Bog Bodies: Mummies and Curious Corpses (True Stories),"Juvenile Nonfiction , General"
Mary McLeod Bethune (Crowell Biographies),"Juvenile Nonfiction , Biography & Autobiography , Cultural, Ethnic & Regional"
"Rocks and Minerals (Explorer Plus, Ladybird)","Juvenile Nonfiction , General"
"Slinky, Scaly Snakes (DK Readers: Level 2)","Juvenile Nonfiction , Animals , Reptiles & Amphibians"
Sharks (Look-Look),"Juvenile Nonfiction , Animals , Marine Life"
Sizes (My First Look at),"Juvenile Nonfiction , General"
What Makes Things Move? (First Science Books Series),"Juvenile Nonfiction , General"
The Ladybug and Other Insects (A First Discovery Book),"Juvenile Nonfiction , Animals , Insects, Spiders, etc."
How Many Animals \1st Brd Bk (My First Golden Board Book),"Juvenile Nonfiction , General"
Making Kites (Step-by-Step),"Juvenile Nonfiction , General"
A Family of Dinosaurs,"Juvenile Nonfiction , General"
The Prodigal Son (People of the Bible),"Juvenile Nonfiction , General"
The Good Samaritan,"Juvenile Nonfiction , General"
Moses of the Bulrushes (People of the Bible),"Juvenile Nonfiction , General"
Grooming and Stable Management (Usborne Riding School Series),"Juvenile Nonfiction , Animals , Horses"
"Incredible Hulk Book of Strength (DK Readers, Level 4)","Juvenile Nonfiction , Readers , Intermediate"
The Sierra Club Summer Book,"Juvenile Nonfiction , General"
The Kingfisher First Dictionary (Kingfisher First Reference),"Juvenile Nonfiction , Reference , General"
Harcourt School Publishers Signatures: Library Book Grade 3 Julians Glorious Summer,"Juvenile Nonfiction , Language Arts , General"
With a Crash and a Bang!,"Juvenile Nonfiction , Literary Criticism & Collections"
Richard Scarry's Hop Aboard! Here We Go!,"Juvenile Nonfiction , General"
A Whole New Ball Game: The Story of the All-American Girls Professional Baseball League,"Juvenile Nonfiction , Sports & Recreation , General"
I Can Cut and Stick (Usborne Playtime),"Juvenile Nonfiction , Activity Books"
The Kids' Book of Questions,"Juvenile Nonfiction , Philosophy"
How to Be School Smart (School Survival Guide),"Juvenile Nonfiction , Study Aids , General"
Make Your Own Web Page--for Kids!,"Juvenile Nonfiction , Computers , Internet"
Horses,"Juvenile Nonfiction , Animals , Horses"
A Field Full of Horses: Read and Wonder,"Juvenile Nonfiction , Animals , Horses"
Baby Animals (Touch and Feel),"Juvenile Nonfiction , Animals , General"
Christopher Columbus (Young Reader's Christian Library),"Juvenile Nonfiction , Biography & Autobiography , Historical"
The Rotten Romans (Horrible Histories),"Juvenile Nonfiction , History , Prehistoric"
One Day in the Desert (Trophy Chapter Book),"Juvenile Nonfiction , Science & Nature , Earth Sciences , Weather"
Girl to Girl: The Real Deal on Being a Girl Today,"Juvenile Nonfiction , General"
Growing Up (Facts of Life Series),"Juvenile Nonfiction , Social Topics , Adolescence"
"You Can Say ""No"" to Drugs! (A Drug-Free Kids Book)","Juvenile Nonfiction , General"
Young Readers Christian Library: Esther,"Juvenile Nonfiction , Biography & Autobiography , Religious"
Madagascar Mad Libs,"Juvenile Nonfiction , Humor , Comic Strips & Cartoons"
101 Words and How They Began,"Juvenile Nonfiction , General"
Games and Giggles Just for Girls (American Girl Library),"Juvenile Nonfiction , Games & Activities , General"
102 Haunted House Jokes,"Juvenile Nonfiction , General"
Misoso: Once Upon a Time Tales from Africa,"Juvenile Nonfiction , General"
Amelia Earhart: Courage in the Sky (Women of Our Time),"Juvenile Nonfiction , Biography & Autobiography , General"
Hear Your Heart: Let's Read and Find Out Science - Stage 2 (Let's-Read-and-Find-Out Science 2),"Juvenile Nonfiction , Science & Nature , Anatomy & Physiology"
"My First Dictionary: 1,000 words, pictures, and def (DK Games)","Juvenile Nonfiction , Reference , Dictionaries"
Patrick Henry Voice of the American Revolution,"Juvenile Nonfiction , Biography & Autobiography , Historical"
Ruth,"Juvenile Nonfiction , Biography & Autobiography , Religious"
DK Readers: Pirates: Raiders of the High Seas (Level 4: Proficient Readers) (DK Readers Level 4),"Juvenile Nonfiction , Law & Crime"
On Board the Titanic: What It Was Like When the Great Liner Sank,"Juvenile Nonfiction , History , General"
Nature in Danger (S O S Planet Earth),"Juvenile Nonfiction , General"
Better Homes and Gardens Water Wonders (Fun-to-do Project Books),"Juvenile Nonfiction , General"
My Very First Word Book (My Very First),"Juvenile Nonfiction , Concepts , Alphabet"
Lift-the-Flap Bible (Lift-The-Flap Book),"Juvenile Nonfiction , Religion , Bible Stories , General"
Osceola: Seminole Warrior,"Juvenile Nonfiction , General"
"What Comes in 2's, 3's & 4's?","Juvenile Nonfiction , Concepts , Counting & Numbers"
"Math Smarts: Tips, Tricks, and Secrets for Making Math More Fun! (American Girl Library)","Juvenile Nonfiction , Mathematics , General"
"Too Old for This, Too Young for That!: Your Survival Guide for the Middle-School Years","Juvenile Nonfiction , Social Topics , General"
I CAN MOVE (I'm Alive Ser.),"Juvenile Nonfiction , General"
Seashells (Science close-up),"Juvenile Nonfiction , General"
What I Like About Passover,"Juvenile Nonfiction , Holidays & Celebrations , Passover"
Eyewitness Explorers: Weather,"Juvenile Nonfiction , Science & Nature , Earth Sciences , Weather"
Code Busters!,"Juvenile Nonfiction , General"
47 Easy-to-Do Classic Science Experiments (Dover Children's Science Books),"Juvenile Nonfiction , Science & Nature , Experiments & Projects"
Down on the Funny Farm (Step into Reading),"Juvenile Nonfiction , Language Arts , General"
How to Draw Cartoons and Caricatures,"Juvenile Nonfiction , Art , Cartooning"
What's Inside You? (Starting Point Science),"Juvenile Nonfiction , Technology , How Things Work-Are Made"
Lakes and Rivers (Where Are We?),"Juvenile Nonfiction , General"
"Good Morning, Sweetie Pie and Other Poems for Little Children","Juvenile Nonfiction , Poetry , General"
Winnie - the - Pooh's ABC,"Juvenile Nonfiction , Concepts , General"
Night Gliders,"Juvenile Nonfiction , Animals , Mice, Hamsters, Guinea Pigs, Squirrels, etc."
Pocketful of Nonsense (Little Golden Book),"Juvenile Nonfiction , Poetry , Humorous"
Oceans (First Starts),"Juvenile Nonfiction , Science & Nature , Astronomy"
The Toddlers Bible (Toddler's Bible Series),"Juvenile Nonfiction , Religion , Biblical Studies"
"The Story of Baseball, (Landmark Giant #4)","Juvenile Nonfiction , Sports & Recreation , Baseball & Softball"
"I Spy a Dinosaur's Eye (Scholastic Reader, Level 1)","Juvenile Nonfiction , Readers , Beginner"
Seasons (Learning Adventures Grade 1),"Juvenile Nonfiction , Activity Books"
A Quiet Place,"Juvenile Nonfiction , Adventure & Adventurers"
To Dad (You Poor Old Wreck) (The Kings Kids Say),"Juvenile Nonfiction , Family , Parents"
Story of the Earth (Exploring the Universe),"Juvenile Nonfiction , General"
Sharks,"Juvenile Nonfiction , Photography"
Hudson River: An Adventure from the Mountains to the Sea,"Juvenile Nonfiction , History , Exploration & Discovery"
Eyewitness Explorers: Night Sky,"Juvenile Nonfiction , Science & Nature , Astronomy"
"Good Night, God Bless","Juvenile Nonfiction , Religious , Christian , Devotional & Prayer"
"Apollo 13 Space Race (All Aboard Reading Book, Level 3)","Juvenile Nonfiction , General"
"True-Life Treasure Hunts (Step-Into-Reading, Step 5)","Juvenile Nonfiction , General"
Super Sand Castle Saturday (MathStart 2),"Juvenile Nonfiction , Mathematics , General"
DK LEGO Readers: Race for Survival (Level 4: Proficient Readers),"Juvenile Nonfiction , Adventure & Adventurers"
696 Silly School Jokes & Riddles,"Juvenile Nonfiction , Humor , Jokes & Riddles"
Meet the Pilgrim Fathers,"Juvenile Nonfiction , General"
Super Cool Jokes and Games for Kids,"Juvenile Nonfiction , Humor , General"
Baseball: Rules of the Game,"Juvenile Nonfiction , General"
I Can Finger Paint (Playtime Series),"Juvenile Nonfiction , Art , Painting"
I Love Gymnastics!,"Juvenile Nonfiction , Sports & Recreation , Gymnastics"
I Want to Be Somebody New! (Beginner Books(R)),"Juvenile Nonfiction , Language Arts , General"
Night Animals: At Your Fingertips (At Your Fingertips Series),"Juvenile Nonfiction , General"
A Picture Book of Thomas Jefferson (Picture Book Biography),"Juvenile Nonfiction , Biography & Autobiography , Historical"
Excuse Me: A Little Book of Manners (Lift-the-Flap Book),"Juvenile Nonfiction , Activity Books , General"
Sharks! (All Aboard Reading),"Juvenile Nonfiction , Animals , Marine Life"
The Comic Book Bible,"Juvenile Nonfiction , Humor , Comic Strips & Cartoons"
How Come?,"Juvenile Nonfiction , General"
All About Animal Migrations: Question and Answer Book (The Question & Answer Book),"Juvenile Nonfiction , General"
You Can Name 100 Trucks!,"Juvenile Nonfiction , Transportation , Cars & Trucks"
Great Source Write on Track: Student Edition Grade 3 (Write Source 2000 Revision),"Juvenile Nonfiction , Language Arts , Composition & Creative Writing"
Little Prayers and Graces,"Juvenile Nonfiction , Religion , Biblical Studies"
"Jumpstart Kindergarten Early Reader: Rain, Rain, Go Away","Juvenile Nonfiction , Study Aids , General"
Creative Kids Artistic Drawing,"Juvenile Nonfiction , Art , Drawing"
The Animal Atlas: A Pictorial Atlas of World Wildlife,"Juvenile Nonfiction , General"
The Glow-In-the-dark Night Sky Book,"Juvenile Nonfiction , General"
DK Biography: Gandhi,"Juvenile Nonfiction , Biography & Autobiography , Social Activists"
DK Biography: George Washington: A Photographic Story of a Life,"Juvenile Nonfiction , Biography & Autobiography , Political"
Dinosaur (Eyewitness),"Juvenile Nonfiction , Animals , Dinosaurs & Prehistoric Creatures"
Don't Know Much About the Presidents,"Juvenile Nonfiction , History , United States , General"
Little People Big Book About Where We Live,"Juvenile Nonfiction , General"
The Big Book Of Christian Crafts,"Juvenile Nonfiction , Religion , Christianity"
The Little Giant® Book of Jokes,"Juvenile Nonfiction , Humor , Jokes & Riddles"
Touch and Feel: Puppy,"Juvenile Nonfiction , Animals , Dogs"
Skating Superstars,"Juvenile Nonfiction , Sports & Recreation , Ice Skating"
Telescope Power: Fantastic Activities & Easy Projects for Young Astronomers,"Juvenile Nonfiction , Science & Nature , Astronomy"
The National Civil Rights Museum Celebrates Everyday People,"Juvenile Nonfiction , People & Places , General"
Heat: A Graphic Reality Check for Teens Dealing With Sexuality (FlipSwitch),"Juvenile Nonfiction , Religious , Christian , General"
Dangerous Animals (Nature Company Discoveries Libraries),"Juvenile Nonfiction , Animals , General"
The Reader's Digest Children's Atlas of the Universe,"Juvenile Nonfiction , Reference , Atlases"
A Picture Book of Eleanor Roosevelt (Picture Book Biography),"Juvenile Nonfiction , Biography & Autobiography , Historical"
"Volcanoes! Mountains of Fire (Step-Into-Reading, Step 4)","Juvenile Nonfiction , Science & Nature , Earth Sciences , Earthquakes & Volcanoes"
What about Heaven? (Little Blessings),"Juvenile Nonfiction , Religion , Bible Stories , General"
Mr. Wizard's 400 Experiments in Science,"Juvenile Nonfiction , Science & Nature , Experiments & Projects"
Harcourt School Publishers Social Studies: Student Edition  Making A Difference Grade 2 2000,"Juvenile Nonfiction , Social Science , General"
A Small Child's Book Of Prayers (Szekeres),"Juvenile Nonfiction , Religious , Christian , Devotional & Prayer"
"102 Creepy, Crawly Bug Jokes","Juvenile Nonfiction , General"
How to Draw Robots and Aliens (Young Artist Series),"Juvenile Nonfiction , Technology , Machinery & Tools"
DK Readers: The Story of Spider-Man (Level 4: Proficient Readers),"Juvenile Nonfiction , Humor , Comic Strips & Cartoons"
"Word Searches Homework Helper, Grade 2","Juvenile Nonfiction , Concepts , General"
What Are Drugs? (A Drug-Free Kids Book),"Juvenile Nonfiction , General"
Antique Automobiles Coloring Book (Dover History Coloring Book),"Juvenile Nonfiction , Activity Books"
101 Ways to Get Straight A's (101 Ways),"Juvenile Nonfiction , Study Aids , General"
Kittens,"Juvenile Nonfiction , General"
The Little ABC Coloring Book (Dover Little Activity Books),"Juvenile Nonfiction , Games & Activities , Word Games"
Anne Frank: Life in Hiding,"Juvenile Nonfiction , Holidays & Celebrations , Other, Religious"
Puppies and Kittens (A Golden Little Look-Look Book),"Juvenile Nonfiction , General"
A Life God Rewards for Kids (Breakthrough Series),"Juvenile Nonfiction , Religion , Christianity"
Tony Hawk: Professional Skateboarder,"Juvenile Nonfiction , Biography & Autobiography , Sports & Recreation"
My World and Globe: Revised Edition,"Juvenile Nonfiction , People & Places , General"
Shh! We're Writing the Constitution,"Juvenile Nonfiction , Law & Crime"
Disney's Beauty and the Beast Word Book (Golden Books),"Juvenile Nonfiction , General"
Capital!: Washington D.C. from A to Z,"Juvenile Nonfiction , History , United States , State & Local"
Kids Make History: A New Look at America's Story,"Juvenile Nonfiction , People & Places , United States , General"
Flyer: A Tale of the Wright Dog (No. 5 in Suzanne Tate's History Series),"Juvenile Nonfiction , Animals , Dogs"
The Kingfisher Illustrated Pocket Dictionary,"Juvenile Nonfiction , Reference , Dictionaries"
Skyscrapers and Towers (Superstructures),"Juvenile Nonfiction , General"
The Glass Ark: The Story of Biosphere 2,"Juvenile Nonfiction , General"
How Did They Do That?,"Juvenile Nonfiction , General"
Civil War Uniforms Coloring Book (Dover Fashion Coloring Book),"Juvenile Nonfiction , History , United States , Civil War Period (1850-1877)"
Everyday Dress of the American Colonial Period Coloring Book (Dover Fashion Coloring Book),"Juvenile Nonfiction , History , United States , Colonial & Revolutionary Periods"
A Place for Owls: True Animal Stories,"Juvenile Nonfiction , General"
Funny Walks,"Juvenile Nonfiction , General"
What's It Like to Be a Ballet Dancer,"Juvenile Nonfiction , General"
Human Body Thematic Unit (Thematic Units),"Juvenile Nonfiction , Science & Nature , Anatomy & Physiology"
Grandma Elephant's in Charge (Read and Wonder),"Juvenile Nonfiction , Animals , Elephants"
Easter,"Juvenile Nonfiction , Holidays & Celebrations , Easter & Lent"
Alphabet Book (Farmyard Tales Books Series),"Juvenile Nonfiction , Concepts , Alphabet"
Weather: Nature Company Discoveries Library (Nature Company Discoveries Libraries),"Juvenile Nonfiction , General"
Angelina Ballerina's Christmas Crafts,"Juvenile Nonfiction , Crafts & Hobbies"
How You Are Changing: For Discussion or Individual Use (Learning About Sex),"Juvenile Nonfiction , Religious , Christian , General"
The Horned Dinosaur: Triceratops (I Love Dinosaurs) (A Golden Look-Look Book),"Juvenile Nonfiction , General"
Skyguide: A Field Guide to the Heavens,"Juvenile Nonfiction , Science & Nature , Astronomy"
Scholastic Reader Level 2: Butterflies,"Juvenile Nonfiction , Readers , Beginner"
The Church Case Scenario: How to Survive and Thrive in Church,"Juvenile Nonfiction , General"
Disney's Mulan,"Juvenile Nonfiction , Social Science , General"
Daniel in the Lions' Den,"Juvenile Nonfiction , Religion , Biblical Studies"
"The ""Putting on the Brakes"" Activity Book for Young People With ADHD","Juvenile Nonfiction , Study Aids , General"
How To Draw More Manga,"Juvenile Nonfiction , Art , Drawing"
Janice VanCleave's Earth Science for Every Kid: 101 Easy Experiments that Really Work,"Juvenile Nonfiction , Science & Nature , Earth Sciences , General"
"Fun with Kids in the Kitchen, Spiral","Juvenile Nonfiction , Cooking & Food"
Janice VanCleave's Animals,"Juvenile Nonfiction , Science & Nature , Experiments & Projects"
Mommy & Baby in the Wild (Lift-The-Flap Nature B00K),"Juvenile Nonfiction , General"
Barbie Mix and Match Fashions Sectioned Flip Book,"Juvenile Nonfiction , Crafts & Hobbies"
The Usborne Book of Kings & Queens: From Tutankhamun to Elizabeth II,"Juvenile Nonfiction , People & Places , General"
Three Little Pigs (Random House Pictureback),"Juvenile Nonfiction , General"
Girls Think of Everything: Stories of Ingenious Inventions by Women,"Juvenile Nonfiction , Girls & Women"
Our Mom Has Cancer,"Juvenile Nonfiction , Health & Daily Living , Diseases, Illnesses & Injuries"
Life (Eyewitness Science),"Juvenile Nonfiction , Science & Nature , Biology"
Dinosaur Dictionary,"Juvenile Nonfiction , General"
Story of the American Revolution Coloring Book (Dover History Coloring Book),"Juvenile Nonfiction , History , United States , Colonial & Revolutionary Periods"
Truck Book (Golden Books),"Juvenile Nonfiction , General"
"Not Now! Said the Cow (Bank Street, Level 2)","Juvenile Nonfiction , General"
"I Spy Funny Teeth (Scholastic Reader, Level 1)","Juvenile Nonfiction , Readers , Beginner"
"Word Searches Homework Helper, Grade 3","Juvenile Nonfiction , Concepts , General"
