Title,Category
Madeline In America And Other Holiday Tales,"Juvenile Nonfiction , Literary Criticism & Collections"
True Escape Stories (True Adventure Stories),"Juvenile Nonfiction , Readers , Chapter Books"
Draw! (ART AND ACTIVITIES FOR KIDS),"Juvenile Nonfiction , General"
Oops! I Made A Mistake Level 1 (All-star Readers),"Juvenile Nonfiction , Social Topics , General"
DK Readers: Whatever The Weather (Level 1: Beginning to Read) (DK Readers Level 1),"Juvenile Nonfiction , Science & Nature , Earth Sciences , Weather"
DINOSAUR WORLD,"Juvenile Nonfiction , Science & Nature , General"
e.encyclopedia,"Juvenile Nonfiction , Reference , Encyclopedias"
Great Expectations,"Juvenile Nonfiction , Antiques & Collectibles"
Scholastic Reader Level 1: I Spy Lightning in the Sky,"Juvenile Nonfiction , Readers , Beginner"
"Washington, D.C.: A Scrapbook","Juvenile Nonfiction , Reference , General"
David and Goliath (People of the Bible Series),"Juvenile Nonfiction , General"
"The First Christmas (Enid Blyton, Religious Stories)","Juvenile Nonfiction , Holidays & Celebrations , Christmas & Advent"
Molly's Craft Book: A Look at Crafts from the Past With Projects You Can Make Today (AMERICAN GIRLS PASTIMES),"Juvenile Nonfiction , Crafts & Hobbies"
The Ultimate LEGO Book,"Juvenile Nonfiction , Sports & Recreation , General"
First Kids (Step into Reading),"Juvenile Nonfiction , Readers , Intermediate"
What Baby Needs (Sears Children's Library),"Juvenile Nonfiction , Family , Siblings"
The Christmas Story,"Juvenile Nonfiction , Holidays & Celebrations , Christmas & Advent"
Wheels on the Bus (Raffi Songs to Read),"Juvenile Nonfiction , Music , Songbooks"
Marley: A Dog Like No Other: A Special Adaptation for Young Readers,"Juvenile Nonfiction , Animals , Dogs"
The American Heritage Children's Thesaurus,"Juvenile Nonfiction , Language Arts , General"
A Basic Dictionary: A Student's Reference,"Juvenile Nonfiction , Reference , Dictionaries"
The Inventor's Times,"Juvenile Nonfiction , History , General"
"Adventure Bible, Revised, NIV","Juvenile Nonfiction , Religion , Bible Stories , General"
Why Mosquitoes Buzz in People's Ears (Pied Piper Book),"Juvenile Nonfiction , General"
Everyday Mathematics: Student Reference Book : Grade 3,"Juvenile Nonfiction , Mathematics , General"
The Titanic (Cornerstones of Freedom),"Juvenile Nonfiction , History , General"
Hanukkah: A Counting Book In English - Hebrew - Yiddish,"Juvenile Nonfiction , Holidays & Celebrations , Hanukkah"
A Precious Moments Gift of Love (Precious Moments (Thomas Nelson)),"Juvenile Nonfiction , General"
The Human Body (Nature Company Discoveries Libraries),"Juvenile Nonfiction , General"
The Preschoolers Bible,"Juvenile Nonfiction , Religion , Biblical Studies"
What Can You Do with a Paper Bag?,"Juvenile Nonfiction , Crafts & Hobbies"
Dancing with Degas,"Juvenile Nonfiction , Performing Arts , Dance"
Story of the Vikings Coloring Book (Dover pictorial archive),"Juvenile Nonfiction , Activity Books"
"In the Desert (Look Once, Look Again Science Series)","Juvenile Nonfiction , Science & Nature , Earth Sciences , Geography"
DK Space Encyclopedia,"Juvenile Nonfiction , Science & Nature , Astronomy"
Ultimate Visual Dictionary of Science,"Juvenile Nonfiction , Science & Nature , General"
Kids' Road Atlas (The Backseat Books Series),"Juvenile Nonfiction , Reference , Atlases"
If You Were an Astronaut (Look-Look),"Juvenile Nonfiction , General"
Book of Magic Tricks (Magic Guides Series),"Juvenile Nonfiction , Games & Activities , Magic"
Happy Baby Animals,"Juvenile Nonfiction , Animals , General"
Happy Baby Colors,"Juvenile Nonfiction , Concepts , Senses & Sensation"
Cuddly Puppies (Feels Real Books),"Juvenile Nonfiction , Animals , Dogs"
Test Prep: Grade 6 (Flash Kids Harcourt Family Learning),"Juvenile Nonfiction , Language Arts , Vocabulary & Spelling"
My Little Word Book (My Little Books),"Juvenile Nonfiction , Language Arts , Vocabulary & Spelling"
Adoption Is for Always (Albert Whitman Concept Paperbacks),"Juvenile Nonfiction , Family , Adoption"
Children's Quick and Easy Cookbook,"Juvenile Nonfiction , Cooking & Food"
Let's Explore Science: Make It Change,"Juvenile Nonfiction , Science & Nature , Chemistry"
Pyramids (A First Discovery Book),"Juvenile Nonfiction , History , General"
Harcourt School Publishers Collections: Chapter Book Grade 5 Tarantula In/Purse,"Juvenile Nonfiction , Language Arts , General"
Easy Spanish Phrase Book: Over 770 Basic Phrases for Everyday Use (Dover Easy Phrase),"Juvenile Nonfiction , Foreign Language Study , General"
Trucks (Bright Baby),"Juvenile Nonfiction , Transportation , Cars & Trucks"
First Words (Bright Baby),"Juvenile Nonfiction , Concepts , Alphabet"
Where Did All the Water Go,"Juvenile Nonfiction , Science & Nature , Earth Sciences , Weather"
DK Pocket-Size Weather Facts,"Juvenile Nonfiction , Science & Nature , Earth Sciences , Weather"
Macmillan Dictionary for Children,"Juvenile Nonfiction , Reference , Dictionaries"
Tara Lipinski: Triumph on Ice,"Juvenile Nonfiction , Biography & Autobiography , Sports & Recreation"
"Gross Out!: Animals That Do Disgusting Things (Penguin Young Readers, Level 4)","Juvenile Nonfiction , Readers , Beginner"
A Girl Named Helen Keller (Scholastic Reader Level 3),"Juvenile Nonfiction , Readers , Beginner"
Crafts for Girls (American Girl Library),"Juvenile Nonfiction , General"
The Golden Book of Sharks and Whales,"Juvenile Nonfiction , General"
"Tiny Terrors, Level 2 Extreme Reader (Extreme Readers)","Juvenile Nonfiction , Animals , General"
Mom and Me Cookbook,"Juvenile Nonfiction , Cooking & Food"
The Prayer of Jabez for Young Hearts,"Juvenile Nonfiction , Religion , Christianity"
A is for America,"Juvenile Nonfiction , People & Places , United States , General"
Gandhi : Peaceful Warrior (Easy Biographies),"Juvenile Nonfiction , Biography & Autobiography , Historical"
"Literacy Bags, 2264","Juvenile Nonfiction , Language Arts , General"
Kids Can Draw Pirates (Kids Can Draw Series),"Juvenile Nonfiction , Art , History"
On the Halfpipe with Tony Hawk,"Juvenile Nonfiction , Biography & Autobiography , Sports & Recreation"
Germs Make Me Sick! (Let's-Read-and-Find-Out Science 2) (Reading Rainbow book),"Juvenile Nonfiction , Health & Daily Living , General"
DK Readers L2: Starry Sky (DK Readers Level 2),"Juvenile Nonfiction , Science & Nature , Astronomy"
"Mummies (Penguin Young Readers, Level 3)","Juvenile Nonfiction , History , Africa"
Lizzie The Elephant (IT'S A WILDLIFE BUDDY),"Juvenile Nonfiction , Animals , General"
Dinosaurs! (Know-It-Alls),"Juvenile Nonfiction , Animals , Dinosaurs & Prehistoric Creatures"
Creepy Beetles! (Hello Science Reader! Level 2),"Juvenile Nonfiction , Animals , Insects, Spiders, etc."
DK Readers: Feeding Time (Level 1: Beginning to Read) (DK Readers Level 1),"Juvenile Nonfiction , Readers , Beginner"
Eyewitness: Spy,"Juvenile Nonfiction , Law & Crime"
John Madden's Heroes of Football,"Juvenile Nonfiction , Biography & Autobiography , Sports & Recreation"
On Beyond Bugs: All About Insects (Cat in the Hat's Learning Library),"Juvenile Nonfiction , Animals , Insects, Spiders, etc."
"A Titanic Journey Across the Sea, 1912 (American Sisters)","Juvenile Nonfiction , History , General"
The Bill of Rights (True Books: Government),"Juvenile Nonfiction , Social Science , Politics & Government"
Pet Bugs: A Kid's Guide to Catching and Keeping Touchable Insects,"Juvenile Nonfiction , Animals , Insects, Spiders, etc."
"Caterpillars, Bugs and Butterflies: Take-Along Guide (Take Along Guides)","Juvenile Nonfiction , Animals , Insects, Spiders, etc."
I Can Read About Seasons,"Juvenile Nonfiction , Concepts , Seasons"
Eye Wonder: Bugs (Eye Wonder),"Juvenile Nonfiction , Animals , Insects, Spiders, etc."
The Century for Young People,"Juvenile Nonfiction , History , General"
Animal Babies (Nature Company Discoveries Libraries),"Juvenile Nonfiction , General"
Williams-Sonoma The Kid's Cookbook: A great book for kids who love to cook (Williams-Sonoma Lifestyles),"Juvenile Nonfiction , Cooking & Food"
A Smart Girl's Guide to Money (American Girl Library),"Juvenile Nonfiction , Girls & Women"
Space Facts (DK Pockets),"Juvenile Nonfiction , Science & Nature , Astronomy"
Flashlight Games (Booktivity),"Juvenile Nonfiction , Activity Books"
Audubon's Birds of America Coloring Book,"Juvenile Nonfiction , Animals , Birds"
Dolphin's First Day: The Story of a Bottlenose Dolphin - a Smithsonian Oceanic Collection Book (Mini book),"Juvenile Nonfiction , Animals , Marine Life"
I See Colors (Emergent Reader Science; Level 1),"Juvenile Nonfiction , General"
Kids' Computer Creations: Using Your Computer for Art & Craft Fun (Williamson Kids Can Books),"Juvenile Nonfiction , Computers , Entertainment & Games"
Houghton Mifflin Soar to Success: Sunken Treasure Lv 5 SUNKEN TREASURE (Read Soar to Success 1999),"Juvenile Nonfiction , Language Arts , General"
Earth (National Geographic Nature Library),"Juvenile Nonfiction , Science & Nature , Earth Sciences , General"
Girls and Their Horses: True Stories from American Girl (American Girl Library),"Juvenile Nonfiction , Animals , Horses"
U.S. Atlas For Young People - Pbk (Troll Reference Library),"Juvenile Nonfiction , Reference , Atlases"
Better Homes and Gardens at the Zoo (Fun-to-do Project Books),"Juvenile Nonfiction , General"
One Year Book of Devotions for Kids #3,"Juvenile Nonfiction , Religion , Biblical Studies"
Crocodiles (Know It Alls),"Juvenile Nonfiction , Animals , Reptiles & Amphibians"
Bright Baby Touch & Feel Perfect Pets (Bright Baby Touch and Feel),"Juvenile Nonfiction , Animals , Pets"
Amelia Earhart: Adventure in the Sky,"Juvenile Nonfiction , Biography & Autobiography , Historical"
Young Abraham Lincoln (Troll First-Start Biography),"Juvenile Nonfiction , Biography & Autobiography , Historical"
"I Am A Leaf (level 1) (Hello Reader, Science)","Juvenile Nonfiction , Readers , Beginner"
Young Christopher Columbus: Discoverer of New Worlds (First-Start Biographies),"Juvenile Nonfiction , Biography & Autobiography , Historical"
Houghton Mifflin Invitations to Literature: Rd Pback+ Wonder Worms 1.3 -Imp WONDER WORMS (Invitations to Lit 1996),"Juvenile Nonfiction , Language Arts , General"
In His Steps: What Would Jesus Do? (Young Reader's Christian Libarary),"Juvenile Nonfiction , Religion , General"
Time For Kids: Harriet Tubman: A Woman of Courage (Time For Kids Biographies),"Juvenile Nonfiction , History , United States , 19th Century"
New Junior Cookbook (Better Homes & Gardens Cooking),"Juvenile Nonfiction , Cooking & Food"
The Nitty-Gritty of Family Life: A Children's Book About Living in a Family (Ready-Set-Grow),"Juvenile Nonfiction , General"
The Kingfisher Illustrated Pocket Thesaurus (Pocket References),"Juvenile Nonfiction , Language Arts , General"
Davy Crockett: A Life on the Frontier (Ready-to-Read Level 3) (Ready-to-Read Stories of Famous Americans),"Juvenile Nonfiction , Biography & Autobiography , Historical"
The World's Greatest Collection of Knock Knock Jokes,"Juvenile Nonfiction , Humor , Jokes & Riddles"
I Can Draw Animals (Usborne Playtime Series),"Juvenile Nonfiction , Art , Drawing"
Tiny Star,"Juvenile Nonfiction , Religion , Biblical Studies"
I Live in Israel: A Text and Activity Book,"Juvenile Nonfiction , People & Places , Middle East"
Light My World Board Book: Numbers,"Juvenile Nonfiction , Concepts , Counting & Numbers"
Science Discovery Works: Unified Level 4,"Juvenile Nonfiction , Science & Nature , General"
Great Mysteries of the Ice and Snow,"Juvenile Nonfiction , General"
Fairy Tales (2 Minute Stories),"Juvenile Nonfiction , General"
Marley: A Dog Like No Other,"Juvenile Nonfiction , Animals , Dogs"
"Bees, Wasps and Ants (A Golden Junior Guide)","Juvenile Nonfiction , General"
"Unexplained: An Encyclopedia of Curious Phenomena, Strange Superstitions, and Ancient Mysteries","Juvenile Nonfiction , Curiosities & Wonders"
The Kingfisher Illustrated Children's Dictionary,"Juvenile Nonfiction , Reference , General"
My Big Science Book (My Big Step by Step),"Juvenile Nonfiction , Science & Nature , Experiments & Projects"
Simple Science Fun Hands-On Science Made Easy (Kidsworks),"Juvenile Nonfiction , General"
A Little Book of Manners for Boys: A Game Plan for Getting Along with Others,"Juvenile Nonfiction , Boys & Men"
DK Eyewitness Books: Robot: Discover the Amazing World of Machines from Robots that Play Chess to Systems that Think,"Juvenile Nonfiction , Technology , Machinery & Tools"
Who's Hiding? (Bible Friends Lift-the-Flap Book),"Juvenile Nonfiction , Religion , Bible Stories , General"
Do You Wanna Bet?: Your Chance to Find Out About Probability,"Juvenile Nonfiction , Mathematics , General"
Famous Places (A Child's First Library of Learning),"Juvenile Nonfiction , General"
Washington Adventures for Kids: An Activity Guide for Children,"Juvenile Nonfiction , General"
Daily Life (Pb) (American Albums from the Collections of the Library of Congress),"Juvenile Nonfiction , History , United States , General"
Night Animals (Totally Amazing),"Juvenile Nonfiction , General"
Natural Disasters (Totally Amazing),"Juvenile Nonfiction , General"
How? (Rand McNally Question Books),"Juvenile Nonfiction , General"
Eye Wonder: Pirate,"Juvenile Nonfiction , History , General"
Baby Faces,"Juvenile Nonfiction , Concepts , Colors"
Baseball 1 2 3,"Juvenile Nonfiction , Mathematics , General"
My First Halloween Board Book,"Juvenile Nonfiction , Holidays & Celebrations , Halloween"
Heidi (Great Illustrated Classics),"Juvenile Nonfiction , Antiques & Collectibles"
Eve and Her Sisters: Women of the Old Testament,"Juvenile Nonfiction , General"
Dinosaurs (Travel Guide),"Juvenile Nonfiction , Animals , Dinosaurs & Prehistoric Creatures"
Spies And Special Forces!,"Juvenile Nonfiction , History , General"
Crafts for Thanksgiving (Holiday Crafts for Kids),"Juvenile Nonfiction , Crafts & Hobbies"
NIrV Kids' Book of Devotions,"Juvenile Nonfiction , Religious , Christian , Devotional & Prayer"
A Horse Named Seabiscuit (All Aboard Reading),"Juvenile Nonfiction , History , United States , 20th Century"
Floating in Space (Let's-Read-and-Find-Out Science 2),"Juvenile Nonfiction , Technology , Aeronautics, Astronautics & Space Science"
"Zipping, Zapping, Zooming Bats (Let's-Read-and-Find-Out Science 2)","Juvenile Nonfiction , Science & Nature , General"
DK Readers: Tale of a Tadpole (Level 1: Beginning to Read),"Juvenile Nonfiction , Animals , Reptiles & Amphibians"
"Why Do Snakes Hiss?: And Other Questions About Snakes, Lizards, and Turtles (Penguin Young Readers, Level 3)","Juvenile Nonfiction , Animals , Birds"
What's Happening to My Body? Book for Girls: Revised Edition,"Juvenile Nonfiction , Health & Daily Living , Maturing"
Touch and Feel: ABC,"Juvenile Nonfiction , Concepts , Senses & Sensation"
My First Dinosaur Board Book (My 1st Board Books),"Juvenile Nonfiction , Animals , Dinosaurs & Prehistoric Creatures"
Disney's Aladdin (Illustrated Classic Series),"Juvenile Nonfiction , Social Science , General"
Bodies From The Ice: Melting Glaciers and the Recovery of the Past,"Juvenile Nonfiction , History , Europe"
"Why Do Horses Neigh? (Penguin Young Readers, Level 3)","Juvenile Nonfiction , Readers , Beginner"
Eyewitness Natural World (Companion to the Pbs Series),"Juvenile Nonfiction , Science & Nature , Earth Sciences , General"
The Glow-In-the-dark Planetarium Book,"Juvenile Nonfiction , General"
Give Me Half! (MathStart 2),"Juvenile Nonfiction , Mathematics , General"
Bodies From The Ash: Life and Death in Ancient Pompeii,"Juvenile Nonfiction , People & Places , Europe"
"It's So Amazing!: A Book about Eggs, Sperm, Birth, Babies, and Families (The Family Library)","Juvenile Nonfiction , Science & Nature , Anatomy & Physiology"
Shipwrecked!: The True Adventures of a Japanese Boy,"Juvenile Nonfiction , Biography & Autobiography , Historical"
The Visual Dictionary of Flight (DK Eyewitness Visual Dictionaries),"Juvenile Nonfiction , Technology , Aeronautics, Astronautics & Space Science"
Walter Wick's Optical Tricks,"Juvenile Nonfiction , Social Science , Psychology"
Let the Games Begin!,"Juvenile Nonfiction , Games & Activities , General"
Awful Ogre's Awful Day,"Juvenile Nonfiction , Poetry , Humorous"
The Children's Illustrated Bible,"Juvenile Nonfiction , Religion , Bible Stories , General"
Games and Fun with Playing Cards (Dover Children's Activity Books),"Juvenile Nonfiction , Games & Activities , General"
Real Fitness: 101 Games and Activities to Get Girls Going! (American Girl Library),"Juvenile Nonfiction , Health & Daily Living , Fitness & Exercise"
The Skeleton Inside You (Let's-Read-and-Find-Out Science 2),"Juvenile Nonfiction , Science & Nature , Anatomy & Physiology"
Wow! I'm Reading!: Fun Activities to Make Reading Happen (Williamson Little Hands Series),"Juvenile Nonfiction , Concepts , Alphabet"
DK Biography: Joan of Arc,"Juvenile Nonfiction , Biography & Autobiography , Religious"
"Star Wars, Episode III - Revenge of the Sith Trivia Quest","Juvenile Nonfiction , Games & Activities , Questions & Answers"
Goldilocks and the Three Bears,"Juvenile Nonfiction , General"
"A Baby Panda Is Born (Penguin Young Readers, Level 3)","Juvenile Nonfiction , Animals , Bears"
Seven African Amercian Scienti (Achievers : African Americans in Science and Technology),"Juvenile Nonfiction , Biography & Autobiography , Science & Technology"
"The Nation's Choice, Phonics Library Level 1 Theme 10: Houghton Mifflin the Nation's Choice California (Houghton Mifflin Reading: The Nation's Choice)","Juvenile Nonfiction , Language Arts , General"
Mummies Unwrapped (level 3) (Hello Reader),"Juvenile Nonfiction , Readers , Chapter Books"
Colorful World (FUN FLAPS),"Juvenile Nonfiction , Concepts , Colors"
Picasso (Getting to Know the World's Greatest Artists),"Juvenile Nonfiction , Biography & Autobiography , Art"
Machines at Work,"Juvenile Nonfiction , Technology , Machinery & Tools"
Pilots and Spacecraft (Star Wars Glow in the Dark),"Juvenile Nonfiction , General"
The Shepherd Boy's Story Board Book,"Juvenile Nonfiction , Religion , Biblical Studies"
American Wild Flowers Coloring Book (Dover Nature Coloring Book),"Juvenile Nonfiction , Science & Nature , Flowers & Plants"
The Amazing Book of Paper Boats: Paper Engineering and Illustrations,"Juvenile Nonfiction , Crafts & Hobbies"
Big Book of Things to Spot (1001 Things to Spot),"Juvenile Nonfiction , Activity Books"
Tricky Puzzles for Clever Kids,"Juvenile Nonfiction , Activity Books , General"
The Story of Jesus (Little Golden Book),"Juvenile Nonfiction , Religion , Bible Stories , General"
"Ready, Set, Grow!: A What's Happening to My Body? Book for Younger Girls","Juvenile Nonfiction , Health & Daily Living , Maturing"
Chester the Chick (How Your Pet Grows),"Juvenile Nonfiction , General"
MYTHOLOGY AND THE UNIVERSE (Isaac Asimov's Library of the Universe),"Juvenile Nonfiction , General"
Whales (Look-Look),"Juvenile Nonfiction , General"
Friends: Making Them & Keeping Them (American Girl),"Juvenile Nonfiction , Activity Books"
Journey Through Japan (Journey Through series),"Juvenile Nonfiction , General"
Amazing Frogs and Toads (Eyewitness Junior),"Juvenile Nonfiction , General"
Room to Grow: An Appetite for Life,"Juvenile Nonfiction , Health & Daily Living , Diet & Nutrition"
Looking at Insects (David Suzuki's Looking at Series),"Juvenile Nonfiction , Animals , Insects, Spiders, etc."
The Fox: Playful Prowler (Animal Close-Ups),"Juvenile Nonfiction , Science & Nature , Environmental Conservation & Protection"
Simple Science,"Juvenile Nonfiction , General"
Usborne Book of Ocean Facts,"Juvenile Nonfiction , Science & Nature , Earth Sciences , Water (Oceans, Lakes, etc.)"
"How to Make Your Science Project Scientific , Revised Edition","Juvenile Nonfiction , Science & Nature , Experiments & Projects"
Fun-To-Make Nature Crafts,"Juvenile Nonfiction , General"
Emeril's There's a Chef in My Soup! Recipes for the Kid in Everyone,"Juvenile Nonfiction , Cooking & Food"
Delights: Level 2.2,"Juvenile Nonfiction , Language Arts , General"
The Magic School Science Reader: The Magic School Bus: Lost in the Snow (The Magic School Bus Science Reader),"Juvenile Nonfiction , Science & Nature , Earth Sciences , Weather"
French Bilingual Dictionary (Beginning Bilingual Dictionaries),"Juvenile Nonfiction , Reference , Dictionaries"
My Good Night® Bible (My Good Night® Collection),"Juvenile Nonfiction , Religion , Bible Stories , General"
The Colors of My Jewish Year (Very First Board Books),"Juvenile Nonfiction , Religion , Judaism"
The Fascinating World of Ants,"Juvenile Nonfiction , Animals , Insects, Spiders, etc."
Birds (World Wildlife Fund),"Juvenile Nonfiction , General"
Animals in Danger: Forests of Africa,"Juvenile Nonfiction , General"
Monumental Mazes,"Juvenile Nonfiction , Games & Activities , Puzzles"
The Story of Jesus (Little Golden Storybook),"Juvenile Nonfiction , Religion , Bible Stories , General"
The Creation (Now You Can Read--Bible Stories.),"Juvenile Nonfiction , General"
New Kids Book of Bible Facts,"Juvenile Nonfiction , Religion , Bible Stories , General"
"What's the Big Idea, Ben Franklin?","Juvenile Nonfiction , History , United States , Colonial & Revolutionary Periods"
Baby's First Book (Little Golden Book),"Juvenile Nonfiction , Language Arts , Vocabulary & Spelling"
Christmas Carol Mad Libs,"Juvenile Nonfiction , Games & Activities , Word Games"
The Highlights Big Book of Fun,"Juvenile Nonfiction , Humor , Jokes & Riddles"
Once A Wolf: How Wildlife Biologists Fought to Bring Back the Gray Wolf,"Juvenile Nonfiction , Science & Nature , Environmental Conservation & Protection"
Great African Americans in the Olympics (Outstanding African Americans),"Juvenile Nonfiction , Biography & Autobiography , Sports & Recreation"
We Love Ballet! (Pictureback(R)),"Juvenile Nonfiction , School & Education"
Across America on an Emigrant Train,"Juvenile Nonfiction , History , United States , 19th Century"
Three Little Kittens (Jellybean Books(R)),"Juvenile Nonfiction , Animals , Cats"
The One Year Devos for Girls 2 (One Year Book of Devotions for Girls),"Juvenile Nonfiction , Religion , Biblical Studies"
God Made You Special,"Juvenile Nonfiction , Religion , Christianity"
Baseball Fever (We Both Read - Level 1-2 (Quality)),"Juvenile Nonfiction , Readers , Beginner"
20th Century America,"Juvenile Nonfiction , History , United States , 20th Century"
"I Am a Rock (Hello Reader Science, Level 1)","Juvenile Nonfiction , Science & Nature , Earth Sciences , Rocks & Minerals"
Wild Weather: Floods! (HELLO READER SCIENCE LEVEL 4),"Juvenile Nonfiction , Science & Nature , Earth Sciences , Weather"
"The Nation's Choice, Phonics Library Level 1 Theme 9: Houghton Mifflin the Nation's Choice California (Houghton Mifflin Reading: The Nation's Choice)","Juvenile Nonfiction , Language Arts , General"
The World's Best Party Games,"Juvenile Nonfiction , Games & Activities , General"
Tiny Treats (American Girls Collection Sidelines),"Juvenile Nonfiction , Cooking & Food"
Everybody Tells Me to Be Myself but I Don't Know Who I Am: Building Your Self-Esteem (Faithgirlz!),"Juvenile Nonfiction , Religious , Christian , General"
"Soccer Techniques, Tactics & Teamwork","Juvenile Nonfiction , Sports & Recreation , Soccer"
Animal Go-round,"Juvenile Nonfiction , Animals , General"
America Is...,"Juvenile Nonfiction , History , United States , General"
Earth From Above for Young Readers,"Juvenile Nonfiction , Readers , Beginner"
"5,000 Miles to Freedom: Ellen and William Craft's Flight from Slavery","Juvenile Nonfiction , Biography & Autobiography , Historical"
Math For Fun Projects,"Juvenile Nonfiction , Mathematics , General"
Wind and Weather (Child's First Library of Learning),"Juvenile Nonfiction , General"
Eyewitness: Soccer,"Juvenile Nonfiction , Sports & Recreation , Soccer"
Longitude: The True Story of a Lone Genius Who Solved the Greatest Scientific Problem of His Time,"Juvenile Nonfiction , Science & Nature , General"
Choppers! (Step into Reading),"Juvenile Nonfiction , Readers , Beginner"
Math: Reproducible Activities (The 100+ Series),"Juvenile Nonfiction , Mathematics , General"
Webster's Reference Library Dictionary: New Revised Edition (Webster's Classic Reference Library),"Juvenile Nonfiction , Reference , Dictionaries"
Ice Skating Basics,"Juvenile Nonfiction , Sports & Recreation , Winter Sports"
My Big Creative Activity Book (My Big Step by Step),"Juvenile Nonfiction , Activity Books"
A Child's Garden of Verses (A Classic Illustrated Edition),"Juvenile Nonfiction , Literary Criticism & Collections"
Fly High!: The Story of Bessie Coleman,"Juvenile Nonfiction , History , United States , General"
Masterpieces Up Close: Western Painting from the 14th to 20th Centuries,"Juvenile Nonfiction , Art , Painting"
Prayer for a Child,"Juvenile Nonfiction , Religious , Christian , Devotional & Prayer"
God Must Really Love . . . COLORS!,"Juvenile Nonfiction , Religious , Christian , General"
Too Many Kangaroo Things to Do! (Great Source Mathstart),"Juvenile Nonfiction , Mathematics , General"
National Geographic Beginners World Atlas Updated Edition,"Juvenile Nonfiction , Reference , Atlases"
Boys Will Put You on a Pedestal (So They Can Look Up Your Skirt): A Dad's Advice for Daughters,"Juvenile Nonfiction , Girls & Women"
Cat Hiss-Tory: A Feline Tour Through the Ages,"Juvenile Nonfiction , Humor , Comic Strips & Cartoons"
A Dictionary of Dance,"Juvenile Nonfiction , Performing Arts , Dance"
Does a Baboon Sleep in a Bed? (Early Experiences),"Juvenile Nonfiction , Health & Daily Living , General"
Amazing Birds (Eyewitness Junior),"Juvenile Nonfiction , Animals , Birds"
