Title,Category
Thunderstorms (True Book: Earth Science) (A True Book: Earth Science),"Juvenile Nonfiction , Science & Nature , Earth Sciences , Weather"
Edward Hopper (Getting to Know the World's Greatest Artists: Previous Editions),"Juvenile Nonfiction , Biography & Autobiography , Art"
She's All That! (Mythlopedia),"Juvenile Nonfiction , Social Science , Folklore & Mythology"
Da Vinci (Getting to Know the World's Greatest Artists),"Juvenile Nonfiction , Biography & Autobiography , Art"
Oh My Gods! (Mythlopedia): A Look-It-Up Guide to the Gods of Mythology,"Juvenile Nonfiction , Social Science , Folklore & Mythology"
Twelve Who Followed Jesus - Arch Books,"Juvenile Nonfiction , Religion , Bible Stories , General"
A Picture Book of Dinosaurs,"Juvenile Nonfiction , General"
Asia (Geography),"Juvenile Nonfiction , General"
Real Beauty: 101 Ways to Feel Great About You (American Girl Library),"Juvenile Nonfiction , Social Issues , Self-Esteem & Self-Reliance"
Frog (Watch Me Grow),"Juvenile Nonfiction , Animals , Reptiles & Amphibians"
Baby Grip: Happy Baby Colors,"Juvenile Nonfiction , Concepts , Colors"
If You Lived With The Cherokees,"Juvenile Nonfiction , People & Places , United States , General"
The World We Live in (Child's First Library of Learning),"Juvenile Nonfiction , General"
Jackie Robinson: Young Sports Trailblazer (Childhood of Famous Americans),"Juvenile Nonfiction , Biography & Autobiography , Sports & Recreation"
The Assassination of John F. Kennedy (Cornerstones of Freedom Second Series),"Juvenile Nonfiction , History , United States , 20th Century"
Uniforms of the American Revolution Coloring Book (Dover Fashion Coloring Book),"Juvenile Nonfiction , History , United States , Colonial & Revolutionary Periods"
You will be my baby even when...,"Juvenile Nonfiction , General"
Miriam Watches Baby Moses: A Story of Faith and Loyalty (Prince of Egypt Values Series),"Juvenile Nonfiction , Religion , Bible Stories , General"
Informania: Sharks,"Juvenile Nonfiction , Animals , Marine Life"
Amazing Lizards (Eyewitness Junior),"Juvenile Nonfiction , General"
Kids' Everything Money (Everything Kids Series),"Juvenile Nonfiction , Business & Economics"
MOZART TONIGHT,"Juvenile Nonfiction , Biography & Autobiography , General"
We Can Make Graphs (Math Learn to Read),"Juvenile Nonfiction , School & Education"
Ribbons of Sand: Exploring Atlantic Beaches (Children's Books),"Juvenile Nonfiction , Science & Nature , Earth Sciences , Water (Oceans, Lakes, etc.)"
Mr. Wizard's Experiments for Young Scientists,"Juvenile Nonfiction , General"
Famous Lives,"Juvenile Nonfiction , Biography & Autobiography , General"
Exploration of North America Coloring Book (Dover History Coloring Book),"Juvenile Nonfiction , History , Exploration & Discovery"
DK Children's Illustrated Encyclopedia,"Juvenile Nonfiction , Reference , Encyclopedias"
How To Draw Endangered Animals - Pb (Bc),"Juvenile Nonfiction , Art , Drawing"
Thankful Together,"Juvenile Nonfiction , Religion , General"
Aladdin and His Wonderful Lamp,"Juvenile Nonfiction , General"
"Oh, Yikes!: History's Grossest Wackiest Moments","Juvenile Nonfiction , Reference , Encyclopedias"
A-Maze-ing Western National Parks & Monuments,"Juvenile Nonfiction , Science & Nature , General"
Encyclopedia (Travel Guide),"Juvenile Nonfiction , Reference , Encyclopedias"
My Very First Golden Bible,"Juvenile Nonfiction , General"
Mad Libs on the Road: World's Greatest Word Game,"Juvenile Nonfiction , Activity Books , General"
Backpack Books: 1001 Facts About the Human Body (Backpack Books),"Juvenile Nonfiction , Science & Nature , Anatomy & Physiology"
Snooze-A-Palooza! (American Girl Library),"Juvenile Nonfiction , Activity Books"
The Lady with the Alligator Purse,"Juvenile Nonfiction , Poetry , Humorous"
Polar Bears and the Arctic: A Nonfiction Companion to Magic Tree House,"Juvenile Nonfiction , People & Places , Polar Regions"
Celebrating Valentines Day: My Special Valentines (Learn to Read Read to Learn Holiday Series),"Juvenile Nonfiction , Holidays & Celebrations , Valentine's Day"
Birds' Nests,"Juvenile Nonfiction , General"
My Pictionary,"Juvenile Nonfiction , General"
Science Explorer: Cells and Heredity,"Juvenile Nonfiction , Science & Nature , Biology"
A Picture Book of Frederick Douglass (Picture Book Biography),"Juvenile Nonfiction , Biography & Autobiography , Historical"
Oregon Trail,"Juvenile Nonfiction , People & Places , United States , General"
A Child's First Bible,"Juvenile Nonfiction , Religion , General"
A Children's Companion Guide to America's History: History and Government,"Juvenile Nonfiction , History , United States , General"
Blue Moo: 17 Jukebox Hits From Way Back Never,"Juvenile Nonfiction , Music , Popular"
From Rock to Fireworks (Changes),"Juvenile Nonfiction , Science & Nature , General"
The Mother Goose Cookbook: Rhymes and Recipes for the Very Young,"Juvenile Nonfiction , Cooking & Food"
Mighty Dinosaurs (Nature Company Discoveries Libraries),"Juvenile Nonfiction , General"
"The Easter Story From The Gospels Of Matthew, Mark, Luke And John","Juvenile Nonfiction , Religion , Christianity"
Passage to Freedom: The Sugihara Story,"Juvenile Nonfiction , History , Holocaust"
How to Draw Dogs (How to Draw (Dover)),"Juvenile Nonfiction , Art , Drawing"
DK Readers: First Day at Gymnastics (Level 1: Beginning to Read) (DK Readers Level 1),"Juvenile Nonfiction , Readers , Beginner"
ABC Touch & Feel: B is for Bear: A Very First Book for the Baby You Love (ABC Books),"Juvenile Nonfiction , Animals , Bears"
Beast Feast: Poems & Paintings,"Juvenile Nonfiction , Poetry , General"
Usborne Book of Papier Mache (How to Make Series),"Juvenile Nonfiction , Technology , Machinery & Tools"
Christian the Lion,"Juvenile Nonfiction , Animals , Lions, Tigers, Leopards, etc."
The Busy Body Book: A Kid's Guide to Fitness,"Juvenile Nonfiction , Science & Nature , Anatomy & Physiology"
101 Places You Gotta See Before You're 12!,"Juvenile Nonfiction , Travel"
Wee Sing 25th Anniversary Celebration book,"Juvenile Nonfiction , Music , General"
Listen to the Wind: The Story of Dr. Greg & Three Cups of Tea (Rise and Shine),"Juvenile Nonfiction , People & Places , Middle East"
The Important Book,"Juvenile Nonfiction , Concepts , General"
Red Scarf Girl: A Memoir of the Cultural Revolution,"Juvenile Nonfiction , People & Places , Asia"
1-2-3 Magic for Kids: Helping Your Kids Understand the New Rules (1 2 3 Magic for Christian Parents),"Juvenile Nonfiction , Family , Parents"
The Wimpy Kid Movie Diary (Diary of a Wimpy Kid),"Juvenile Nonfiction , Performing Arts , Film"
A Potty for Me!,"Juvenile Nonfiction , Health & Daily Living , Toilet Training"
Twizzlers Percentages Book,"Juvenile Nonfiction , Concepts , Counting & Numbers"
"Black Out!: Animals That Live in the Dark: Animals That Live in the Dark (Penguin Young Readers, Level 3)","Juvenile Nonfiction , Readers , Beginner"
Children's Planet Earth Encyclopedia,"Juvenile Nonfiction , Reference , Encyclopedias"
What's Happening to Me?: Girls Edition,"Juvenile Nonfiction , Health & Daily Living , Maturing"
Celebrating President's Day: What Is a President? (Learn to Read Read to Learn Holiday Series),"Juvenile Nonfiction , Biography & Autobiography , Political"
"You Must Be Joking!: Lots of Cool Jokes, Plus 17 1/2 Tips for Remembering, Telling, and Making Up Your Own Jokes","Juvenile Nonfiction , Language Arts , Composition & Creative Writing"
The White House (American Symbols & Their Meanings),"Juvenile Nonfiction , History , United States , 19th Century"
The Statue of Liberty (American Symbols & Their Meanings),"Juvenile Nonfiction , History , United States , 19th Century"
The Great Big Art Activity Book,"Juvenile Nonfiction , Art , General"
Celebrating Father's Day: Father's Day Is for Special People (Learn to Read Holiday Series1999),"Juvenile Nonfiction , Holidays & Celebrations , Other, Non-Religious"
DK Readers L4: D-Day Landings: The Story of the Allied Invasion: The Story of the Allied Invasion (DK Readers Level 4),"Juvenile Nonfiction , History , Military & Wars"
"The Kids' Book of Divorce: By, For, and About Kids","Juvenile Nonfiction , General"
Cooking On A Stick: Campfire Recipes for Kids (Gibbs Smith Jr. Activity),"Juvenile Nonfiction , Cooking & Food"
Little Girls Bible Storybook for Mothers and Daughters,"Juvenile Nonfiction , Religion , Biblical Studies"
The Moon and I,"Juvenile Nonfiction , Biography & Autobiography , Women"
Baseball Players Do Amazing Things (Step-Up Books),"Juvenile Nonfiction , General"
The Young Investor: Projects and Activities for Making Your Money Grow,"Juvenile Nonfiction , Concepts , Money"
My Soccer Book,"Juvenile Nonfiction , Sports & Recreation , Soccer"
Harcourt School Publishers Collections: Student Edition : Welcome Home Grade 1/4 2000,"Juvenile Nonfiction , Readers , Beginner"
Illustrated Picture Atlas of the World (World Atlas),"Juvenile Nonfiction , General"
Underwear: What We Wear Under There,"Juvenile Nonfiction , History , General"
"The Great Art Scandal : Solve the Crime, Save the Show!","Juvenile Nonfiction , Art , Painting"
Mary's Easter Story: The Story of Easter : Matthew 21:1-11 and John 18:1-20:31,"Juvenile Nonfiction , Holidays & Celebrations , Easter & Lent"
I'm Going to Read® (Level 1): Who Spilled the Milk? (I'm Going to Read® Series),"Juvenile Nonfiction , Readers , Beginner"
Hau Kola: Hello Friend (Meet the Author),"Juvenile Nonfiction , Biography & Autobiography , Literary"
Burning Up: On Tour with the Jonas Brothers,"Juvenile Nonfiction , Music , Popular"
You Can Draw Fantastic Animals,"Juvenile Nonfiction , Animals , General"
"My Very First Encyclopedia With Winnie the Pooh and Friends: Nature, Books Are Fun Ed","Juvenile Nonfiction , Reference , Encyclopedias"
Did You See What I Saw?: Poems About School (Picture Puffins),"Juvenile Nonfiction , Poetry , Humorous"
Fantastic Cutaway: Speed (Copper Beach Series),"Juvenile Nonfiction , Transportation , General"
History of the World,"Juvenile Nonfiction , History , General"
Fantastic Feats and Failures,"Juvenile Nonfiction , Science & Nature , Physics"
Design Your Own Coat of Arms: An Introduction to Heraldry (Dover Children's Activity Books),"Juvenile Nonfiction , Games & Activities , General"
Swing!: A Scanimation Picture Book,"Juvenile Nonfiction , Sports & Recreation , General"
I Can Draw People (Usborne Playtime),"Juvenile Nonfiction , Art , Drawing"
DK MF WORD BOARD BK REV EDIT (My 1st Board Books),"Juvenile Nonfiction , Language Arts , Vocabulary & Spelling"
My First Animal Board Book,"Juvenile Nonfiction , Animals , General"
Putting on the Brakes: Young People's Guide to Understanding Attention Deficit Hyperactivity Disorder,"Juvenile Nonfiction , Health & Daily Living , Diseases, Illnesses & Injuries"
Fishy Friends: A Journey Through the Coral Kingdom,"Juvenile Nonfiction , Animals , Marine Life"
The Cat at the Door: And Other Stories to Live by,"Juvenile Nonfiction , Family , General"
Gifted Hands TV Tie-in: The Ben Carson Story (ZonderKidz Biography),"Juvenile Nonfiction , Biography & Autobiography , Religious"
101 Ways To Boost Your Science Skills,"Juvenile Nonfiction , School & Education"
Time For Kids: Clara Barton: Angel of the Battlefield (Time For Kids Biographies),"Juvenile Nonfiction , Biography & Autobiography , Historical"
NFL Reader: Between the Lines,"Juvenile Nonfiction , Sports & Recreation , Football"
"Addition Homework Helper, Grade 1","Juvenile Nonfiction , Mathematics , Arithmetic"
Classic Children's Prayers (Little Prayer Series) (Little Prayers Series),"Juvenile Nonfiction , Religion , Biblical Studies"
Ride a Purple Pelican (Mulberry Books),"Juvenile Nonfiction , People & Places , United States , General"
"Colorful Chameleons! (Step-Into-Reading, Step 3)","Juvenile Nonfiction , Animals , Reptiles & Amphibians"
The Kid Who Invented the Popsicle: And Other Surprising Stories about Inventions,"Juvenile Nonfiction , History , General"
Eye: A Light Receiver,"Juvenile Nonfiction , General"
Touch and Feel: Ponies,"Juvenile Nonfiction , Animals , Horses"
The Boy With a Sling,"Juvenile Nonfiction , Religion , Bible Stories , General"
Jon and the Little Lost Lamb: The Parable of the Good Shepherd (Arch Books),"Juvenile Nonfiction , Religion , Bible Stories , General"
The Renaissance and the New World (History of Everyday Things series),"Juvenile Nonfiction , General"
"For Boys Only: The Biggest, Baddest Book Ever","Juvenile Nonfiction , Curiosities & Wonders"
The Book of Totally Irresponsible Science: 64 Daring Experiments for Young Scientists,"Juvenile Nonfiction , Science & Nature , Experiments & Projects"
Fish and Not Fish: Level 3,"Juvenile Nonfiction , Animals , Fishes"
Going Lobstering (Outdoor Adventures),"Juvenile Nonfiction , Adventure & Adventurers"
Exploring Light and Color,"Juvenile Nonfiction , Science & Nature , Experiments & Projects"
Learning About the Changing Seasons,"Juvenile Nonfiction , Science & Nature , General"
Easter Crafts,"Juvenile Nonfiction , Holidays & Celebrations , Easter & Lent"
Fort Mchenry (Famous Forts Throughout American History),"Juvenile Nonfiction , History , United States , General"
Troll Math Homework Survival Guide: A Reference for Students and Parents (Grades 4-6),"Juvenile Nonfiction , Mathematics , Geometry"
The Quiz Book (American Girl Library),"Juvenile Nonfiction , Activity Books"
"Seashells, Crabs and Sea Stars: Take-Along Guide (Take Along Guides)","Juvenile Nonfiction , Animals , Marine Life"
Pyramids,"Juvenile Nonfiction , Concepts , Size & Shape"
Celebrating Christmas: Christmas Decorations Learn to Read Holiday Reader (Learn to Read. Holiday Series),"Juvenile Nonfiction , School & Education"
WHY DOES LIGHTNING STRIKE (Why Books),"Juvenile Nonfiction , Science & Nature , Earth Sciences , General"
Weather (At Your Fingertips Series),"Juvenile Nonfiction , Science & Nature , Earth Sciences , Weather"
The Glad Scientist Explores the Human Body,"Juvenile Nonfiction , Science & Nature , Anatomy & Physiology"
So Much,"Juvenile Nonfiction , History , General"
Cut & Assemble Plains Indians Teepee Village (Dover Children's Activity Books),"Juvenile Nonfiction , People & Places , United States , Native American"
The Illuminated Alphabet (Dover Coloring Book),"Juvenile Nonfiction , History , Medieval"
Puzzle Journey Through Time (Puzzle Journey Series),"Juvenile Nonfiction , Games & Activities , Puzzles"
The Cloud Book,"Juvenile Nonfiction , Science & Nature , Earth Sciences , Weather"
The First Easter,"Juvenile Nonfiction , Holidays & Celebrations , Easter & Lent"
Easy Art Fun!: Do-It-Yourself Crafts for Beginning Readers (Little Hands Read-&-Do Book),"Juvenile Nonfiction , Art , General"
The Beginner's Bible Noah and the Ark (I Can Read! / The Beginner's Bible),"Juvenile Nonfiction , Religion , Bible Stories , General"
Discover George Washington (Discovery Readers),"Juvenile Nonfiction , Biography & Autobiography , Historical"
Young Believer 365: Devotions to help you stand strong 24/7,"Juvenile Nonfiction , Religion , Christianity"
Davy Crockett: Young Pioneer,"Juvenile Nonfiction , Biography & Autobiography , Historical"
The Little Animal ABC Coloring Book (Dover Little Activity Books),"Juvenile Nonfiction , Games & Activities , Word Games"
"You Gotta be Kidding! The Crazy Book of ""Would you Rather"" Questions","Juvenile Nonfiction , Games & Activities , Questions & Answers"
Insects (Look-Look),"Juvenile Nonfiction , Animals , Insects, Spiders, etc."
The Beginner's Bible Jonah and the Big Fish: My First (I Can Read! / The Beginner's Bible),"Juvenile Nonfiction , Religious , Christian , General"
My Family History (A Troll Family Guide),"Juvenile Nonfiction , General"
Kids' Easy Knitting Projects (Quick Starts for Kids!),"Juvenile Nonfiction , Crafts & Hobbies"
Larryboy and the Awful Ear Wacks Attacks,"Juvenile Nonfiction , Religion , Christianity"
Class President Library Book Grade 4: Harcourt School Publishers Treasury of Literature (Treasury of Literature 95y047),"Juvenile Nonfiction , Language Arts , General"
The Penguin Family Book,"Juvenile Nonfiction , Science & Nature , Zoology"
Bats (Lerner Natural Science Book),"Juvenile Nonfiction , Animals , Mammals"
Walking by Faith Grade 4 Christian Morality,"Juvenile Nonfiction , Religion , Christianity"
People of the Longhouse: How the Iroquoian Tribes Lived (How They Lived),"Juvenile Nonfiction , People & Places , United States , Native American"
INVESTIGATIONS 2008 STUDENT MATH HANDBOOK GRADE 3,"Juvenile Nonfiction , Mathematics , General"
Racing Around (MathStart 2),"Juvenile Nonfiction , Mathematics , General"
The Cow of No Color: Riddle Stories and  Justice Tales from Around the World,"Juvenile Nonfiction , Social Topics , Values & Virtues"
Our 50 States: A Family Adventure Across America,"Juvenile Nonfiction , People & Places , United States , General"
Flight,"Juvenile Nonfiction , History , General"
Incredible You! 10 Ways to let your greatness shine through,"Juvenile Nonfiction , Social Topics , Emotions & Feelings"
Ed Emberley's Drawing Book of Animals,"Juvenile Nonfiction , Animals , General"
Houghton Mifflin Soar to Success: Paperback Level 3 Educate Arthur (Read Soar to Success 1999),"Juvenile Nonfiction , Language Arts , General"
Science Book of Electricity,"Juvenile Nonfiction , General"
Colors (Foil Fun Board Books),"Juvenile Nonfiction , Science & Nature , Physics"
Three Billy Goats Gruff - Pbk,"Juvenile Nonfiction , General"
The Gristmill (Historic Communities (Paperback)),"Juvenile Nonfiction , History , United States , General"
"Janice VanCleave's Science Project Workbook, Grades 3-6","Juvenile Nonfiction , Science & Nature , General"
Houghton Mifflin Soar to Success: Camp Knock Knock Lv 4 CAMP KNOCK KNOCK (Read Soar to Success 1999),"Juvenile Nonfiction , Language Arts , General"
Owls,"Juvenile Nonfiction , Animals , Birds"
LITTLE GOLDEN BIBLE,"Juvenile Nonfiction , Religion , Bible Stories , General"
Dogs (DK Pockets),"Juvenile Nonfiction , Animals , Dogs"
Amazing Animal Builders (Animal Wonders),"Juvenile Nonfiction , General"
The Complete Book of Arts and Crafts,"Juvenile Nonfiction , Art , General"
Totally Amazing Plants,"Juvenile Nonfiction , General"
I Wonder Why Triceratops Had Horns: and Other Questions about Dinosaurs,"Juvenile Nonfiction , Animals , Dinosaurs & Prehistoric Creatures"
DK First Dictionary,"Juvenile Nonfiction , Reference , Dictionaries"
The Plymouth Colony (We the People: Exploration and Colonization),"Juvenile Nonfiction , History , United States , Colonial & Revolutionary Periods"
American Family of the Colonial Era Paper Dolls in Full Color (Dover Paper Dolls),"Juvenile Nonfiction , History , General"
Dolphins (Our Wild World),"Juvenile Nonfiction , Animals , Mammals"
Marie Curie: A Brilliant Life (Snapshots: Images of People and Places in History),"Juvenile Nonfiction , Biography & Autobiography , Science & Technology"
Helen Keller: A Determined Life (Snapshots: Images of People and Places in History),"Juvenile Nonfiction , Biography & Autobiography , General"
The Battle of Gettysburg (We the People: Civil War Era),"Juvenile Nonfiction , History , United States , 19th Century"
"Baseball's Greatest Hitters (Step-Into-Reading, Step 5)","Juvenile Nonfiction , Readers , Beginner"
Girls and their Dogs (American Girl Library),"Juvenile Nonfiction , Animals , Dogs"
The Lewis and Clark Expedition (We the People: Expansion and Reform),"Juvenile Nonfiction , History , United States , 19th Century"
Girls Who Rocked the World : Heroines from Sacagawea to Sheryl Swoopes,"Juvenile Nonfiction , Biography & Autobiography , Historical"
First Words (BABY TOUCH & FEEL),"Juvenile Nonfiction , Concepts , General"
Harcourt School Publishers Trophies: Below Level Individual Reader Grade 3 Pony Express to the Rescue,"Juvenile Nonfiction , Language Arts , General"
Eyewitness: World War II (Eyewitness Books),"Juvenile Nonfiction , History , Military & Wars"
Who Were the Beatles? (Who Was--?),"Juvenile Nonfiction , Biography & Autobiography , Music"
The Magical Math Book,"Juvenile Nonfiction , Mathematics , General"
"Backpack Books: 1,001 Facts about Rocks & Minerals (Backpack Books)","Juvenile Nonfiction , Science & Nature , Earth Sciences , Rocks & Minerals"
The Worst-Case Scenario Survival Handbook: Middle School (Worst Case Scenario Junior Editions),"Juvenile Nonfiction , Humor , General"
My Christmas Craft Book,"Juvenile Nonfiction , General"
Houghton Mifflin Invitations to Literature: Readers Watch Me Read Looking After Billy (Invitations to Literacy),"Juvenile Nonfiction , Readers , Beginner"
My Little Book About God,"Juvenile Nonfiction , Religion , General"
Rolling in the Aisles : Kids Pick the Funniest Poems,"Juvenile Nonfiction , Poetry , Humorous"
Rain Forest (Kingfisher Voyages),"Juvenile Nonfiction , Science & Nature , Trees & Forests"
150 Fun Facts Found in the Bible,"Juvenile Nonfiction , Religion , Biblical Studies"
Around the World in a Hundred Years: From Henry the Navigator to Magellan,"Juvenile Nonfiction , History , United States , General"
Garfield: The Knight in Shining Armor,"Juvenile Nonfiction , General"
Science Fun at Home,"Juvenile Nonfiction , Science & Nature , Experiments & Projects"
Extraordinary Girls,"Juvenile Nonfiction , Social Topics , General"
Poetry for Young People: Carl Sandburg,"Juvenile Nonfiction , Poetry , General"
Animal Hide-And-Seek (Bank Street Level 2),"Juvenile Nonfiction , General"
National Geographic Readers: Sharks! (Science Reader Level 2),"Juvenile Nonfiction , Readers , Beginner"
Hearing (The Senses),"Juvenile Nonfiction , General"
My Little Bible Picture Book,"Juvenile Nonfiction , Religion , General"
1000 Things You Should Know About Science,"Juvenile Nonfiction , Science & Nature , General"
1000 Things You Should Know About Wild Animals,"Juvenile Nonfiction , Animals , General"
Advanced Yo-Yo Tricks,"Juvenile Nonfiction , Sports & Recreation , General"
Being a Girl Who Serves: How to Find Your Life by Giving It Away,"Juvenile Nonfiction , Religion , Christianity"
Snakes Are Hunters (Let's-Read-and-Find-Out Science 2),"Juvenile Nonfiction , Science & Nature , General"
Animals Under Our Feet (We Both Read: Level 1),"Juvenile Nonfiction , Readers , Beginner"
"Great Adventures: Wild Ride, Buffalo Soldier, and other great stories and devos","Juvenile Nonfiction , Religion , Biblical Studies"
Baseball Bloopers,"Juvenile Nonfiction , Boys & Men"
Precious Moments: Prayers for Boys and Girls,"Juvenile Nonfiction , General"
Plains Indians Coloring Book (Dover History Coloring Book),"Juvenile Nonfiction , People & Places , United States , Native American"
Bug Dance (MathStart 1),"Juvenile Nonfiction , Mathematics , General"
Let's Go Riding,"Juvenile Nonfiction , Readers , Beginner"
Kindergarten Activities Homework Helper,"Juvenile Nonfiction , Activity Books , General"
Young Readers Christian Library: Peter,"Juvenile Nonfiction , Biography & Autobiography , Religious"
Look! The Ultimate Spot the Difference Book,"Juvenile Nonfiction , General"
Houghton Mifflin Reading: The Nation's Choice: On My Way Practice Readers Theme 3 Grade 1 Mack,"Juvenile Nonfiction , Language Arts , General"
The Big Book of Bible Facts,"Juvenile Nonfiction , General"
Young Learner's Thesaurus: With Illustrations,"Juvenile Nonfiction , Reference , Thesauri"
The Kingfisher Illustrated Nature Encyclopedia,"Juvenile Nonfiction , Science & Nature , General"
DK Readers L2: Water Everywhere (DK Readers Level 2),"Juvenile Nonfiction , Science & Nature , Earth Sciences , Water (Oceans, Lakes, etc.)"
Amazing Math Puzzles,"Juvenile Nonfiction , Mathematics , General"
Bison (Our Wild World),"Juvenile Nonfiction , Animals , General"
Bugs Are Insects (Let's-Read-and-Find-Out Science 1),"Juvenile Nonfiction , Science & Nature , Biology"
Houghton Mifflin Reading the Literature Experience: Bears Dont Go to School Level C,"Juvenile Nonfiction , Literary Criticism & Collections"
My Best Book of Spaceships (The Best Book of),"Juvenile Nonfiction , Science & Nature , Astronomy"
The Day the Dinosaurs Died (I Can Read Level 2),"Juvenile Nonfiction , Science & Nature , Biology"
"Spectrum Test Prep, Grade 3","Juvenile Nonfiction , Study Aids , Test Preparation"
"Old Stormalong, the Seafaring Sailor (Folk Tales of America)","Juvenile Nonfiction , General"
Anne Frank: a photographic story of a life,"Juvenile Nonfiction , Biography & Autobiography , Historical"
Growing With Jesus:100 Daily Devotionals,"Juvenile Nonfiction , Religion , Christianity"
Aesop's Fables Coloring Book,"Juvenile Nonfiction , Activity Books"
Starting Painting (First Skills Series),"Juvenile Nonfiction , Art , Painting"
How to Draw Animals (Young Artist Series),"Juvenile Nonfiction , Art , Drawing"
What's Going On? (Emergent Reader Science; Level 1),"Juvenile Nonfiction , General"
Organic Crafts: 75 Earth-Friendly Art Activities,"Juvenile Nonfiction , Crafts & Hobbies"
"Earth-Friendly Outdoor Fun: How to Make Fabulous Games, Gardens, and Other Projects from Reusable Objects (Earth-Friendly Series)","Juvenile Nonfiction , Crafts & Hobbies"
Houghton Mifflin Invitations to Literature: Paperback Plus Imp Level 1.4 Sheep Shop (Invitations to Lit 1996),"Juvenile Nonfiction , Language Arts , General"
Atlas of Countries (First Discovery Books),"Juvenile Nonfiction , Reference , Atlases"
Snow White and the Seven Dwarfs (Disney's Wonderful World of Reading),"Juvenile Nonfiction , General"
Receiving Holy Communion: How to Make a Good Communion (Saint Joseph Beginner Series),"Juvenile Nonfiction , Religion , Christianity"
