Title,Category
The Great ABC Treasure Hunt: A Hidden Picture Alphabet Book (Time-Life Early Learning Program),"Juvenile Nonfiction , General"
Houghton Mifflin Invitations to Literature: Student Anthology Level 1.3 Share 1997 (Invitations to Lit 1997),"Juvenile Nonfiction , Language Arts , General"
Houghton Mifflin Invitations to Literature: Student Anthology Level 1.4 Surprise 1997 (Invitations to Lit 1997),"Juvenile Nonfiction , Language Arts , General"
A Shaker's Dozen,"Juvenile Nonfiction , Concepts , Counting & Numbers"
Time Exposure: A Photographic Record of the Dinosaur Age,"Juvenile Nonfiction , General"
Tools and Gadgets (Historic Communities (Paperback)),"Juvenile Nonfiction , Lifestyles , Farm & Ranch Life"
A Show of Hands: Say It in Sign Language,"Juvenile Nonfiction , General"
"Recyclopedia: Games, Science Equipment, and Crafts from Recycled Materials","Juvenile Nonfiction , Technology , General"
Phonics (Step Ahead),"Juvenile Nonfiction , Language Arts , General"
"Making Cents: Every Kid's Guide to Money : How to Make It, What to Do With It","Juvenile Nonfiction , General"
Baby Science: How Babies Really Work!,"Juvenile Nonfiction , Science & Nature , Anatomy & Physiology"
Nijinski,"Juvenile Nonfiction , General"
I'm New Here,"Juvenile Nonfiction , School & Education"
On Passover,"Juvenile Nonfiction , Holidays & Celebrations , Passover"
The Trees Stand Shining,"Juvenile Nonfiction , General"
Automobiles (History Series),"Juvenile Nonfiction , History , General"
Knights and Castles: A Nonfiction Companion to Magic Tree House #2: The Knight at Dawn (Magic Tree House (R) Fact Tracker),"Juvenile Nonfiction , History , Medieval"
"Science Fair Success Secrets: How to Win Prizes, Have Fun, and Think Like a Scientist","Juvenile Nonfiction , Science & Nature , Experiments & Projects"
The Secret Life of Food,"Juvenile Nonfiction , Cooking & Food"
D-Day: A Day That Changed America: They Fought to Free Europe from Hitler's Tyranny,"Juvenile Nonfiction , History , Military & Wars"
A New Treasury of Poetry,"Juvenile Nonfiction , General"
Who Says a Dog Goes Bow-Wow?,"Juvenile Nonfiction , General"
"Human Body (Explorer Plus, Ladybird)","Juvenile Nonfiction , Science & Nature , Biology"
Magellan: & The Exploration of South America (Great Explorer Series),"Juvenile Nonfiction , History , General"
Drake & the 16Th-Century Explorers (Great Explorer Series),"Juvenile Nonfiction , History , General"
Families (Looking at Paintings),"Juvenile Nonfiction , Art , General"
Draw Super Manga Monsters!,"Juvenile Nonfiction , Art , Cartooning"
Noah and the Ark: A Bible Spin-Me-Around Book,"Juvenile Nonfiction , General"
Math: Grade K (Premium Education Series),"Juvenile Nonfiction , Mathematics , General"
"Deadly Creatures (Explorer Plus, Ladybird)","Juvenile Nonfiction , General"
Cool Crafts for Creative Kids,"Juvenile Nonfiction , Art , General"
MY FIRST LOOK AT NOISES,"Juvenile Nonfiction , General"
The Easter Story,"Juvenile Nonfiction , Holidays & Celebrations , Easter & Lent"
So You Want to Be President? (CALDECOTT MEDAL BOOK),"Juvenile Nonfiction , People & Places , United States , General"
Baby's First Bible,"Juvenile Nonfiction , Religion , Bible Stories , General"
What to Expect When the New Baby Comes Home (What to Expect Kids),"Juvenile Nonfiction , Family , New Baby"
Aircraft (Rand Mcnally Factbooks),"Juvenile Nonfiction , Technology , General"
Introduction to Biology (Introductions Series),"Juvenile Nonfiction , Science & Nature , Biology"
Looking into Nature's Secrets,"Juvenile Nonfiction , Science & Nature , General"
Star-Spangled Crafts,"Juvenile Nonfiction , History , United States , General"
Divorce Is Not the End of the World : Zoe's And Evan's Coping Guide for Kids,"Juvenile Nonfiction , Family , Marriage & Divorce"
A Child's Alaska,"Juvenile Nonfiction , Travel"
My First Passover,"Juvenile Nonfiction , Holidays & Celebrations , Passover"
Jeff Gordon: Rainbow Warrior: Racing Back to the Front--My Memoir (Auto Racing's New Wave),"Juvenile Nonfiction , Biography & Autobiography , General"
No Pretty Pictures: A Child of War (National Book Award Finalist),"Juvenile Nonfiction , History , Military & Wars"
On Passover,"Juvenile Nonfiction , Holidays & Celebrations , Passover"
Look Closer: Pond Life,"Juvenile Nonfiction , Science & Nature , Environmental Science & Ecosystems"
"This Unhappy Country: The Turn of the Civil War, 1863","Juvenile Nonfiction , History , United States , 19th Century"
"The Everything Kids' Joke Book: Side-Splitting, Rib-Tickling Fun","Juvenile Nonfiction , Humor , Jokes & Riddles"
Cactus Hotel (Rise and Shine),"Juvenile Nonfiction , Science & Nature , Flowers & Plants"
Playtime (Treasure Hunt),"Juvenile Nonfiction , Concepts , General"
101 Things Everyone Should Know About Science,"Juvenile Nonfiction , Science & Nature , General"
Communication: Means and Technologies for Exchanging Information,"Juvenile Nonfiction , General"
Behind the Secret Window,"Juvenile Nonfiction , History , Holocaust"
Ride a Purple Pelican,"Juvenile Nonfiction , People & Places , United States , General"
Strawberry Shortcake's Berry Best Gardening Book,"Juvenile Nonfiction , Gardening"
Smart About the First Ladies: Smart About History,"Juvenile Nonfiction , History , United States , General"
"Civil War Sub: the Mystery of the Hunley: The Mystery of the Hunley (Penguin Young Readers, Level 4)","Juvenile Nonfiction , Social Science , Archaeology"
Reading Comprehension Grade 1 (Learn on the Go),"Juvenile Nonfiction , Language Arts , General"
"Wagon Train (Rise and Shine) (Penguin Young Readers, Level 3)","Juvenile Nonfiction , History , United States , 19th Century"
Language Arts Grade 1: Build Learning Skills (Premium Education Series),"Juvenile Nonfiction , Language Arts , General"
Anne Frank: Beyond the Diary - A Photographic Remembrance,"Juvenile Nonfiction , History , Holocaust"
Who's That Stepping on Plymouth Rock?,"Juvenile Nonfiction , History , United States , Colonial & Revolutionary Periods"
Dora the Explorer Safety (Wipe-Off Workbook),"Juvenile Nonfiction , Activity Books"
Skills for Kindergarten (Parents Magazine),"Juvenile Nonfiction , Concepts , General"
Time for Kids: World Atlas,"Juvenile Nonfiction , Reference , Atlases"
Ashanti to Zulu: African Traditions (Picture Puffin Books),"Juvenile Nonfiction , People & Places , United States , African American"
George Washington Carver: The Peanut Wizard (Smart About History),"Juvenile Nonfiction , Biography & Autobiography , Science & Technology"
Archaeology: The Usborne Young Scientist,"Juvenile Nonfiction , Science & Nature , General"
The Secret Life of Food,"Juvenile Nonfiction , Cooking & Food"
Biggest Riddle Book in the World,"Juvenile Nonfiction , Humor , Jokes & Riddles"
Leon's Story (Sunburst Books),"Juvenile Nonfiction , Biography & Autobiography , Cultural Heritage"
Scott Foresman Intermediate Dictionary,"Juvenile Nonfiction , General"
Mother Goose Magic,"Juvenile Nonfiction , General"
Doubleday Illustrated Children's Bible,"Juvenile Nonfiction , General"
What to Expect When the Babysitter Comes (What to Expect Kids),"Juvenile Nonfiction , Family , General"
Tomorrow Is a Brand New Day,"Juvenile Nonfiction , General"
The Book of Jesus for Families,"Juvenile Nonfiction , Religion , Christianity"
Chipmunks/Beavers (Getting to Know Nature's Children Series),"Juvenile Nonfiction , General"
Brontosaurus (Dinosaur Lib Series),"Juvenile Nonfiction , General"
Archaeopteryx (Dinosaur Lib Series),"Juvenile Nonfiction , Animals , Dinosaurs & Prehistoric Creatures"
Allosaurus (Dinosaur Lib Series),"Juvenile Nonfiction , General"
The Long Haired Girl: A Chinese Legend,"Juvenile Nonfiction , General"
Growing and changing: a handbook for preteens,"Juvenile Nonfiction , Health & Daily Living , Maturing"
What's Happening to My Body?: Book for Girls a Growing Up Guide for Parents and Daughters,"Juvenile Nonfiction , General"
Children's Letters to God,"Juvenile Nonfiction , Religion , General"
Diplodocus (Dinosaur Lib Series),"Juvenile Nonfiction , General"
Corythosaurus (Dinosaur Library),"Juvenile Nonfiction , General"
The Strength of the Hills: A Portrait of a Family Farm,"Juvenile Nonfiction , General"
Seashores (Nature Club),"Juvenile Nonfiction , General"
Guppies in Tuxedos: Funny Eponyms,"Juvenile Nonfiction , Language Arts , General"
"Don't Do That!: A Child's Guide to Bad Manners, Ridiculous Rules, and Inadequate Etiquette (Rainbow Morning Music Picture Books)","Juvenile Nonfiction , Social Topics , Manners & Etiquette"
"The Truth Behind A Series of Unfortunate Events: Eyeballs, Leeches, Hypnotism and Orphans --- Exploring Lemony Snicket's World","Juvenile Nonfiction , Reference , General"
P.B. Bear Sticker Activity Book: Shopping,"Juvenile Nonfiction , Readers , Beginner"
Projects for a Healthy Planet: Simple Environmental Experiments for Kids,"Juvenile Nonfiction , Science & Nature , Experiments & Projects"
On the Day You Were Born,"Juvenile Nonfiction , Science & Nature , General"
Noah's Ark,"Juvenile Nonfiction , Religion , Christianity"
Noah's Aardvark,"Juvenile Nonfiction , Religion , Biblical Studies"
Chipmunk Song,"Juvenile Nonfiction , General"
Cal Ripken Jr: Count Me In,"Juvenile Nonfiction , Sports & Recreation , Baseball & Softball"
The Black Hat Dances: Two Buddhist Boys in the Himalayas,"Juvenile Nonfiction , General"
My Little Golden Book About God,"Juvenile Nonfiction , Religion , Biblical Studies"
Intriguing Lateral Thinking Puzzles,"Juvenile Nonfiction , Games & Activities , Puzzles"
Prayers and Graces (Illustrated Library for Child.),"Juvenile Nonfiction , Religion , General"
MY CLOTHES (Small World Word Books),"Juvenile Nonfiction , General"
From Flower to Flower Ani & PO,"Juvenile Nonfiction , General"
The Supreme Court (Government of People),"Juvenile Nonfiction , General"
"The Everything Kids' Puzzle Book: Mazes, Word Games, Puzzles & More! Hours of Fun!","Juvenile Nonfiction , Activity Books , General"
Portraits of War: Civil War Photographers and Their Work,"Juvenile Nonfiction , History , United States , 19th Century"
Campaigns and Elections (Ballots and Bandwagons),"Juvenile Nonfiction , General"
Pride of Puerto Rico: The Life of Roberto Clemente,"Juvenile Nonfiction , Sports & Recreation , Baseball & Softball"
A Child's Organic Garden,"Juvenile Nonfiction , Technology , Agriculture"
A Day in a Life of a Police Officer (Level 1: Beginning to Read),"Juvenile Nonfiction , Art , General"
Joyful Noise: Poems for Two Voices,"Juvenile Nonfiction , Poetry , General"
The Hero's Trail: A Guide for a Heroic Life,"Juvenile Nonfiction , Biography & Autobiography , General"
Three Clever Mice: Folktales,"Juvenile Nonfiction , General"
Polly Vaughn: A Traditional British Ballad,"Juvenile Nonfiction , General"
Anatosaurus (Dinosaur Library),"Juvenile Nonfiction , General"
"Fireworks, Picnics and Flags","Juvenile Nonfiction , Holidays & Celebrations , General"
"Where Do You Think You're Going, Christopher Columbus?","Juvenile Nonfiction , Science & Nature , Discoveries"
J. K. Rowling: The Wizard Behind Harry Potter,"Juvenile Nonfiction , Reference , General"
Little Visits Every Day,"Juvenile Nonfiction , Religion , Biblical Studies"
"WHY DONT YOU GET A HORSE, SAM ADAMS? (PAPERBACK) 1996 PUFFIN","Juvenile Nonfiction , History , United States , Colonial & Revolutionary Periods"
Laugh-eteria,"Juvenile Nonfiction , Art , General"
I Wanted to Know All about God,"Juvenile Nonfiction , Religion , General"
The Dinosaur Encyclopedia,"Juvenile Nonfiction , Reference , Encyclopedias"
The Random House Book of How Things Work,"Juvenile Nonfiction , General"
"Religion, Science, Medicine & Warfare (Illustrated Encyclopedia)","Juvenile Nonfiction , History , Modern"
Pin the Tail On the Donkey and Other Party Games,"Juvenile Nonfiction , General"
"Does a Kangaroo Have a Mother, Too?","Juvenile Nonfiction , Animals , General"
Soccer Skills For Young Players,"Juvenile Nonfiction , Sports & Recreation , Soccer"
DK Readers: Jobs People Do -- A Day in a Life of a Teacher (Level 1: Beginning to Read) (DK Readers Level 1),"Juvenile Nonfiction , Readers , Beginner"
North American Indians,"Juvenile Nonfiction , General"
"Land of Yesterday, Land of Tomorrow: 9","Juvenile Nonfiction , General"
Dinosaurs and Other Archosaurs (Random House Lib Knowledge(TM)),"Juvenile Nonfiction , Social Science , Archaeology"
A Kid's Guide to the White House: Is George Washington Upstairs?,"Juvenile Nonfiction , History , United States , General"
Informania: Aliens,"Juvenile Nonfiction , Technology , Aeronautics, Astronautics & Space Science"
Penguins (Eyes on Nature),"Juvenile Nonfiction , General"
The Littlest Dinosaurs,"Juvenile Nonfiction , Animals , Dinosaurs & Prehistoric Creatures"
Amazing Aircraft: See More Readers Level 2,"Juvenile Nonfiction , Readers , Beginner"
Pooh's Little Etiquette Book,"Juvenile Nonfiction , Social Topics , Manners & Etiquette"
Little People: Big Book About the Sea                                                     Activity Book About the Sea,"Juvenile Nonfiction , General"
How to Do Your Best on Tests (School Survival Guide),"Juvenile Nonfiction , Reference , General"
The Care and Keeping of Friends (American Girl Library),"Juvenile Nonfiction , Social Topics , Friendship"
Wild Bears -Level 1 (See More Readers),"Juvenile Nonfiction , Science & Nature , Anatomy & Physiology"
My First Book of Sign,"Juvenile Nonfiction , Concepts , General"
Exploring the Night Sky: The Equinox Astronomy Guide for Beginners,"Juvenile Nonfiction , Science & Nature , Astronomy"
Hand Shadows and More Hand Shadows (Dover Children's Activity Books),"Juvenile Nonfiction , Games & Activities , General"
Putting on the Brakes: Young People's Guide to Understanding Attention Deficit Hyperactivity Disorder,"Juvenile Nonfiction , Social Topics , Special Needs"
New York's Bravest,"Juvenile Nonfiction , History , United States , 19th Century"
The Young Musician's Survival Guide: Tips from Teens & Pros,"Juvenile Nonfiction , Music , Instruction & Study"
DK Biography Abraham Lincoln: A Photographic Story of a Life,"Juvenile Nonfiction , Biography & Autobiography , Political"
Escape to Freedom: The Underground Railroad Adventures of Callie and William (I Am American),"Juvenile Nonfiction , People & Places , United States , African American"
"Hurry, Hurry!: Matthew 21:1-11 (Jesus Enters Jerusalem) (Hear Me Read Level 1 Series)","Juvenile Nonfiction , Holidays & Celebrations , Easter & Lent"
When We Went to the Zoo,"Juvenile Nonfiction , General"
I Spy Mystery: A Book of Picture Riddles,"Juvenile Nonfiction , Games & Activities , Puzzles"
The Aircraft Encyclopedia,"Juvenile Nonfiction , Transportation , Aviation"
The Roald Dahl Quiz Book,"Juvenile Nonfiction , Reference , General"
Exploring Space,"Juvenile Nonfiction , Language Arts , General"
Mother Goose On the Loose,"Juvenile Nonfiction , Humor , Comic Strips & Cartoons"
The Tea Party Book,"Juvenile Nonfiction , General"
"Baseball's Boneheads, Bad Boys, and Just Plain Crazy Guys","Juvenile Nonfiction , Humor , General"
Little Visits for Families,"Juvenile Nonfiction , Religion , General"
Your Pet Dinosaur: An Owner's Manual,"Juvenile Nonfiction , General"
The Night Sky Book: An Everyday Guide to Every Night,"Juvenile Nonfiction , General"
National Geographic United States Atlas for Young Explorers (New Millennium),"Juvenile Nonfiction , Reference , Atlases"
Exploring the Sky by Day: The Equinox Guide to Weather and the Atmosphere,"Juvenile Nonfiction , Science & Nature , Earth Sciences , Weather"
"What Little Girls Are Made Of: Sugar, Spice, and Everything Nice","Juvenile Nonfiction , Poetry , General"
Knights and Armor Coloring Book (Dover Fashion Coloring Book),"Juvenile Nonfiction , History , Medieval"
The Bug Book,"Juvenile Nonfiction , Science & Nature , General"
William Wegman: Puppies,"Juvenile Nonfiction , Animals , Dogs"
A Treasury of Tips to Amuse a Child,"Juvenile Nonfiction , General"
The Ragged Peddlar: Flavia's Dream Maker Stories #4 (A Dream Maker Story),"Juvenile Nonfiction , Social Science , General"
"Write Source 2000 a Guide to Writing, Thinking, & Learning: A Guide to Writing, Thinking & Learning","Juvenile Nonfiction , Language Arts , Composition & Creative Writing"
Mammals and Their Milk,"Juvenile Nonfiction , General"
Dinosaurs Are Different (Let's Read-And-Find-Out Science),"Juvenile Nonfiction , General"
"Math, Grade 2 (Skill Builder Workbooks)","Juvenile Nonfiction , Mathematics , General"
"Amazing Animals: The Fastest, Heaviest, Smallest, Largest, Fiercest, and Funniest","Juvenile Nonfiction , Animals , General"
Yours Till Banana Splits: 201 Autograph Rhymes,"Juvenile Nonfiction , General"
The Prayer Of Jabez Devotions For Kids Living Big For God,"Juvenile Nonfiction , Religion , Christianity"
Prehistoric Animals,"Juvenile Nonfiction , General"
"Apples, How They Grow","Juvenile Nonfiction , General"
I Want To Be A Firefighter,"Juvenile Nonfiction , Readers , Beginner"
Noises from Under the Rug: A Songbook and More,"Juvenile Nonfiction , Music , Songbooks"
Super-Completely and Totally the Messiest,"Juvenile Nonfiction , Family , Siblings"
Artists of Handcrafted Furniture at Work,"Juvenile Nonfiction , General"
Mothers Are Forever: Quotations Honoring the Wisest Women We Know,"Juvenile Nonfiction , Family , Parents"
Comeback! Four True Stories (Step into Reading),"Juvenile Nonfiction , General"
The Catholic Children's Bible,"Juvenile Nonfiction , Religion , Bible Stories , General"
The Ultimate Disney Joke Book,"Juvenile Nonfiction , Humor , Jokes & Riddles"
My First Pocket Guide Seashore Life (National Geographic My First Pocket Guides),"Juvenile Nonfiction , Science & Nature , Earth Sciences , Water (Oceans, Lakes, etc.)"
What Is God?,"Juvenile Nonfiction , Religion , General"
Deserts (Where Are You?),"Juvenile Nonfiction , General"
Pilgrims of Plymouth (Rise and Shine),"Juvenile Nonfiction , Language Arts , General"
National Geographic My First Pocket Guides: Weather,"Juvenile Nonfiction , Science & Nature , Earth Sciences , Weather"
The Middle Ages,"Juvenile Nonfiction , Activity Books"
Beyond the Lemonade Stand,"Juvenile Nonfiction , Business & Economics"
I Spy Fun House: A Book of Picture Riddles,"Juvenile Nonfiction , Games & Activities , Puzzles"
Behold: Spot the Difference Bible Stories,"Juvenile Nonfiction , General"
This Is Our Seder,"Juvenile Nonfiction , Holidays & Celebrations , Other, Religious"
Tales of Virtue: A Book of Right and Wrong (The Beginners Bible),"Juvenile Nonfiction , General"
All About Trees (Question and Answer Book),"Juvenile Nonfiction , General"
Reading Comprehension Gr. 3 (Learn on the Go),"Juvenile Nonfiction , Language Arts , General"
Precious Moments Bible Classics : Stories from the New Testament,"Juvenile Nonfiction , Religion , Christianity"
The Last of the Mohicans (Great Illustrated Classics),"Juvenile Nonfiction , Antiques & Collectibles"
D Is for Dreidel,"Juvenile Nonfiction , Holidays & Celebrations , Hanukkah"
Sing a New Song: A Book of Psalms,"Juvenile Nonfiction , Religion , Bible Stories , General"
The Prayer Of Jabez For Little Ones,"Juvenile Nonfiction , Religion , Christianity"
Abe Lincoln and the Muddy Pig,"Juvenile Nonfiction , Biography & Autobiography , Historical"
"The Girls' Book of Friendship: Cool Quotes, True Stories, Secrets and More","Juvenile Nonfiction , Girls & Women"
Lootas Little Wave Eater: An Orphaned Sea Otter's Story,"Juvenile Nonfiction , Animals , Marine Life"
Amazing Athlete #4: Girls on Blades (Look-Look),"Juvenile Nonfiction , Sports & Recreation , General"
Entertaining Science Experiments with Everyday Objects,"Juvenile Nonfiction , Science & Nature , Experiments & Projects"
Disney Picture Dictionary (Disney Learning),"Juvenile Nonfiction , Reference , Dictionaries"
"Chicken Soup for the Kid's Soul: 101 Stories of Courage, Hope and Laughter (Chicken Soup for the Soul)","Juvenile Nonfiction , Social Science , Sociology"
Rhinoceros Tap: And 14 Other Seriously Silly Songs,"Juvenile Nonfiction , Music , Songbooks"
A Boy at War: A Novel of Pearl Harbor,"Juvenile Nonfiction , Adventure & Adventurers"
"A Stranger Thief and a Pack of Lies, A (2:52 / Mysteries of Eckert House)","Juvenile Nonfiction , Religion , Christianity"
Princess Sonora and the Long Sleep (Princess Tales),"Juvenile Nonfiction , Social Science , Folklore & Mythology"
I Spy Fantasy: A Book of Picture Riddles,"Juvenile Nonfiction , Games & Activities , Puzzles"
Easy-to-Do Card Tricks for Children (Become a Magician),"Juvenile Nonfiction , Games & Activities , General"
How to Draw Cats (Dover How to Draw),"Juvenile Nonfiction , Games & Activities , General"
Inside Noah's Ark,"Juvenile Nonfiction , Religion , Bible Stories , General"
The New Big Book Of U.s. Presidents,"Juvenile Nonfiction , History , United States , State & Local"
The Gas We Pass: The Story of Farts,"Juvenile Nonfiction , Health & Daily Living , General"
Rider in the Sky: How an American Cowboy Built England's First Airplane,"Juvenile Nonfiction , Biography & Autobiography , General"
The Hanukkah Family Treasury,"Juvenile Nonfiction , Holidays & Celebrations , Hanukkah"
Disney's Beauty and the Beast (Little Golden Book),"Juvenile Nonfiction , General"
The American House Styles of Architecture Coloring Book (Dover History Coloring Book),"Juvenile Nonfiction , Architecture"
My Baptism Book,"Juvenile Nonfiction , Religious , Christian , Devotional & Prayer"
The Merry Adventures of Robin Hood,"Juvenile Nonfiction , Antiques & Collectibles"
The Arabs In The Golden Age (Peoples of the Past),"Juvenile Nonfiction , People & Places , Middle East"
Looking Back: A Book of Memories,"Juvenile Nonfiction , Biography & Autobiography , Literary"
"A History of US: Book 6: War, Terrible War (1860-1865) (A History of US, 6)","Juvenile Nonfiction , History , United States , 19th Century"
God's Paintbrush,"Juvenile Nonfiction , Religion , General"
Stories of the Flood,"Juvenile Nonfiction , Literary Criticism & Collections"
In the Attic,"Juvenile Nonfiction , Activity Books"
North American Indian Design Coloring Book (Dover Native American Coloring Books),"Juvenile Nonfiction , People & Places , United States , Native American"
"A History of US: Book 8: An Age of Extremes (1870-1917) (A History of US, 8)","Juvenile Nonfiction , History , United States , 20th Century"
The Adventures of Rama: With Illustrations from a Sixteenth-Century Mughal Manuscript,"Juvenile Nonfiction , General"
Creatures of the Desert World,"Juvenile Nonfiction , Animals , General"
175 Science Experiments to Amuse and Amaze Your Friends,"Juvenile Nonfiction , General"
Boitano's Edge: Inside The Real World Of Figure Skating,"Juvenile Nonfiction , Sports & Recreation , Winter Sports"
In God's Name,"Juvenile Nonfiction , Religion , General"
Booktalk: Occasional Writing on Literature and Children,"Juvenile Nonfiction , General"
Cats Are Cats,"Juvenile Nonfiction , General"
Great Masks to Make,"Juvenile Nonfiction , General"
My First Bible (Lap Library),"Juvenile Nonfiction , General"
Other Worlds: A Beginners Guide to Planets and Moons,"Juvenile Nonfiction , Technology , Aeronautics, Astronautics & Space Science"
Science Wizardry for Kids,"Juvenile Nonfiction , Science & Nature , Experiments & Projects"
Geography For Fun Projects,"Juvenile Nonfiction , Science & Nature , General"
Awesome Jokes,"Juvenile Nonfiction , Humor , Jokes & Riddles"
Rhinoceros Tap: 15 Seriously Silly Songs,"Juvenile Nonfiction , Music , Songbooks"
A Young Patriot: The American Revolution as Experienced by One Boy,"Juvenile Nonfiction , History , United States , Colonial & Revolutionary Periods"
How a Book Is Made (Reading Rainbow Book),"Juvenile Nonfiction , Art , General"
Indian Sign Language (Native American),"Juvenile Nonfiction , Games & Activities , General"
Writing a Research Paper: A Step-By-Step Approach,"Juvenile Nonfiction , Language Arts , General"
Chesapeake 1-2-3,"Juvenile Nonfiction , Concepts , Counting & Numbers"
The Best Book of Wolves and Wild Dogs,"Juvenile Nonfiction , Animals , Foxes"
A Smart Girl's Guide to Boys,"Juvenile Nonfiction , Social Topics , Friendship"
175 More Science Experiments to Amuse and Amaze Your Friends,"Juvenile Nonfiction , General"
The First American Revolution: The American Colonies on the Eve of Independence,"Juvenile Nonfiction , History , United States , Colonial & Revolutionary Periods"
The Super Joke Book,"Juvenile Nonfiction , Humor , Jokes & Riddles"
Best Riddle Book Ever,"Juvenile Nonfiction , Humor , Jokes & Riddles"
"This House Is Made of Mud/Esta Casa Esta hecha de lodo (Rise and Shine) (English, Multilingual and Spanish Edition)","Juvenile Nonfiction , Foreign Language Study , Spanish"
Dinosaur and Other Prehistoric Animal Fact Finder,"Juvenile Nonfiction , Animals , Dinosaurs & Prehistoric Creatures"
Insects: At Your Fingertips (At Your Fingertips Series/Boards),"Juvenile Nonfiction , General"
Ancient Egpyt (Eyewitness),"Juvenile Nonfiction , History , Middle East"
Little People Big Book About Animals,"Juvenile Nonfiction , General"
Eric Carle's Opposites (The World of Eric Carle),"Juvenile Nonfiction , Concepts , Opposites"
"Salem Days, Life in a Colonial Seaport (Adventures in Colonial America)","Juvenile Nonfiction , General"
"Good Sports: Winning, Losing, and Everything in Between (American Girl Library)","Juvenile Nonfiction , General"
The Landing of the Pilgrims (Landmark Books),"Juvenile Nonfiction , History , United States , General"
"Wild, Wild Wolves (Step into Reading)","Juvenile Nonfiction , Science & Nature , Zoology"
After Columbus: The Horse's Return to America (Smithsonian Wil Heritage Collection),"Juvenile Nonfiction , General"
