Title,Category
The Master of Disguise: My Secret Life in the CIA,"Political Science , Intelligence & Espionage"
The Record of the Paper: How the New York Times Misreports US Foreign Policy,"Political Science , International Relations , General"
The Successor States to the USSR,"Political Science , General"
"The American Presidency, 1945-2000: Illusions of Grandeur","Political Science , Political Process , General"
The Challenge of Third World Development (2nd Edition),"Political Science , Political Economy"
Organizing the Presidency,"Political Science , Public Affairs & Administration"
"A Moment of Crisis: Jimmy Carter, The Power of a Peacemaker, and North Korea's Nuclear Ambitions","Political Science , International Relations , Diplomacy"
When You Ride Alone You Ride with Bin Laden: What the Government Should Be Telling Us to Help Fight the War on Terrorism,"Political Science , Political Freedom & Security , Terrorism"
"The Woman at the Washington Zoo: Writings on Politics, Family, and Fate","Political Science , Essays"
Weapons of Mass Distortion: The Coming Meltdown of the Liberal Media,"Political Science , International Relations , Arms Control"
Count Us in: Growing Up With Down Syndrome,"Political Science , General"
Friendly Fire: Losing Friends and Making Enemies in the Anti-American Century,"Political Science , International Relations , General"
11-Sep,"Political Science , International Relations , General"
"Way Out There in the Blue: Reagan, Star Wars and the End of the Cold War","Political Science , History & Theory"
Gag Rule: On the Suppression of Dissent and Stifling of Democracy,"Political Science , Civil Rights"
"Eyewitness to Power: The Essence of Leadership, Nixon to Clinton","Political Science , Political Process , General"
Presidential War Power,"Political Science , Security (National & International)"
Life as We Have Known It,"Political Science , Labor & Industrial Relations"
On the Meaning of Victory: Essays on Strategy,"Political Science , General"
Running The World: the Inside Story of the National Security Council and the Architects of American Power,"Political Science , International Relations , General"
Land Banking (Johns Hopkins Studies in Urban Affairs Series),"Political Science , General"
Deficit Dilemma: Budget Policy in the Reagan Era (The Changing Domestic Priorities Series),"Political Science , General"
Ozone Diplomacy: New Directions in Safeguarding the Planet,"Political Science , General"
The Opportunity,"Political Science , Reference"
The Oxford Companion to Politics of the World,"Political Science , International Relations , General"
Marching Toward the 21st Century: Military Manpower and Recruiting (Contributions in Military Studies),"Political Science , International Relations , Arms Control"
Political Ethics and Public Office,"Political Science , Public Affairs & Administration"
Every Kid Counts: 31 Ways to Save Our Children,"Political Science , General"
Homeland,"Political Science , Terrorism"
"The Changing Soviet Navy, a Staff Paper","Political Science , General"
"The Bush Agenda: Invading the World, One Economy at a Time","Political Science , Public Policy , Economic Policy"
"In Conflict: Iraq War Veterans Speak Out on Duty, Loss, and the Fight to Stay Alive","Political Science , Peace"
Bushwhacked: Life in George W. Bush's America,"Political Science , American Government , Executive Branch"
American Jihad: The Terrorists Living Among Us,"Political Science , Political Freedom & Security , Terrorism"
A Child Shall Lead Them: Lessons About Hope from Children With Cancer,"Political Science , General"
Treason: Liberal Treachery from the Cold War to the War on Terrorism,"Political Science , Political Process , Political Parties"
"Democracy in America, Volume 1 (Vintage Classics)","Political Science , Political Ideologies , Democracy"
"Democracy in America, Volume 2 (Vintage Classics)","Political Science , Political Ideologies , Democracy"
Adams vs. Jefferson: The Tumultuous Election of 1800 (Pivotal Moments in American History Series),"Political Science , Political Process , Campaigns & Elections"
Brainless: The Lies and Lunacy of Ann Coulter,"Political Science , Political Ideologies , Conservatism & Liberalism"
What's the Matter with Kansas? How Conservatives Won the Heart of America,"Political Science , Political Ideologies , Conservatism & Liberalism"
Tales from the Left Coast: True Stories of Hollywood Stars and Their Outrageous Politics,"Political Science , General"
In Defense of Our America: The Fight for Civil Liberties in the Age of Terror,"Political Science , History & Theory"
"THE REVOLUTION WILL NOT BE TELEVISED: Democracy, the Internet, and the Overthrow of Everything","Political Science , Political Process , Campaigns & Elections"
Mavericks of the Sky: The First Daring Pilots of the U.S. Air Mail,"Political Science , American Government , National"
"The Accidental President: How 413 Lawyers, 9 Supreme Court Justices, and 5,963,110 Floridians (Give or Take a Few) Landed George W. Bush in the White House","Political Science , Political Process , Campaigns & Elections"
Night Draws Near: Iraq's People in the Shadow of America's War,"Political Science , Political Freedom"
Javits: The Autobiography of a Public Man,"Political Science , General"
The Missing Peace: The Inside Story of the Fight for Middle East Peace,"Political Science , International Relations , General"
Power Plays: Win or Lose--How History's Great Political Leaders Play the Game,"Political Science , Political Process , Political Parties"
"Women, Resistance & Revolution: A History of Women and Revolution in the Modern World","Political Science , General"
The Hunt for Bin Laden: Task Force Dagger,"Political Science , General"
Bushwhacked: Life in George W. Bush's America,"Political Science , General"
Wilsonian Statecraft: Theory and Practice of Liberal Internationalism During World War I (America in the Modern World) (American In Modern World),"Political Science , International Relations , Diplomacy"
The Next Attack: The Failure of the War on Terror and a Strategy for Getting it Right,"Political Science , Terrorism"
"The Puzzle Palace: Inside the National Security Agency, America's Most Secret Intelligence Organization","Political Science , Intelligence & Espionage"
Watchdogs of Democracy?: The Waning Washington Press Corps and How It Has Failed the Public,"Political Science , Political Ideologies , Democracy"
Friends in Deed: Inside the U.S.- Israel Alliance,"Political Science , General"
The Fourth Power: A Grand Strategy for the United States in the Twenty-First Century,"Political Science , International Relations , General"
"American Theocracy: The Peril and Politics of Radical Religion, Oil, and Borrowed Money in the 21st Century","Political Science , Political Ideologies , Conservatism & Liberalism"
The Corruption of American Politics: What Went Wrong and Why,"Political Science , American Government , General"
"When I Was a Kid, This Was a Free Country","Political Science , Civil Rights"
American Ally: Tony Blair and the War on Terror,"Political Science , International Relations , General"
Strike From the Sky: Israeli Airborne Troops,"Political Science , General"
Speaker: Lessons from Forty Years in Coaching and Politics,"Political Science , American Government , Legislative Branch"
Three Billion New Capitalists: The Great Shift of Wealth and Power to the East,"Political Science , Public Policy , Economic Policy"
Slouching Towards Gomorrah,"Political Science , General"
"Domestic Presidency, The: Policy-Making in the White House","Political Science , Political Process , General"
Sneaking Into the Flying Circus: How the Media Turn Our Presidential Campaigns into Freak Shows,"Political Science , Political Ideologies , Democracy"
Terrorism and the Media,"Political Science , Terrorism"
Whistling Past Dixie: How Democrats Can Win Without the South,"Political Science , Political Process , Political Parties"
The Battle for Peace: A Frontline Vision of America's Power and Purpose,"Political Science , International Relations , General"
Politics Lost: How American Democracy Was Trivialized By People Who Think You're Stupid,"Political Science , Political Process , Campaigns & Elections"
"The Savage Nation: Saving America from the Liberal Assault on Our Borders, Language and Culture","Political Science , History & Theory"
Preventive Diplomacy: Stopping Wars Before They Start,"Political Science , International Relations , Arms Control"
Conservatives Without Conscience,"Political Science , Political Process , Political Parties"
Will They Ever Trust Us Again?: Letters From the War Zone,"Political Science , Reference"
Winning Right: Campaign Politics and Conservative Policies,"Political Science , Political Process , Political Parties"
"I Die, but My Memory Lives on: The World AIDS Crisis and the Memory Book Project","Political Science , General"
Mass Hate: The Global Rise of Genocide and Terror (Revised and Updated),"Political Science , Terrorism"
"Command of Office: How War, Secrecy, and Deception Transformed the Presidency, from Theodore Roosevelt to George W. Bush","Political Science , International Relations , General"
"The Woman at the Washington Zoo: Writings on Politics, Family, and Fate","Political Science , Essays"
The Price Of Government: Getting the Results We Need in an Age of Permanent Fiscal Crisis,"Political Science , Public Policy , Economic Policy"
Liberty Under Attack: Reclaiming Our Freedoms in an Age of Terror,"Political Science , Political Freedom & Security , Civil Rights"
REAL WAR (Richard Nixon Library Editions),"Political Science , General"
The President of Good and Evil: The Ethics of George W. Bush,"Political Science , General"
The Age of Fallibility: Consequences of the War on Terror,"Political Science , Terrorism"
Looking Back on the Reagan Presidency,"Political Science , American Government , General"
Disinformation : 22 Media Myths That Undermine the War on Terror,"Political Science , Terrorism"
In Our Own Words: Extraordinary Speeches of the American Century,"Political Science , History & Theory"
The Real Deal: The History and Future of Social Security,"Political Science , Public Policy , Social Security"
Man in the Shadows: Inside the Middle East Crisis with a Man Who Led the Mossad,"Political Science , Intelligence & Espionage"
Before the Fall : An Inside View of the Pre-Watergate White House,"Political Science , Government , General"
"Back In Action: An American Soldier's Story Of Courage, Faith And Fortitude","Political Science , International Relations , General"
Eastern Europe - Pa,"Political Science , General"
"Blessed Assurance: At Home with the Bomb in Amarillo, Texas","Political Science , International Relations , Arms Control"
Blackbeard the Pirate: A Reappraisal of His Life and Times,"Political Science , General"
"First Call: The Making of the Modern U.S. Military, 1945-1953","Political Science , General"
The Politics of Deceit: Saving Freedom and Democracy from Extinction,"Political Science , American Government , General"
Under God: Religion and American Politics,"Political Science , American Government , General"
"Curveball: Spies, Lies, and the Con Man Who Caused a War","Political Science , Intelligence & Espionage"
The Lexus and the Olive Tree,"Political Science , Political Economy"
A Brighter Tomorrow: Fulfilling the Promise of Nuclear Energy,"Political Science , Public Policy , General"
"Guns, Crime, and Freedom","Political Science , General"
"Crashing the Gate: Netroots, Grassroots, and the Rise of People-Powered Politics","Political Science , Political Process , Political Parties"
"Bone to Pick: Of Forgiveness, Reconciliation, Reparation, and Revenge","Political Science , General"
Why Terrorism Works: Understanding the Threat Responding to the Challenge,"Political Science , Security (National & International)"
The One Percent Doctrine: Deep Inside America's Pursuit of Its Enemies Since 9/11,"Political Science , Terrorism"
"All the President's Spin: George W. Bush, the Media, and the Truth","Political Science , Political Process , Campaigns & Elections"
Day of Reckoning: The Consequences of American Economic Policy,"Political Science , General"
The Case for Goliath: How America Acts as the World's Government in the Twenty-First Century,"Political Science , International Relations , General"
"The L Word: An Unapologetic, Thoroughly Biased, Long-Overdue Explication and Celebration of Liberalism","Political Science , General"
Thunder on the Left: An Insider's Report on the Hijacking of the Democratic Party,"Political Science , General"
"Pacific Defense: Arms, Energy, and America's Future in Asia","Political Science , General"
The Right to Privacy,"Political Science , Constitutions"
The Lexus and the Olive Tree: Understanding Globalization,"Political Science , Political Economy"
God Has Ninety-Nine Names: A Reporter's Journey Through a Militant Middle East,"Political Science , General"
On Power and Ideology: The Managua Lectures,"Political Science , Political Ideologies , General"
Broken Covenant: American Foreign Policy and the Crisis Between the U.S. and Israel,"Political Science , General"
Great True Spy Stories,"Political Science , General"
Let Go and Grow: Recovery for Adult Children of Alcoholics,"Political Science , General"
Plagues and Politics,"Political Science , General"
Countdown to Terror: The Top-Secret Information that Could Prevent the Next Terrorist Attack on America--and How the CIA Has Ignored It,"Political Science , Security (National & International)"
The Starr Report: The Findings of Independent Counsel Kenneth W. Starr on President Clinton and the Lewinsky Affair,"Political Science , Reference"
Does America Need a Foreign Policy? : Toward a Diplomacy for the 21st Century,"Political Science , International Relations , General"
The House and Senate Explained: The People's Guide to Congress (Wiley Series in Environmental Quality),"Political Science , American Government , Legislative Branch"
An Introduction to Legal Reasoning,"Political Science , General"
Living the Bill of Rights: How to Be an Authentic American,"Political Science , Constitutions"
Not for Ourselves Alone: The Story of Elizabeth Cady Stanton and Susan B. Anthony,"Political Science , Civil Rights"
Chindia: How China and India Are Revolutionizing Global Business,"Political Science , Political Economy"
"Bringing Down The Great Wall: Writings on Science, Culture and Democracy in China","Political Science , International Relations , General"
"The O'Reilly Factor: The Good, the Bad, and the Completely Ridiculous in American Life","Political Science , Political Process , Political Parties"
Real Peace,"Political Science , General"
"The Greatest Threat: Iraq, Weapons of Mass Destruction and the Growing Crisis in Global Security","Political Science , Security (National & International)"
"My FBI: Bringing Down the Mafia, Investigating Bill Clinton, and Fighting the War on Terror","Political Science , Intelligence & Espionage"
"War in a Time of Peace: Bush, Clinton, and the Generals","Political Science , Peace"
Slander: Liberal Lies About the American Right,"Political Science , Political Process , Political Parties"
The Language of Nuclear War: An Intelligent Citizen's Dictionary,"Political Science , General"
Just And Unjust Wars: Incorporating The Lessons Of Operation Desert Storm,"Political Science , History & Theory"
Union Voices: Labor's Responses to Crisis (S U N Y Series in the Anthropolgy of Work),"Political Science , Labor & Industrial Relations"
Report from Ground Zero: The Story of the Rescue Efforts at the World Trade Center,"Political Science , Terrorism"
Thirty Days: Tony Blair and the Test of History,"Political Science , International Relations , Diplomacy"
Unbridled Power: Inside the Secret Culture of the IRS,"Political Science , Political Process , General"
"Arrogant Capital: Washington, Wall Street, and the Frustration of American Politics","Political Science , General"
Bin Laden: The Man Who Declared War on America,"Political Science , Terrorism"
Bankrupt: The Intellectual and Moral Bankruptcy of Today's Democratic Party,"Political Science , Political Process , Political Parties"
Naked Republicans: A Full-frontal Exposure of Right-wing Hypocrisy and Greed,"Political Science , Political Ideologies , Conservatism & Liberalism"
Is That a Politician in Your Pocket: Washington on $2 Million a Day,"Political Science , American Government , Legislative Branch"
Call to Order: Floor Politics in the House and Senate,"Political Science , American Government , Legislative Branch"
"East and West: China, Power, and the Future of Asia","Political Science , International Relations , General"
Changing America: Blueprints for the New Administration : The Citizens Transition Project,"Political Science , Public Affairs & Administration"
Industry and Politics in West Germany: Toward the Third Republic (Cornell Studies in Political Economy),"Political Science , Labor & Industrial Relations"
Living on the Edge: The Realities of Welfare in America,"Political Science , Public Policy , Social Services & Welfare"
The File: A Personal History,"Political Science , Political Process , General"
Shadows and Whispers: Power Politics Inside the Kremlin from Brezhnev to Gorbachev,"Political Science , General"
Robert's Rules of Order,"Political Science , General"
How to Make Nuclear Weapons Obsolete,"Political Science , General"
A Danger of Democracy: The Presidential Nominating Process,"Political Science , American Government , National"
No Place Left Called Home,"Political Science , General"
United States and Africa: Into the 21st Century (Overseas Development Council),"Political Science , General"
The State of the Nation: Government and the Quest for a Better Society,"Political Science , American Government , State"
The South in Modern America: A Region at Odds (New American Nation Series),"Political Science , American Government , State"
The Miami Herald Report: Democracy Held Hostage,"Political Science , Political Process , Elections"
The Arabs: Journey Beyond the Mirage,"Political Science , International Relations , General"
Democratic Imperative The,"Political Science , General"
"Beyond Our Means: How America's Long Years of Debt, Deficits, and Reckless Borrowing Now Threaten to Overwhelm Us","Political Science , General"
Packwood: The Public and Private Life from Acclaim to Outrage,"Political Science , General"
"The Final Days: The Last, Desperate Abuses of Power by the Clinton White House","Political Science , History & Theory"
The Murder of a Shopping Bag Lady,"Political Science , General"
Who Runs Washington?,"Political Science , General"
Inquisition: The Persecution and Prosecution of the Reverend Sun Myung Moon,"Political Science , American Government , Judicial Branch"
Memoirs,"Political Science , General"
"Rome Wasn't Burnt in a Day: The Real Deal on How Politicians, Bureaucrats, and Other Washington Barbarians are Bankrupting America","Political Science , General"
Terrorism and the Constitution: Sacrificing Civil Liberties In The Name Of National Security,"Political Science , Constitutions"
From the Atlantic to the Urals: National Perspectives on the New Europe,"Political Science , General"
"Trb, Views and Perspectives on the Presidency","Political Science , General"
Let's Be Heard,"Political Science , History & Theory"
Dying from Dioxin: A Citizen's Guide to Reclaiming our Health and Rebuilding Democracy,"Political Science , Human Rights"
"Freedom Betrayed: How America led a Global Democratic Revolution, Won the Cold War and Walked Away","Political Science , International Relations , General"
Autobiography of Benjamin Franklin,"Political Science , History & Theory"
My Declaration of Independence,"Political Science , General"
Social Security: What Every Taxpayer Should Know,"Political Science , Public Policy , Social Security"
"Thanks for the Memories, Mr. President: Wit and Wisdom from the Front Row at the White House","Political Science , Political Process , Political Parties"
"Honorable Treachery: A History of U.S. Intelligence, Espionage, and Covert Action from the American Revolution to the CIA","Political Science , General"
American Warplanes,"Political Science , General"
Strategic Asia 2004-05: Confronting Terrorism in the Pursuit of Power,"Political Science , International Relations , General"
Countdown to Reform: The Great Social Security Debate,"Political Science , Public Policy , Social Policy"
"Between Two Worlds: Realism, Idealism, and American Foreign Policy After the Cold War","Political Science , General"
Military Power And The Advance Of Technology: General Purpose Military Forces For The 1980s And Beyond (Westview special studies in military affairs),"Political Science , Security (National & International)"
They All Come to Geneva: And Other Tales of a Public Diplomat,"Political Science , General"
Men in Black: How the Supreme Court Is Destroying America,"Political Science , American Government , National"
The Enduring Revolution: How the Contract with America Continues to Shape the Nation,"Political Science , Government , Legislative Branch"
100 People Who Are Screwing Up America (And Al Franken Is #37),"Political Science , Political Ideologies , Conservatism & Liberalism"
Fog Facts : Searching for Truth in the Land of Spin (Nation Books),"Political Science , History & Theory"
The Best Democracy Money Can Buy,"Political Science , Political Ideologies , Democracy"
On Being A Superpower: And Not Knowing What To Do About It,"Political Science , Security (National & International)"
"Revolution at the Roots: Making Our Government Smaller, Better and Closer to Home","Political Science , General"
"The Case Against Lawyers: How the Lawyers, Politicians, and Bureaucrats Have Turned the Law into an Instrument of Tyranny--and What We as Citizens Have to Do About It","Political Science , Reference"
"What to Do When You Can't Afford Health Care: The ""A-To-Z"" Sourcebook for the Entire Family","Political Science , General"
Secret Armies: Inside the American Soviet and European Special Forces,"Political Science , General"
100 Jobs in Social Change,"Political Science , General"
The Starr Report: The Official Report of the Independent Counsel's Investigation of the President,"Political Science , Reference"
Banana Diplomacy: The Making of American Policy in Nicaragua 1981-1987,"Political Science , General"
Daughter of Deceit: The Human Drama Behind the Walker Spy Case,"Political Science , General"
American: Beyond Our Grandest Notions,"Political Science , Political Ideologies , Nationalism & Patriotism"
The Awakening of the Soviet Union: Enlarged Edition (Reith Lectures),"Political Science , General"
Governor Tom Kean: From the New Jersey Statehouse to the 911 Commission,"Political Science , American Government , Local"
Man of the People: The Life of John McCain,"Political Science , American Government , Legislative Branch"
Confronting Iran: The Failure of American Foreign Policy and the Next Great Crisis in the Middle East,"Political Science , International Relations , General"
Preventing World War III: A Realistic Grand Strategy,"Political Science , General"
The Case For Democracy,"Political Science , Political Freedom"
Moral Foundation of Democracy (Walgreen Foundation Lecture),"Political Science , Political Ideologies , Democracy"
Draw!: Political Cartoons from Left to Right,"Political Science , General"
Attack the Messenger: How Politicians Turn You Against the Media (American Political Challenges),"Political Science , Political Process , General"
Building Bridges: An Egypt-U.S. Free Trade Agreement,"Political Science , International Relations , General"
The Radical Center: The Future of American Politics,"Political Science , American Government , General"
Operation Iraqi Freedom: The Insider Story,"Political Science , General"
Of Walls and Bridges: The United States & Eastern Europe (Twentieth Century Fund Book),"Political Science , International Relations , General"
Troublemaker,"Political Science , General"
Plan of Attack: The Definitive Account of the Decision to Invade Iraq,"Political Science , International Relations , General"
"The Constitutional Foundations of World Peace (Suny Series in Global Conflict and Peace Education) (SUNY series, Global Conflict and Peace Education)","Political Science , Peace"
Women for All Seasons: The Story of the Women's International League for Peace and Freedom,"Political Science , General"
The Defense Game: An Insider Explores the Astonishing Realities of Americas Defense Establishment,"Political Science , General"
The Language Police: How Pressure Groups Restrict What Students Learn,"Political Science , General"
In Confidence: Moscow's Ambassador to America's Six Cold War Presidents (1962-1986),"Political Science , General"
The Information Revolution and National Security: Dimensions and Directions (Significant Issues Series),"Political Science , Security (National & International)"
The Cybernetic Theory of Decision: New Dimensions of Political Analysis,"Political Science , International Relations , General"
"Stupid White Men, and other sorry excuses for the state of the Nation!","Political Science , Political Process , Political Parties"
Beyond the Beltway: Engaging the Public in U.S. Foreign Policy,"Political Science , International Relations , General"
Ralph's Revolt: The Case for Joining Nader's Rebellion,"Political Science , General"
China Wakes: The Struggle for the Soul of a Rising Power,"Political Science , International Relations , General"
Argument Without End: In Search Of Answers To The Vietnam Tragedy,"Political Science , International Relations , General"
