Title,Category
"Power, Faith, and Fantasy: America in the Middle East, 1776 to the Present","Political Science , International Relations , General"
The Greatest Story Ever Sold: The Decline and Fall of Truth from 9/11 to Katrina,"Political Science , American Government , General"
The Conscience of a Liberal,"Political Science , Political Ideologies , Conservatism & Liberalism"
Truth and Consequences: Special Comments on the Bush Administration's War on American Values,"Political Science , Political Ideologies , Conservatism & Liberalism"
Sacred Honor: A Biography of Colin Powell,"Political Science , General"
The Third Freedom: Ending Hunger In Our Time,"Political Science , Political Economy"
Rebel in Chief: Inside the Bold and Controversial Presidency of George W. Bush,"Political Science , Political Process , General"
Dereliction of Duty: The Eyewitness Account of How President Bill Clinton Compromised America's Long-Term National Security,"Political Science , Public Policy , Social Policy"
"Founding Sisters and the Nineteenth Amendment (Turning Points in History, 7)","Political Science , Political Process , Campaigns & Elections"
Free Choice for Workers: A History of the Right to Work Movement,"Political Science , Labor & Industrial Relations"
Bush at War,"Political Science , American Government , National"
Treason: Liberal Treachery from the Cold War to the War on Terrorism,"Political Science , Political Process , Political Parties"
Social Security and Its Discontents: Perspectives on Choice,"Political Science , Public Policy , Social Security"
Facing Down Evil,"Political Science , Intelligence & Espionage"
Second Chance: Three Presidents and the Crisis of American Superpower,"Political Science , American Government , Executive Branch"
Positively American: Winning Back the Middle-Class Majority One Family at a Time,"Political Science , Public Policy , General"
Guests of the Ayatollah: The First Battle in America's War with Militant Islam,"Political Science , International Relations , General"
Center of The Storm,"Political Science , Political Process , Campaigns & Elections"
Reconstructing America: The Symbol of America in Modern Thought,"Political Science , International Relations , General"
America Alone: The Neo-Conservatives and the Global Order,"Political Science , American Government , General"
50+: Igniting a Revolution to Reinvent America,"Political Science , Public Policy , General"
The Fear Brokers,"Political Science , General"
Charlie Wilson's War: The Extraordinary Story of How the Wildest Man in Congress and a Rogue CIA Agent Changed the History of Our Times,"Political Science , Intelligence & Espionage"
The Ideas That Conquered The World,"Political Science , International Relations , General"
The Presidential Game: The Origins of American Presidential Politics,"Political Science , American Government , Executive Branch"
Fixing Elections: The Failure of America's Winner Take All Politics,"Political Science , Political Ideologies , Democracy"
Intelligence: From Secrets to Policy(3rd Edition),"Political Science , American Government , General"
"Rich Media, Poor Democracy: Communication Politics in Dubious Times","Political Science , General"
The Mask of Command,"Political Science , General"
Protecting the President: The Inside Story of a Secret Service Agent,"Political Science , General"
Breaking The News: How the Media Undermine American Democracy,"Political Science , Political Process , Campaigns & Elections"
The Nightingale's Song,"Political Science , General"
"Why Government Doesn't Work: How Reducing Government Will Bring Us Safer Cities, Better Schools, Lower Taxes, More Freedom and Prosperity for All","Political Science , General"
American Gunfight: The Plot to Kill Harry Truman--and the Shoot-out that Stopped It,"Political Science , American Government , Executive Branch"
Trevor's Place: The Story of the Boy Who Brings Hope to the Homeless,"Political Science , General"
Churchill's Grand Alliance: The Anglo-American Special Relationship 1940-57,"Political Science , International Relations , General"
Governance in a Globalizing World,"Political Science , International Relations , Diplomacy"
Founding Brothers: The Revolutionary Generation,"Political Science , History & Theory"
"The Secret History of the American Empire: The Truth About Economic Hit Men, Jackals, and How to Change the World (John Perkins Economic Hitman Series)","Political Science , International Relations , General"
"Essential Readings in World Politics, Second Edition (The Norton Series in World Politics)","Political Science , International Relations , General"
"Tragedy and Farce: How the American Media Sell Wars, Spin Elections, and Destroy Democracy","Political Science , General"
America's Secret War: Inside the Hidden Worldwide Struggle Between America and Its Enemies,"Political Science , International Relations , General"
The Dust Of Empire: The Race For Mastery In The Asian Heartland,"Political Science , International Relations , General"
Team Bush : Leadership Lessons from the Bush White House,"Political Science , History & Theory"
Hoover's FBI,"Political Science , Law Enforcement"
Mustang: A Combat Marine,"Political Science , General"
Inventing Al Gore: A Biography,"Political Science , General"
Holy War on the Home Front: The Secret Islamic Terror Network in the United States,"Political Science , Political Freedom"
State of Emergency: The Third World Invasion and Conquest of America,"Political Science , International Relations , General"
The U.S. Constitution and Fascinating Facts About It,"Political Science , Constitutions"
Write It When I'm Gone: Remarkable Off-the-Record Conversations With Gerald R. Ford,"Political Science , History & Theory"
The New American Story,"Political Science , History & Theory"
Shadow War: The Untold Story of How Bush Is Winning the War on Terror,"Political Science , Terrorism"
"The Real Stars: In Today's America, Who Are the True Heroes?","Political Science , American Government , General"
The Procurement Revolution (IBM Center for the Business of Government),"Political Science , Labor & Industrial Relations"
Managing the World Economy: The Consequences of Corporate Alliances,"Political Science , General"
In Good Company: How Social Capital Makes Organizations Work,"Political Science , Political Process , General"
"European Integration Revisited: Progress, Prospects, And U.s. Interests","Political Science , International Relations , General"
"Security First: For a Muscular, Moral Foreign Policy","Political Science , General"
Justice Rehnquist and the Constitution (Princeton Legacy Library),"Political Science , General"
Hats in the Ring: An Illustrated History of American Presidential Campaigns,"Political Science , Political Process , Campaigns & Elections"
Inside the Walls of Alcatraz,"Political Science , General"
The Encyclopedia of the Environment,"Political Science , General"
Imperial Life in the Emerald City: Inside Iraq's Green Zone,"Political Science , World , General"
The United States v. I. Lewis Libby,"Political Science , International Relations , General"
The Paradox of American Power: Why the World's Only Superpower Can't Go It Alone,"Political Science , Reference"
Year of the Rat: How Bill Clinton Compromised U.S. Security for Chinese Cash,"Political Science , Political Ideologies , Conservatism & Liberalism"
"Overblown: How Politicians and the Terrorism Industry Inflate National Security Threats, and Why We Believe Them","Political Science , Political Freedom & Security , International Security"
The Battle for Peace: A Frontline Vision of America's Power and Purpose,"Political Science , Security (National & International)"
Winning the Future: A 21st Century Contract With America,"Political Science , Public Policy , Economic Policy"
What's So Great About America,"Political Science , Civics & Citizenship"
Bound To Lead: The Changing Nature Of American Power,"Political Science , International Relations , General"
The Modern American Presidency,"Political Science , History & Theory"
America's Global Interests: A New Agenda,"Political Science , General"
"Crazies to the Left of Me, Wimps to the Right: How One Side Lost Its Mind and the Other Lost Its Nerve","Political Science , Political Ideologies , Conservatism & Liberalism"
Bush Versus the Environment,"Political Science , American Government , General"
LOST RIGHTS: The Destruction of American Liberty,"Political Science , Civil Rights"
Inside the Asylum: Why the UN and Old Europe are Worse Than You Think,"Political Science , International Relations , Diplomacy"
Environmental Politics and Policy (Environmental Politics & Policy),"Political Science , Public Policy , Environmental Policy"
The French Betrayal of America,"Political Science , International Relations , General"
"Cruelty and Silence: War, Tyranny, Uprising and the Arab World","Political Science , International Relations , General"
Globalization: A Very Short Introduction (Very Short Introductions),"Political Science , International Relations , General"
Worse Than Watergate: The Secret Presidency of George W. Bush,"Political Science , American Government , General"
Government Nannies,"Political Science , American Government , General"
The Great Unraveling: Losing Our Way in the New Century (Updated and Expanded),"Political Science , American Government , National"
"The Assault on Reason: Our Information Ecosystem, from the Age of Print to the Age of Trump","Political Science , American Government , National"
It Takes One to Tango,"Political Science , General"
Jews in American Politics: Introduction by Senator Joseph I. Lieberman,"Political Science , Public Affairs & Administration"
The Shadow Factory: The Ultra-Secret NSA from 9/11 to the Eavesdropping on America,"Political Science , Intelligence & Espionage"
Change We Can Believe In: Barack Obama's Plan to Renew America's Promise,"Political Science , Political Process , Political Parties"
The Nine: Inside the Secret World of the Supreme Court,"Political Science , American Government , Judicial Branch"
Turkmeniscam: How Washington Lobbyists Fought to Flack for a Stalinist Dictatorship,"Political Science , International Relations , General"
The Devil We Know: Dealing with the New Iranian Superpower,"Political Science , International Relations , Diplomacy"
"Supercapitalism: The Transformation of Business, Democracy, and Everyday Life","Political Science , Political Ideologies , Democracy"
The Modern US War Machine: An Encyclopedia of American Military Equipment and Strategy,"Political Science , General"
"Inside the Beltway: Offbeat Stories, Scoops, and Shenanigans from around the Nation's Capital","Political Science , Essays"
Invasion: How America Still Welcomes Terrorists Criminals & Other Foreign Menaces to Our Shores,"Political Science , Public Policy , General"
"Breaking the Deadlock: The 2000 Election, the Constitution, and the Courts","Political Science , Political Process , Campaigns & Elections"
"The O'Reilly Factor: The Good, the Bad, and the Completely Ridiculous in American Life","Political Science , Political Ideologies , Conservatism & Liberalism"
Osama: The Making of a Terrorist,"Political Science , General"
Guantanamo: What the World Should Know,"Political Science , International Relations , General"
Barbarians Inside the Gates: The Black Book of Bolshevism,"Political Science , Political Ideologies , Communism, Post-Communism & Socialism"
Framing the Future: How Progressive Values Can Win Elections and Influence People,"Political Science , Political Process , Campaigns & Elections"
Passion and Politics,"Political Science , General"
The United States of Europe: The New Superpower and the End of American Supremacy,"Political Science , International Relations , General"
Soldiers of Fortune (Epic of Flight),"Political Science , General"
Divided America: The Ferocious Power Struggle in American Politics,"Political Science , Political Process , Political Parties"
Truman and the Steel Seizure Case: The Limits of Presidential Power (Contemporary American history series),"Political Science , American Government , General"
Major Problems in American Foreign Relations: Since 1914 : Documents and Essays (Major Problems in American History),"Political Science , International Relations , General"
A Half Penny on the Federal Dollar: The Future of Development Aid,"Political Science , International Relations , General"
"INTELLIGENCE MATTERS: The CIA, the FBI, Saudi Arabia, and the Failure of America's War on Terror","Political Science , Political Freedom"
Independents Day: Awakening the American Spirit,"Political Science , Public Policy , General"
Chain of Command: The Road from 9/11 to Abu Ghraib,"Political Science , World , General"
Camp David: Peacemaking and Politics,"Political Science , Peace"
"Off with Their Heads: Traitors, Crooks & Obstructionists in American Politics, Media & Business","Political Science , General"
The Ultimate Terrorists,"Political Science , Terrorism"
"Judgment Days: Lyndon Baines Johnson, Martin Luther King Jr., And The Laws That Changed America","Political Science , Civil Rights"
Fair Trade for All: How Trade Can Promote Development (Initiative for Policy Dialogue Series C),"Political Science , International Relations , Trade & Tariffs"
Ecological Disaster: Cleaning Up the Hidden Legacy of the Soviet Regime : A Twentieth Century Fund Report (Russia in Transition),"Political Science , Public Policy , Environmental Policy"
Justice on Earth: Earthjustice and the People It Has Served,"Political Science , General"
Weapons Proliferation in the 1990s (Washington Quarterly Readers),"Political Science , General"
It's My Party Too: The Battle for the Heart of the GOP and the Future of America,"Political Science , Political Process , Political Parties"
Globalization: What's New?,"Political Science , Globalization"
A Force More Powerful: A Century of Nonviolent Conflict,"Political Science , Peace"
"After the Wars: Reconstruction in Afghanistan, Central America, Indochina, the Horn of Africa, and Southern Africa (U.S.Third World Policy Perspectives Series)","Political Science , International Relations , General"
At Home in the World,"Political Science , Terrorism"
"East and West: China, Power, and the Future of Asia","Political Science , International Relations , General"
Planet India: How the Fastest Growing Democracy Is Transforming America and the World,"Political Science , International Relations , General"
"Applebee's America: How Successful Political, Business, and Religious Leaders Connect with the New American Community","Political Science , Political Process , General"
The Predator State: How Conservatives Abandoned the Free Market and Why Liberals Should Too,"Political Science , Public Policy , Economic Policy"
Out of Mao's Shadow: The Struggle for the Soul of a New China,"Political Science , International Relations , General"
Presidential Courage: Brave Leaders and How They Changed America 1789-1989,"Political Science , History & Theory"
Planet India: The Turbulent Rise of the Largest Democracy and the Future of Our World,"Political Science , International Relations , General"
The End of Iraq: How American Incompetence Created a War Without End,"Political Science , International Relations , General"
Dead Certain: The Presidency of George W. Bush,"Political Science , General"
The 9/11 Report: The National Commission on Terrorist Attacks Upon the United States,"Political Science , Terrorism"
The Merchants of Fear: Why They Want Us to be Afraid,"Political Science , Political Ideologies , Democracy"
America's Secret War: Inside the Hidden Worldwide Struggle Between the United States and Its Enemies,"Political Science , International Relations , General"
"False Profits: The Inside Story of BCCI, The Worlds Most Corrupt Financial Empire","Political Science , General"
The 10 Big Lies About America: Combating Destructive Distortions About Our Nation,"Political Science , Political Ideologies , Conservatism & Liberalism"
Postcards from Tomorrow Square: Reports from China,"Political Science , International Relations , General"
Taking Sides: Clashing Views on Controversial Issues in World Politics (Revised),"Political Science , International Relations , General"
"1912: Wilson, Roosevelt, Taft and Debs--The Election that Changed the Country","Political Science , Political Process , Campaigns & Elections"
"The Prize: The Epic Quest for Oil, Money, & Power","Political Science , World , General"
"House of Bush, House of Saud: The Secret Relationship Between the World's Two Most Powerful Dynasties","Political Science , Reference"
The Broken Branch: How Congress Is Failing America and How to Get It Back on Track (Institutions of American Democracy Series),"Political Science , American Government , Legislative Branch"
For Love of Politics: Bill and Hillary Clinton: The White House Years,"Political Science , General"
"Lights, Camera, War: Is Media Technology Driving International Politics?","Political Science , General"
The Complete Idiot's Guide to World Conflicts,"Political Science , International Relations , General"
The Most Democratic Branch: How the Courts Serve America (Institutions of American Democracy),"Political Science , American Government , Judicial Branch"
Congressional Procedures and Policy Process,"Political Science , American Government , Legislative Branch"
Failed States: The Abuse of Power and the Assault on Democracy (American Empire Project),"Political Science , Political Ideologies , Democracy"
Armed Madhouse: From Baghdad to New Orleans-Sordid Secrets and Strange Tales of a White House Gone Wild,"Political Science , Political Process , Political Advocacy"
Sidney Reilly: The True Story of the World's Greatest Spy,"Political Science , General"
The Global Class War : How America's Bipartisan Elite Lost Our Future - and What It Will Take to Win it Back,"Political Science , Globalization"
The Presidency and the Management of National Security,"Political Science , General"
An Inconvenient Book: Real Solutions to the World's Biggest Problems,"Political Science , Essays"
"Whitewash: What the Media Won't Tell You About Hillary Clinton, but Conservatives Will","Political Science , Political Ideologies , Conservatism & Liberalism"
At Your Own Risk: An American Chronicle of Crisis and Capitivity in the Middle East,"Political Science , American Government , National"
A Prayer for the City,"Political Science , Public Policy , City Planning & Urban Development"
The Translator: A Memoir,"Political Science , International Relations , General"
"Guilty: Liberal ""Victims"" and Their Assault on America","Political Science , Political Ideologies , Conservatism & Liberalism"
Elections American Style,"Political Science , Political Process , Campaigns & Elections"
"Now They Call Me Infidel: Why I Renounced Jihad for America, Israel, and the War on Terror","Political Science , Political Ideologies , Conservatism & Liberalism"
Citizens of the Empire: The Struggle to Claim Our Humanity,"Political Science , History & Theory"
American Diplomacy in the Twentieth Century,"Political Science , International Relations , Diplomacy"
The End of Poverty: Economic Possibilities for Our Time,"Political Science , Public Policy , Economic Policy"
"Bitter Friends, Bosom Enemies: Iran, the U.S., and the Twisted Path to Confrontation","Political Science , International Relations , General"
U.S. Versus Them: How a Half-Century of Conservatism Has Undermined America's Security,"Political Science , Political Ideologies , Conservatism & Liberalism"
Sources of Conflict in the 21st Century: Regional Futures and U.S. Strategy,"Political Science , International Relations , General"
"The Paradox of American Democracy: Elites, Special Interests, and the Betrayal of Public Trust","Political Science , Political Process , General"
Fighting Back: The War on Terrorism from Inside the Bush White House,"Political Science , Terrorism"
"America at the Crossroads: Democracy, Power, and the Neoconservative Legacy","Political Science , International Relations , General"
Shcharansky: Hero of Our Time,"Political Science , General"
The Late Great U.S.A.: The Coming Merger With Mexico and Canada,"Political Science , International Relations , General"
We Can Have Peace in the Holy Land: A Plan That Will Work,"Political Science , International Relations , General"
The Long Emergency: Surviving the Converging Catastrophes of the Twenty-First Century,"Political Science , Public Policy , Environmental Policy"
World War IV: The Long Struggle Against Islamofascism,"Political Science , International Relations , General"
Princess Masako: Prisoner of the Chrysanthemum Throne,"Political Science , Comparative Politics"
The Inheritance: The World Obama Confronts and the Challenges to American Power,"Political Science , General"
Legacy of Ashes: The History of the CIA,"Political Science , Security (National & International)"
"The Personal President: Power Invested, Promise Unfulfilled","Political Science , General"
Reinventing Government: How The Entrepreneurial Spirit Is Transforming The Public Sector,"Political Science , American Government , National"
Cities Back from the Edge: New Life for Downtown (Automation),"Political Science , Public Policy , City Planning & Urban Development"
Lucius D. Clay: An American Life,"Political Science , General"
Locked in the Cabinet,"Political Science , Political Process , General"
"Leave Us Alone: Getting the Government's Hands Off Our Money, Our Guns, Our Lives","Political Science , Political Ideologies , Conservatism & Liberalism"
Neither King Nor Prelate: Religion and the New Nation 1776-1826,"Political Science , General"
Road to Air America: Breaking the Right Wing Stranglehold on Our Nation's Airwaves,"Political Science , General"
Leviathan on the Right: How Big-Government Conservativism Brought Down the Republican Revolution,"Political Science , American Government , General"
Out of Order: An incisive and boldly original critique of the news media's domination of America's political process,"Political Science , Political Process , Campaigns & Elections"
Changing British Party,"Political Science , Public Policy , General"
Will Terrorists Go Nuclear?,"Political Science , Terrorism"
31 Days: The Crisis That Gave Us the Government We Have Today,"Political Science , American Government , Executive Branch"
We Wrecked the Place,"Political Science , General"
Israel in the Mind of America,"Political Science , General"
Bare Knuckles and Back Rooms: My Life in American Politics,"Political Science , Political Process , General"
From Welfare to Work,"Political Science , Public Policy , Social Policy"
"Lands of Charm and Cruelty: Travels in Southeast Asia, 1st Vintage Departures","Political Science , World , Asian"
Hoodwinked: The Documents That Reveal How Bush Sold Us a War,"Political Science , General"
"Cowboy Capitalism: European Myths, American Reality","Political Science , Political Economy"
The Clinton Crack-up: The Boy President's Life After the White House,"Political Science , General"
The Hunting of the President: The Ten-Year Campaign to Destroy Bill and Hillary Clinton,"Political Science , American Government , General"
American Vertigo: Traveling America in the Footsteps of Tocqueville,"Political Science , Political Economy"
No Remedy Left Behind: Lessons from a Half-Decade of NCLB,"Political Science , Public Policy , General"
"Health Care Half Truths: Too Many Myths, Not Enough Reality (American Political Challenges)","Political Science , Public Policy , General"
The World After Oil The Shifting Axis of Power and Wealth,"Political Science , International Relations , General"
William Donald Schaefer: A Political Biography,"Political Science , American Government , State"
The National Endowments: A Critical Symposium,"Political Science , General"
Tough Choices: Jewish Perspectives on Social Justice,"Political Science , General"
America Back on Track,"Political Science , American Government , National"
The Rise of Global Civil Society: Building Communities and Nations from the Bottom Up,"Political Science , Public Policy , General"
The Greatest Story Ever Sold: The Decline and Fall of Truth in Bush's America,"Political Science , Public Policy , General"
Invasion of the Party Snatchers: How the Holy-Rollers and the Neo-Cons Destroyed the GOP,"Political Science , Political Process , Political Parties"
I'll Be Short: Essentials for a Decent Working Society,"Political Science , Public Policy , Economic Policy"
The Audacity of Deceit: Barack Obama's War on American Values,"Political Science , Political Ideologies , General"
How to Talk to a Liberal (If You Must): The World According to Ann Coulter,"Political Science , Political Process , Political Parties"
The Eagle's Shadow,"Political Science , International Relations , General"
A Letter to America,"Political Science , Essays"
Second Chance: Three Presidents and the Crisis of American Superpower,"Political Science , American Government , Executive Branch"
Unholy War: Terror in the Name of Islam,"Political Science , International Relations , General"
Inside Soviet Military Intelligence,"Political Science , General"
Terrorism and U.S. Foreign Policy,"Political Science , Security (National & International)"
Troubled Waters: Future U.S. Security Assistance in the Persian Gulf,"Political Science , Security (National & International)"
Neo-conservatism: The Autobiography of an Idea,"Political Science , General"
Regime Change: U.S. Strategy through the Prism of 9/11 (Woodrow Wilson Center Press),"Political Science , International Relations , General"
Fists of Steel (The Third Reich),"Political Science , General"
