Title,Category
Hill Rat: Blowing the Lid Off Congress,"Political Science , General"
Betrayal : How the Clinton Administration Undermined American Security,"Political Science , General"
"The Price of Loyalty: George W. Bush, the White House, and the Education of Paul O'Neill","Political Science , Government , Executive Branch"
Escape from the CIA: How the CIA Won and Lost the Most Important KGB Spy Ever to Defect to the U.S.,"Political Science , General"
Reinventing Government: How the Entrepreneurial Spirit is Transforming the Public Sector (Plume),"Political Science , American Government , General"
Kirkpatrick Mission (Diplomacy Wo Apology Ame at the United Nations 1981 to 85,"Political Science , General"
Rogue Regimes: Terrorism and Proliferation,"Political Science , International Relations , Arms Control"
You Know You're A Republican/Democrat If...,"Political Science , Political Process , Political Parties"
Let Freedom Ring: Winning the War of Liberty over Liberalism,"Political Science , Terrorism"
Shakedown: Exposing The Real Jesse Jackson,"Political Science , Civil Rights"
Ain't You Glad You Joined the Republicans?: A Short History of the Gop,"Political Science , General"
Let Freedom Ring: Winning the War of Liberty over Liberalism,"Political Science , Terrorism"
Holy War Inc. Inside the Secret World of Osama Bin Laden,"Political Science , International Relations , General"
Red Dragon Rising: Communist China's Military Threat to America,"Political Science , International Relations , General"
"The Real War on Crime: Report of the National Criminal Justice Commission, The","Political Science , General"
Leaving Town Alive: Confessions of an Arts Warrior,"Political Science , General"
The American Style of Foreign Policy: Cultural Politics and Foreign Affairs,"Political Science , International Relations , General"
Politics of Latin American Development,"Political Science , Public Policy , Economic Policy"
Deadlock: The Inside Story of America's Closest Election,"Political Science , General"
You Say You Want a Revolution : A Story of Information Age Politics,"Political Science , Public Affairs & Administration"
In the Shadow of F.D.R.: From Harry Truman to Bill Clinton,"Political Science , History & Theory"
Lockheed F-117A: Operation and Development of the Stealth Fighter,"Political Science , General"
Here: A Biography of the New American Continent,"Political Science , International Relations , General"
Beyond Survival: New Directions for the Disarmament Movement,"Political Science , International Relations , Arms Control"
Rewriting History,"Political Science , Political Process , General"
Dragons Teeth,"Political Science , General"
At War with Ourselves: Why America Is Squandering Its Chance to Build a Better World,"Political Science , Security (National & International)"
Civil Wars: A Battle for Gay Marriage,"Political Science , Civil Rights"
"Deliver Us from Evil: Defeating Terrorism, Despotism, and Liberalism","Political Science , Terrorism"
Seamless Government: A Practical Guide to Re-Engineering in the Public Sector,"Political Science , Public Affairs & Administration"
"Why War? Ideology, Theory, and History (Campus)","Political Science , History & Theory"
Forgotten Children of the AIDS Epidemic (Yale Fastback Series),"Political Science , Public Policy , Social Services & Welfare"
African American Women in Congress: Forming and Transforming History,"Political Science , American Government , Legislative Branch"
No Neutral Ground?: Abortion Politics In An Age Of Absolutes (Dilemmas in American Politics),"Political Science , American Government , National"
American Pharaoh: Mayor Richard J. Daley - His Battle for Chicago and the Nation,"Political Science , American Government , State"
Big Lies: The Right-Wing Propaganda Machine and How It Distorts the Truth,"Political Science , Political Process , Political Parties"
The Gilded Dome: The U.S. Senate and Campaign Finance Reform,"Political Science , General"
Stickin': The Case for Loyalty,"Political Science , American Government , General"
The Politics of Truth: A Diplomat's Memoir: Inside the Lies that Led to War and Betrayed My Wife's CIA Identity,"Political Science , American Government , General"
Breakdown: How America's Intelligence Failures Led to September 11,"Political Science , Terrorism"
The Third Terrorist: The Middle East Connection to the Oklahoma City Bombing,"Political Science , Terrorism"
The Color of Truth: McGeorge Bundy and William Bundy: Brothers in Arms,"Political Science , International Relations , General"
Washington,"Political Science , Political Process , General"
The Interrogators: Inside the Secret War Against al Qaeda,"Political Science , General"
Presidential Inaugurations,"Political Science , History & Theory"
"Burn Before Reading: Presidents, CIA Directors, and Secret Intelligence","Political Science , Intelligence & Espionage"
Had Enough?: A Handbook for Fighting Back,"Political Science , Political Ideologies , Conservatism & Liberalism"
They Only Look Dead: Why Progressives Will Dominate the Next Political Era,"Political Science , Public Policy , Economic Policy"
"The Exception to the Rulers: Exposing Oily Politicians, War Profiteers, and the Media That Love Them","Political Science , Political Ideologies , Democracy"
The European Dream,"Political Science , Political Ideologies , Democracy"
Fighting with Allies:: America and Britain in Peace and War,"Political Science , General"
Thieves in High Places: They've Stolen Our Country--And It's Time to Take It Back,"Political Science , General"
"What Every American Should Know About Who's Really Running the World: The People, Institutions, and Organizations That Control Our Future","Political Science , World , General"
Fighting for the Future: Will America Triumph?,"Political Science , Security (National & International)"
The Politics of Truth: Inside the Lies that Led to War and Betrayed My Wife's CIA Identity: A Diplomat's Memoir,"Political Science , International Relations , Diplomacy"
Silver Wings: A History of the United States Air Force,"Political Science , General"
"Terrorism and Tyranny: Trampling Freedom, Justice and Peace to Rid the World of Evil","Political Science , International Relations , General"
The Nightingale's Song,"Political Science , General"
Made in Texas: George W. Bush and the Southern Takeover of American Politics,"Political Science , American Government , State"
The Lies of George W. Bush: Mastering the Politics of Deception,"Political Science , General"
Does America Need a Foreign Policy? : Toward a Diplomacy for the 21st Century,"Political Science , International Relations , General"
"Politics: Observations and Arguments, 1966-2004","Political Science , Essays"
The Raiders: The Elite Strike Forces That Altered the Course of War and History,"Political Science , General"
Shooting Straight: Telling the Truth About Guns in America,"Political Science , International Relations , Arms Control"
The New Terrorism: Fanaticism and the Arms of Mass Destruction,"Political Science , International Relations , General"
The Body and the Blood: The Middle East's Vanishing Christians and the Possibility for Peace,"Political Science , Political Freedom"
U.S.F. Constellation,"Political Science , General"
"Verifying Nonproliferation Treaties: Obligation, Process, and  Sovereignty","Political Science , International Relations , Arms Control"
Mugged by the State: Outrageous Government Assaults on Ordinary People and Their Property,"Political Science , Public Policy , General"
Last Man Down: A Firefighter's Story of Survival and Escape from the World Trade Center,"Political Science , Terrorism"
"Real Federalism: Why It Matters, How It Could Happen","Political Science , Political Process , General"
"CIVIL RIGHTS AND WRONGS: A Memoir of Race and    Politics, 1944-1994","Political Science , Political Freedom & Security , Civil Rights"
The World's Armies,"Political Science , General"
Al-Qaeda: In Search of the Terror Network that Threatens the World (Nation Books),"Political Science , Terrorism"
Blinded by the Right: The Conscience of an Ex-Conservative,"Political Science , Political Process , Political Parties"
"A Just Response: The Nation on Terrorism, Democracy, and September 11, 2001 (Nation Books)","Political Science , International Relations , General"
The Security Implicationf of the New Twiwan (Adelphi series),"Political Science , Security (National & International)"
Never Stop Running: Allard Lowenstein And American Liberal Activism,"Political Science , General"
Stepping Up to Power: The Political Journey of American Women,"Political Science , Political Process , Campaigns & Elections"
"Give Me a Break: How I Exposed Hucksters, Cheats, and Scam Artists and Became the Scourge of the Liberal Media...","Political Science , General"
Competing in the New Economy,"Political Science , Public Policy , Economic Policy"
The Good Fight: Declare Your Independence and Close the Democracy Gap,"Political Science , Public Policy , General"
Narrowing the Nation's Power: The Supreme Court Sides with the States,"Political Science , History & Theory"
God and Ronald Reagan: A Spiritual Life,"Political Science , General"
Shield of the Republic: The United States Navy in an Era of Cold War and Violent Peace 1945-1962,"Political Science , General"
The Ralph Nader Reader,"Political Science , Political Process , General"
Madame Hillary: The Dark Road to the White House,"Political Science , American Government , Legislative Branch"
Terror and Liberalism,"Political Science , General"
The Geneva Accord: And Other Strategies for Healing the Israeli-Palestinian Conflict (The Terra Nova Series),"Political Science , International Relations , General"
The Secret Service: The Hidden History of an Enigmatic Agency,"Political Science , Law Enforcement"
"The Nation, 1865-1990: Selections from the Independent Magazine of Politics and Culture","Political Science , Essays"
Peace Kills: America's Fun New Imperialism,"Political Science , International Relations , General"
The New Majority: Toward a Popular Progressive Politics,"Political Science , Political Process , Political Parties"
"Deliver Us From Evil CD: Defeating Terrorism, Despotism, and Liberalism","Political Science , Terrorism"
Where the Right Went Wrong: How Neoconservatives Subverted the Reagan Revolution and Hijacked the Bush Presidency,"Political Science , Political Ideologies , General"
Passion for Islam: Shaping the Modern Middle East: The Egyptian Experience (Lisa Drew Books),"Political Science , World , General"
The Bubble Of American Supremacy: The Costs Of Bush's War In Iraq,"Political Science , Security (National & International)"
"What We've Lost: How the Bush Administration Has Curtailed Our Freedoms, Mortgaged Our Economy, Ravaged Our Environment, and Damaged Our Standing in the World","Political Science , General"
"Misunderestimated: The President Battles Terrorism, John Kerry, and the Bush Haters","Political Science , General"
Agents Of Influence,"Political Science , General"
Recollections of a Life,"Political Science , General"
"The Tides of Reform: Making Government Work, 1945-1995","Political Science , Political Process , General"
Alone Together,"Political Science , General"
Partners in Power: The Clintons and Their America,"Political Science , American Government , State"
Reason to Believe: A Keen Assessment of Who We Are and an Inspiring Vision of What We Could Be,"Political Science , General"
Smash Mouth: Two Years In The Gutter With Al Gore And George W. Bush -- Notes From The 2000 Campaign Trail,"Political Science , Political Process , Campaigns & Elections"
It's a Free Country: Personal Freedom in America After September 11,"Political Science , General"
Payback: America's Long War in the Middle East,"Political Science , General"
Death of Outrage: Bill Clinton and the Assault on American Ideals,"Political Science , Political Ideologies , Conservatism & Liberalism"
The Real War,"Political Science , General"
Behind the Oval Office: Winning the Presidency in the Nineties,"Political Science , Political Process , Campaigns & Elections"
Hating America: The New World Sport,"Political Science , International Relations , General"
Heavy Losses,"Political Science , General"
MAYOR,"Political Science , General"
I Think I Don't Remember,"Political Science , General"
The Japan That Can Say No: Why Japan Will Be First Among Equals,"Political Science , General"
Imperial America: The Bush Assault on the World Order,"Political Science , General"
The Global Rivals,"Political Science , International Relations , General"
Hail to the Candidate: Presidential Campaigns from Banners to Broadcasts,"Political Science , General"
Club Fed,"Political Science , General"
Beyond Peace,"Political Science , General"
Like No Other Time: The 107th Congress and the Two Years That Changed America Forever,"Political Science , American Government , General"
"Dude, Where's My Country?","Political Science , General"
Family Circle: The Boudins and the Aristocracy of the Left,"Political Science , History & Theory"
Europe Undivided: The New Logic of Peace in U.S.-Russian Relations,"Political Science , International Relations , General"
WAR WITHOUT BLOODSHED: The Art of Politics,"Political Science , General"
No Contest : Corporate Lawyers and the Perversion of Justice in America,"Political Science , Political Process , Political Advocacy"
The Pentagon and the Art of War: The Question of Military Reform,"Political Science , General"
Terrorism and America: A Commonsense Strategy for a Democratic Society (BCSIA Studies in International Security),"Political Science , Security (National & International)"
What Jackie Taught Us: Lessons from the Remarkable Life of Jacqueline Kennedy Onassis,"Political Science , General"
Legend: The Secret World of Lee Harvey Oswald,"Political Science , General"
"Dream Makers, Dream Breakers: The World of Justice Thurgood Marshall","Political Science , General"
The REAL ANITA HILL,"Political Science , General"
Russia Shakes the World: The Second Russian Revolution and Its Impact on the West,"Political Science , General"
Rough Edges: My Unlikely Road from Welfare to Washington,"Political Science , General"
With Reagan: The Inside Story,"Political Science , American Government , Executive Branch"
"The Making of the President, 1972: A Narrative History of American Politics in Action","Political Science , General"
Man of the House: The Life and Political Memoirs of Speaker Tip O'Neill,"Political Science , General"
Adventures in Porkland: How Washington Wastes Your Money and Why They Won't Stop,"Political Science , General"
In Praise of Public Life,"Political Science , Public Affairs & Administration"
"Contract With America: The Bold Plan by Rep. Newt Ginrich, Rep. Dick Armey and the House Republicans to Change the Nation","Political Science , General"
"Caveat: Realism, Reagan and Foreign Policy","Political Science , General"
Character: America's Search for Leadership,"Political Science , General"
"The Right Man: The Surprise Presidency of George W. Bush, An Inside Account","Political Science , Political Process , General"
Flashpoints: Promise and Peril in a New World,"Political Science , History & Theory"
Not for Sale At Any Price: How We Can Save America for Our Children,"Political Science , General"
Beyond Choice: Reproductive Freedom In The 21st Century,"Political Science , Public Policy , General"
Loud and Clear,"Political Science , General"
"All's Fair: Love, War and Running for President","Political Science , General"
Tainted Legacy: 9/11 and the Ruin of Human Rights (Nation Books),"Political Science , Terrorism"
Seize the Moment: America's Challenge in a One-Superpower World,"Political Science , General"
Perestroika: New Thinking for Our Country and the World,"Political Science , General"
The Invisible Epidemic: The Story of Women and AIDS,"Political Science , General"
Deadlines and Datelines,"Political Science , General"
Freedom and Order: A Commentary on the American Political Scene,"Political Science , Political Freedom & Security , General"
Bush at War,"Political Science , Political Process , General"
Leadership,"Political Science , American Government , State"
Neoconomy: George Bush's Revolutionary Gamble with America's Future,"Political Science , Public Policy , Economic Policy"
"Now, Let Me Tell You What I Really Think","Political Science , Essays"
Why Americans Hate Politics: The Death of the Democratic Process,"Political Science , General"
Up 'Til Now: A Memoir,"Political Science , General"
The Tempting Of America (The Political Seduction of the Law),"Political Science , General"
The Unfinished Election Of 2000 Leading Scholars Examine America's Strangest Election,"Political Science , Political Process , Elections"
Ronald Reagan in Private: A Memoir of My Years in the White House,"Political Science , Political Ideologies , General"
Treachery: How America's Friends and Foes Are Secretly Arming Our Enemies,"Political Science , General"
Arkansas Mischief: The Birth of a National Scandal,"Political Science , Public Affairs & Administration"
God Has Ninety-Nine Names: Reporting from a Militant Middle East,"Political Science , American Government , General"
"All's Fair: Love, War, and Running for President","Political Science , Political Process , Elections"
War Plan Iraq: Ten Reasons Against War with Iraq,"Political Science , International Relations , General"
Because Each Life Is Precious: Why an Iraqi Man Came to Risk Everything for Private Jessica Lynch,"Political Science , Political Freedom"
Unlimited Access: An FBI Agent Inside the Clinton White House,"Political Science , American Government , Executive Branch"
Things Worth Fighting for: Collected Writings,"Political Science , General"
The New Nuclear Danger: George W. Bush's Military-Industrial Complex,"Political Science , General"
Dreaming War: Blood for Oil and the Cheney-Bush Junta (Nation Books),"Political Science , History & Theory"
"Red, White & Liberal: How Left Is Right & Right Is Wrong","Political Science , History & Theory"
The Official Handbook of the Vast Right Wing Conspiracy,"Political Science , General"
Who's Looking Out for You?,"Political Science , American Government , General"
Banana Republicans: How the Right Wing is Turning America Into a One-Party State,"Political Science , American Government , General"
Prisoners of Hope: The Story of Our Captivity and Freedom in Afghanistan,"Political Science , Reference"
The Book on Bush: How George W. (Mis)leads America,"Political Science , General"
Fat Man Fed Up: How American Politics Went Bad,"Political Science , General"
Revenge: A Story of Hope,"Political Science , Reference"
Governor Reagan: His Rise To Power,"Political Science , American Government , State"
The War Over Iraq: Saddams Tyranny and Americas Mission,"Political Science , International Relations , General"
The Abu Ghraib Investigations: The Official Independent Panel and Pentagon Reports on the Shocking Prisoner Abuse in Iraq,"Political Science , Terrorism"
Rewriting History,"Political Science , Political Process , General"
"Congress: Keystone of the Washington Establishment, Revised Edition (Perspectives; 12)","Political Science , American Government , Legislative Branch"
Dick: The Man Who Is President,"Political Science , General"
A Hundred and One Days: A Baghdad Journal,"Political Science , Political Ideologies , General"
"The Real State Of The Union: From The Best Minds In America, Bold Solutions To The Problems Politicians Dare Not Address (New America Books)","Political Science , Political Process , General"
Power Trip: U.S. Unilateralism and Global Strategy After September 11 (Open Media Series),"Political Science , International Relations , General"
Warrior-King: The Case for Impeaching George W. Bush,"Political Science , Constitutions"
"Fear's Empire: War, Terrorism, and Democracy in the Age of Independence","Political Science , International Relations , General"
The New KGB: Engine of Soviet Power,"Political Science , General"
Presidents Under Fire: Commanders-in-Chief in Victory and Defeat,"Political Science , General"
"The Soft Vengeance of a Freedom Fighter, New Edition","Political Science , History & Theory"
"Sharing World Leadership?: A New Era for America and Japan (Aei Studies, 488)","Political Science , History & Theory"
"Cases and Strategies for Preventive Action (Preventive Action Reports, Vol 2)","Political Science , Security (National & International)"
Earth in the Balance: Ecology and the Human Spirit,"Political Science , Public Policy , General"
There's Nothing in the Middle of the Road but Yellow Stripes and Dead Armadillos: A Work of Political Subversion,"Political Science , Essays"
How to Be a Cheap Hawk: The 1999 and 2000 Defense Budgets (Brookings Studies in Foreign Policy),"Political Science , Public Policy , Economic Policy"
War Without Bloodshed,"Political Science , General"
"Candidates, Parties, and Campaigns: Electoral Politics in America","Political Science , General"
Shattered Dreams: The Story of Charlotte Fedders,"Political Science , General"
Behind the Front Page: A Candid Look at How the News Is Made,"Political Science , General"
A Matter of Character: Inside the White House of George W. Bush,"Political Science , Political Process , General"
The Next American Frontier,"Political Science , General"
The Sewing Circles of Herat: A Personal Voyage Through Afghanistan,"Political Science , General"
Betrayal: How the Clinton Administration Undermined American Security,"Political Science , Political Ideologies , Conservatism & Liberalism"
War And The American Presidency,"Political Science , Security (National & International)"
"Buying of the President 2004, The","Political Science , General"
"Our Plan for America: Stronger at Home, Respected in the World","Political Science , Government , National"
Why I Hate the Republicans,"Political Science , Political Process , Political Parties"
Government and Environmental Politics: Essays on Historical Developments since World War Two,"Political Science , Public Policy , Environmental Policy"
The Politics of Bad Faith: The Radical Assault on America's Future,"Political Science , Political Ideologies , General"
U.S. Foreign Policy and the Third World: Agenda 1985-86 (U.S. Third World Policy Perspectives),"Political Science , International Relations , General"
Complete Spy,"Political Science , General"
Ghosts: Vintage Aircraft of World War II,"Political Science , General"
Arabia Imperilled: The Security Imperatives of the Arab Gulf States,"Political Science , General"
United States Military Almanac,"Political Science , General"
The Apocalyptic Premise,"Political Science , General"
The Complete Idiot's Guide to the Impeachment of the President,"Political Science , Political Ideologies , Democracy"
No Island of Sanity: Paula Jones v. Bill Clinton: The Supreme Court on Trial (Library of Contemporary Thought),"Political Science , American Government , General"
The Gospel According to RFK: Why It Matters Now,"Political Science , Public Policy , General"
Uncovering Clinton: A Reporter's Story,"Political Science , Government , General"
My Turn at the Bully Pulpit: Straight Talk About the Things That Drive Me Nuts,"Political Science , General"
WHOS IN CONTROL: Polar Politics and the Sensible Center,"Political Science , Political Process , General"
"The Savage Nation: Saving America from the Liberal Assault on Our Borders, Language, and Culture","Political Science , Political Ideologies , Conservatism & Liberalism"
Plunkitt of Tammany Hall,"Political Science , History & Theory"
An Unlikely Conservative,"Political Science , History & Theory"
"Deliver Us from Evil: Defeating Terrorism, Despotism, and Liberalism","Political Science , Terrorism"
The Book on Bush: How George W. (Mis)leads America,"Political Science , Political Process , Political Parties"
"The Price of Loyalty: George W. Bush, the White House, and the Education of Paul O'Neill","Political Science , History & Theory"
"Red, White & Liberal: How Left Is Right & Right Is Wrong","Political Science , Political Process , General"
Tell Newt to Shut Up: Prize-Winning Washington Post Journalists Reveal How Reality Gagged the Gingrich Revolution,"Political Science , American Government , General"
The Age of Sacred Terror,"Political Science , Security (National & International)"
6 Nightmares: The Real Threats to American Security...,"Political Science , Terrorism"
"We're Right, They're Wrong: A Handbook for Spirited Progressives","Political Science , General"
Scorpion Tongues: The Irresistible History of Gossip in American Politics,"Political Science , Political Process , General"
Locked in the Cabinet,"Political Science , Political Process , General"
"If It's Not Close, They Can't Cheat: Crushing the Democrats in Every Election and Why Your Life Depends on It","Political Science , Political Process , General"
Community-Building With Pacific Asia (Triangle Papers),"Political Science , Economic Conditions"
"Vote.com: How Big-Money Lobbyists and the Media are Losing Their Influence, and the Internet is Giving Power to the People","Political Science , Political Process , Elections"
1999: Victory Without War,"Political Science , General"
John F. Kerry: The Complete Biography By The Boston Globe Reporters Who Know Him Best (Publicaffairs Reports),"Political Science , American Government , Legislative Branch"
"Off with Their Heads: Traitors, Crooks, and Obstructionists in American Politics, Media, and Business","Political Science , General"
The Lost Art of Drawing the Line: How Fairness Went Too Far,"Political Science , Human Rights"
