Title,Category
"The Power of the Vote: Electing Presidents, Overthrowing Dictators, and Promoting Democracy Around the World","Political Science , Political Process , Campaigns & Elections"
The Italian Letter: How the Bush Administration Used a Fake Letter to Build the Case for War in Iraq,"Political Science , International Relations , General"
Europe Today,"Political Science , International Relations , General"
Seeing the Elephant: The U.S. Role in Global Security,"Political Science , Security (National & International)"
Institutions of American Democracy: The Judicial Branch,"Political Science , American Government , Judicial Branch"
Reason: Why Liberals Will Win the Battle for America,"Political Science , Political Process , General"
Will Israel Survive?,"Political Science , International Relations , General"
The Two Americas: Our Current Political Deadlock and How to Break It,"Political Science , History & Theory"
Kids Are Americans Too,"Political Science , Political Ideologies , Conservatism & Liberalism"
Reclaiming Conservatism: How a Great American Political Movement Got Lost--And How It Can Find Its Way Back,"Political Science , Political Process , Political Parties"
American Grit: What It Will Take to Survive and Win in the 21st Century,"Political Science , Political Ideologies , Conservatism & Liberalism"
"The Power of Progress: How America's Progressives Can (Once Again) Save Our Economy, Our Climate, and Our Country","Political Science , Political Process , Political Advocacy"
Congress And Its Members (Congress & Its Members),"Political Science , American Government , Legislative Branch"
View from the Eye of the Storm: Terror and Reason in the Middle East,"Political Science , International Relations , General"
History of the U.s. Marines,"Political Science , General"
You Have the Power: How to Take Back Our Country and Restore Democracy in America,"Political Science , Political Ideologies , Democracy"
Negotiating Arab-Israeli Peace: American Leadership in the Middle East,"Political Science , International Relations , Diplomacy"
THROUGH OUR ENEMIES' EYES (M),"Political Science , Terrorism"
The Paradox of American Power: Why the World's Only Superpower Can't Go It Alone,"Political Science , International Relations , General"
"Broken Government: How Republican Rule Destroyed the Legislative, Executive, and Judicial Branches","Political Science , American Government , General"
Can She Be Stopped?: Hillary Clinton Will Be the Next President of the United States Unless . . .,"Political Science , Political Process , Campaigns & Elections"
Spider's Web: The Secret History of How the White House Illegally Armed Iraq,"Political Science , General"
Countdown to Reform: The Greater Social Security Debate,"Political Science , Public Policy , Social Policy"
Clashing Views on Controversial Issues in World Politics (Taking Sides: Clashing Views on Controversial Issues in World Politics),"Political Science , General"
The WTO After Seattle,"Political Science , International Relations , General"
An Insiders Guide to the UN,"Political Science , General"
Drug Legalization: For and Against (For & Against Series),"Political Science , Public Policy , Social Policy"
Catastrophe,"Political Science , Political Ideologies , Conservatism & Liberalism"
Bringing the Jobs Home: How the Left Created the Outsourcing Crisis--and How We CanFix It,"Political Science , Reference"
"Chomsky for Beginners (WRITERS AND READERS BEGINNERS DOCUMENTARY COMIC BOOK, 80)","Political Science , Political Ideologies , General"
"They Never Said It: A Book of Fake Quotes, Misquotes, and Misleading Attributions","Political Science , International Relations , General"
Winning the Long War: Lessons from the Cold War for Defeating Terrorism and Preserving Freedom,"Political Science , General"
"Through Our Enemies' Eyes: Osama bin Laden, Radical Islam, and the Future of America","Political Science , Terrorism"
Stat for 21st Century,"Political Science , General"
50 Simple Things You Can Do to Fight the Right,"Political Science , Political Ideologies , Democracy"
The Men Who Stare at Goats,"Political Science , Intelligence & Espionage"
A Thyme for Peace,"Political Science , Peace"
Children of Open Adoption and Their Families,"Political Science , General"
unSpun: Finding Facts in a World of Disinformation,"Political Science , Political Process , General"
Soldiers: A History of Men in Battle,"Political Science , General"
Addicted to War: Why the U.S. Can't Kick Militarism,"Political Science , General"
"Back to Basics for the Republican Party, Second Edition","Political Science , Political Process , Political Parties"
Consumer's Medical Desk Reference: Information Your Doctor Can't or Won't Tell,"Political Science , General"
Your Government Failed You: Breaking the Cycle of National Security Disasters,"Political Science , American Government , General"
The Myth of Soviet Military Supremacy,"Political Science , General"
The Reagan Diaries,"Political Science , American Government , Executive Branch"
"The Bill of Rights, The Courts, and the Law","Political Science , History & Theory"
"The Citizens Almanac: Fundamental Documents, Symbols, and Anthems of the United States","Political Science , Civics & Citizenship"
The Major Film Theories: An Introduction (Galaxy Books),"Political Science , History & Theory"
Not on Our Watch: The Mission to End Genocide in Darfur and Beyond,"Political Science , International Relations , General"
Basic Facts About the United Nations,"Political Science , International Relations , General"
Inside the FDA: The Business and Politics Behind the Drugs We Take and the Food We Eat,"Political Science , American Government , National"
Secrets of the Kingdom: The Inside Story of the Secret Saudi-U.S. Connection,"Political Science , History & Theory"
"The Nixon Memo: Political Respectability, Russia, and the Press","Political Science , General"
50 Facts That Should Change The World,"Political Science , General"
The Conservative Crack-Up,"Political Science , General"
Classic Readings in Organizational Behavior,"Political Science , General"
Breach of Faith: Hurricane Katrina and the Near Death of a Great American City,"Political Science , American Government , General"
Reagan's Disciple: George W. Bush's Troubled Quest for a Presidential Legacy,"Political Science , Political Process , Political Parties"
The Threat Closer to Home: Hugo Chavez and the War Against America,"Political Science , Security (National & International)"
Global AIDS: Myths & Facts,"Political Science , General"
Rostenkowski: The Pursuit of Power and the End of the Old Politics,"Political Science , American Government , Legislative Branch"
Peace is Possible: Conversations with Arab and Israeli Leaders from 1988 to the Present,"Political Science , Peace"
"LIBERTY, EQUAILITY, POWER, VOL 2","Political Science , General"
Going Rouge: An American Nightmare,"Political Science , American Government , State"
Eyes on the Horizon: Serving on the Front Lines of National Security,"Political Science , International Relations , Diplomacy"
"How to Break a Terrorist: The U.S. Interrogators Who Used Brains, Not Brutality, to Take Down the Deadliest Man in Iraq","Political Science , Terrorism"
Innocent Abroad: An Intimate Account of American Peace Diplomacy in the Middle East,"Political Science , International Relations , Diplomacy"
Our Good Name: A Company's Fight to Defend Its Honor and Get the Truth Told About Abu Ghraib,"Political Science , Human Rights"
Bush's Brain: How Karl Rove Made George W. Bush Presidential,"Political Science , Political Process , Campaigns & Elections"
Tyrants: The World's 20 Worst Living Dictators,"Political Science , Political Freedom"
Leading by Example: How We Can Inspire an Energy and Security Revolution,"Political Science , Public Policy , Economic Policy"
Liberty for Latin America: How to Undo Five Hundred Years of State Oppression,"Political Science , General"
Feeling Your Pain: The Explosion and Abuse of Government Power in the Clinton-Gore Years,"Political Science , American Government , General"
A Tragic Legacy: How a Good vs. Evil Mentality Destroyed the Bush Presidency,"Political Science , Public Policy , General"
The Progress Paradox: How Life Gets Better While People Feel Worse,"Political Science , General"
7 Deadly Scenarios: A Military Futurist Explores War in the 21st Century,"Political Science , Security (National & International)"
What Do We Do Now?: A Workbook for the President-Elect,"Political Science , American Government , Executive Branch"
Liberty and Tyranny: A Conservative Manifesto,"Political Science , Political Ideologies , Conservatism & Liberalism"
Accountable: Making America as Good as Its Promise,"Political Science , Political Process , General"
The Coming Conflict with China,"Political Science , International Relations , General"
Jimmy Carter: The Liberal Left and World Chaos: A Carter/Obama Plan That Will Not Work,"Political Science , International Relations , General"
How Would a Patriot Act?: Defending American Values from a President Run Amok,"Political Science , American Government , National"
Chasing the Sun: Rethinking East Asian Policy,"Political Science , International Relations , General"
"Communists and Catholics in France, 1936-1939: The Politics of the Outstretched Hand (UNIVERSITY OF FLORIDA MONOGRAPHS SOCIAL SCIENCES)","Political Science , Comparative Politics"
With All Our Might: A Progressive Strategy for Defeating Jihadism and Defending Liberty,"Political Science , Terrorism"
Imperial Ambitions: Conversations on the Post-9/11 World (American Empire Project),"Political Science , Terrorism"
Arguing with Idiots: How to Stop Small Minds and Big Government,"Political Science , Political Ideologies , Conservatism & Liberalism"
The Stakes: America In The Middle East,"Political Science , International Relations , General"
Remembering Reagan,"Political Science , International Relations , General"
Where Does the Money Go?: Your Guided Tour to the Federal Budget Crisis (Guided Tour of the Economy),"Political Science , Public Policy , General"
Who Speaks For Islam?: What a Billion Muslims Really Think,"Political Science , Political Freedom"
Smart Power: Toward a Prudent Foreign Policy for America,"Political Science , International Relations , Diplomacy"
Cold War 1945-1991 2e,"Political Science , International Relations , General"
Technology in War: The Impact of Science on Weapon Development and Modern Battle (An Arco Military Book),"Political Science , General"
"War of Necessity, War of Choice: A Memoir of Two Iraq Wars","Political Science , Security (National & International)"
Comparative Politics: A Theoretical Framework,"Political Science , General"
Out of Bounds and Out of Control: Regulatory Enforcement at the EPA,"Political Science , Reference"
Difficult Transitions: Foreign Policy Troubles at the Outset of Presidential Power,"Political Science , American Government , Executive Branch"
Common Wealth: Economics for a Crowded Planet,"Political Science , Public Policy , Economic Policy"
"The Argument: Billionaires, Bloggers, and the Battle to Remake Democratic Politics","Political Science , Political Ideologies , Democracy"
Finding America's Voice: A Strategy for Reinvigorating U.S. Public Diplomacy (Council on Foreign Relations (Council on Foreign Relations Press)),"Political Science , International Relations , Diplomacy"
"Now They Call Me Infidel: Why I Renounced Jihad for America, Israel, and the War on Terror","Political Science , Political Ideologies , Conservatism & Liberalism"
Going Public: New Strategies of Presidential Leadership,"Political Science , Political Process , General"
"Introduction to Comparative Politics, AP* Edition","Political Science , General"
Healthy Competition: What's Holding Back Health Care and How to Free It,"Political Science , Public Policy , Social Services & Welfare"
Global Governance Reform: Breaking the Stalemate,"Political Science , International Relations , General"
Getting Results: A Guide For Federal Leaders And Managers,"Political Science , Public Affairs & Administration"
"Crazies to the Left of Me, Wimps to the Right: How One Side Lost Its Mind and the Other Lost Its Nerve","Political Science , Political Ideologies , Conservatism & Liberalism"
Current Issues 2006 Edition: Whose Music Is It? 2006-2007 SUPPLEMENT,"Political Science , General"
"Static: Government Liars, Media Cheerleaders, and the People Who Fight Back","Political Science , American Government , General"
"The Presidency and the Political System, 8th Edition","Political Science , Political Process , General"
"Politics of Congressional Elections (Longman Classics Series), The (6th Edition)","Political Science , General"
Comeback America: Turning the Country Around and Restoring Fiscal Responsibility,"Political Science , Public Policy , Economic Policy"
Green Zone (Imperial Life/Emerald City Movie Tie-In Edition),"Political Science , Security (National & International)"
The Death of American Virtue: Clinton vs. Starr,"Political Science , History & Theory"
Peace: The Words and Inspiration of Mahatma Gandhi (Me-We),"Political Science , Peace"
The Terror Presidency: Law and Judgment Inside the Bush Administration,"Political Science , American Government , Executive Branch"
"America's Promise Restored: Preventing Culture, Crusade, and Partisanship from Wrecking Our Nation","Political Science , International Relations , General"
Crunch: Why Do I Feel So Squeezed? (And Other Unsolved Economic Mysteries),"Political Science , International Relations , Diplomacy"
"Myths, Illusions, and Peace: Finding a New Direction for America in the Middle East","Political Science , International Relations , General"
"The Late Great USA: NAFTA, the North American Union, and the Threat of a Coming Merger with Mexico and Canada","Political Science , International Relations , General"
"The Prize: The Epic Quest for Oil, Money & Power","Political Science , International Relations , General"
Selected Speeches and Writings: Abraham Lincoln,"Political Science , General"
At the Point of a Gun: Democratic Dreams and Armed Intervention,"Political Science , Comparative Politics"
The Caged Virgin: An Emancipation Proclamation for Women and Islam,"Political Science , Civil Rights"
The Predator State: How Conservatives Abandoned the Free Market and Why Liberals Should Too,"Political Science , Public Policy , Economic Policy"
"Women, the State, and Welfare","Political Science , Public Policy , Social Services & Welfare"
The Age Of Terror,"Political Science , Political Freedom & Security , Terrorism"
The New Chinese Empire: Bejing's Political Dilemma And What It Means For The United States,"Political Science , General"
The U.N. Exposed: How the United Nations Sabotages America's Security and Fails the World,"Political Science , International Relations , General"
"Of the People, By the People, For the People","Political Science , General"
Public Policymaking in a Democratic Society: A Guide to Civic Engagement,"Political Science , Public Policy , General"
The Blue Pages: A Directory of Companies Rated by Their Politics and Practices,"Political Science , Reference"
Culture Warrior,"Political Science , Political Ideologies , Conservatism & Liberalism"
An Inconvenient Book: Real Solutions to the World's Biggest Problems,"Political Science , Political Ideologies , Conservatism & Liberalism"
The Limits of Power: The End of American Exceptionalism (American Empire Project),"Political Science , American Government , General"
Circle in the Sand: Why We Went Back to Iraq,"Political Science , International Relations , General"
Countdown to Crisis: The Coming Nuclear Showdown with Iran,"Political Science , Reference"
A Great Wall,"Political Science , International Relations , General"
ProBlogger: Secrets for Blogging Your Way to a Six-Figure Income,"Political Science , Political Process , General"
Obama's Challenge: America's Economic Crisis and the Power of a Transformative Presidency,"Political Science , American Government , Executive Branch"
Blueprint for Action: A Future Worth Creating,"Political Science , International Relations , General"
Myths and Facts: A Guide to the Arab-Israeli Conflict,"Political Science , International Relations , Arms Control"
Collapse: How Societies Choose to Fail or Succeed,"Political Science , Public Policy , Environmental Policy"
The Powers of War and Peace: The Constitution and Foreign Affairs after 9/11,"Political Science , International Relations , Treaties"
How Congress Works and Why You Should Care,"Political Science , American Government , Legislative Branch"
Time President Obama: The Path to The White House,"Political Science , American Government , Executive Branch"
From Beirut to Jerusalem,"Political Science , International Relations , General"
The Star-Spangled Banner: The Making of an American Icon,"Political Science , Political Ideologies , Nationalism & Patriotism"
"The Great Powers and the European States System, 1815-1914","Political Science , General"
Inside Game/Outside Game: Winning Strategies for Saving Urban America (Century Foundation Books (Brookings Hardcover)),"Political Science , Public Policy , Regional Planning"
Democracy's Good Name: The Rise and Risks of the World's Most Popular Form of Government,"Political Science , Political Ideologies , Democracy"
"Game Change: Obama and the Clintons, McCain and Palin, and the Race of a Lifetime","Political Science , Political Process , Campaigns & Elections"
"Hubris: The Inside Story of Spin, Scandal, and the Selling of the Iraq War","Political Science , American Government , General"
110 People Who Are Screwing Up America (and Al Franken Is #37),"Political Science , Political Ideologies , Conservatism & Liberalism"
"About Face: A History of America's Curious Relationship with China, from Nixon to Clinton","Political Science , International Relations , General"
A Bold Fresh Piece of Humanity,"Political Science , Commentary & Opinion"
"Better Parties, Better Government: A Realistic Program for Campaign Finance Reform","Political Science , Political Process , Political Parties"
"Freer Trade, Protected Environment: Balancing Trade Liberalization and Environmental Interests","Political Science , Public Policy , Environmental Policy"
A SHINING CITY: THE LEGACY OF RONALD REAGAN,"Political Science , Political Process , General"
"Interpreting China's Grand Strategy: Past, Present, and Future (Project Air Force)","Political Science , International Relations , General"
"Fleeced: How Barack Obama, Media Mockery of Terrorist Threats, Liberals Who Want to Kill Talk Radio, the Do-Nothing Congress, Companies That Help Iran, and Washington Lobbyists for Foreign Governments Are Scamming Us ... and What to Do About It","Political Science , Political Ideologies , Conservatism & Liberalism"
The Russia Balance Sheet,"Political Science , International Relations , General"
Inside a U.S. Embassy: How the Foreign Service Works for America,"Political Science , International Relations , Diplomacy"
Hope in Hell: Inside the World of Doctors Without Borders,"Political Science , NGOs (Non-Governmental Organizations)"
The Second Civil War: How Extreme Partisanship Has Paralyzed Washington and Polarized America,"Political Science , American Government , National"
Future Jihad: Terrorist Strategies Against America,"Political Science , Security (National & International)"
"The Foreigner's Gift: The Americans, the Arabs, and the Iraqis in Iraq","Political Science , International Relations , General"
The Children,"Political Science , Civil Rights"
Anti Americanism,"Political Science , International Relations , General"
The Rebirth of Europe,"Political Science , International Relations , General"
Making Washington Work: Tales of Innovation in the Federal Government,"Political Science , Political Process , General"
Thicker than Oil: America's Uneasy Partnership with Saudi Arabia,"Political Science , International Relations , Diplomacy"
Myths and Facts: A Guide to the Arab-Israeli Conflict,"Political Science , International Relations , General"
Democracy in America: Abridged Edition (Penguin Books for History: U.S.),"Political Science , General"
Politics In States And Communities,"Political Science , General"
You Can't Be President: The Outrageous Barriers to Democracy in America,"Political Science , Political Process , Campaigns & Elections"
50 Facts That Should Change The USA,"Political Science , Censorship"
The New Nuclear Danger: George W. Bush's Military-Industrial Complex,"Political Science , General"
No Right to Remain Silent: The Tragedy at Virginia Tech,"Political Science , General"
The World Is Flat: A Brief History of the Twenty-first Century,"Political Science , Globalization"
Half the Sky: Turning Oppression into Opportunity for Women Worldwide,"Political Science , Political Process , Political Advocacy"
The Looming Tower: Al-Qaeda and the Road to 9/11,"Political Science , Terrorism"
Bomb Power: The Modern Presidency and the National Security State,"Political Science , American Government , Executive Branch"
"American Conspiracies: Lies, Lies, and More Dirty Lies that the Government Tells Us","Political Science , American Government , National"
Jihad: The Rise of Militant Islam in Central Asia,"Political Science , Security (National & International)"
"The King and the Cowboy: Theodore Roosevelt and Edward the Seventh, Secret Partners","Political Science , International Relations , Diplomacy"
The Alliance: America-Europe-Japan Makers of the postwar world,"Political Science , History & Theory"
Upstream: The Ascendance of American Conservatism,"Political Science , Political Ideologies , Conservatism & Liberalism"
The Next Superpower?: The Rise of Europe and Its Challenge to the United States,"Political Science , International Relations , General"
Stop the Next War Now: Effective Responses to Violence and Terrorism,"Political Science , International Relations , General"
Architects of Air Power (The Epic of flight),"Political Science , General"
War and Anti-War: Making Sense of Today's Global Chaos,"Political Science , General"
Women Activists: Challenging the Abuse of Power,"Political Science , History & Theory"
The Battle for America 2008: The Story of an Extraordinary Election,"Political Science , Political Process , Campaigns & Elections"
"Understanding China: A Guide to China's Economy, History, and Political Culture","Political Science , History & Theory"
"Stones into Schools: Promoting Peace with Books, Not Bombs, in Afghanistan and Pakistan","Political Science , Human Rights"
To Save America: Stopping Obama's Secular-Socialist Machine,"Political Science , Public Policy , Economic Policy"
"Culture of Corruption: Obama and His Team of Tax Cheats, Crooks, and Cronies","Political Science , American Government , Executive Branch"
No Apology: The Case for American Greatness,"Political Science , International Relations , General"
2010: Take Back America: A Battle Plan,"Political Science , Political Process , General"
The Battle: How the Fight between Free Enterprise and Big Government Will Shape Americas Future,"Political Science , Public Policy , Economic Policy"
"The Promise: President Obama, Year One","Political Science , General"
Conservative Victory: Defeating Obama's Radical Agenda,"Political Science , Political Ideologies , Conservatism & Liberalism"
Half the Sky: Turning Oppression into Opportunity for Women Worldwide,"Political Science , Political Process , Political Advocacy"
Cyber War: The Next Threat to National Security and What to Do About It,"Political Science , Security (National & International)"
"American Government: Roots and Reform, 2009 Edition (10th Edition)","Political Science , General"
The Post-American World,"Political Science , Globalization"
How Soccer Explains the World: An Unlikely Theory of Globalization,"Political Science , Globalization"
Am Gov 2009,"Political Science , American Government , National"
"The Travels of a T-Shirt in the Global Economy: An Economist Examines the Markets, Power and Politics of the World Trade, 2nd Edition","Political Science , International Relations , Trade & Tariffs"
On the Brink: Inside the Race to Stop the Collapse of the Global Financial System,"Political Science , American Government , Executive Branch"
"The Manchurian President: Barack Obama's Ties to Communists, Socialists and Other Anti-American Extremists","Political Science , American Government , Executive Branch"
"Freefall: America, Free Markets, and the Sinking of the World Economy","Political Science , Public Policy , Economic Policy"
"Listen Up, Mr. President: Everything You Always Wanted Your President to Know and Do","Political Science , American Government , Executive Branch"
Essentials of International Relations (Fourth Edition) (The Norton Series in World Politics),"Political Science , History & Theory"
Killer Politics: How Big Money and Bad Politics Are Destroying the Great American Middle Class,"Political Science , Political Economy"
"Warriors for the West: Fighting Bureaucrats, Radical Groups, And Liberal Judges on America's Frontier","Political Science , Public Policy , Environmental Policy"
Whitehall,"Political Science , General"
How the Left Swiftboated America: The Liberal Media Conspiracy to Make You Think George Bush Was the Worst President in History,"Political Science , Political Ideologies , Conservatism & Liberalism"
A Resource Book for Senior Girl Scouts.,"Political Science , Public Policy , Social Policy"
The Obama Diaries,"Political Science , American Government , Executive Branch"
Modern Latin America,"Political Science , History & Theory"
