Title,Category
The Enemy Within: Straight Talk About the Power and Defeat of Sin,"Religion , Christian Theology , Ethics"
The Bible through the Ages,"Religion , Biblical Studies , General"
Pearls of Wisdom: A Harvest of Quotations from All Ages,"Religion , General"
The Illustrated Life of Jesus Christ,"Religion , Christianity , Literature & the Arts"
Finding Your Religion: When the Faith You Grew Up With Has Lost Its Meaning,"Religion , Spirituality"
The Book of Heaven,"Religion , Inspirational"
The Measure of a Man: 20 Attributes of a Godly Man,"Religion , Spirituality"
Experiencing the Passion of Jesus: A Discussion Guide on History's Most Important Event,"Religion , Christian Life , General"
God's Word for Today,"Religion , Christian Life , Devotional"
Joshua and the City,"Religion , Inspirational"
Women of Worth (Focus on the Family Women's Series),"Religion , Biblical Commentary , General"
Condi: The Condoleezza Rice Story,"Religion , Christian Life , General"
Footprints: Scripture with Reflections Inspired by the Best-loved Poem,"Religion , Spirituality"
Keeping a Princess Heart in a Not-So-Fairy-Tale World,"Religion , Christian Life , General"
A Guide to the Passion: 100 Questions About The Passion of The Christ,"Religion , Biblical Reference , General"
The Book of the Bible,"Religion , Reference"
Joy to the World,"Religion , Holidays , Christmas & Advent"
"Growing Up Catholic: The Millennium Edition: An Infinitely Funny Guide for the Faithful, the Fallen and Everyone In-Between","Humor , Topic , Religion"
The Complete Idiot's Guide to the World's Religions,"Religion , General"
Be Careful What You Pray For...You Just Might Get It,"Religion , Prayerbooks , General"
To the Ends of the Earth,"Religion , Biblical Commentary , New Testament"
"Christ, the Light of the World: A Devotional","Religion , Devotional"
The Koran: Selected Suras (Dover Thrift Editions),"Religion , Islam , Koran & Sacred Writings"
True Freedom: The Liberating Power of Prayer (LifeChange Books),"Religion , Christian Life , General"
One Hundred Graces,"Religion , Prayerbooks , General"
God's Little Instruction Book for Mom (God's Little Instruction Books),"Religion , Christian Life , Inspirational"
Anatomy of the Sacred: An Introduction to Religion,"Religion , General"
Mothers Day Ideals 2004 (Ideals Mother's Day),"Religion , Holidays , General"
All About Hanukkah,"Religion , Holidays , Jewish"
God Calling: Devotionals for Restoring Faith and Serenity,"Religion , Inspirational"
Today's Destructive Cults and Movements,"Religion , Cults"
Treasured Stories of Christmas: A Touching Collection of Stories That Bring Gifts from the Heart and Joy to the Soul,"Religion , General"
I’m Dreaming of Some White Chocolate: Christmas Reflections with a Little Holly & a Lot of Jolly,"Religion , Holidays , Christmas & Advent"
Mother Quotations (Quotations Books),"Religion , Counseling"
Joy to the World: A Victorian Christmas,"Religion , Holidays , Christmas & Advent"
Life's Little Instruction Book For Incurable Romantics A Pulse-quickening Collection For And About People In Love,"Religion , Christian Life , General"
The Cross: An Anthology (Nelson's Anthology),"Religion , Christianity , Literature & the Arts"
God's Promises for Your Every Need,"Religion , Inspirational"
God's Promises for Every Day,"Religion , Biblical Reference , Quotations"
The Facts on the New Age Movement (The Anker Series),"Religion , General"
My Country 'tis of Thee,"Religion , Inspirational"
Twelve Keys to an Effective Church: The Leaders' Guide,"Religion , Christian Church , Administration"
Christmas Ideals 2006 (IDEALS CHRISTMAS),"Religion , Holidays , General"
All Things Are Possible: Pass the Word,"Religion , Faith"
The Jesus I Never Knew,"Religion , Christian Life , Personal Growth"
Joy to the World,"Religion , Holidays , Christmas & Advent"
Christmas With God (Quiet Moments),"Religion , Devotional"
Season's Greetings,"Religion , Holidays , Christmas & Advent"
Prayers and Poems for Christmas,"Religion , Prayerbooks , Christian"
Christ Is Born,"Religion , Holidays , Christmas & Advent"
Things Seen and Unseen: A Year Lived in Faith,"Religion , Faith"
"Inside Narnia: A Guide to Exploring The Lion, the Witch and the Wardrobe","Religion , Christianity , Literature & the Arts"
"The Bondage Breaker: Overcoming Negative Thoughts, Irrational Feelings, Habitual Sins","Religion , Inspirational"
I'll Be Home for Christmas,"Religion , Inspirational"
The Life of David (Jewish Encounters),"Religion , Judaism , History"
English Spirituality in the Age of Wesley,"Religion , Spirituality"
Wild Truth Journal for Junior Highers,"Religion , Christian Ministry , Youth"
"So Help Me God: The Ten Commandments, Judicial Tyranny, and the Battle for Religious Freedom","Religion , Religion, Politics & State"
Fueled by Faith: Living Vibrantly in the Power of Prayer,"Religion , Inspirational"
Praying for Purpose for Women: A Prayer Experience That Will Change Your Life Forever (Pathway to Purpose),"Religion , Prayer"
Christmas: An Annual Treasury,"Religion , Holidays , Christmas & Advent"
God Can Handle It . . .Graduates,"Religion , Inspirational"
Escape the Coming Night,"Religion , Biblical Commentary , Old Testament"
Corporate Giants: Personal Stories of Faith and Finance,"Religion , Faith"
The Elements of Judaism,"Religion , General"
Kabbalah: The Divine Plan (The Hidden Wisdom Library),"Religion , General"
Islam for Beginners,"Religion , Islam , General"
Dancing with Dinosaurs: Ministry in a Hostile & Hurting World,"Religion , Christian Ministry , Pastoral Resources"
Smashing the Idols: A Jewish Inquiry into the Cult Phenomenon,"Religion , Christianity , Catholic"
Some of My Best Friends Are Jewish,"Humor , Topic , Religion"
Joy To The World: The Christmas Story & Carols,"Religion , Christianity , Methodist"
Silent Night,"Religion , Holidays , Christmas & Advent"
Believe,"Religion , Inspirational"
The Seventh Day: The Story of the Jewish Sabbath,"Religion , General"
Have a Merry Little Christmas,"Religion , Holidays , Christmas & Advent"
When the Saints Go Marching Out! : Mobilizing the Church for Mission,"Religion , Christian Ministry , Pastoral Resources"
Encouraging One Another (Women of Faith Study Guide Series),"Religion , Biblical Studies , Bible Study Guides"
Fresh Brewed Life A Stirring Invitation To Wake Up Your Soul,"Religion , Christian Life , General"
The Greatest Gift,"Religion , Inspirational"
Sun Myung Moon and the Unification Church,"Religion , General"
Stories of Heart and Home,"Religion , Christian Life , General"
Masonic Lodge,"Religion , Comparative Religion"
The New Age Cult,"Religion , General"
Confronting the Cults,"Religion , General"
Jewish Humor: What the Best Jewish Jokes Say About the Jews,"Religion , Judaism , General"
The Book of J,"Religion , Biblical Studies , General"
Light for the Path (Every Day Light Series) (Vol 3),"Religion , Devotional"
Mourning & Mitzvah: A Guided Journal for Walking the Mourner's Path Through Grief to Healing,"Religion , Judaism , Rituals & Practice"
Blue Like Jazz: Nonreligious Thoughts on Christian Spirituality,"Religion , Spirituality"
Where Is God When It Hurts?,"Religion , Spirituality"
Traditions of Christmas,"Religion , Inspirational"
Concise Dictionary of Christianity in America,"Religion , Reference"
The Dieter's Prayer Book,"Religion , Prayerbooks , General"
Getting Through the Tough Stuff: It's Always Something!,"Religion , Christian Ministry , Pastoral Resources"
Celebrating the Wonder of Motherhood: Intimate Moments With My Daughter Mikayla and the Septuplets,"Religion , Devotional"
The Bible and the Qur'an,"Religion , Christianity , Catholic"
"Becoming a Thinking Christian: If We Want Church Renewal, We Will Have to Renew Thinking in the Church","Religion , Christian Theology , General"
Baptism,"Religion , Christianity , Lutheran"
Hard Questions About Christianity Made Easy: An Easy-To-Understand Pocket Reference (Bible Made Easy),"Religion , Christianity , General"
When to Speak Up and When To Shut Up,"Religion , Christian Life , General"
Rick Warren and the Purpose That Drives Him: An Insider Looks at the Phenomenal Bestseller,"Religion , Inspirational"
"The Complete Bar/Bat Mitzvah Planner: An Indispendable, Money - Saving Workbook For Organizing Every Aspect Of The Event - From Temple Services To Reception","Religion , Judaism , Rituals & Practice"
In Search of the Real Spirit of Christmas,"Religion , Holidays , Christmas & Advent"
Guideposts for the Spirit: Stories of Faith for Mothers,"Religion , Inspirational"
The World's Religions,"Religion , Biblical Reference , General"
Understanding Secular Religions (Handbook of Today's Religions),"Religion , General"
"Phillips' Book of Great Thoughts & Funny Sayings: A Stupendous Collection of Quotes, Quips, Epigrams, Witticisms, and Humorous Comments. For Personal Enjoyment and Ready Reference.","Religion , Biblical Reference , Quotations"
The Da Vinci Deception,"Religion , Spirituality"
The Twelve Teas of Christmas,"Religion , Holidays , General"
The bad Popes,"Religion , Christianity , Catholic"
Encyclopedia of Judaism,"Religion , General"
The Truth Behind the Da Vinci Code: A Challenging Response to the Bestselling Novel,"Religion , Christianity , General"
Christianity On Trial: Arguments Against Anti-Religious Bigotry,"Religion , Christianity , General"
The Golden Books Treasury of Prayers From Around the World,"Juvenile Nonfiction , Religion , General"
A Little Inspiration for a Prayer-Filled Day,"Religion , Christian Life , General"
The Imitation of Christ (Dover Thrift Editions),"Religion , Devotional"
The Case for Christ: A Journalist's Personal Investigation of the Evidence for Jesus (Student Edition),"Religion , Christianity , General"
"Patti's Pearls: Lessons in Living Genuinely, Joyfully, Generously","Religion , Inspirational"
A Child's Book of Parables,"Juvenile Nonfiction , Religion , Bible Stories , General"
Controlling Your Emotions Before They Control You,"Religion , Counseling"
The Unauthorized Version: Truth and Fiction in the Bible,"Religion , General"
Bonhoeffer's Legacy: The Christian Way in a World Without Religion,"Religion , General"
Stories for the Heart: Over 100 Stories to Encourage Your Soul,"Religion , Inspirational"
God's Words of Life for Teens,"Religion , Christian Life , Inspirational"
A Life God Rewards for Teens (Breakthrough Series),"Religion , Christian Life , General"
Irish Blessings: An Illustrated Edition,"Religion , General"
The Trouble with Jesus,"Religion , Christian Life , General"
Jewish Wit and Wisdom (Dover Thrift Editions),"Humor , Topic , Religion"
After Suicide (Christian Care Books),"Religion , Christian Ministry , Counseling & Recovery"
Christmas: Celebrating The Joy of Faith and Family (God's Way),"Religion , Devotional"
For unto Us a Child Is Born,"Religion , Holidays , Christmas & Advent"
The Shengold Jewish Encyclopedia,"Religion , Biblical Reference , Dictionaries & Encyclopedias"
"The Good Life: Seeking Purpose, Meaning, and Truth in Your Life","Religion , Christian Life , General"
Stories Behind the Great Traditions of Christmas (Stories Behind Books),"Religion , Holidays , Christmas & Advent"
Were They Wise Men or Kings?: The Book of Christmas Questions,"Religion , Holidays , Christian"
The Ten Words That Will Change a Nation: The Ten Commandments,"Religion , Education"
A Little Inspiration for a FAITH-Filled Day,"Religion , Christian Life , General"
The Complete Book of Bible Literacy,"Religion , Biblical Reference , General"
"Peter, Paul, and Mary Magdalene: The Followers of Jesus in History and Legend","Religion , Christianity , History"
Lose It for Life,"Religion , Christian Life , General"
The Papa Prayer: The Prayer You've Never Prayed,"Religion , Christian Life , General"
Promise to Mary: A Story of Faith in Action,"Religion , History"
Transforming Children Into Spiritual Champions: Why Children Should Be Your Church's #1 Priority,"Religion , Christian Ministry , Pastoral Resources"
On Becoming Baby Wise,"Religion , General"
The Legend and the Apostle: The Battle for Paul in Story and Canon,"Religion , Biblical Studies , General"
Nine Parts of Desire: The Hidden World of Islamic Women,"Religion , Islam , General"
Deceptions and Myths of the Bible,"Religion , Biblical Studies , General"
God Was Not in the Fire: The Search for a Spiritual Judaism,"Religion , Judaism , General"
Jewish Worship,"Religion , Judaism , Rituals & Practice"
Good Marriages Take Time: Bad Marriages Take More Time,"Religion , General"
Approval Addiction: Overcoming Your Need to Please Everyone,"Religion , Christian Living , General"
How to Hear from God: Learn to Know His Voice and Make Right Decisions,"Religion , Christian Living , General"
Living as Partners With God,"Juvenile Nonfiction , Religion , Judaism"
The Book of the Jewish Year,"Religion , General"
Making All Things New: An Invitation to the Spiritual Life,"Religion , Spirituality"
Fire in the Soul: A New Psychology of Spiritual Optimism,"Religion , Spirituality"
"Look Great, Feel Great: 12 Keys to Enjoying a Healthy Life Now","Religion , Spirituality"
History of the Amish: Revised And Updated,"Religion , Christianity , Amish"
How to Encourage the Man in Your Life,"Religion , Christian Life , General"
Shepherding a Child's Heart,"Religion , Christian Theology , General"
Being the Body,"Religion , Institutions & Organizations"
The Gifts of the Jews (Hinges of History),"Religion , Judaism , History"
"The Many Faces of Judaism: Orthodox, Conservative, Reconstructionist, and Reform","Religion , Judaism , General"
"Adam, Eve, and the Serpent: Sex and Politics in Early Christianity","Religion , Christian Theology , General"
The Jewish Baby Book,"Religion , General"
"Hugs for Those in Love: Stories, Sayings, and Scriptures to Encourage and Inspire the Heart","Religion , Christian Life , General"
The Jew in the Lotus: A Poet's Re-Discovery of Jewish Identity in Buddhist India,"Religion , Judaism , General"
A History of Israel (Westminster AIDS to the Study of the Scriptures),"Religion , Biblical Studies , Old Testament"
The Adversary: The Christian Versus Demon Activity,"Religion , Reference"
Ministering Cross-Culturally: An Incarnational Model for Personal Relationships,"Religion , General"
The Life God Blesses: The Secret of Enjoying God's Favor,"Religion , Christian Life , General"
Reel Spirituality: Theology and Film in Dialogue (Engaging Culture),"Religion , Christian Theology , General"
The Ten Commandments of Dating,"Religion , Christian Life , General"
Seasons of Grace,"Religion , General"
Her Choice to Heal: Finding Spiritual and Emotional Peace After Abortion,"Religion , Ethics"
With Open Hands,"Religion , Prayer"
The Prayer of Jabez for Women,"Religion , Biblical Meditations , Old Testament"
A Thirst for Wholeness,"Religion , General"
When God Doesn't Make Sense,"Religion , Christian Life , General"
Sexy Girls: How Hot Is Too Hot?,"Young Adult Nonfiction , Religion , Christianity"
Scientology: The Fundamentals of Thought,"Religion , Scientology"
Stories for the Extreme Teen's Heart: Over One Hundred Treasures to Touch Your Soul (Stories for the Heart Series Endcap Kit),"Religion , Inspirational"
Every Man's Battle: Winning the War on Sexual Temptation One Victory at a Time (The Every Man Series),"Religion , Christian Life , General"
Christianity and Paganism in the Fourth to Eighth Centuries,"Religion , Christianity , History"
Chicken Soup for the Jewish Soul: 101 Stories to Open the Heart and Rekindle the Spirit (Chicken Soup for the Soul),"Religion , Atheism"
Why Be Different: A Look into Judaism,"Young Adult Nonfiction , Religion , Judaism"
Christianity in Crisis,"Religion , Christianity , General"
Intended for Pleasure: New Approaches to Sexual Intimacy in Christian Marriage,"Religion , Ethics"
Prison or Paradise: The New Religious Cults,"Religion , General"
The Blessing of a Skinned Knee: Using Jewish Teachings to Raise Self-Reliant Children,"Religion , Judaism , General"
Our God Is Awesome,"Religion , Christian Life , General"
Trusting God: Even When Life Hurts,"Religion , Christian Life , Spiritual Growth"
31 Days of Praise: Enjoying God Anew (31 Days Series),"Religion , Christian Life , General"
Celebration of Discipline: The path to Spiritual Growth,"Religion , Spirituality"
The Power of Prayer and Fasting: 10 Secrets of Spiritual Strength,"Religion , Spirituality"
Let's Get To Know Each Other,"Religion , Christianity , History"
Handle With Prayer,"Religion , Prayerbooks , Christian"
"Help, Lord! I'm Having A Senior Moment: Notes to God on Growing Older","Religion , Christian Living , General"
WHO SWITCHED PRICE T,"Religion , Christian Life , General"
Victory in the Valleys of Life,"Religion , General"
The Normal Christian Life,"Religion , Christian Life , General"
How to Prepare for the Coming Persecution,"Religion , General"
Bedtime Bible Story Book: 365 Read-aloud Stories from the Bible,"Juvenile Nonfiction , Religion , Bible Stories , General"
Light on Your Path: True Stories and Scriptures for Young Readers,"Juvenile Nonfiction , Religion , Bible Stories , General"
No God but God: Egypt and the Triumph of Islam,"Religion , Islam , General"
"True Identity: The Bible for Women -  Becoming Who You Are In Christ, Today's New International Version","Religion , General"
Come Thirsty Workbook: Receive What Your Soul Longs For,"Religion , Christian Living , General"
A Family Christmas,"Religion , Holidays , Christmas & Advent"
Proverbs: Learning to Live Wisely (A Life Guide Bible Study),"Religion , Biblical Studies , Old Testament"
A Travel Guide to Heaven (Random House Large Print),"Religion , Spirituality"
Really Important Stuff My Kids Have Taught Me,"Religion , General"
The Family Manager,"Religion , Christian Life , Family"
Breath of Heaven,"Religion , Holidays , Christmas & Advent"
God Is Closer Than You Think: This Can Be the Greatest Moment of Your Life Because This Moment Is the Place Where You Can Meet God,"Religion , Christian Theology , General"
The Jewish Book of Why,"Religion , Judaism , General"
"Eunuchs for the Kingdom of Heaven: Women, Sexuality, and the Catholic Church","Religion , General"
Cosmic Conflict: Good and Evil Wage War for Planet Earth,"Religion , Christian Church , History"
Simply Jesus: Experiencing the One Your Heart Longs For (LifeChange Books),"Religion , Christian Life , General"
The Prayer of Jesus : The Promise and Power of Living in the Lord's Prayer,"Religion , Christian Living , General"
Names of God,"Religion , Theology"
The Golfer's Tee Time Devotional: Inspiration from the Rich Traditions of Golf,"Religion , General"
A Woman After God's Own Heart®,"Religion , Prayerbooks , Christian"
Mocha with Max: Friendly Thoughts & Simple Truths from the Writings of Max Lucado,"Religion , Inspirational"
Character Counts: A Guide for Accountability Groups,"Religion , Christianity , General"
"Living Lights, Shining Stars","Religion , Christian Life , General"
"Be Right : How to be Right with God, Yourself, and Others  (An Expository Study of Romans)","Religion , Biblical Commentary , New Testament"
Hurt Healing and Happy Again,"Religion , General"
Who Put All These Cucumbers in My Garden,"Religion , General"
The Book,"Religion , Biblical Studies , General"
Epistles/Now,"Religion , General"
Chicken Soup for the Christian Soul (Chicken Soup for the Soul),"Religion , Christian Life , General"
The Third Jesus: The Christ We Cannot Ignore,"Religion , Spirituality"
Atlas of the Bible: An Illustrated Guide to the Holy Land (Readers Digest),"Religion , General"
The Easter Women: Luke 7:36-8.3; 23:55-24:12; John 20:1-18 for Children (Quality Religious Books for Children),"Religion , General"
Walking with the Savior,"Religion , Inspirational"
Biblical Meditations for the Easter Season,"Religion , Meditations"
Sing Alleluia!: An Easter Story for Children,"Religion , Holidays , Easter & Lent"
When Jesus Was Born,"Juvenile Nonfiction , Religion , General"
Proverbs (The Message),"Religion , Biblical Studies , New Testament"
The Ten Commandments and Human Rights (Overtures to Biblical Theology),"Religion , Christian Theology , General"
Red Sky in the Morning: How You Can Help Prevent America's Gathering Storms,"Religion , Spirituality"
Bible Classics: Stories from the Old Testament (Precious Moments),"Juvenile Nonfiction , Religion , Christianity"
Major United Methodist Beliefs,"Religion , Christianity , Methodist"
Power Thoughts: Achieve Your True Potential Through Power Thinking,"Religion , Inspirational"
Queen of Angels,"Religion , General"
Bible Promise Book for Women,"Religion , General"
Jesus & the Riddle of the Dead Sea Scrolls: Unlocking the Secrets of His Life Story,"Religion , General"
Messiah: War in the Middle East & the Road to Armageddon,"Religion , General"
God's Little Devotional Book,"Religion , General"
Bubble Gum and Chalk Dust: Prayers and Poems for Teachers,"Religion , General"
Acts 1-12: God Moves in the Early Church (Fisherman Bible Studyguide Series),"Religion , Biblical Studies , General"
Seven Stories of Christmas Love,"Religion , Holidays , Christmas & Advent"
Peace With God,"Religion , Christian Theology , General"
Letters to the Corinthians (The Daily Study Bible Series.--Rev. Ed) (English and Hebrew Edition),"Religion , Biblical Commentary , New Testament"
Never Alone: A Personal Way to God by the author of JOSHUA,"Religion , Inspirational"
Husbands Who Won't Lead and Wives Who Won't Follow,"Religion , Christian Life , General"
"Help, Lord! I'm Having a Senior Moment: Notes to God on Growing Older","Religion , Devotional"
Angel Book: A Handbook for Aspiring Angels,"Religion , General"
Leading Life-Changing Small Groups-paperback,"Religion , Christian Ministry , General"
Stories From a Soldier's Heart: For the Patriotic Soul,"Religion , Inspirational"
Interpreter's Concise Commentary Pentateuch,"Religion , General"
"To Run and Not Grow Tired: Restoring Your Faith in Times of Trauma, Hurt, or Depression (Fran Sciacca Bible Studies)","Religion , Biblical Studies , General"
When a Jew Celebrates (The Jewish Values Series),"Religion , Biblical Studies , General"
Speaking the Truth in Love: How To Be an Assertive Christian,"Religion , General"
After Jesus: The Triumph of Christianity,"Religion , Christianity , General"
Jews: The Essence and Character of a People,"Religion , Judaism , General"
No Greater Love,"Religion , Christianity , General"
A Forgiving God in an Unforgiving World,"Religion , General"
Who Killed Jesus?: Exposing the Roots of Anti-Semitism in the Gospel Story of the Death of Jesus,"Religion , General"
The Book of Catholic Customs and Traditions,"Religion , General"
Cups of Light and Other Illustrations for Sermons and Devotions,"Religion , Christian Ministry , Preaching"
Husbands Who Won't Lead and Wives Who Won't Follow,"Religion , Christian Life , General"
Studies in the Sermon on the Mount: God's Character and the Believer's Conduct (OSWALD CHAMBERS LIBRARY),"Religion , Christian Life , Personal Growth"
"Gifts from a Course in Miracles: Accept This Gift, A Gift of Peace, A Gift of Healing","Religion , Christianity , General"
Hustling God: Why We Work So Hard for What God Wants to Give,"Religion , Christian Life , General"
"Daily Word: Love, Inspiration, And Guidance For Everyone","Religion , Devotional"
Traveling Light: Releasing the Burdens You Were Never Intended to Bear,"Religion , Christian Life , General"
With Faces to the Evening Sun: Faith Stories from the Nursing Home,"Religion , Prayerbooks , Christian"
It's Not the Same Without You: Coming Home to the Catholic Church,"Religion , Christianity , Catholic"
Growing Through Mid-Life Crises: Thoughts from Solomon and Others,"Religion , General"
Loving God,"Religion , Inspirational"
The Maker's Diet,"Religion , Christian Living , General"
Walking the Bible: A Journey by Land Through the Five Books of Moses,"Religion , Biblical Studies , Old Testament"
Stand Like Mountain Flow Like Water: Reflections on Stress and Human Spirituality Revised and Expanded Tenth Anniversary Edition,"Religion , Christian Life , General"
So You're Thinking About Homeschooling: Fifteen Families Show How You Can Do It,"Religion , Christian Life , General"
Power of the Plus Factor,"Religion , General"
Building Up One Another,"Religion , Christian Life , General"
The Day the Little Children Came (Arch Books),"Juvenile Nonfiction , Religion , Bible Stories , General"
Grace Walk: What You've Always Wanted in The Christian Life,"Religion , Christian Life , Devotional"
Intimate Friendship with God: Through Understanding the Fear of the Lord,"Religion , General"
"Grandma, Do You Remember When?: Sharing a Lifetime of Loving Memories--A Keepsake Journal","Religion , Christian Living , General"
Know Why You Believe,"Religion , Faith"
Living Faith,"Religion , Christian Life , General"
The Art of Happiness: A Handbook for Living,"Religion , Buddhism , General"
Jesus: A Life,"Religion , General"
Susanna Wesley (The Sowers),"Religion , Christianity , Methodist"
Bible Teachings Made Easy: Answers to Tough Bible Questions,"Religion , Biblical Studies , General"
Unfailing Love - Participant's Workbook: Growing Closer to Jesus Christ (Sisters Bible Study),"Religion , Christian Life , Women's Issues"
Sacred Rage: The Wrath of Militant Islam,"Religion , Islam , General"
The Glory of Christmas: Thoughts on God's Great Grace,"Religion , Holidays , Christmas & Advent"
Remembering the Future: The Challenge of the Churches in Europe,"Religion , Christianity , History"
Messy Spirituality: God's Annoying Love for Imperfect People,"Religion , Spirituality"
