Title,Category
The Genesis of Ethics,"Religion , Ethics"
The Good Book: Reading the Bible with Mind and Heart,"Religion , Biblical Biography , General"
Meditations: On the Monk Who Dwells in Daily Life,"Religion , General"
Joshua and the City,"Religion , Inspirational"
How Good Do We Have to Be? A New Understanding of Guilt and Forgiveness,"Religion , Psychology of Religion"
Standing for Something: 10 Neglected Virtues That Will Heal Our Hearts and Homes,"Religion , Christianity , Church of Jesus Christ of Latter-day Saints (Mormon)"
May I Have This Dance?,"Religion , Devotional"
"Meditations from Conversations with God: An Uncommon Dialogue, Book 1 (Conversations with God Series)","Religion , Meditations"
What My Parents Did Right,"Religion , Christian Life , Family"
The View from a Monastery,"Religion , Monasticism"
Who Needs God,"Religion , Spirituality"
How To Live Through A Bad Day: 7 Powerful Insights From Christ's Words on the Cross,"Religion , Christian Life , General"
The Heart of a Leader,"Religion , Inspirational"
Friendship with God: an uncommon dialogue,"Religion , Spirituality"
Extravagant Grace,"Religion , Inspirational"
Keeping Your Kids Catholic: It May Seem Impossible but It Can Be Done,"Religion , General"
The Gift of Sex: A Guide to Sexual Fulfillment,"Religion , Christian Life , General"
The Biblical Road to Blessing,"Religion , Christian Life , Spiritual Growth"
Guide to Cults and New Religions,"Religion , Cults"
The Dancing Healers: A Doctor's Journey of Healing with Native Americans,"Religion , Ethnic & Tribal"
The Way of the Wizard: Twenty Spiritual Lessons for Creating the Life You Want,"Religion , Spirituality"
Inner Revolution,"Religion , Buddhism , General"
Three Gospels,"Religion , Biblical Studies , General"
Why Can't I Fall in Love? A 12-Step Program,"Religion , Judaism , General"
Just Build the Ark and the Animals Will Come:: Children on Bible Stories,"Religion , General"
Romans,"Religion , Biblical Studies , New Testament , Paul's Letters"
Don't Know Much About the Bible: Everything You Need to Know About the Good Book but Never Learned,"Religion , Biblical Studies , General"
Irish Druids and Old Irish Religions,"Religion , Ethnic & Tribal"
Quiet Times for Couples,"Religion , Devotional"
A Contest of Faiths: Missionary Women and Pluralism in the America Southwest,"Religion , General"
After the Boxes Are Unpacked,"Religion , Christian Living , Women's Interests"
The Book of Ch'I: Harnessing the Healing Forces of Energy,"Religion , Spirituality"
Plain and Simple: A Woman's Journey to the Amish,"Religion , Christianity , Amish"
"The Education of the Heart: Readings and Sources for Care of the Soul, Soul Mates, and The Re-Enchantment of Everyday Life","Religion , General"
Lessons from the Fairway: Inspirational Stories from the Fairway for the Yound and Old Alike!,"Religion , Christian Life , General"
Your Sacred Self,"Religion , General"
Sacred Stories: A Celebration of the Power of Story to Transform and Heal,"Religion , General"
"In Buddha's Kitchen : Cooking, Being Cooked, and Other Adventures at a Meditation Center","Religion , Buddhism , General"
The World Of Biblical Literature,"Religion , General"
Praying God's Will For Your Life: A Prayerful Walk To Spiritual Well Being,"Religion , Christian Living , Prayer"
"The United Lutheran Church in America, 1918-1962","Religion , Christianity , Lutheran"
God's Psychiatry: Healing for the Troubled Heart and Spirit,"Religion , Meditations"
A Reason For Hope: Gaining Strength for Your Fight Against Cancer,"Religion , Christian Life , Devotional"
One Day My Soul Just Opened Up: 40 Days and 40 Nights Toward Spiritual Strength and Personal Growth,"Religion , Inspirational"
Holy Siege: The Year That Shook Catholic America,"Religion , General"
"Why Me?: Coping With Grief, Loss and Change","Religion , General"
Anyway: The Paradoxical Commandments: Finding Personal Meaning in a Crazy World,"Religion , Christian Living , General"
A Singular Devotion: 366 Portraits of Singles Who Have Changed the World,"Religion , General"
Secret Language of the Soul: A Visual Exploration of the Spiritual World,"Religion , General"
Life Lines: Holding on (and Letting Go),"Religion , Inspirational"
The Story of the Bible,"Religion , General"
Go for the Goal: Motivational Stories about Men of Achievement,"Religion , Inspirational"
Pulling Weeds Planting Seeds: Growing Character in Your Life and Family,"Religion , General"
Rekindling the Flame: How Jews Are Coming Back to Their Faith,"Religion , Judaism , General"
"God Said It, Don't Sweat It: How to Keep Life's Petty Hassles from Overwhelming You","Religion , Inspirational"
American Judaism: Adventure in Modernity,"Religion , General"
Beyond Jabez: Expanding Your Borders,"Religion , Christian Living , General"
How to Get Along with Difficult People,"Religion , Christian Life , General"
Angels Unawares,"Religion , Spirituality"
A People Adrift : The Crisis of the Roman Catholic Church in America,"Religion , Christianity , Catholic"
Envisioning a Sustainable Society: Learning Our Way Out (SUNY series in Environmental Public Policy),"Religion , Religion & Science"
The Power of Positive Living,"Religion , General"
"Life Is Tough, But God Is Faithful: How to See God's Love in Difficult Times","Religion , Christian Life , General"
Straight Talk: Overcoming Emotional Battles with the Power of God's Word,"Religion , Christian Living , General"
Eerdmans' Handbook to Christianity in America,"Religion , General"
A Promise Is a Promise: An Almost Unbelievable Story of a Mother's Unconditional Love and What It Can Teach Us,"Religion , Inspirational"
The Mission: Inside the Church of Jesus Christ of Latter-Day Saints,"Religion , General"
Living Without Electricity (People's Place Book No. 9),"Religion , Christianity , Amish"
Tender Warrior: God's Intention for a Man,"Religion , Devotional"
Why I Am a Muslim,"Religion , Sikhism"
"Understanding Islam: An Introduction to the Muslim World, Third Edition","Religion , Islam , Rituals & Practice"
Talking To Your Children About God,"Religion , Christianity , General"
Something More: Excavating Your Authentic Self,"Religion , Christian Life , General"
Crossing the Threshold of Hope (Random House Large Print),"Religion , General"
The Song of Eve: Mythology and Symbols of the Goddess,"Religion , General"
A Mother's Legacy: Wisdom from Mothers to Daughters,"Religion , Inspirational"
Tortured for Christ,"Religion , Christianity , Lutheran"
When the Fairy Dust Settles: A Mother and Her Daughter Discuss What Really Matters,"Religion , Christian Living , General"
Love Is Letting Go of Fear,"Religion , Spirituality"
Cooking With Hot Flashes: And Other Ways to Make Middle Age Profitable,"Humor , Topic , Religion"
Crossing the Threshold of Hope,"Religion , Christianity , Catholic"
Partners in Prayer,"Religion , Prayer"
Our Christian Symbols,"Religion , Reference"
Unfinished Work,"Religion , Christian Life , General"
For Those Who Can't Believe : Overcoming the Obstacles to Faith,"Religion , Inspirational"
Larry Burkett's Little Instruction Book on Managing Your Money,"Religion , General"
Keys to Becoming an Effective Worship Leader (Tom Kraeuter on Worship)(old edition),"Religion , Christian Education , Children & Youth"
The Daily Chase,"Religion , Christianity , Literature & the Arts"
The Rainbow People of God: The Making of a Peaceful Revolution,"Religion , History"
Yield to Jesus (Y2J): A Devotional,"Religion , Devotional"
The Zippered Heart: Healing for the Secrets We Hide Inside,"Religion , Christian Life , General"
"Every Man, God's Man Workbook: Pursuing Courageous Faith and Daily Integrity (The Every Man Series)","Religion , Christian Life , General"
Voices of Strength And Hope for a Friend With AIDS,"Religion , General"
Harry Potter and the Bible : The Menace Behind the Magick,"Religion , Cults"
Knowing God Intimately: Being as Close to Him as You Want to Be,"Religion , Christian Life , General"
Understanding Bible Prophecy for Yourself (Tim LaHaye Prophecy Library),"Religion , Biblical Studies , General"
Tea With Patsy Clairmont,"Religion , Christian Life , General"
If I Gave You God's Phone Number.... Searching for Spirituality in America,"Religion , Spirituality"
The Darkness And The Dawn,"Religion , Christian Life , General"
The Father Connection: How You Can Make the Difference in Your Child's Self-Esteem and Sense of Purpose,"Religion , Christian Living , Men's Interests"
Soul Matters For Men,"Religion , Christian Life , General"
Baby's First Bible,"Juvenile Nonfiction , Religion , Bible Stories , General"
Dead Sea Scrolls Deception,"Religion , General"
Doorways to Christian Growth,"Religion , Christian Theology , General"
Essential Tibetan Buddhism,"Religion , Reference"
Number Our Days: A Triumph of Continuity and Culture Among Jewish Old People in an Urban Ghetto,"Religion , Judaism , General"
"Precious Moments Angel Kisses and Snuggle-Time Prayers: A Collection of Verses, Prayers, and Quiet Moments of Love","Religion , Inspirational"
The Way of the Spirit,"Religion , Ethnic & Tribal"
"Ancient Wells, Living Water: God Invites You to Come and Drink","Religion , Spirituality"
You Are God's Gift to Me,"Religion , Inspirational"
Men Astutely Trained: A History of the Jesuits in the American Century,"Religion , History"
"Your People Shall Be My People: How Israel, the Jews and the Christian Church Will Come together in the Last Days","Religion , Biblical Commentary , Old Testament"
The Hope Chest,"Religion , Biblical Reference , Quotations"
The Grace Awakening,"Religion , General"
No Greater Savior,"Religion , General"
"Walking on Thorns, the Call to Christian Obedience","Religion , General"
The Ten Commandments,"Religion , Inspirational"
The Workbook on Spiritual Disciplines (Maxie Dunnam Workbook Series),"Religion , Spirituality"
Amazed by Grace,"Religion , Christian Living , General"
The Student Bible Dictionary,"Religion , Biblical Reference , Dictionaries & Encyclopedias"
Into The Garden: A Wedding Anthology: Poetry and Prose on Love and Marriage,"Religion , Inspirational"
Soul Matters For Teens,"Religion , Christian Life , General"
Transforming Bible Study with Children: A Guide for Learning Together,"Religion , Christian Education , Children & Youth"
"Science and Health with Key to the Scriptures (Authorized, Trade Ed.)","Religion , Religion & Science"
"The Ten Commandments of Character: Essential Advice for Living an Honorable, Ethical, Honest Life","Religion , Ethics"
The Last of the Giants: Lifting the Veil on Islam and the End Times,"Religion , General"
Book of Adam to Moses,"Religion , General"
Teaching Your Children About God: A Modern Jewish Approach,"Religion , General"
Wise Women: Over Two Thousand Years of Spiritual Writing by Women,"Religion , General"
The Victorious Christian Life,"Religion , Christian Ministry , Discipleship"
The Da Vinci Code: Fact or Fiction? : A Critique of the Novel by Dan Brown,"Religion , Christian Theology , Apologetics"
When God Says War Is Right: The Christian's Perspective on When and How to Fight,"Religion , Religion, Politics & State"
Releasing the Rivers Within: The Exhilaration of Utter Dependence on God,"Religion , Christian Living , General"
When Life Hurts: Comforting Reflections for Our Troubled Moments,"Religion , Meditations"
"Sacred Passage: How to Provide Fearless, Compassionate Care for the Dying","Religion , Buddhism , General"
Hear the Just Word & Live It (Illuminationbooks),"Religion , Christianity , Catholic"
Buddhism: The Path to Nirvana (Religious Traditions of the World),"Religion , Buddhism , General"
United Methodist Altars:A Guide For The Local Church,"Religion , Christian Church , Administration"
The Fire of God,"Religion , General"
The Ecstatic Journey: The Transforming Power of Mystical Experience,"Religion , Mysticism"
Extraordinary Power for Ordinary Christians,"Religion , Spirituality"
The Faith Factor: Proof of the Healing Power of Prayer,"Religion , Faith"
"The Art of Living : A Guide to Contentment, Joy and Fulfillment","Religion , Buddhism , General"
Strength for the Journey,"Religion , General"
The Rewriting of America's History,"Religion , General"
Turin Shroud: In Whose Image? the Truth Behind the Centuries-Long Conspiracy of Silence,"Religion , Cults"
The Incarnation: An Anthology (Nelson's Anthology Series),"Religion , Christianity , Literature & the Arts"
Abraham and His Sons (Reader's Digest - Bible Wisdom for Today),"Religion , Biblical Studies , Old Testament"
Peace with God: The Secret Happiness,"Religion , Christian Life , General"
Prophetic Poems: God Speaks to His People,"Religion , General"
"Zen: Images, Texts, and Teachings","Religion , General"
GLORY OF NEW TESTAMENT,"Religion , General"
Promises to Keep: Daily Devotions for Men of Integrity,"Religion , Devotional"
Reader's Digest Complete Guide to the Bible: An Illustrated Book-by-Book Companion to the Scriptures,"Religion , Biblical Studies , General"
"Sex, Lies, and the Media","Religion , Christian Life , General"
The Art of Creative Living: Making Every Day a Radiant Masterpiece,"Religion , Inspirational"
Sacred Rage: The Wrath of Militant Islam,"Religion , Islam , General"
More Prayers on My Pillow: Words of Comfort and Hope for Girls on the Journey to Self,"Religion , General"
Understanding and Teaching the Bible (Lead Books),"Religion , General"
Don't Buy the Lie: Discerning Truth in a World of Deception (invert),"Religion , Christian Life , General"
The Woman Who Laughed at God: The Untold History of the Jewish People (Compass),"Religion , History"
Living in Sin?: A Bishop Rethinks Human Sexuality,"Religion , Christianity , General"
Men & Women,"Religion , Christian Living , Love & Marriage"
Jesus In Blue Jeans: A Practical Guide To Everyday Spirituality,"Religion , Spirituality"
Woman Thou Art Loosed,"Religion , Christian Living , General"
Be Careful What You Pray For...You Just Might Get It,"Religion , Spirituality"
Breaking the Silence,"Religion , Judaism , General"
A Friar's Joy: Magic Moments from Real Life,"Religion , Christian Living , General"
"Pray With Your Eyes Open: Looking at God, Ourselves, and Our Prayers","Religion , Prayer"
Tony: Our Journey Together,"Religion , General"
Operation World,"Religion , Prayer"
Secret Strength: For Those Who Search,"Religion , General"
Impacting Your World,"Religion , Biblical Studies , Bible Study Guides"
Christian Living in the Home,"Religion , Christian Life , Family"
Shroud,"Religion , General"
Still Catholic (American Storytelling),"Religion , Christianity , Catholic"
Spiritual Parenting: A Guide to Understanding and Nurturing the Heart of Your Child,"Religion , General"
Moments of Grace: Meeting the Challenge to Change,"Religion , Inspirational"
More Holy Humor: Inspirational Wit and Cartoons,"Religion , General"
"Armageddon, Oil, and the Middle East Crisis: What the Bible Says About the Future of the MiddleEast and the End of Western Civilization","Religion , Biblical Studies , General"
"Lay Shepherding: A Guide for Visiting the Sick, the Aged, the Troubled and the Bereaved","Religion , Christian Ministry , Pastoral Resources"
Strengthening Adult Sunday School Class (Creative leadership series),"Religion , General"
The Proverbs 31 Lady and Other Impossible Dreams,"Religion , General"
The Story of the Shakers,"Religion , Christianity , Shaker"
Prince of Darkness: Antichrist and the New World Order,"Religion , Biblical Studies , Prophecy"
Great People of the Bible and How They Lived,"Religion , General"
The Search for God at Harvard,"Religion , Christian Rituals & Practice , General"
Irregular People,"Religion , Christian Life , Relationships"
Bringing Elizabeth Home: A Journey of Faith and Hope,"Religion , Faith"
The Hidden Encyclical of Pius XI,"Religion , Christianity , Catholic"
Only Angels Can Wing It The Rest Of Us Have To Practice,"Religion , Christian Life , General"
Healing Words: The Power of Prayer and the Practice of Medicine,"Religion , General"
Failure: The Back Door to Success,"Religion , Psychology of Religion"
The Shadow of the Apocalypse: When All Hell Breaks Loose,"Religion , Biblical Studies , Prophecy"
The Problem of Wineskins: Church Structure in Technological Age,"Religion , General"
The Book of Jesus for Families,"Juvenile Nonfiction , Religion , Christianity"
There is a Place Where You Are Not Alone (Dolphin Book),"Religion , General"
This Incredible Century: A Warm and Witty Biography of the 20th Century from America's Foremost Storyteller,"Religion , General"
Tough-Minded Faith for Tender-Hearted People,"Religion , Ethics"
What Is Anglicanism? (The Anglican Studies Series),"Religion , Christianity , Anglican"
Revolution in World Missions: A Challenge from the Heart,"Religion , Christian Ministry , Evangelism"
The Passionate People: Carriers of the Spirit,"Religion , General"
Guide My Feet: Prayers and Meditations on Loving and Working for Children,"Religion , Education"
The Ten Offenses,"Religion , Christian Life , General"
Hand-Me-Down Genes and Second-Hand Emotions,"Religion , General"
"On Becoming a Musical, Mystical Bear: Spirituality American Style","Religion , Spirituality"
Out of the Saltshaker and into the World: Evangelism As a Way of Life,"Religion , Christian Ministry , Evangelism"
Heaven Help the Home (An Input book),"Religion , General"
"Mother Angelica's Answers, Not Promises: Straightforward Solutions to Life's Puzzling Problems","Religion , Christian Life , General"
Life on the Edge,"Religion , Christian Life , General"
"Love Life for Every Married Couple: How to Fall in Love, Stay in Love, Rekindle Your Love","Religion , Christian Life , Love & Marriage"
The Secret of Happiness,"Religion , Christian Life , Spiritual Growth"
The Day Christ Died,"Religion , Christianity , General"
Plain Bread,"Religion , General"
"Everyday Grace: Having Hope, Finding Forgiveness, and Making Miracles","Religion , Christian Life , General"
Don't Let Jerks Get the Best of You / Advice For Dealing With Difficult People,"Religion , General"
Soul Work: A Field Guide for Spiritual Seekers,"Religion , Spirituality"
Children's Letters to God,"Juvenile Nonfiction , Religion , General"
Charlton Heston Presents the Bible,"Religion , Biblical Commentary , General"
Just As I Am,"Religion , Christianity , General"
"A Daughter's Journey Home: Finding a Way to Love, Honor and Connect with Your Mother","Religion , Christian Life , General"
Beginning Of The End,"Religion , Christian Theology , Eschatology"
The Gathering Storm: World Events and the Return of Christ,"Religion , General"
Bhagavad-Gita as It Is,"Religion , Buddhism , General"
The Prayer of Jabez: Breaking Through to the Blessed Life,"Religion , Biblical Meditations , Old Testament"
Secrets of the Vine: Breaking Through to Abundance,"Religion , Inspirational"
The Preacher Joke Book,"Humor , Topic , Religion"
Behold Your God: Studies on the Atributes of God,"Religion , Biblical Studies , Bible Study Guides"
When All You'Ve Ever Wanted Isn't Enough,"Religion , General"
Dropping Your Guard: The Value of Open Relationships,"Religion , Christian Life , General"
The Mysterious Bible Codes,"Religion , Biblical Studies , Prophecy"
"The Great Investment: Faith, Family, and Finance","Religion , Faith"
A Life With Purpose: The Story of the Man Behind The Purpose-Driven Life,"Religion , Christianity , General"
Turbulent Souls,"Religion , Christianity , Catholic"
I Like Being Catholic,"Religion , Christianity , Catholic"
The Way to Christ: Spiritual Exercises,"Religion , Christianity , Catholic"
Persecution: How Liberals Are Waging War Against Christianity,"Religion , Christianity , General"
Noah's Ark,"Juvenile Nonfiction , Religion , Christianity"
Keeping Passover: Everything You Need to Know to Bring the Ancient Tradition to Life and Create Yo,"Religion , Judaism , Rituals & Practice"
Noah's Aardvark,"Juvenile Nonfiction , Religion , Biblical Studies"
"Just for Jesus: God Called, a Family Answered","Religion , Christian Life , General"
Without Walls: God's Blueprint for the 21st Century Church,"Religion , Christian Ministry , Evangelism"
Stretch Out Your Hand: Exploring Healing Prayer (Kaleidoscope Series),"Religion , General"
"Joyful Journey, The","Religion , Inspirational"
With Open Heart (English and French Edition),"Religion , General"
The Search for Meaning,"Religion , General"
A Broader Vision: Perspectives on the Buddha and the Christ,"Religion , General"
Raising the Standard: Reclaiming Our World for God,"Religion , General"
The Re-Enchantment of Everyday Life,"Religion , Spirituality"
My Little Golden Book About God,"Juvenile Nonfiction , Religion , Biblical Studies"
Building Your House on the Lord: A Firm Foundation for Family Life (Fisherman Bible Studyguide Series),"Religion , Biblical Studies , Bible Study Guides"
Gifts of Grace: A Gathering of Personal Encounters With the Virgin Mary,"Religion , Christianity , Catholic"
Shattered Faith,"Religion , Christian Theology , General"
The Work We Have to Do: A History of Protestants in America (Religion in American Life),"Religion , Christianity , Protestant"
Commune With the Angels: A Heavenly Handbook,"Religion , General"
Day by Day With Billy Graham,"Religion , Prayerbooks , Christian"
Prayers and Graces (Illustrated Library for Child.),"Juvenile Nonfiction , Religion , General"
Discovering the Laws of Life,"Religion , Education"
Knowing God's Will: Biblical Principles of Guidance,"Religion , General"
Little House on the Freeway: Help for the Hurried Home,"Religion , Christian Life , General"
And the Angels Were Silent (Chronicles of the Cross),"Religion , General"
Small Miracles for Women: Extraordinary Coincidences of Heart and Spirit,"Religion , Spirituality"
The sacraments and your everyday life,"Religion , General"
15 Minutes to Build a Stronger Marriage,"Religion , Christian Living , Love & Marriage"
"In the Heart of the World: Thoughts, Stories and Prayers","Religion , Meditations"
His Glory Revealed: A Devotional,"Religion , Devotional"
The Art of Happiness at Work,"Religion , Buddhism , General"
A Simple Monk: Writings on His Holiness the Dalai Lama,"Religion , Buddhism , General"
A Rainy Afternoon With God (Illuminationbooks),"Religion , Meditations"
The Home You Made For Me <i>celebrating A Mother's Love</i>,"Religion , Inspirational"
Mother Teresa,"Religion , General"
Beyond Dogma: Dialogues and Discourses,"Religion , Buddhism , General"
Sacred America: The Emerging Spirit of the People,"Religion , Spirituality"
The Quest for God: A Personal Pilgrimage,"Religion , General"
The Secret Of Happiness,"Religion , Christian Life , Spiritual Growth"
All You Really Need To Know About Prayer You Can Learn From The Poor,"Religion , Christian Theology , General"
SACRED SITES: THE BUDDHIST MONASTERY,"Religion , Buddhism , General"
Emissary of Light: My Adventures With the Secret Peacemakers,"Religion , General"
My Journey: From an Iowa Farm to a Cathedral of Dreams,"Religion , Spirituality"
Fresh-cut Flowers for Mother,"Religion , Christianity , General"
This Side of Nirvana: Memoirs of a Spiritually Challenged Buddhist,"Religion , Buddhism , General"
My Heart's Cry,"Religion , Christian Life , General"
God in the Alley: Being and Seeing Jesus in a Broken World,"Religion , Christian Ministry , Evangelism"
Burn,"Religion , Christian Life , General"
Restoring Faith: America's Religious Leaders Answer Terror with Hope,"Religion , Faith"
The Walk at Work: Seven Steps to Spiritual Success on the Job,"Religion , Christian Living , General"
Best Catherine Marshall,"Religion , General"
"Real Magnolias: Stories of Southern Women Finding Hope, Love, and Laughter","Religion , Christian Life , General"
Still Catholic After All These Years,"Religion , General"
Fresh-Cut Flowers For Mother,"Religion , Inspirational"
In Search of the Birth of Jesus,"Religion , Christian Theology , General"
Help! I'm a Volunteer Youth Worker,"Religion , Agnosticism"
Come As You Are: An Open Invitation From The Heart Of God,"Religion , Inspirational"
Give Us This Day Our Daily Bread: Asking for and Sharing Life's Necessities,"Religion , General"
What Matters Most: Four Absolute Necessities in Following Christ,"Religion , Christian Life , General"
38 Values to Live By,"Religion , Inspirational"
Tis a Gift to Be Simple,"Religion , Christian Theology , Ethics"
How Will It End?,"Religion , General"
Mind Siege: The Battle for Truth in the New Millennium,"Religion , Christian Life , General"
Life on Hold: Finding Hope in the Face of Serious Illness,"Religion , General"
Listening to Love: Responding to the Startling Voice of God,"Religion , Christian Living , General"
Lists to Live By: The Fourth Collection: For Everything That Really Matters,"Religion , Inspirational"
God and the Oval Office: The Religious Faith of Our 43 Presidents,"Religion , Religion, Politics & State"
Little Visits Every Day,"Juvenile Nonfiction , Religion , Biblical Studies"
Small Miracles Of Love & Friendship: Remarkable Coincidences of Warmth and Devotion,"Religion , Inspirational"
A Closer Walk,"Religion , General"
How to Be Born Again,"Religion , Christian Ministry , Evangelism"
Disciplines of the Beautiful Woman,"Religion , Christian Life , General"
Growing Slowly Wise: Building a Faith that Works,"Religion , Faith"
Experiencing Forgiveness (The in Touch Study Series),"Religion , Biblical Studies , Bible Study Guides"
Seeds of Hope: A Henri Nouwen Reader,"Religion , Christian Life , General"
So Stick A Geranium In Your Hat And Be Happy!,"Religion , Christian Life , General"
I'm Outta Here: Facing the Tough Choices After High School,"Religion , General"
