Title,Category
Refresh My Heart in Spring (Meditations for Women),"Religion , Meditations"
Losing My Religion: How I Lost My Faith Reporting on Religion in America and Found Unexpected Peace,"Religion , Faith"
The Heart of Christmas,"Religion , Christian Life , General"
Praying God's Word: Breaking Free From Spiritual Strongholds,"Religion , Christian Living , Prayer"
"But Lord, I Was Happy Shallow: Lessons Learned in the Deep Places","Religion , Christian Life , General"
Shepherd's Notes: Exodus,"Religion , Biblical Commentary , Old Testament"
Shepherd's Notes: Romans,"Religion , Biblical Commentary , New Testament"
Shepherd's Notes: Ezekiel,"Religion , Biblical Studies , Old Testament , General"
Getting a Grip,"Religion , Christian Life , General"
What Every Child Needs: Meet Your Child's Nine Basic Needs (And Be a Better Mom),"Religion , Christian Life , Family"
Life Lessons: Book Of John,"Religion , Biblical Studies , New Testament"
When Godly People Do Ungodly Things: Arming Yourself in the Age of Seduction,"Religion , Christian Living , General"
The Great Doctrines of the Bible,"Religion , Biblical Commentary , General"
90 Minutes in Heaven: A True Story of Death and Life,"Religion , Christian Theology , Eschatology"
Walk With Jesus: Stations of the Cross,"Religion , Christianity , Catholic"
Cure for the Common Life: Living in Your Sweet Spot,"Religion , Christian Living , General"
The One Year Book of Devotions for Women,"Religion , Christian Life , Devotional"
"The Everything World's Religions Book: Discover the Beliefs, Traditions, and Cultures of Ancient and Modern Religions","Religion , General"
Blended Families: Creating Harmony as You Build a New Home Life,"Religion , Christian Living , Family & Relationships"
A Field Guide to Christianity: Answering Common Misconceptions,"Religion , General"
All the Parables of the Bible: A Study and Analysis of the More Than 250 Parables in Scripture,"Religion , Biblical Reference , General"
Letter to a Christian Nation,"Religion , Religion, Politics & State"
We Are Sisters,"Religion , Christian Life , General"
Everyday Sacred: A Woman's Journey Home,"Religion , Inspirational"
Dark Things,"Young Adult Nonfiction , Religion , Christianity"
"I Don't Want Delilah, I Need You!: What a Woman Needs to Know  What a Man Needs to Understand","Religion , Christian Life , Love & Marriage"
Courage for the Chicken Hearted: Humorous and Inspiring Stories for Confident Living,"Religion , Inspirational"
Then God Created Woman (Renewing the Heart),"Religion , Christian Theology , General"
Miriam's Kitchen: A Memoir,"Religion , Judaism , General"
Adventurous Prayer (Women of Faith Study Guide Series),"Religion , Christian Life , General"
Ephesians (LifeChange),"Religion , Biblical Studies , New Testament , Paul's Letters"
No More Us & Them,"Religion , General"
Healing the Dysfunctional Church Family (The Recovery Bookshelf),"Religion , General"
Jerusalem Countdown: A Warning to the World,"Religion , Christian Living , General"
The Critical Meaning of the Bible,"Religion , Biblical Commentary , General"
Prescription for a Healthy Church: Ministry Ideas to Nurture Whole People,"Religion , General"
God's Master Plan for Your Life,"Religion , Christian Living , Personal Growth"
Stealing Jesus: How Fundamentalism Betrays Christianity,"Religion , Fundamentalism"
The Jesus Person Pocket Promise Book:800 Promises From the Word of God,"Religion , Spirituality"
Breakfast With the Pope: Daily Readings,"Religion , Christianity , Catholic"
Believing in Ourselves: The Wisdom of Women,"Religion , Inspirational"
Stripped: Uncensored Grace on the Streets of Vegas,"Religion , Christianity , History"
Symbols of the Church,"Religion , Biblical Commentary , General"
Plain Living: A Quaker Path to Simplicity,"Religion , Spirituality"
The Book for Children,"Religion , General"
The Lost Gospel: The Quest for the Gospel of Judas Iscariot,"Religion , Biblical Criticism & Interpretation , General"
God Things Come in Small Packages,"Religion , General"
Things Pondered: From the Heart of a Lesser Woman,"Religion , Christian Living , General"
My Little Bible Series - Blue,"Juvenile Nonfiction , Religion , Biblical Studies"
Catholics In Crisis: An American Parish Fights For Its Soul,"Religion , General"
Matters of the Heart Devotions for Women,"Religion , Devotional"
Prove It! Jesus,"Religion , Inspirational"
"The Origins of Things, Or, How the Hour Got Its Minutes","Religion , Antiquities & Archaeology"
Shared Splendor,"Religion , Christian Theology , General"
Lent Begins at Home,"Religion , Prayer"
Sacraments Today,"Religion , General"
Broken Things: Why We Suffer,"Religion , Psychology of Religion"
Dictionary of Saints,"Religion , Reference"
When Bad Things Happen to Good People,"Religion , Inspirational"
For These Tough Times: Reaching Toward Heaven for Hope & Healing,"Religion , Inspirational"
Walk with God,"Religion , Christian Living , Spiritual Growth"
Chicken Soup for the Christian Teenage Soul: Stories to Open the Hearts of Christian Teens (Chicken Soup for the Soul),"Young Adult Nonfiction , Religion , Christianity"
On Life after Death,"Religion , Spirituality"
The Illustrated Dictionary and Concordance of the Bible,"Religion , General"
One Morning in Joseph's Garden: An Easter Story,"Juvenile Nonfiction , Religion , Christianity"
The Volunteer Revolution: Unleashing the Power of Everybody,"Religion , Christian Living , General"
"Here's Hope: New Testament, New King James Version","Religion , Biblical Studies , General"
The Establishment Clause: Religion and the First Amendment,"Religion , Religion, Politics & State"
How to Deal with Annoying People: What to Do When You Can't Avoid Them,"Religion , Christianity , General"
"Every Young Woman's Battle: Guarding Your Mind, Heart, and Body in a Sex-Saturated World (The Every Man Series)","Religion , Christian Life , General"
A Guide for the Advanced Soul: A Book of Insight,"Religion , Inspirational"
"Trial, Tribulation & Triumph: Before, During, and After Antichrist","Religion , Christian Theology , Eschatology"
Pilgrim Fellowship of Faith: The Church as Communion,"Religion , Christianity , Catholic"
The Da Vinci Hoax: Exposing the Errors in the Da Vinci Code,"Religion , Christianity , General"
Nothing But the Truth,"Religion , Christianity , Catholic"
"Handbook for Today's Catholic: Beliefs, Practices, Prayers (A Redemptorist Pastoral Publication)","Religion , General"
A Deeper Joy,"Religion , General"
The In-Between Church: Navigating Size Transitions in Congregations,"Religion , Christian Church , Administration"
"Personal Faith, Public Policy: The 7 Urgent Issues that We, as People of Faith, Need to Come Together and Solve","Religion , Christian Living , Social Issues"
Arousing the Goddess: Sex and Love in the Buddhist Ruins of India,"Religion , Spirituality"
"Jesus, the One and Only","Religion , Biblical Studies , New Testament , General"
God In All Worlds: An Anthology of Contemporary Spiritual Writing,"Religion , General"
Breaking the Da Vinci Code: Answers to the Questions Everyone's Asking,"Religion , Christian Living , General"
Classic Sermons on Worship (Kregel Classic Sermons),"Religion , Christian Theology , General"
"More Than Words: A Dictionary of Christian Faith Offering Definitions and Insight to Preachers, Teachers, and Other Church Leaders","Religion , General"
Foremothers: Women of the Bible,"Religion , General"
The Secret of God's Presence (Formerly God's Gift Perfection,"Religion , Faith"
Good News About Injustice: A Witness of Courage in a Hurting World,"Religion , Christian Theology , General"
The Fabric of Faithfulness: Weaving Together Belief and Behavior During the University Years,"Religion , Christian Life , General"
Sacred Choices: The Right to Contraception nd Abortion in Ten World Religions (Sacred Energies Series),"Religion , Christianity , Catholic"
"Meaning of Jesus, The","Religion , Christianity , General"
"While You Were Gone: A Handbook for Returning Catholics, and Those Thinking About It","Religion , Christianity , Catholic"
The Pontiff in Winter: Triumph and Conflict in the Reign of John Paul II,"Religion , Christianity , Catholic"
Praying God's Word Day by Day,"Religion , Christian Living , Prayer"
Blessings: Prayers and Declarations for a Heartful Life,"Religion , Inspirational"
Waiting for the Second Coming: Studies in Thessalonians,"Religion , Biblical Studies , New Testament"
Saving Paradise: How Christianity Traded Love of This World for Crucifixion and Empire,"Religion , Christianity , History"
Quiet Moments with God for Women (Quiet Moments with God Devotional),"Religion , Christian Living , Devotional"
Rosh Hashanah Yom Kipper Survival Kit,"Religion , Holidays , Jewish"
And the Angels Were Silent: The Final Week of Jesus,"Religion , Christianity , General"
"Straight Talk: What Men Need to Know, What Women Should Understand","Religion , General"
Walking the Bible: A Journey by Land Through the Five Books of Moses,"Religion , Biblical Studies , Old Testament , General"
Thanksgiving: A Time to Remember,"Religion , Holidays , Other"
"The Buddhist Tradition: In India, China and Japan","Religion , Buddhism , General"
"The Faith Club: A Muslim, A Christian, A Jew-- Three Women Search for Understanding","Religion , Comparative Religion"
Speaking of Faith,"Religion , Religion, Politics & State"
The Prayer of Jabez: Bible Study,"Religion , Inspirational"
Finding God in the Questions: A Personal Journey,"Religion , Faith"
Church Meetings That Work,"Religion , Christian Ministry , Missions"
Treasures from Heaven,"Religion , Inspirational"
God's Name In Vain: The Wrongs And Rights Of Relgion In Politics,"Religion , Religion, Politics & State"
Is It Good for the Jews?: The Crisis of America's Israel Lobby,"Religion , Judaism , General"
Crisis in the Village: Restoring Hope in African American Communities,"Religion , Religion, Politics & State"
One Month to Live: Thirty Days to a No-Regrets Life,"Religion , Christian Life , General"
Lessons from a Father to His Son,"Religion , Inspirational"
Closing the Gap,"Religion , Inspirational"
America Looks Up,"Religion , Christian Life , General"
A Chance at Childhood Again: Restoring Freedom and Wonder to Everyday Life,"Religion , Christianity , General"
God Under My Roof: Celtic Songs and Blessings,"Religion , Spirituality"
Not in Our Classrooms: Why Intelligent Design Is Wrong for Our Schools,"Religion , Religion & Science"
Finding God in the Questions: A Personal Journey,"Religion , Christian Living , General"
"A Quaker Book of Wisdom: Life Lessons In Simplicity, Service, And Common Sense","Religion , Inspirational"
Terror in the Name of God: Why Religious Militants Kill,"Religion , Christian Living , General"
Crazy Love: Overwhelmed by a Relentless God,"Religion , Christian Life , General"
The Fight of Your Life: Why Your Teen Is at Risk and What Only You Can Do About It,"Religion , Christian Living , Family & Relationships"
Christianity In Crisis: 21st Century,"Religion , Christian Theology , Apologetics"
Girl Soldier: A Story of Hope for Northern Uganda's Children,"Religion , Christianity , History"
Tribal Church: Ministering to the Missing Generation,"Religion , Christian Ministry , General"
Thumpin' It: The Use and Abuse of the Bible in Today's Presidential Politics,"Religion , Biblical Studies , History & Culture"
Heaven Is Real: Lessons on Earthly Joy--What Happened After 90 Minutes in Heaven,"Religion , Inspirational"
"Good News, Bad News: Evangelization, Conversion and the Crisis of Faith","Religion , Christian Theology , General"
"The Faith: What Christians Believe, Why They Believe It, and Why It Matters","Religion , Christian Theology , Ethics"
Prayer (Catholic Spirituality for Adults),"Religion , Spirituality"
Sin Boldly: A Field Guide for Grace,"Religion , Christian Life , Spiritual Growth"
"AN American Gospel: On Family, History, and the Kingdom of God","Religion , Faith"
Light Force: A Stirring Account of the Church Caught in the Middle East Crossfire,"Religion , Christian Ministry , Missions"
The Will of God: Answering the Hard Questions,"Religion , Christian Living , Personal Growth"
A Case for the Existence of God,"Religion , Religion & Science"
Young Readers Christian Library: Jesus,"Juvenile Nonfiction , Religion , Bible Stories , General"
Teens Talkin' Faith: A Christian Perspective,"Young Adult Nonfiction , Religion , Christianity"
"The Answers Book: The 20 Most-Asked Questions About Creation, Evolution & the Book of Genesis Answered! Revised & Expanded Edition","Religion , Reference"
"Resurrection of the Shroud: New Scientific, Medical, and Archeological Evidence","Religion , Christian Theology , General"
Decision Making by the Book: How to Choose Wisely in an Age of Options,"Religion , Ethics"
Be Angry But Don't Blow It! Maintaining Your Passion Without Losing Your Cool,"Religion , Christian Living , General"
The Life You've Always Wanted Participant's Guide: Six Sessions on Spiritual Disciplines for Ordinary People (Groupware),"Religion , Biblical Studies , General"
Why Christianity Must Change or Die: A Bishop Speaks to Believers In Exile,"Religion , Christianity , General"
Where to Find it in the Bible: The Ultimate A to Z Resource,"Religion , Biblical Reference , General"
The Phoenix Affirmations: A New Vision for the Future of Christianity,"Religion , Christian Living , General"
Growing Plans,"Religion , General"
Plain and Amish: An Alternative to Modern Pessimism,"Religion , Christian Theology , General"
G.I. Joe & Lillie: Remembering a Life of Love and Loyalty,"Religion , Spirituality"
"1,001 Questions and Answers About Judaism","Religion , General"
And the Angels Were Silent,"Religion , Reference"
Reflections From a Mother's Heart Your Life Story in Your Own Words (A Family Legacy for Your Children),"Religion , General"
Invitation to the Old Testament: Participant Book: A Short-Term DISCIPLE Bible Study,"Religion , Biblical Studies , Old Testament"
Get Out of That Pit: Straight Talk about God's Deliverance,"Religion , Christian Living , Personal Growth"
What Paul Meant,"Religion , Biblical Studies , New Testament , Paul's Letters"
Life as a Vapor: Thirty-One Meditations for Your Faith,"Religion , Devotional"
8 Choices That Will Change a Woman's Life,"Religion , Ethics"
The Life You've Always Wanted: Spiritual Disciplines for Ordinary People (Expanded and Adapted for Small Groups),"Religion , Spirituality"
Mary My Mother (St. Joseph Picture Books),"Religion , Christian Education , Children & Youth"
"Moses: A Man of Selfless Dedication (Great Lives from God's Word, Volume 4)","Religion , Inspirational"
Discover Your God-Given Gifts,"Religion , Christian Life , General"
Mealtime Memories: Sharing the Warmth of Family Traditions,"Religion , Christian Life , General"
The Garden of Friendship: Celebrating the Blessings of Loved Ones,"Religion , Inspirational"
Pope John Paul II,"Religion , General"
30 Days to Taming Your Tongue: What You Say (and Don't Say) Will Improve Your Relationships,"Religion , Christian Life , General"
Skin Deep: The Powerful Link Between Your Body Image and Your Self-Esteem,"Religion , General"
The Complete Idiot's Guide to Understanding Intelligent Design,"Religion , Religion & Science"
Baby Jesus Prince of Peace,"Juvenile Nonfiction , Religion , General"
Noah's Ark (Little Golden Book),"Juvenile Nonfiction , Religion , Bible Stories , General"
One Thing You Can't Do in Heaven,"Religion , Christianity , General"
Treasures from Bible Times,"Religion , General"
The Essential Dalai Lama: His Important Teachings,"Religion , Buddhism , General"
Christianity: The Faith That Makes Sense,"Religion , Christian Theology , General"
Revolution in World Missions,"Religion , General"
The Cross and The Crescent: The Dramatic Story of the Earliest Encounters Between Christians and Muslims,"Religion , History"
The Message Promise Book,"Religion , Devotional"
Turning the Mind Into an Ally,"Religion , Buddhism , General"
Maximize the Moment: God's Action Plan For Your Life,"Religion , Inspirational"
A Portrait of Jesus,"Religion , Christian Living , Inspirational"
Short Prayers for Busy Women,"Religion , Spirituality"
Scared to Life,"Religion , General"
Under Cover (EZ Lesson Plan),"Religion , Christian Life , General"
With Burning Hearts: A Meditation on the Eucharistic Life,"Religion , Spirituality"
Unexpected Grace Comfort In The Midst Of Loss,"Religion , Christian Life , General"
The Last Rose: A True Celebration of Eternal Life,"Religion , Inspirational"
"Precious Moments, Seasons of Faith Series, Gifts from the Heart","Religion , Inspirational"
Yearning: Living Between How It Is How It Ought to Be,"Religion , Ethics"
The Chocolate Cake Sutra: Ingredients for a Sweet Life,"Religion , Buddhism , Zen"
Prayers for a Thousand Years,"Religion , Inspirational"
His Brother's Keeper: Israel and Diaspora Jewry in the Twenty-first Century,"Religion , Judaism , General"
Humor For A Friends Heart: Stories Quips And Quotes To Lift The Heart (humor For The Heart),"Religion , Inspirational"
"How to Win a Cosmic War: God, Globalization, and the End of the War on Terror","Religion , Islam , General"
Read with Me Bible: an NIrV Story Bible for Children,"Juvenile Nonfiction , Religion , Bible Stories , General"
Silent No More: Confronting America's False Images of Islam,"Religion , Islam , Theology"
Leading Bible Discussions (Lifeguide Bible Studies),"Religion , Biblical Studies , General"
"Constantine's Sword: The Church and the Jews, A History","Religion , Christianity , Catholic"
The Joy of Being a Catechist: From Watering to Blossoming (Spirit Life Series),"Religion , General"
"The Reader's Bible, A Narrative: Selections from the King James Version","Religion , Biblical Studies , General"
Boyhood Daze: An Incomplete Guide to Raising Boys,"Religion , Christian Life , General"
"Experiencing the Heart of Jesus: Knowing His Heart, Feeling His Love","Religion , Christian Living , General"
Church in History,"Religion , Christianity , History"
"Control Trap, The","Religion , Inspirational"
The Carpenter's Cloth: Christ's Journey to the Cross and Beyond,"Religion , Biblical Commentary , New Testament"
War on Terror: Unfolding Bible Prophecy,"Religion , Biblical Studies , Prophecy"
"An Anchor for the Soul: Help for the Present, Hope for the Future","Religion , Christian Ministry , Evangelism"
The Power of a Praying® Parent,"Religion , Prayer"
Revelations of a Single Woman: Loving the Life I Didn't Expect,"Religion , Christian Living , General"
Family Walk: 52 Weekly Devotions for Your Family,"Religion , Christian Life , Devotional"
How to Start a New Service: Your Church Can Reach New People,"Religion , Christian Rituals & Practice , General"
Nothing Special,"Religion , Buddhism , General"
Youth Ministry Cargo,"Religion , General"
Four Pillars of a Man's Heart: Bringing Strength into Balance,"Religion , Christian Ministry , Pastoral Resources"
Parenting Today's Adolescent Helping Your Child Avoid The Traps Of The Preteen And Teen Years,"Religion , Christian Living , General"
A Love Worth Giving: Living in the Overflow of God's Love,"Religion , Inspirational"
Jesus: Who Is He?,"Religion , Christianity , General"
Disney & the Bible: A Scriptural Critique of a Media Conglomerate.,"Religion , Christian Life , General"
Intimacy With The Almighty,"Religion , Christian Living , General"
Living Religions: A Brief Introduction,"Religion , Education"
"When Every Hour's a Rush Hour: Guilt-Busters, Love-Boosters and Time -Savers for Working Moms","Religion , Inspirational"
Can You Stand to be Blessed?,"Religion , Christian Living , General"
A History of the World's Religions,"Religion , General"
Daily Stepping Stones,"Religion , General"
The Alchemy of the Heart - Life's Refining Process to Free Us from Ourselves,"Religion , Christian Life , Spiritual Growth"
An Introduction to the Faith of Catholics,"Religion , Christianity , Catholic"
Turn: Remembering Our Foundations,"Religion , Christian Living , General"
Marriage Minutes,"Religion , Devotional"
The Real Jesus: The Misguided Quest for the Historical Jesus and the Truth of the Traditional Go,"Religion , General"
World Religions: From Ancient History to the Present,"Religion , General"
The Jesus I Never Knew Study Guide,"Religion , Christian Living , Personal Growth"
Befriending: A Self-Guided Retreat for Busy People,"Religion , Christian Theology , Ethics"
Transforming Congregational Culture,"Religion , Christian Ministry , Pastoral Resources"
The Good Samaritan:  Luke 10:25-37 for Children (Arch Book),"Religion , Biblical Studies , General"
Footprints of a Pilgrim: The Life and Loves of Ruth Bell Graham,"Religion , Christian Living , General"
Healing the Hurt in Your Marriage,"Religion , Christian Life , General"
Fifty Reasons Why Jesus Came to Die,"Religion , Biblical Studies , General"
How a Man Prays for His Family (Lifeskills for Men),"Religion , Inspirational"
A Consumer's Guide to Hope: Where to Find It and How to Keep It,"Religion , General"
Cry Out Paper-Rights Reverted,"Religion , General"
"Finding a Mentor, Being a Mentor: Sharing Our Lives as Women of God","Religion , Christian Ministry , Discipleship"
The Protestant Reformation (Documentary History of Western Civilization),"Religion , Christianity , Protestant"
Emyl Jenkins' Southern Christmas,"Religion , Holidays , Christmas & Advent"
Shadows of Things to Come: A Prophetic Look at God's Unfolding Plan,"Religion , Christianity , Pentecostal & Charismatic"
Darwin on Trial,"Religion , Philosophy"
Off The Beaten Path Finding God In Unexpected Places-a Devotional,"Religion , Inspirational"
Paul Among Jews and Gentiles and Other Essays,"Religion , Christian Theology , General"
Christian Theology: An Introduction 3rd Edition,"Religion , Christianity , General"
Jerusalem: City of Jesus,"Religion , General"
Life In Christ: A Catholic Catechism for Adults,"Religion , Christianity , General"
Spiritual Disciplines for the Christian Life Study Guide,"Religion , Christian Life , General"
Jesus Without Religion: What Did He Say? What Did He Do? What's the Point?,"Religion , Christianity , General"
One Minute After You Die: A Preview of Your Final Destination - Trade Paper,"Religion , Christian Life , Spiritual Growth"
The Analects of Confucius,"Religion , Confucianism"
Prayer's Apprentice,"Religion , Prayer"
"Words Made Flesh: Scripture, Psychology and Human Communication","Religion , Christian Ministry , Pastoral Resources"
Lifetime Guarantee,"Religion , Christian Life , General"
A Woman's Answer to Anger: Getting Your Emotions Under Control,"Religion , Christianity , General"
Making a Good Move,"Religion , Clergy"
Unfreezing Moves: Following Jesus into the Mission Field,"Religion , Inspirational"
"Locking Arms: Shoulder to Shoulder, Man to Man...God's Design for Masculine Friendships","Religion , General"
"God, Are You There?: Do You Care? Do You Know About Me","Religion , Biblical Studies , New Testament"
Secrets of the Vine for Women,"Religion , Christian Life , General"
Inside Afghanistan: An American Aide Worker's Mission of Mercy to a War-Torn People,"Religion , Christian Ministry , Missions"
The Moral Teaching of Paul: Selected Issues,"Religion , Biblical Studies , New Testament"
"Lifesigns: Intimacy, Fecundity, and Ecstasy in Christian Perspective","Religion , General"
The Buddha from Brooklyn,"Religion , Buddhism , General"
The Oxford Illustrated History of Christianity (Oxford Illustrated Histories),"Religion , History"
Epicenter: Why Current Rumblings in the Middle East Will Change Your Future,"Religion , Christianity , General"
The Word Made Flesh: An Overview of the Catholic Faith,"Religion , Christianity , Catholic"
It's NOT About ME: Rescue From the Life We Thought Would Make Us Happy,"Religion , Christian Theology , General"
Pocket Dictionary of Saints: Revised Edition,"Religion , Spirituality"
"Iran: The Coming Crisis: Radical Islam, Oil, and the Nuclear Threat","Religion , Biblical Studies , Prophecy"
How to Start and Sustain a Faith-Based Small Group,"Religion , General"
Let Freedom Ring,"Juvenile Nonfiction , Religion , Judaism"
Rattled: Surviving Your Baby's First Year Without Losing Your Cool,"Religion , Christian Living , General"
Why Did God Make Bugs And Other Icky Things - Dfl (Dimensions for Living),"Religion , General"
Where Does God Live? Questions and Answers for Parents and Children,"Religion , Reference"
The Power of a Praying Woman,"Religion , Christian Living , General"
God's Mirror: A Modern Parable,"Religion , Inspirational"
Islam Today: A Short Introduction to the Muslim World (Introductions to Religion),"Religion , Islam , General"
Religion For Dummies,"Religion , General"
Fresh Brewed Life: A Stirring Invitation to Wake Up Your Soul,"Religion , Christian Life , General"
Women Who Do Too Much,"Religion , General"
Christ Among Other gods: A Defense of Christ in an Age of Tolerance,"Religion , Comparative Religion"
Firstlight: The Early Inspirational Writings of Sue Monk Kidd,"Religion , Inspirational"
What Do Jews Believe?: The Spiritual Foundations of Judaism,"Religion , Judaism , Rituals & Practice"
The Power of Myth,"Religion , General"
Checklist for Life for Teens: Timeless Wisdom and   Foolproof Strategies for Making the Most of Life's Challenges and Opportunities,"Religion , Christian Life , General"
He Chose You,"Religion , Christianity , Orthodox"
The Heart of Christianity: Rediscovering a Life of Faith,"Religion , Christian Living , General"
Highest Calling: Serving in the Royal Priesthood,"Religion , Christian Ministry , General"
Turning Toward Joy (Turning Point Series),"Religion , Christian Life , General"
