Title,Category
They Were Women Too: A Daily Devotional Based on the Women of the Old Testament,"Religion , General"
Experience a Fresh Explosion of Faith: A Taste of Believing God,"Religion , Biblical Studies , Bible Study Guides"
Islam: A Primer,"Religion , Islam , General"
"At Peace with All Their Neighbors: Catholics and Catholicism in the National Capital, 1787-1860 (Not In A Series)","Religion , Christianity , Catholic"
Tender Warrior: God's Intention for a Man,"Religion , Christian Theology , General"
"Healing Power of the Christian Mind, The","Religion , General"
How Can I Be Sure I'm a Christian?: What the Bible Says About Assurance of Salvation,"Religion , Christian Theology , Soteriology"
Souled Out: Reclaiming Faith and Politics after the Religious Right,"Religion , Religion, Politics & State"
Deal With It!: You Cannot Conquer What You Will Not Confront,"Religion , Christian Life , General"
The True Woman: The Beauty and Strength of a Godly Woman,"Religion , Christian Theology , General"
The One Year Devotions for Couples: 365 Inspirational Readings,"Religion , Devotional"
Secrets of the Richest Man Who Ever Lived,"Religion , Biblical Studies , General"
"Chicken Soup for the Christian Soul II: Stories of Faith, Hope and Healing (Chicken Soup for the Soul)","Religion , Christian Living , General"
Too Blessed to Be Stressed Words of Wisdom for Women on the Move,"Religion , Christian Life , General"
Everything Starts from Prayer: Mother Teresa's Meditations on Spiritual Life for People of All Faiths,"Religion , Inspirational"
Agenda for Biblical People,"Religion , General"
"Getting Through What You're Going Through: Comfort, Hope, And Encouragement from the 23rd Pslams","Religion , Biblical Criticism & Interpretation , Old Testament"
"Passion, Power and Praise: A Model for Men's Spirituality from the Life of David","Religion , Christian Life , General"
Becoming a Man of Prayer: A Seven-Week Strategy Based on the Instructions of Jesus (Life and Ministry of Jesus Christ),"Religion , Christian Life , Spiritual Growth"
Racing Toward Armageddon: The Three Great Religions and the Plot to End the World,"Religion , Fundamentalism"
Reaching: The Journey to Fulfillment,"Religion , Christian Theology , General"
What Jesus Meant,"Religion , Christianity , General"
Rescue Your Love Life: Changing Those Dumb Attitudes & Behaviors That Will Sink Your Marriage,"Religion , Christian Life , General"
Leading Church Thru Change (Creative leadership series),"Religion , General"
A Treasury of Adoption Miracles: True Stories of God's Presence Today (Miracle Books Collection),"Religion , Biblical Studies , General"
Genesis,"Religion , Biblical Studies , General"
God's Promise For Every Need,"Religion , Inspirational"
Basic Christian Beliefs (Volume 4) (Illustrated Bible Summary Series),"Religion , Biblical Reference , General"
What Makes Us Catholic: Eight Gifts for Life,"Religion , Christianity , History"
When Children Ask About God: A Guide for Parents Who Don't Always Have All the Answers,"Religion , Education"
A Busy Woman's Guide to Prayer,"Religion , Christian Life , General"
Inviting God In: Scriptural Reflections and Prayers Throughout the Year,"Religion , Spirituality"
How to Answer a Jehovah's Witness,"Religion , Christianity , Jehovah's Witnesses"
Finding Our Way Again: The Return of the Ancient Practices,"Religion , Spirituality"
More Hard Sayings of the New Testament (Hard Sayings Series),"Religion , Biblical Studies , General"
Living in the Power of the Holy Spirit: A Catholic Bible Study (Emmaus Journey Bible Study),"Religion , Christianity , Catholic"
Your God Is Too Safe: Rediscovering the Wonder of a God You Can't Control,"Religion , Christian Living , General"
Just Like Jesus Devotional: A Thirty Day Walk With the Savior,"Religion , Devotional"
Mother Angelica's Little Book of Life Lessons and Everyday Spirituality,"Religion , Christianity , Catholic"
In God's Time: The Bible and the Future,"Religion , Biblical Criticism & Interpretation , New Testament"
The DIVA Principle®: Secrets to Divine Inspiration for Victorious Attitude,"Religion , Christian Living , General"
The Dynamics Of Worship,"Religion , Christian Ministry , General"
The Bible Answer Book,"Religion , Inspirational"
Small Group Strategies: Ideas and Activities for Developing Spiritual Growth in Your Students,"Religion , Christian Living , General"
Laugh Again,"Religion , Christian Life , Inspirational"
Beyond Macaroni and Cheese,"Religion , Christian Life , Family"
All-Star Games: From All-Star Youth Leaders,"Religion , Institutions & Organizations"
Classic Children's Prayers (Little Prayer Series) (Little Prayers Series),"Juvenile Nonfiction , Religion , Biblical Studies"
Angels Over Their Shoulders,"Religion , General"
A Passionate Life,"Religion , Christian Living , General"
"Looking for Mary: (Or, the Blessed Mother and Me) (Compass)","Religion , Spirituality"
A Heart Like His: Intimate Reflections on the Life of David,"Religion , Christian Living , Spiritual Growth"
No God but God: Egypt and the Triumph of Islam,"Religion , Islam , General"
Meditations for the Expectant Mother,"Religion , Meditations"
The Boy With a Sling,"Juvenile Nonfiction , Religion , Bible Stories , General"
Jon and the Little Lost Lamb: The Parable of the Good Shepherd (Arch Books),"Juvenile Nonfiction , Religion , Bible Stories , General"
Militant Islam Reaches America,"Religion , Islam , General"
Human Rights in the Americas: The Struggle for Consensus,"Religion , General"
World Religions: Western Traditions,"Religion , Christianity , Catholic"
Joy for the Journey: A Woman's Book of Joyful Promises,"Religion , Christian Life , General"
Augsburg Sermons for Children Series C (Luke),"Religion , General"
Building a Christian World View,"Religion , Christian Theology , Apologetics"
God's Road Map for Moms,"Religion , Christian Life , General"
Shopping for Time: How to Do It All and NOT Be Overwhelmed,"Religion , Christian Life , Women's Issues"
Eternity: Reclaiming a Passion for What Endures,"Religion , Christian Living , General"
You Are Not Your Own: Living Loud for God,"Religion , Christian Ministry , Discipleship"
Keep It Simple for Busy Women: Inspiring Ideas to Reduce Stress and Enjoy Life More,"Religion , Devotional"
The Beginner's Bible Noah and the Ark (I Can Read! / The Beginner's Bible),"Juvenile Nonfiction , Religion , Bible Stories , General"
The Burkett & Blue Definitive Guide to Securing Wealth to Last: Money Essentials for the Second Half of Life,"Religion , Christian Living , General"
Falling Forward: Into His Arms of Grace,"Religion , Christian Life , General"
"Caregiving: The Spiritual Journey of Love, Loss, and Renewal","Religion , Spirituality"
The Story of the Bible,"Religion , Biblical Studies , General"
Young Believer 365: Devotions to help you stand strong 24/7,"Juvenile Nonfiction , Religion , Christianity"
Know Fear: Facing Life's Six Most Common Phobias,"Religion , Inspirational"
We Hear the Christmas Angels: True Stories of Their Presence,"Religion , Holidays , Christmas & Advent"
"2012, the Bible, and the End of the World","Religion , Biblical Studies , Prophecy"
Larryboy and the Awful Ear Wacks Attacks,"Juvenile Nonfiction , Religion , Christianity"
Ideals Friendship 2005,"Religion , Devotional"
Ideals Christmas,"Religion , Holidays , Christmas & Advent"
"Painting in the Dark: The Longing to Be Seen, to Be Heard, and to Be Known","Religion , Inspirational"
Living with Thorns: A Biblical Survival Guide,"Religion , Christian Life , Spiritual Growth"
"The Lutheran Handbook: A Field Guide to Church Stuff, Everyday Stuff, and the Bible","Religion , Christianity , Catechisms"
Holding Her Head High: Inspiration from 12 Single Mothers Who Championed Their Children and Changed History,"Religion , Christian Living , Women's Interests"
What's He Really Thinking?: How to Be a Relational Genius with the Man in Your Life,"Religion , Christian Life , Women's Issues"
Reformed Spirituality,"Religion , Christian Living , General"
"Humor Me, I' M Your Mother!","Religion , Christian Living , General"
Fruit of the Spirit: Living the Supernatural Life (Interactions),"Religion , Biblical Studies , General"
Free Inside and Out (Women of Faith),"Religion , Christianity , General"
Dear Graduate: Letters of Wisdom from Charles R. Swindoll,"Religion , Christian Living , Inspirational"
Walking by Faith Grade 4 Christian Morality,"Juvenile Nonfiction , Religion , Christianity"
Moments of Peace in the Presence of God,"Religion , Meditations"
Jesus Under Fire: Modern Scholarship Reinvents the Historical Jesus,"Religion , Christian Theology , General"
"Above All, Love: Reflections on the Greatest Commandment","Religion , Christian Life , Inspirational"
Be Intolerant: Because Some Things Are Just Stupid,"Religion , Christian Life , General"
UPRISING,"Religion , Christian Living , General"
Keeper of the Keys,"Religion , General"
Four Pillars of a Man's Heart: Bringing Strength into Balance,"Religion , Christianity , General"
Saint Saul: A Skeleton Key to the Historical Jesus,"Religion , Biblical Criticism & Interpretation , New Testament"
So That Your Values Live On: Ethical Wills and How to Prepare Them,"Religion , Ethics"
The One Year Devotions for Women on the Go (One Year Books),"Religion , Inspirational"
Infidels: A History of the Conflict Between Christendom and Islam,"Religion , General"
The Ransomed Heart: A Collection of Devotional Readings,"Religion , Spirituality"
The Next Christendom: The Coming of Global Christianity,"Religion , Christianity , General"
Patron Saints By Michael Freze,"Religion , History"
What You Need to Know About the New Age Movement (Conversations With the Cults),"Religion , General"
The Mentor Leader: Secrets to Building People and Teams That Win Consistently,"Religion , Christian Living , Personal Growth"
"Outrageous Idea of Academic Faithfulness, The: A Guide for Students","Religion , Education"
"Engaging God's World: A Christian Vision of Faith, Learning, and Living","Religion , Christian Education , General"
What Everyone Needs to Know about Islam,"Religion , Islam , General"
Praying to Change Your Life: A Guide to Productive Prayer,"Religion , Christian Theology , General"
Sacred Marriage Participant's Guide: What If God Designed Marriage to Make Us Holy More Than to Make Us Happy?,"Religion , Christian Education , General"
Liturgy Made Simple,"Religion , Christian Rituals & Practice , General"
Jehovah's Witnesses Answered Verse by Verse,"Religion , Cults"
Ten Dumb Things Churches Do: How to Avoid Them,"Religion , Christian Church , Administration"
Acts: Adventures of the Early Church (Teach Yourself the Bible),"Religion , Biblical Studies , General"
"The Spiritual Chicks Question Everything: Learn to Risk, Release, and Soar","Religion , Spirituality"
God's Power to Change Your Life (Living with Purpose),"Religion , Christian Theology , General"
God's Little Devotional Book for Moms,"Religion , Devotional"
Promises of Joy for A Woman of Faith,"Religion , Meditations"
LITTLE GOLDEN BIBLE,"Juvenile Nonfiction , Religion , Bible Stories , General"
God's Little Devotional Book on Success (God's Little Devotional Book Series),"Religion , General"
Total Devotion: 365 Days to Hang Tight with Jesus,"Young Adult Nonfiction , Religion , Christianity"
Becoming a Woman of Freedom (Bible Studies: Becoming a Woman),"Religion , Biblical Studies , Bible Study Guides"
My First Bible,"Religion , Christianity , General"
Saint Kateri Tekakwitha: The Lily of the Mohawks,"Religion , Christian Education , Children & Youth"
God Is Back: How the Global Revival of Faith Is Changing the World,"Religion , Religion, Politics & State"
The Promise: God's Purpose and Plan for When Life Hurts,"Religion , Christian Living , General"
Jesus: The Great Debate,"Religion , Biblical Commentary , New Testament"
Dancing Bones: Living Lively in the Valley (Women of Faith (Zondervan)),"Religion , Christianity , General"
Everyday Encouragement (Spiritual Refreshment for Women),"Religion , Inspirational"
Would You Rather...?,"Religion , Christian Ministry , Youth"
Love & Death: My Journey through the Valley of the Shadow,"Religion , Spirituality"
Transformation: Turn Your Life Around Starting Today!,"Religion , Christian Life , General"
The Call,"Religion , Christian Theology , Eschatology"
Take Your Diploma and Run!: Speaking to the Next Generation,"Religion , General"
How to Keep Your Faith In an Upside Down World,"Religion , Christian Life , Spiritual Growth"
Give Thanks with a Grateful Heart: Songs4Worship Devotional (Songs 4 Worship Devotional),"Religion , Christian Life , General"
Standing with Courage: Confronting Tough Decisions about Sex,"Religion , Christian Life , General"
When War Is Unjust: Being Honest in Just-War Thinking,"Religion , Ethics"
"A Cross Cultural Look at Death, Dying and Religion","Religion , General"
Daily We Follow Him: Learning Discipleship from Peter,"Religion , Biblical Biography , New Testament"
Ministry of Communion (Ministry Series),"Religion , Christianity , Catholic"
NIV Compact Dictionary of the Bible,"Religion , Christian Education , General"
Enough: Discovering Joy through Simplicity and Generosity,"Religion , Christian Living , Social Issues"
Celebrating the Spirit of Christmas,"Religion , Holidays , Christmas & Advent"
A Pocket Catechism for Kids,"Religion , Education"
My Little Book About God,"Juvenile Nonfiction , Religion , General"
Prayers and Promises for Mom (PRAYERS & PROMISES),"Religion , Inspirational"
World Religions,"Religion , Reference"
The Complete Husband: A Practical Guide to Biblical Husbanding,"Religion , General"
A Joke a Day Keeps the Doctor Away,"Humor , Topic , Religion"
Graying Gracefully: Preaching to Older Adults,"Religion , Sermons , Christian"
Laugh Yourself Healthy: Keep the Doctor Away―With a Giggle a Day!,"Religion , Christian Living , General"
"Prayers God Always Answers: How His Faithfulness Surprises, Delights, and Amazes","Religion , Inspirational"
Quicknotes Bible Concordance (QuickNotes Commentaries),"Religion , Biblical Reference , Concordances"
48 Days to the Work You Love: Preparing for the New Normal,"Religion , Christian Living , Professional Growth"
150 Fun Facts Found in the Bible,"Juvenile Nonfiction , Religion , Biblical Studies"
And the Angels Were Silent (Chronicles of the Cross),"Religion , Reference"
God's Little Devotional Journal,"Religion , Devotional"
A Cup of Comfort for Grandparents: Stories That Celebrate a Very Special Relationship (Cup of Comfort Series Book),"Religion , Inspirational"
Finding Your Way After Your Spouse Dies,"Religion , Christian Ministry , Pastoral Resources"
The New Absolutes,"Religion , Fundamentalism"
When It Hurts Too Much to Wait: Understanding Gods Timing,"Religion , General"
Devotions for a Sensational Life,"Religion , Devotional"
"Ideas A-Z Series: Esther (Ideas A to Z Series, 1)","Religion , Biblical Commentary , Old Testament"
Fire Evangelism: Reaching the Lost Through Love and Power,"Religion , Christianity , Pentecostal & Charismatic"
My Little Bible Picture Book,"Juvenile Nonfiction , Religion , General"
Commonsense Guide to Fasting,"Religion , Christianity , Pentecostal & Charismatic"
"The Snooze-Alarm Syndrome: When You Have the Desire, but Lack the Discipline","Religion , Christian Life , General"
Kisses of Sunshine for Grandmas,"Religion , Devotional"
Girl Talk With God,"Religion , Christian Life , General"
"HELP ME, I've fallen and I can't get up","Religion , Christian Living , Spiritual Growth"
Dreams: Lost and Found,"Religion , General"
Islam and the Bible: Why Two Faiths Collide,"Religion , Christian Living , General"
Discipleship Essentials: A Guide to Building Your Life in Christ,"Religion , Christian Life , General"
Being a Girl Who Serves: How to Find Your Life by Giving It Away,"Juvenile Nonfiction , Religion , Christianity"
Wisdom Literature and Poetry: Interpreter's Concise Commentary (Interpreter's concise commentary),"Religion , General"
In His Steps,"Religion , Biblical Studies , General"
Hot Illustrations for Youth Talks,"Religion , Christian Ministry , Pastoral Resources"
Open Heavens Unlock The Power Of Revival In Your Life,"Religion , Christianity , Pentecostal & Charismatic"
When Good Men Are Tempted,"Religion , Christian Life , General"
Saint Paul the Apostle,"Religion , Christianity , Saints & Sainthood"
"Great Adventures: Wild Ride, Buffalo Soldier, and other great stories and devos","Juvenile Nonfiction , Religion , Biblical Studies"
Twinkle: Sharing Your Faith One Light at a Time,"Religion , Christian Ministry , Evangelism"
The New Bible Commentary: Revised,"Religion , General"
The Search for the Twelve Apostles,"Religion , Biblical Studies , History & Culture"
Acts: Seeing God's Power in Action : 24 Studies in 2 Parts for Individuals or Groups,"Religion , Biblical Studies , New Testament"
Your Best Nap Now: 7 Steps to Nodding Off at Your Full Potential,"Humor , Topic , Religion"
Thinking of You,"Religion , Inspirational"
Witness The Passion,"Religion , Holidays , Easter & Lent"
The Prayer Of Jesus: Secrets to Real Intimacy With God,"Religion , Christian Life , General"
Live God Loud,"Religion , Christian Life , General"
Lent With Luke: Meditations for Busy People,"Religion , Meditations"
Toward More Glorious Praise: Power Principles for Faith-Filled People (Spirit-Filled Life Kingdom Dynamics Study Guides),"Religion , Biblical Studies , Bible Study Guides"
Sharing the Faith With Your Child: From Age Seven to Fourteen : A Handbook for Catholic Parents,"Young Adult Nonfiction , Religion , General"
Lists to Live By: The Third Collection: For Everything That Really Matters,"Religion , Christian Life , General"
Religions of Mesoamerica: Cosmovision and Ceremonial Centers (Religious Traditions of the World),"Religion , General"
Winning Over Your Emotions: Helpful Answers That Will Change Your Life,"Religion , Christian Life , General"
Drawing Angels Near: Drawing Angels Near,"Religion , General"
Defining Moments: When Choices Matter Most,"Religion , Christian Theology , General"
Creative Hospitality,"Religion , General"
The 3000 Year-Old Guide to Parenting: Wisdom from Proverbs for Todays Parents,"Religion , General"
How to Speak to Youth . . . and Keep Them Awake at the Same Time,"Religion , Christian Living , Leadership & Mentoring"
The Father Who Calls: Devotional Insights for Daily Meditations,"Religion , General"
Trust Jesus,"Religion , General"
Psalms and Compassions: A Jesuit's Journey Through Cancer,"Religion , Inspirational"
Encouragement for Your Heart,"Religion , Inspirational"
The Touch of Jesus,"Religion , Christian Ministry , Evangelism"
The Broken Image: Restoring Personal Wholeness Through Healing Prayer,"Religion , General"
The Only Hope for America: The Transforming Power of the Gospel of Jesus Christ,"Religion , Christianity , Pentecostal & Charismatic"
The Seeker's Guide to Saints (Seeker Series),"Religion , Christianity , Catholic"
10 Seconds Can Change Your Life Forever,"Religion , Inspirational"
Refined by Fire: A Family's Triumph of Love and Faith,"Religion , Inspirational"
"Oprah, Miracles, and the New Earth: A Critique","Religion , Christian Living , Social Issues"
Is God on America's Side?: The Surprising Answer and Why it Matters During This Election Season,"Religion , Christian Life , Social Issues"
Eve: The History of an Idea,"Religion , General"
There I Go Again: How to Keep from Falling for the Same Old Sin,"Religion , General"
Destined to Overcome: Exercising Your Spiritual Authority,"Religion , Christian Living , Spiritual Warfare"
Relational Parenting: Going Beyond Your Child's Behavior to Meet Their Deepest Needs,"Religion , Inspirational"
Ashes To Easter: Lenten Meditations,"Religion , Meditations"
Living the Gospel of Life: A Challenge to American Catholics,"Religion , Christianity , Catholic"
Ask the Bible Geek®: Answers to Questions From Catholic Teens,"Religion , Christianity , Catholic"
Desiring God: Meditations of a Christian Hedonist,"Religion , Biblical Meditations , General"
Secrets of a Fulfilled Woman: Finding True Contentment in Your Life,"Religion , Christian Life , General"
Talking to Your Children About Being Catholic,"Religion , Christian Life , General"
Saints: Seventy Stories of Faith,"Religion , Faith"
A Godward Life: Savoring the Supremacy of God in All of Life,"Religion , Meditations"
What's in the Bible About God?: What's in the Bible and Why Should I Care? (Why Is That in the Bible and Why Should I Care?),"Religion , Biblical Studies , Old Testament"
"Listen, Mother of God!: Reflections on the Litany of Loreto","Religion , Spirituality"
I Am with You Always: Experiencing God in Times of Need,"Religion , Inspirational"
The Dead Sea Scriptures,"Religion , Biblical Studies , Old Testament , General"
A Once-and-Coming Spirit at Pentecost: Essays on the Liturgical Readings Between Easter and Pentecost,"Religion , Spirituality"
Virtual Faith : The Irreverent Spiritual Quest of Generation X,"Religion , Christian Theology , General"
Discovering God's Will,"Religion , Christian Life , General"
Dancing in the Arms of God: Finding Intimacy and Fulfillment by Following His Lead,"Religion , Inspirational"
Three Months with Matthew,"Religion , Biblical Studies , New Testament"
Stories of Our Favorite Hymns,"Religion , General"
Footsteps to Follow: Eternal Truths for Christian Living,"Religion , Christian Life , General"
Growing With Jesus:100 Daily Devotionals,"Juvenile Nonfiction , Religion , Christianity"
Praying God's Will for My Husband,"Religion , Prayer"
The Transparent Leader,"Religion , Christianity , General"
Visioneering: God's Blueprint for Developing and Maintaining Personal Vision,"Religion , Inspirational"
The Equipping Pastor: A Systems Approach To Congregational Leadership,"Religion , Leadership"
Home Grown Heroes: How to Raise Courageous Kids,"Religion , Christian Life , General"
Growing Up Christian: Have You Taken Ownership of Your Relationship with God?,"Religion , Christian Education , Children & Youth"
Exploring the Old Testament,"Religion , Biblical Studies , Old Testament"
JOHN (Macarthur Bible Studies),"Religion , Biblical Studies , New Testament"
How I Pray: People of Different Religions Share with Us That Most Sacred and Intimate Act of Faith,"Religion , Prayerbooks , General"
The Father of Love: Spiritual Insights from the Love Comes Softly Series,"Religion , General"
Heroes,"Religion , General"
The Urban Christian,"Religion , Fundamentalism"
Thoughts for Young Men,"Religion , Spirituality"
Sacred Thirst,"Religion , Christian Life , Personal Growth"
Receiving Holy Communion: How to Make a Good Communion (Saint Joseph Beginner Series),"Juvenile Nonfiction , Religion , Christianity"
"If How-To's Were Enough We Would All be Skinny, Rich and Happy","Religion , Spirituality"
Interviewing Your Daughter's Date,"Religion , Christian Living , Family & Relationships"
Ready for Life,"Young Adult Nonfiction , Religion , Christianity"
Catholic Picture Bible: Popular Stories from the Old and New Testaments,"Juvenile Nonfiction , Religion , Bible Stories , General"
The Drama of Medjugorje,"Religion , Christian Theology , Mariology"
"The Official Hugs Book,","Religion , Christian Life , Inspirational"
Sometimes Miracles Hide,"Religion , Christian Life , General"
Falling In Love With Jesus Abandoning Yourself To The Greatest Romance Of Your Life,"Religion , Christian Life , General"
"Life's Challenges, Your Opportunities: God Has Given You A Promise...You've Come Into A Problem...How You Respond Will Determine How Quickly The Provision Comes...","Religion , Christian Living , Personal Growth"
Skeptics and True Believers: The Exhilarating Connection Between Science and Spirituality,"Religion , Religion & Science"
"Celebrate 2000: A Three Year Reader : Reflections on Jesus, the Holy Spirit, and the Father","Religion , General"
Mother Angelica: Her Life Story,"Religion , General"
Creating an Authentic Youth Ministry,"Young Adult Nonfiction , Religion , General"
The Absolutes,"Religion , Christian Life , General"
What Is Redaction Criticism?,"Religion , Biblical Commentary , New Testament"
A Young Man After God's Own Heart: Turn Your Life into an Extreme Adventure,"Religion , Inspirational"
Relationships 101 (101 Series),"Religion , Inspirational"
Outlive Your Life: You Were Made to Make A Difference,"Religion , Christian Life , General"
The Coming Economic Armageddon: What Bible Prophecy Warns about the New Global Economy,"Religion , Biblical Studies , Prophecy"
Sun Stand Still: What Happens When You Dare to Ask God for the Impossible,"Religion , Christian Living , General"
Pocket Bible Dictionary: Nelson's Pocket Reference Series,"Religion , Biblical Studies , General"
Pocket Bible Concordance: Nelson's Pocket Reference Series,"Religion , Biblical Reference , General"
"If You Really Trust Me, Why Can't I Stay Out Later? (Devotionals for Teens)","Religion , General"
"The Boy Who Came Back from Heaven: A Remarkable Account of Miracles, Angels, and Life beyond This World","Religion , Christian Life , Inspirational"
The Princess Within: Restoring the Soul of a Woman,"Religion , Inspirational"
Living on the Edge: Dare to Experience True Spirituality,"Religion , Biblical Studies , General"
Living a Life of Balance: Women of Faith Study Guide Series,"Religion , Biblical Studies , General"
Hope Unseen: The Story of the U.S. Army's First Blind Active-Duty Officer,"Religion , Leadership"
Seeing Yourself Through God's Eyes: A 31-Day Devotional Guide,"Religion , Christian Living , Devotional"
Point Man: How a Man Can Lead His Family,"Religion , Christian Living , General"
